ffff88b97e752a80 1533378292 C Bi:4:003:1 0 2471 = 5b5d2409 9f020201 015c083d 00001012 02061013 02011011 03061014 43011015
ffff88b97e752a80 1533378313 S Bi:4:003:1 -115 4096 <
ffff88b97e752f00 1533379665 C Bi:4:003:1 0 478 = 5b5d2501 d6010001 84171000 0701cb8d 0000716b 03fd0503 f607f701 05ffff01
ffff88b97e752f00 1533379694 S Bi:4:003:1 -115 4096 <
ffff88b97e7520c0 1533382679 C Bi:4:003:1 0 486 = 5b5d2601 d6010001 a2e61100 0701cb8d 00006c80 01551af8 04ffe70f 0c06fd08
ffff88b97e7520c0 1533382691 S Bi:4:003:1 -115 4096 <
ffff88b97e752840 1533385039 C Bi:4:003:1 0 479 = 5b5d2701 d7010001 a3bf0000 0c01cc8d 0000605f 01f905fd 03fb04fe 01fe0303
ffff88b97e752840 1533385050 S Bi:4:003:1 -115 4096 <
ffff88b97e752a80 1533388663 C Bi:4:003:1 0 485 = 5b5d2801 d7010001 b38f0100 0c01cc8d 00005f80 00c01519 16122410 0710faed
ffff88b97e752a80 1533388674 S Bi:4:003:1 -115 4096 <
ffff88b97e752f00 1534382425 C Bi:4:003:1 0 2471 = 5b5d2909 9f020201 015c083d 00001012 02061013 02011011 03061014 43011015
ffff88b97e752f00 1534382438 S Bi:4:003:1 -115 4096 <
ffff88b97e7520c0 1534383796 C Bi:4:003:1 0 478 = 5b5d2a01 d6010001 cb871000 0701cb8d 00006b6d fbfc0007 fa08f803 ffff0000
ffff88b97e7520c0 1534383826 S Bi:4:003:1 -115 4096 <
ffff88b97e752840 1534386923 C Bi:4:003:1 0 488 = 5b5d2b01 d6010001 ea3b1100 0701cb8d 00006a80 01521af8 0401e70b 13040006
ffff88b97e752840 1534386935 S Bi:4:003:1 -115 4096 <
ffff88b97e752a80 1534389173 C Bi:4:003:1 0 479 = 5b5d2c01 d7010001 eb140000 0c01cc8d 0000625e 00ff0200 03fb03fd 00fc0303
ffff88b97e752a80 1534389184 S Bi:4:003:1 -115 4096 <
ffff88b97e752f00 1534392797 C Bi:4:003:1 0 485 = 5b5d2d01 d7010001 fadf0100 0c01cc8d 00005f80 00c31b0c 1d0e290b 0712fbef
ffff88b97e752f00 1534392808 S Bi:4:003:1 -115 4096 <
ffff88b97e7520c0 1535386559 C Bi:4:003:1 0 2471 = 5b5d2e09 9f020201 015c083d 00001012 02061013 02011011 03061014 43011015
ffff88b97e7520c0 1535386571 S Bi:4:003:1 -115 4096 <
ffff88b97e752840 1535388056 C Bi:4:003:1 0 478 = 5b5d2f01 d6010001 12dd1000 0701cb8d 00006e67 05fb0201 fb04ff03 f907fe01
ffff88b97e752840 1535388077 S Bi:4:003:1 -115 4096 <
ffff88b97e752a80 1535391055 C Bi:4:003:1 0 486 = 5b5d3001 d6010001 31ad1100 0701cb8d 00006d80 01511ff7 02fee70f 1003000b
ffff88b97e752a80 1535391067 S Bi:4:003:1 -115 4096 <
ffff88b97e752f00 1535393299 C Bi:4:003:1 0 479 = 5b5d3101 d7010001 32860000 0c01cc8d 0000615e 00fb06fd 04fc03fe feff0500
ffff88b97e752f00 1535393310 S Bi:4:003:1 -115 4096 <
ffff88b97e7520c0 1535396944 C Bi:4:003:1 0 485 = 5b5d3201 d7010001 42580100 0c01cc8d 00005f80 00c21815 1911210e 0815f6f1
ffff88b97e7520c0 1535396955 S Bi:4:003:1 -115 4096 <
ffff88b97e752840 1536390816 C Bi:4:003:1 0 2471 = 5b5d3309 9f020201 015c083d 00001012 02061013 02011011 03061014 43011015
ffff88b97e752840 1536390842 S Bi:4:003:1 -115 4096 <
ffff88b97e752a80 1536392189 C Bi:4:003:1 0 478 = 5b5d3401 d6010001 5a591000 0701cb8d 00006c69 00fb0302 fd06fb02 00fc0101
ffff88b97e752a80 1536392209 S Bi:4:003:1 -115 4096 <
ffff88b97e752f00 1536395314 C Bi:4:003:1 0 486 = 5b5d3501 d6010001 79491100 0701cb8d 00006e80 015020f4 09fbe60d 1208fc07
ffff88b97e752f00 1536395326 S Bi:4:003:1 -115 4096 <
ffff88b97e7520c0 1536397563 C Bi:4:003:1 0 479 = 5b5d3601 d7010001 7a210000 0c01cc8d 0000605c 00ff03fd 06fc02ff fe000101
ffff88b97e7520c0 1536397574 S Bi:4:003:1 -115 4096 <
ffff88b97e752840 1536401190 C Bi:4:003:1 0 485 = 5b5d3701 d7010001 89f30100 0c01cc8d 00005c80 00bf1813 18102510 0712fbee
ffff88b97e752840 1536401201 S Bi:4:003:1 -115 4096 <
ffff88b97e752a80 1537394948 C Bi:4:003:1 0 2471 = 5b5d3809 9f020201 015c083d 00001012 02061013 02011011 03061014 43011015
ffff88b97e752a80 1537394974 S Bi:4:003:1 -115 4096 <
ffff88b97e752f00 1537396450 C Bi:4:003:1 0 478 = 5b5d3901 d6010001 a1e41000 0701cb8d 00006a67 01fdfe00 0306f802 00feff00
ffff88b97e752f00 1537396463 S Bi:4:003:1 -115 4096 <
ffff88b97e7520c0 1537399453 C Bi:4:003:1 0 486 = 5b5d3a01 d6010001 c0ac1100 0701cb8d 00006c80 01511bf9 05fae315 0c090005
ffff88b97e7520c0 1537399465 S Bi:4:003:1 -115 4096 <
ffff88b97e752840 1537401702 C Bi:4:003:1 0 479 = 5b5d3b01 d7010001 c1840000 0c01cc8d 0000615d 01fc0400 00ff02ff ff00fe05
ffff88b97e752840 1537401713 S Bi:4:003:1 -115 4096 <
ffff88b97e752a80 1537405334 C Bi:4:003:1 0 485 = 5b5d3c01 d7010001 d1550100 0c01cc8d 00005c80 00c01910 1a12240f 0315fbeb
ffff88b97e752a80 1537405345 S Bi:4:003:1 -115 4096 <
ffff88b97e752f00 1538399212 C Bi:4:003:1 0 2471 = 5b5d3d09 9f020201 015c083d 00001012 02061013 02011011 03061014 43011015
ffff88b97e752f00 1538399248 S Bi:4:003:1 -115 4096 <
ffff88b97e7520c0 1538400705 C Bi:4:003:1 0 478 = 5b5d3e01 d6010001 e9441000 0701cb8d 00006b68 00fc04fd 0306f702 03fbfe00
ffff88b97e7520c0 1538400718 S Bi:4:003:1 -115 4096 <
ffff88b97e752840 1538403707 C Bi:4:003:1 0 486 = 5b5d3f01 d6010001 080a1100 0701cb8d 00006d80 01521efa 04fce90d 0d06fe03
ffff88b97e752840 1538403720 S Bi:4:003:1 -115 4096 <
ffff88b97e752a80 1538405956 C Bi:4:003:1 0 479 = 5b5d4001 d7010001 08e20000 0c01cc8d 0000615d ffff05fc 07f903fd 03f90600
ffff88b97e752a80 1538405967 S Bi:4:003:1 -115 4096 <
ffff88b97e752f00 1538409583 C Bi:4:003:1 0 487 = 5b5d4101 d7010001 18b30100 0c01cc8d 00005e80 00c41a0c 1e0d2511 050ffdea
ffff88b97e752f00 1538409594 S Bi:4:003:1 -115 4096 <
ffff88b97e7520c0 1539403465 C Bi:4:003:1 0 2471 = 5b5d4209 9f020201 015c083d 00001012 02061013 02011011 03061014 43011015
ffff88b97e7520c0 1539403491 S Bi:4:003:1 -115 4096 <
ffff88b97e752840 1539404856 C Bi:4:003:1 0 478 = 5b5d4301 d6010001 30ae1000 0701cb8d 00006969 fdfb02ff 0108f703 01fc01ff
ffff88b97e752840 1539404868 S Bi:4:003:1 -115 4096 <
ffff88b97e752a80 1539407856 C Bi:4:003:1 0 488 = 5b5d4401 d6010001 4f7a1100 0701cb8d 00006780 014d1ef5 0afae809 13070008
ffff88b97e752a80 1539407868 S Bi:4:003:1 -115 4096 <
ffff88b97e752f00 1539410215 C Bi:4:003:1 0 479 = 5b5d4501 d7010001 50530000 0c01cc8d 00005f5d fffe0002 03fe00ff 00fe0300
ffff88b97e752f00 1539410226 S Bi:4:003:1 -115 4096 <
ffff88b97e7520c0 1539413839 C Bi:4:003:1 0 485 = 5b5d4601 d7010001 60250100 0c01cc8d 00005f80 00c11714 1b0e2610 0416f7ee
ffff88b97e7520c0 1539413860 S Bi:4:003:1 -115 4096 <
ffff88b97e752840 1540407729 C Bi:4:003:1 0 2471 = 5b5d4709 9f020201 015c083d 00001012 02061013 02011011 03061014 43011015
ffff88b97e752840 1540407744 S Bi:4:003:1 -115 4096 <
ffff88b97e752a80 1540409225 C Bi:4:003:1 0 478 = 5b5d4801 d6010001 78311000 0701cb8d 00006b6c fb000103 fb07fa01 01fafc07
ffff88b97e752a80 1540409248 S Bi:4:003:1 -115 4096 <
ffff88b97e752f00 1540412241 C Bi:4:003:1 0 486 = 5b5d4901 d6010001 97481100 0701cb8d 00006d80 01521ff6 08fbe611 0b05fe0c
ffff88b97e752f00 1540412253 S Bi:4:003:1 -115 4096 <
ffff88b97e7520c0 1540414486 C Bi:4:003:1 0 479 = 5b5d4a01 d7010001 98200000 0c01cc8d 0000605b 02ff0301 02fb00fe 00ff0400
ffff88b97e7520c0 1540414497 S Bi:4:003:1 -115 4096 <
ffff88b97e752840 1540418224 C Bi:4:003:1 0 485 = 5b5d4b01 d7010001 a7f10100 0c01cc8d 00005e80 00c21910 1b0e2a09 0712fbec
ffff88b97e752840 1540418236 S Bi:4:003:1 -115 4096 <
ffff88b97e752a80 1541411982 C Bi:4:003:1 0 2471 = 5b5d4c09 9f020201 015c083d 00001012 02061013 02011011 03061014 43011015
ffff88b97e752a80 1541412012 S Bi:4:003:1 -115 4096 <
ffff88b97e752f00 1541413480 C Bi:4:003:1 0 478 = 5b5d4d01 d6010001 bfe31000 0701cb8d 00006f6e fc00ff05 fd06f601 fffd0304
ffff88b97e752f00 1541413498 S Bi:4:003:1 -115 4096 <
ffff88b97e7520c0 1541416486 C Bi:4:003:1 0 486 = 5b5d4e01 d6010001 deb81100 0701cb8d 00006e80 01551df6 04fde70f 0512fd06
ffff88b97e7520c0 1541416499 S Bi:4:003:1 -115 4096 <
ffff88b97e752840 1541418737 C Bi:4:003:1 0 479 = 5b5d4f01 d7010001 df910000 0c01cc8d 0000625f feff04fe 04fc0001 01fb0204
ffff88b97e752840 1541418748 S Bi:4:003:1 -115 4096 <
ffff88b97e752a80 1541422371 C Bi:4:003:1 0 485 = 5b5d5001 d7010001 ef620100 0c01cc8d 00006080 00c11d0f 1c10210d 0a11f9eb
ffff88b97e752a80 1541422382 S Bi:4:003:1 -115 4096 <
ffff88b97e752f00 1542416240 C Bi:4:003:1 0 2471 = 5b5d5109 9f020201 015c083d 00001012 02061013 02011011 03061014 43011015
ffff88b97e752f00 1542416266 S Bi:4:003:1 -115 4096 <
ffff88b97e7520c0 1542417739 C Bi:4:003:1 0 478 = 5b5d5201 d6010001 075a1000 0701cb8d 0000706b 00fe0402 fd02fc00 00f909ff
ffff88b97e7520c0 1542417758 S Bi:4:003:1 -115 4096 <
ffff88b97e752840 1542420742 C Bi:4:003:1 0 488 = 5b5d5301 d6010001 263f1100 0701cb8d 00006e80 015020fc 05ffe20a 0e09fc0d
ffff88b97e752840 1542420755 S Bi:4:003:1 -115 4096 <
ffff88b97e752a80 1542422996 C Bi:4:003:1 0 479 = 5b5d5401 d7010001 27180000 0c01cc8d 0000605d 00fb0403 03fb02fe 00fe02ff
ffff88b97e752a80 1542423007 S Bi:4:003:1 -115 4096 <
ffff88b97e752f00 1542426740 C Bi:4:003:1 0 483 = 5b5d5501 d7010001 36ea0100 0c01cc8d 00005d80 00c21813 1b0b270f 0415faee
ffff88b97e752f00 1542426751 S Bi:4:003:1 -115 4096 <
ffff88b97e7520c0 1543420508 C Bi:4:003:1 0 2471 = 5b5d5609 9f020201 015c083d 00001012 02061013 02011011 03061014 43011015
ffff88b97e7520c0 1543420536 S Bi:4:003:1 -115 4096 <
ffff88b97e752840 1543422001 C Bi:4:003:1 0 478 = 5b5d5701 d6010001 4ede1000 0701cb8d 00006d6a 02fc0106 fa03f903 f90afeff
ffff88b97e752840 1543422020 S Bi:4:003:1 -115 4096 <
ffff88b97e752a80 1543424997 C Bi:4:003:1 0 486 = 5b5d5801 d6010001 6db61100 0701cb8d 00006e80 01551af9 04fee611 0e03fe06
ffff88b97e752a80 1543425018 S Bi:4:003:1 -115 4096 <
ffff88b97e752f00 1543427241 C Bi:4:003:1 0 479 = 5b5d5901 d7010001 6e8f0000 0c01cc8d 00006560 ff0103fe 03fd00fe ff000302
ffff88b97e752f00 1543427250 S Bi:4:003:1 -115 4096 <
ffff88b97e7520c0 1543430866 C Bi:4:003:1 0 483 = 5b5d5a01 d7010001 7e5f0100 0c01cc8d 00005f80 00c51611 15112911 0114fcec
ffff88b97e7520c0 1543430876 S Bi:4:003:1 -115 4096 <
ffff88b97e752840 1544424760 C Bi:4:003:1 0 2471 = 5b5d5b09 9f020201 015c083d 00001012 02061013 02011011 03061014 43011015
ffff88b97e752840 1544424786 S Bi:4:003:1 -115 4096 <
ffff88b97e752a80 1544426258 C Bi:4:003:1 0 478 = 5b5d5c01 d6010001 96511000 0701cb8d 00006e6d fbff05ff fe07f604 fefc0004
ffff88b97e752a80 1544426277 S Bi:4:003:1 -115 4096 <
ffff88b97e752f00 1544429270 C Bi:4:003:1 0 486 = 5b5d5d01 d6010001 b5431100 0701cb8d 00006f80 014f25f4 08f8ec09 0e0afa08
ffff88b97e752f00 1544429282 S Bi:4:003:1 -115 4096 <
ffff88b97e7520c0 1544431520 C Bi:4:003:1 0 479 = 5b5d5e01 d7010001 b61c0000 0c01cc8d 0000615e ffff0203 01fd00ff ff0103fe
ffff88b97e7520c0 1544431531 S Bi:4:003:1 -115 4096 <
ffff88b97e752840 1544435253 C Bi:4:003:1 0 485 = 5b5d5f01 d7010001 c5ee0100 0c01cc8d 00006280 00c8150f 1e102406 0f10f8f1
ffff88b97e752840 1544435264 S Bi:4:003:1 -115 4096 <
ffff88b97e752a80 1545429015 C Bi:4:003:1 0 2471 = 5b5d6009 9f020201 015c083d 00001012 02061013 02011011 03061014 43011015
ffff88b97e752a80 1545429028 S Bi:4:003:1 -115 4096 <
ffff88b97e752f00 1545430514 C Bi:4:003:1 0 478 = 5b5d6101 d6010001 ddfa1000 0701cb8d 00006b6c f9ff04fe fe0df7ff fffefe03
ffff88b97e752f00 1545430539 S Bi:4:003:1 -115 4096 <
ffff88b97e7520c0 1545433522 C Bi:4:003:1 0 488 = 5b5d6201 d6010001 fcc81100 0701cb8d 00006e80 015516fc 0401e315 0d02fc0d
ffff88b97e7520c0 1545433535 S Bi:4:003:1 -115 4096 <
ffff88b97e752840 1545435773 C Bi:4:003:1 0 479 = 5b5d6301 d7010001 fda10000 0c01cc8d 0000615f ffff0000 04fc02ff feff0500
ffff88b97e752840 1545435784 S Bi:4:003:1 -115 4096 <
ffff88b97e752a80 1545439391 C Bi:4:003:1 0 483 = 5b5d6401 d7010001 0d6e0100 0c01cc8d 00006080 00c41415 17112b08 0712fbee
ffff88b97e752a80 1545439402 S Bi:4:003:1 -115 4096 <
ffff88b97e752f00 1545903913 C Bi:4:003:1 0 478 = 5b5d6501 d6010001 1c021000 0701cb0d 00006c69 00fc06ff fc09f703 fdfc0400
ffff88b97e752f00 1545903925 S Bi:4:003:1 -115 4096 <
ffff88b97e7520c0 1545906019 C Bi:4:003:1 0 486 = 5b5d6601 d6010001 2d031100 0701cb0d 00006e80 01561df5 08f8ea0a 1206fd0f
ffff88b97e7520c0 1545906032 S Bi:4:003:1 -115 4096 <
ffff88b97e752840 1545907770 C Bi:4:003:1 0 479 = 5b5d6701 d7010001 2ddb0000 0c01cc0d 0000615d fffe04ff 05fc02fd 00fd0501
ffff88b97e752840 1545907781 S Bi:4:003:1 -115 4096 <
ffff88b97e752a80 1545909894 C Bi:4:003:1 0 483 = 5b5d6801 d7010001 3bae0100 0c01cc0d 00005e80 00c01a0e 1911260f 0415f8ec
ffff88b97e752a80 1545909905 S Bi:4:003:1 -115 4096 <
ffff88b97e752f00 1545911514 C Bi:4:003:1 0 478 = 5b5d6901 d6010001 3ca91000 0701cb0d 00006c6a fb010301 fd05fd00 fffe0001
ffff88b97e752f00 1545911532 S Bi:4:003:1 -115 4096 <
ffff88b97e7520c0 1545913534 C Bi:4:003:1 0 486 = 5b5d6a01 d6010001 4a9a1100 0701cb0d 00006e80 01571af8 0103e313 0e07f90c
ffff88b97e7520c0 1545913547 S Bi:4:003:1 -115 4096 <
ffff88b97e752840 1545915395 C Bi:4:003:1 0 479 = 5b5d6b01 d7010001 4b720000 0c01cc0d 00006362 fefd0400 04fa0100 01fb05ff
ffff88b97e752840 1545915406 S Bi:4:003:1 -115 4096 <
ffff88b97e752a80 1545917387 C Bi:4:003:1 0 485 = 5b5d6c01 d7010001 594b0100 0c01cc0d 00006080 00c91112 1a0d2513 0410fbee
ffff88b97e752a80 1545917398 S Bi:4:003:1 -115 4096 <
ffff88b97e752f00 1545919144 C Bi:4:003:1 0 478 = 5b5d6d01 d6010001 5a3f1000 0701cb0d 00006763 05fb0101 fc06fb01 0300fdfd
ffff88b97e752f00 1545919157 S Bi:4:003:1 -115 4096 <
ffff88b97e7520c0 1545921137 C Bi:4:003:1 0 486 = 5b5d6e01 d6010001 68361100 0701cb0d 00006b80 01531df8 06fae512 0e07fd0a
ffff88b97e7520c0 1545921149 S Bi:4:003:1 -115 4096 <
ffff88b97e752840 1545923019 C Bi:4:003:1 0 479 = 5b5d6f01 d7010001 690f0000 0c01cc0d 0000615b 04fe02ff 05f80201 01fa0501
ffff88b97e752840 1545923030 S Bi:4:003:1 -115 4096 <
ffff88b97e752a80 1545925023 C Bi:4:003:1 0 483 = 5b5d7001 d7010001 76e10100 0c01cc0d 00005e80 00c01712 1a13240f 060ffbeb
ffff88b97e752a80 1545925034 S Bi:4:003:1 -115 4096 <
ffff88b97e752f00 1545926770 C Bi:4:003:1 0 478 = 5b5d7101 d6010001 77d61000 0701cb0d 00006a63 04fc0000 fe09f706 03fff802
ffff88b97e752f00 1545926782 S Bi:4:003:1 -115 4096 <
ffff88b97e7520c0 1545928773 C Bi:4:003:1 0 486 = 5b5d7201 d6010001 85c71100 0701cb0d 00006e80 015324f5 07fce410 0b0afb05
ffff88b97e7520c0 1545928786 S Bi:4:003:1 -115 4096 <
ffff88b97e752840 1545930519 C Bi:4:003:1 0 479 = 5b5d7301 d7010001 869f0000 0c01cc0d 0000605d 00fe0301 ffff0100 fd000201
ffff88b97e752840 1545930544 S Bi:4:003:1 -115 4096 <
ffff88b97e752a80 1545932644 C Bi:4:003:1 0 483 = 5b5d7401 d7010001 94780100 0c01cc0d 00006280 00c51615 190f260e 0411faf0
ffff88b97e752a80 1545932655 S Bi:4:003:1 -115 4096 <
ffff88b97e752f00 1545934415 C Bi:4:003:1 0 478 = 5b5d7501 d6010001 956c1000 0701cb0d 00006e70 f8fd0404 fb09f800 0100f909
ffff88b97e752f00 1545934434 S Bi:4:003:1 -115 4096 <
ffff88b97e7520c0 1545936394 C Bi:4:003:1 0 488 = 5b5d7601 d6010001 a3621100 0701cb0d 00006d80 01581bfa 03ffe510 10000108
ffff88b97e7520c0 1545936406 S Bi:4:003:1 -115 4096 <
ffff88b97e752840 1545938146 C Bi:4:003:1 0 479 = 5b5d7701 d7010001 a43a0000 0c01cc0d 00006258 08fc0401 02fc0102 fdfd0204
ffff88b97e752840 1545938157 S Bi:4:003:1 -115 4096 <
ffff88b97e752a80 1545940268 C Bi:4:003:1 0 483 = 5b5d7801 d7010001 b2140100 0c01cc0d 00005e80 00c01714 190d2a0e 0116f9ed
ffff88b97e752a80 1545940279 S Bi:4:003:1 -115 4096 <
ffff88b97e752f00 1545941898 C Bi:4:003:1 0 478 = 5b5d7901 d6010001 b3091000 0701cb0d 00006e69 03fcff03 fb05fd06 fc0101fe
ffff88b97e752f00 1545941917 S Bi:4:003:1 -115 4096 <
ffff88b97e7520c0 1545944019 C Bi:4:003:1 0 486 = 5b5d7a01 d6010001 c0fa1100 0701cb0d 00006d80 015619fc 01fce912 0e07fc09
ffff88b97e7520c0 1545944032 S Bi:4:003:1 -115 4096 <
ffff88b97e752840 1545945769 C Bi:4:003:1 0 479 = 5b5d7b01 d7010001 c1d20000 0c01cc0d 00006160 fefd0303 04f9fe02 fe000402
ffff88b97e752840 1545945780 S Bi:4:003:1 -115 4096 <
ffff88b97e752a80 1545947769 C Bi:4:003:1 0 483 = 5b5d7c01 d7010001 cfab0100 0c01cc0d 00005e80 00be1d0e 1e0d290e 0318f6ef
ffff88b97e752a80 1545947780 S Bi:4:003:1 -115 4096 <
ffff88b97e752f00 1545949512 C Bi:4:003:1 0 478 = 5b5d7d01 d6010001 d0a01000 0701cb0d 00006b64 03fffc02 fc07f806 00ff06fc
ffff88b97e752f00 1545949531 S Bi:4:003:1 -115 4096 <
ffff88b97e7520c0 1545951515 C Bi:4:003:1 0 488 = 5b5d7e01 d6010001 de951100 0701cb0d 00006b80 015221f4 07fce415 0805000b
ffff88b97e7520c0 1545951528 S Bi:4:003:1 -115 4096 <
ffff88b97e752840 1545953393 C Bi:4:003:1 0 479 = 5b5d7f01 d7010001 df6d0000 0c01cc0d 0000615e 00000004 00fb02fc 06fa0500
ffff88b97e752840 1545953404 S Bi:4:003:1 -115 4096 <
ffff88b97e752a80 1545955415 C Bi:4:003:1 0 485 = 5b5d8001 d7010001 ed470100 0c01cc0d 00005d80 00c01810 1d0f270e 0413fceb
ffff88b97e752a80 1545955425 S Bi:4:003:1 -115 4096 <
ffff88b97e752f00 1545957145 C Bi:4:003:1 0 478 = 5b5d8101 d6010001 ee3c1000 0701cb0d 00006f6f fbfc07ff fe05fd01 fc00ff00
ffff88b97e752f00 1545957163 S Bi:4:003:1 -115 4096 <
ffff88b97e7520c0 1545959138 C Bi:4:003:1 0 488 = 5b5d8201 d6010001 fc2c1100 0701cb0d 00006c80 01551bf9 07fae60f 0e07ff07
ffff88b97e7520c0 1545959150 S Bi:4:003:1 -115 4096 <
ffff88b97e752840 1545961020 C Bi:4:003:1 0 479 = 5b5d8301 d7010001 fd050000 0c01cc0d 0000625f fb030500 02fc03fc ffff06fc
ffff88b97e752840 1545961031 S Bi:4:003:1 -115 4096 <
ffff88b97e752a80 1545963020 C Bi:4:003:1 0 485 = 5b5d8401 d7010001 0ae10100 0c01cc0d 00005d80 00c31017 1711290d 0517f6ec
ffff88b97e752a80 1545963030 S Bi:4:003:1 -115 4096 <
ffff88b97e752f00 1545964769 C Bi:4:003:1 0 478 = 5b5d8501 d6010001 0bd51000 0701cb0d 0000726e 00fa0601 fe04f903 0000fb02
ffff88b97e752f00 1545964789 S Bi:4:003:1 -115 4096 <
ffff88b97e7520c0 1545966769 C Bi:4:003:1 0 486 = 5b5d8601 d6010001 19cc1100 0701cb0d 00006c80 01521dfc 0000ec09 1106fd04
ffff88b97e7520c0 1545966782 S Bi:4:003:1 -115 4096 <
ffff88b97e752840 1545968516 C Bi:4:003:1 0 479 = 5b5d8701 d7010001 1aa40000 0c01cc0d 00005e5d fe0004fd 04fc01fb 03000002
ffff88b97e752840 1545968526 S Bi:4:003:1 -115 4096 <
ffff88b97e752a80 1545970645 C Bi:4:003:1 0 485 = 5b5d8801 d7010001 287d0100 0c01cc0d 00005f80 00c21a10 1d0b290c 0515fceb
ffff88b97e752a80 1545970656 S Bi:4:003:1 -115 4096 <
ffff88b97e752f00 1545972395 C Bi:4:003:1 0 478 = 5b5d8901 d6010001 29721000 0701cb0d 00006d68 01fa0500 0303fa03 fefc0201
ffff88b97e752f00 1545972415 S Bi:4:003:1 -115 4096 <
ffff88b97e7520c0 1545974394 C Bi:4:003:1 0 488 = 5b5d8a01 d6010001 37621100 0701cb0d 00006d80 015618fa 07f9ea12 0a06ff0b
ffff88b97e7520c0 1545974407 S Bi:4:003:1 -115 4096 <
ffff88b97e752840 1545976155 C Bi:4:003:1 0 479 = 5b5d8b01 d7010001 383a0000 0c01cc0d 00006360 fffd0302 fe020001 fffc05ff
ffff88b97e752840 1545976166 S Bi:4:003:1 -115 4096 <
ffff88b97e752a80 1545978164 C Bi:4:003:1 0 485 = 5b5d8c01 d7010001 46160100 0c01cc0d 00005f80 00c01c11 1b0e270e 0711fbf1
ffff88b97e752a80 1545978174 S Bi:4:003:1 -115 4096 <
ffff88b97e752f00 1545979896 C Bi:4:003:1 0 478 = 5b5d8d01 d6010001 470a1000 0701cb0d 00006e66 040101fe fe04fd00 0200fc03
ffff88b97e752f00 1545979908 S Bi:4:003:1 -115 4096 <
ffff88b97e7520c0 1545981901 C Bi:4:003:1 0 486 = 5b5d8e01 d6010001 55011100 0701cb0d 00007180 01591afa 07fce40f 1107f804
ffff88b97e7520c0 1545981913 S Bi:4:003:1 -115 4096 <
ffff88b97e752840 1545983770 C Bi:4:003:1 0 479 = 5b5d8f01 d7010001 55d90000 0c01cc0d 00006260 feff0100 000103fd fefb0802
ffff88b97e752840 1545983781 S Bi:4:003:1 -115 4096 <
ffff88b97e752a80 1545985782 C Bi:4:003:1 0 485 = 5b5d9001 d7010001 63b20100 0c01cc0d 00006080 00bf1c0c 1e11260e 0512fdeb
ffff88b97e752a80 1545985793 S Bi:4:003:1 -115 4096 <
ffff88b97e752f00 1545987520 C Bi:4:003:1 0 478 = 5b5d9101 d6010001 64a61000 0701cb0d 00006d6a 05fbff00 fe04fc04 fe0200fe
ffff88b97e752f00 1545987539 S Bi:4:003:1 -115 4096 <
ffff88b97e7520c0 1545989524 C Bi:4:003:1 0 488 = 5b5d9201 d6010001 72971100 0701cb0d 00006d80 01571bf7 0bf6e712 0806000a
ffff88b97e7520c0 1545989536 S Bi:4:003:1 -115 4096 <
ffff88b97e752840 1545991263 C Bi:4:003:1 0 479 = 5b5d9301 d7010001 736f0000 0c01cc0d 00005f5b 01fe0101 ff0201fc 02fe0202
ffff88b97e752840 1545991274 S Bi:4:003:1 -115 4096 <
ffff88b97e752a80 1545993394 C Bi:4:003:1 0 487 = 5b5d9401 d7010001 814b0100 0c01cc0d 00005e80 00c11614 13132810 0512faf0
ffff88b97e752a80 1545993405 S Bi:4:003:1 -115 4096 <
ffff88b97e752f00 1545995020 C Bi:4:003:1 0 478 = 5b5d9501 d6010001 823f1000 0701cb0d 00006b69 fb020202 ff01f807 f902fe05
ffff88b97e752f00 1545995038 S Bi:4:003:1 -115 4096 <
ffff88b97e7520c0 1545997149 C Bi:4:003:1 0 488 = 5b5d9601 d6010001 90371100 0701cb0d 00006d80 01541bf9 06fae812 0f03f90a
ffff88b97e7520c0 1545997162 S Bi:4:003:1 -115 4096 <
ffff88b97e752840 1545998895 C Bi:4:003:1 0 479 = 5b5d9701 d7010001 91100000 0c01cc0d 00005f5e fefd0300 02fe02fd 00fd0401
ffff88b97e752840 1545998906 S Bi:4:003:1 -115 4096 <
ffff88b97e752a80 1546000888 C Bi:4:003:1 0 485 = 5b5d9801 d7010001 9ee90100 0c01cc0d 00005a80 00be1712 1e0a2a0b 0614faee
ffff88b97e752a80 1546000899 S Bi:4:003:1 -115 4096 <
ffff88b97e752f00 1546002646 C Bi:4:003:1 0 478 = 5b5d9901 d6010001 9fde1000 0701cb0d 00006765 00fdff05 fe04fb01 fd0202ff
ffff88b97e752f00 1546002665 S Bi:4:003:1 -115 4096 <
ffff88b97e7520c0 1546004650 C Bi:4:003:1 0 488 = 5b5d9a01 d6010001 adce1100 0701cb0d 00006c80 014f1ff9 05fce811 090bfc01
ffff88b97e7520c0 1546004663 S Bi:4:003:1 -115 4096 <
ffff88b97e752840 1546006373 C Bi:4:003:1 0 479 = 5b5d9b01 d7010001 aea70000 0c01cc0d 00006261 fa030202 00fd03fa 04fd0201
ffff88b97e752840 1546006378 S Bi:4:003:1 -115 4096 <
ffff88b97e752a80 1546008524 C Bi:4:003:1 0 487 = 5b5d9c01 d7010001 bc800100 0c01cc0d 00005e80 00bc1914 1a122211 0611fbed
ffff88b97e752a80 1546008529 S Bi:4:003:1 -115 4096 <
ffff88b97e752f00 1546010271 C Bi:4:003:1 0 478 = 5b5d9d01 d6010001 bd751000 0701cb0d 00006b67 02f90600 fc04fcfe 040002fe
ffff88b97e752f00 1546010276 S Bi:4:003:1 -115 4096 <
ffff88b97e7520c0 1546012269 C Bi:4:003:1 0 488 = 5b5d9e01 d6010001 cb6e1100 0701cb0d 00006e80 015022f8 07fce60d 0c05ff0a
ffff88b97e7520c0 1546012275 S Bi:4:003:1 -115 4096 <
ffff88b97e752840 1546014019 C Bi:4:003:1 0 479 = 5b5d9f01 d7010001 cc470000 0c01cc0d 0000615d 01000002 00fdff04 fffa09fd
ffff88b97e752840 1546014024 S Bi:4:003:1 -115 4096 <
ffff88b97e752a80 1546016019 C Bi:4:003:1 0 485 = 5b5da001 d7010001 da210100 0c01cc0d 00006280 00c11a13 18112512 030e00ed
ffff88b97e752a80 1546016023 S Bi:4:003:1 -115 4096 <
ffff88b97e752f00 1546017771 C Bi:4:003:1 0 478 = 5b5da101 d6010001 db151000 0701cb0d 00006d6b 03fa0101 f80ef606 00fb04fc
ffff88b97e752f00 1546017783 S Bi:4:003:1 -115 4096 <
ffff88b97e7520c0 1546019786 C Bi:4:003:1 0 488 = 5b5da201 d6010001 e9051100 0701cb0d 00006e80 01551bf9 08fae813 0d00fe08
ffff88b97e7520c0 1546019792 S Bi:4:003:1 -115 4096 <
ffff88b97e752840 1546021523 C Bi:4:003:1 0 479 = 5b5da301 d7010001 e9de0000 0c01cc0d 00005e5e fefe0103 00ff01ff fffc06fd
ffff88b97e752840 1546021528 S Bi:4:003:1 -115 4096 <
ffff88b97e752a80 1546023648 C Bi:4:003:1 0 487 = 5b5da401 d7010001 f7b80100 0c01cc0d 00005d80 00bf1513 1914260d 0316f6f2
ffff88b97e752a80 1546023652 S Bi:4:003:1 -115 4096 <
ffff88b97e752f00 1546025396 C Bi:4:003:1 0 478 = 5b5da501 d6010001 f8ad1000 0701cb0d 00006e6b 01fc0000 fa08fc03 02fd04fc
ffff88b97e752f00 1546025402 S Bi:4:003:1 -115 4096 <
ffff88b97e7520c0 1546027397 C Bi:4:003:1 0 488 = 5b5da601 d6010001 06a61100 0701cb0d 00006e80 01531ef4 07fde415 0c08fc09
ffff88b97e7520c0 1546027403 S Bi:4:003:1 -115 4096 <
ffff88b97e752840 1546029144 C Bi:4:003:1 0 479 = 5b5da701 d7010001 077f0000 0c01cc0d 0000615f fd010202 02f904fe 02fe0102
ffff88b97e752840 1546029148 S Bi:4:003:1 -115 4096 <
ffff88b97e752a80 1546031162 C Bi:4:003:1 0 487 = 5b5da801 d7010001 15590100 0c01cc0d 00006180 00c41614 1b0c2710 0710f8ef
ffff88b97e752a80 1546031166 S Bi:4:003:1 -115 4096 <
ffff88b97e752f00 1546032891 C Bi:4:003:1 0 478 = 5b5da901 d6010001 164d1000 0701cb0d 00006d6d fbfd0800 fc07f5ff 08fd0100
ffff88b97e752f00 1546032903 S Bi:4:003:1 -115 4096 <
ffff88b97e7520c0 1546034891 C Bi:4:003:1 0 488 = 5b5daa01 d6010001 243f1100 0701cb0d 00006f80 01581ef6 06fee211 090bfc0b
ffff88b97e7520c0 1546034897 S Bi:4:003:1 -115 4096 <
ffff88b97e752840 1546036791 C Bi:4:003:1 0 479 = 5b5dab01 d7010001 25170000 0c01cc0d 00006260 01fd04fe 04f807fd fffc0500
ffff88b97e752840 1546036796 S Bi:4:003:1 -115 4096 <
ffff88b97e752a80 1546038772 C Bi:4:003:1 0 487 = 5b5dac01 d7010001 32eb0100 0c01cc0d 00006080 00c01f0d 1c0b280c 0b0ef7f3
ffff88b97e752a80 1546038776 S Bi:4:003:1 -115 4096 <
ffff88b97e752f00 1546040519 C Bi:4:003:1 0 478 = 5b5dad01 d6010001 33e01000 0701cb0d 00006b68 03f80501 0007f603 fd010001
ffff88b97e752f00 1546040525 S Bi:4:003:1 -115 4096 <
ffff88b97e7520c0 1546042520 C Bi:4:003:1 0 488 = 5b5dae01 d6010001 41d91100 0701cb0d 00006e80 01541cf9 08f7ed0d 0c04fe08
ffff88b97e7520c0 1546042526 S Bi:4:003:1 -115 4096 <
ffff88b97e752840 1546044278 C Bi:4:003:1 0 479 = 5b5daf01 d7010001 42b20000 0c01cc0d 00005e5b ff020002 04f90100 01f907fe
ffff88b97e752840 1546044282 S Bi:4:003:1 -115 4096 <
ffff88b97e752a80 1546046396 C Bi:4:003:1 0 487 = 5b5db001 d7010001 508c0100 0c01cc0d 00005e80 00c21514 1b112707 0b13f7f0
ffff88b97e752a80 1546046401 S Bi:4:003:1 -115 4096 <
ffff88b97e752f00 1546048013 C Bi:4:003:1 0 478 = 5b5db101 d6010001 51811000 0701cb0d 00006b69 01fc04fe fa0af207 0202fb04
ffff88b97e752f00 1546048024 S Bi:4:003:1 -115 4096 <
ffff88b97e7520c0 1546050018 C Bi:4:003:1 0 488 = 5b5db201 d6010001 5f721100 0701cb0d 00006f80 01551ff6 0400e40e 0e02000b
ffff88b97e7520c0 1546050024 S Bi:4:003:1 -115 4096 <
ffff88b97e752840 1546051895 C Bi:4:003:1 0 479 = 5b5db301 d7010001 604b0000 0c01cc0d 00006461 ff000100 04fa0104 fffb09ff
ffff88b97e752840 1546051899 S Bi:4:003:1 -115 4096 <
ffff88b97e752a80 1546053897 C Bi:4:003:1 0 487 = 5b5db401 d7010001 6e1f0100 0c01cc0d 00005d80 00bf1814 1812260f 0614f8ea
ffff88b97e752a80 1546053901 S Bi:4:003:1 -115 4096 <
ffff88b97e752f00 1546055648 C Bi:4:003:1 0 478 = 5b5db501 d6010001 6f131000 0701cb0d 00006c68 fdf70b02 fd07f801 00fe0500
ffff88b97e752f00 1546055660 S Bi:4:003:1 -115 4096 <
ffff88b97e7520c0 1546057646 C Bi:4:003:1 0 488 = 5b5db601 d6010001 7d0b1100 0701cb0d 00006d80 015520f3 07fce70c 0b0cfd0b
ffff88b97e7520c0 1546057652 S Bi:4:003:1 -115 4096 <
ffff88b97e752840 1546059415 C Bi:4:003:1 0 479 = 5b5db701 d7010001 7de40000 0c01cc0d 00006362 fdfe03ff 05fb0100 00ff0101
ffff88b97e752840 1546059419 S Bi:4:003:1 -115 4096 <
ffff88b97e752a80 1546061523 C Bi:4:003:1 0 487 = 5b5db801 d7010001 8bbf0100 0c01cc0d 00005d80 00c01712 1b0f2a0d 0513f6f2
ffff88b97e752a80 1546061527 S Bi:4:003:1 -115 4096 <
ffff88b97e752f00 1546063150 C Bi:4:003:1 0 478 = 5b5db901 d6010001 8cb41000 0701cb0d 00006a68 fffb0303 fc0cf403 feff03fc
ffff88b97e752f00 1546063162 S Bi:4:003:1 -115 4096 <
ffff88b97e7520c0 1546065271 C Bi:4:003:1 0 488 = 5b5dba01 d6010001 9aab1100 0701cb0d 00006c80 015120f9 05fce60f 0e08fb0b
ffff88b97e7520c0 1546065277 S Bi:4:003:1 -115 4096 <
ffff88b97e752840 1546067020 C Bi:4:003:1 0 479 = 5b5dbb01 d7010001 9b840000 0c01cc0d 00006160 fdff0302 fc000001 fd0007fd
ffff88b97e752840 1546067025 S Bi:4:003:1 -115 4096 <
ffff88b97e752a80 1546069029 C Bi:4:003:1 0 487 = 5b5dbc01 d7010001 a9580100 0c01cc0d 00005f80 00c21612 1a11280b 0812fdea
ffff88b97e752a80 1546069033 S Bi:4:003:1 -115 4096 <
ffff88b97e752f00 1546070770 C Bi:4:003:1 0 478 = 5b5dbd01 d6010001 aa4c1000 0701cb0d 0000706d 00fc0202 fd08f505 fb010203
ffff88b97e752f00 1546070776 S Bi:4:003:1 -115 4096 <
ffff88b97e7520c0 1546072771 C Bi:4:003:1 0 488 = 5b5dbe01 d6010001 b8441100 0701cb0d 00006b80 01521df7 05ffe513 0c08fb09
ffff88b97e7520c0 1546072776 S Bi:4:003:1 -115 4096 <
ffff88b97e752840 1546074647 C Bi:4:003:1 0 479 = 5b5dbf01 d7010001 b91d0000 0c01cc0d 0000605e 00ff0000 01fd0300 fffd0301
ffff88b97e752840 1546074651 S Bi:4:003:1 -115 4096 <
ffff88b97e752a80 1546076650 C Bi:4:003:1 0 487 = 5b5dc001 d7010001 c6f80100 0c01cc0d 00005d80 00c11610 1a152111 0911f8f1
ffff88b97e752a80 1546076655 S Bi:4:003:1 -115 4096 <
ffff88b97e752f00 1546078398 C Bi:4:003:1 0 478 = 5b5dc101 d6010001 c7ed1000 0701cb0d 00006b68 02feff01 0101fb06 00fbfe02
ffff88b97e752f00 1546078404 S Bi:4:003:1 -115 4096 <
ffff88b97e7520c0 1546080403 C Bi:4:003:1 0 488 = 5b5dc201 d6010001 d5e41100 0701cb0d 00006780 01501df5 07fbea10 0f050102
ffff88b97e7520c0 1546080409 S Bi:4:003:1 -115 4096 <
ffff88b97e752840 1546082148 C Bi:4:003:1 0 479 = 5b5dc301 d7010001 d6bd0000 0c01cc0d 0000625e fffc07fe 03f90601 fcfd0104
ffff88b97e752840 1546082152 S Bi:4:003:1 -115 4096 <
ffff88b97e752a80 1546084272 C Bi:4:003:1 0 489 = 5b5dc401 d7010001 e4910100 0c01cc0d 00005c80 00bb1a10 1f0f270b 0912fbed
ffff88b97e752a80 1546084277 S Bi:4:003:1 -115 4096 <
ffff88b97e752f00 1546086021 C Bi:4:003:1 0 478 = 5b5dc501 d6010001 e5851000 0701cb0d 00006965 03fefb06 fb06fb04 fe00fe04
ffff88b97e752f00 1546086033 S Bi:4:003:1 -115 4096 <
ffff88b97e7520c0 1546088021 C Bi:4:003:1 0 488 = 5b5dc601 d6010001 f37e1100 0701cb0d 00006e80 015519f9 07fdea0d 0e06fe07
ffff88b97e7520c0 1546088026 S Bi:4:003:1 -115 4096 <
ffff88b97e752840 1546089771 C Bi:4:003:1 0 479 = 5b5dc701 d7010001 f4570000 0c01cc0d 00005e5c fe0202fe 01fe03fe 02fa0403
ffff88b97e752840 1546089775 S Bi:4:003:1 -115 4096 <
ffff88b97e752a80 1546091896 C Bi:4:003:1 0 485 = 5b5dc801 d7010001 02320100 0c01cc0d 00005e80 00c01815 1a122211 050efcef
ffff88b97e752a80 1546091901 S Bi:4:003:1 -115 4096 <
ffff88b97e752f00 1546093522 C Bi:4:003:1 0 478 = 5b5dc901 d6010001 03271000 0701cb0d 0000726c 05fefc02 fd04f906 000100fe
ffff88b97e752f00 1546093533 S Bi:4:003:1 -115 4096 <
ffff88b97e7520c0 1546095535 C Bi:4:003:1 0 488 = 5b5dca01 d6010001 111d1100 0701cb0d 00006f80 014f22f8 06fde70e 0b0bff02
ffff88b97e7520c0 1546095541 S Bi:4:003:1 -115 4096 <
ffff88b97e752840 1546097396 C Bi:4:003:1 0 479 = 5b5dcb01 d7010001 11f60000 0c01cc0d 0000605f 01fa04ff 04fb05fd 01fc05fe
ffff88b97e752840 1546097401 S Bi:4:003:1 -115 4096 <
ffff88b97e752a80 1546099388 C Bi:4:003:1 0 485 = 5b5dcc01 d7010001 1fc90100 0c01cc0d 00005d80 00c11914 1712270b 0613faec
ffff88b97e752a80 1546099393 S Bi:4:003:1 -115 4096 <
ffff88b97e752f00 1546101147 C Bi:4:003:1 0 478 = 5b5dcd01 d6010001 20be1000 0701cb0d 00006c6a fffe0202 fd06f601 04fe01ff
ffff88b97e752f00 1546101152 S Bi:4:003:1 -115 4096 <
ffff88b97e7520c0 1546103159 C Bi:4:003:1 0 488 = 5b5dce01 d6010001 2eb41100 0701cb0d 00006a80 01511ff5 06fde512 0d05ff0a
ffff88b97e7520c0 1546103165 S Bi:4:003:1 -115 4096 <
ffff88b97e752840 1546104916 C Bi:4:003:1 0 479 = 5b5dcf01 d7010001 2f8d0000 0c01cc0d 0000605d 01fe0203 02fcfe00 00fe0303
ffff88b97e752840 1546104921 S Bi:4:003:1 -115 4096 <
ffff88b97e752a80 1546107021 C Bi:4:003:1 0 485 = 5b5dd001 d7010001 3d670100 0c01cc0d 00006080 00c31c14 12112710 0511faed
ffff88b97e752a80 1546107040 S Bi:4:003:1 -115 4096 <
ffff88b97e752f00 1546108771 C Bi:4:003:1 0 478 = 5b5dd101 d6010001 3e5b1000 0701cb0d 00006d6b fe00ff06 fb02fa02 fc000502
ffff88b97e752f00 1546108776 S Bi:4:003:1 -115 4096 <
ffff88b97e7520c0 1546110773 C Bi:4:003:1 0 488 = 5b5dd201 d6010001 4c531100 0701cb0d 00006a80 01551bf7 07fbe809 1305fb0c
ffff88b97e7520c0 1546110778 S Bi:4:003:1 -115 4096 <
ffff88b97e752840 1546112522 C Bi:4:003:1 0 479 = 5b5dd301 d7010001 4d2c0000 0c01cc0d 00006160 fffd04fc 040000fe ff010302
ffff88b97e752840 1546112527 S Bi:4:003:1 -115 4096 <
ffff88b97e752a80 1546114649 C Bi:4:003:1 0 487 = 5b5dd401 d7010001 5a000100 0c01cc0d 00005f80 00c11815 1810260b 0c10f7f0
ffff88b97e752a80 1546114654 S Bi:4:003:1 -115 4096 <
ffff88b97e752f00 1546116272 C Bi:4:003:1 0 478 = 5b5dd501 d6010001 5bf41000 0701cb0d 00006f6d 02fd0104 f907f801 0200fc00
ffff88b97e752f00 1546116284 S Bi:4:003:1 -115 4096 <
ffff88b97e7520c0 1546118393 C Bi:4:003:1 0 488 = 5b5dd601 d6010001 69ec1100 0701cb0d 00006f80 015716fd 0300e80c 1205f80a
ffff88b97e7520c0 1546118399 S Bi:4:003:1 -115 4096 <
ffff88b97e752840 1546120147 C Bi:4:003:1 0 479 = 5b5dd701 d7010001 6ac50000 0c01cc0d 00005e5c fd0203fd 03fe02fe 01fc0204
ffff88b97e752840 1546120151 S Bi:4:003:1 -115 4096 <
ffff88b97e752a80 1546122141 C Bi:4:003:1 0 487 = 5b5dd801 d7010001 789f0100 0c01cc0d 00005d80 00bf1915 140f2e0b 0512fdec
ffff88b97e752a80 1546122145 S Bi:4:003:1 -115 4096 <
ffff88b97e752f00 1546123897 C Bi:4:003:1 0 478 = 5b5dd901 d6010001 79931000 0701cb0d 00006f71 f70006fe 0008f5ff 02fd0201
ffff88b97e752f00 1546123909 S Bi:4:003:1 -115 4096 <
ffff88b97e7520c0 1546125889 C Bi:4:003:1 0 488 = 5b5dda01 d6010001 878d1100 0701cb0d 00006d80 01551cf7 08fee50e 0f02fe08
ffff88b97e7520c0 1546125894 S Bi:4:003:1 -115 4096 <
ffff88b97e752840 1546127771 C Bi:4:003:1 0 479 = 5b5ddb01 d7010001 88650000 0c01cc0d 00005e5b 000100ff 03fe0100 fdfd08fa
ffff88b97e752840 1546127776 S Bi:4:003:1 -115 4096 <
ffff88b97e752a80 1546129770 C Bi:4:003:1 0 485 = 5b5ddc01 d7010001 96390100 0c01cc0d 00005c80 00c50f16 1d0b2712 0310fdee
ffff88b97e752a80 1546129774 S Bi:4:003:1 -115 4096 <
ffff88b97e752f00 1546131525 C Bi:4:003:1 0 478 = 5b5ddd01 d6010001 972e1000 0701cb0d 00006c69 fefa0405 fd09f8fd 0100fd05
ffff88b97e752f00 1546131537 S Bi:4:003:1 -115 4096 <
ffff88b97e7520c0 1546133525 C Bi:4:003:1 0 488 = 5b5dde01 d6010001 a5241100 0701cb0d 00007080 01551ff8 04ffe60e 0b0af60e
ffff88b97e7520c0 1546133530 S Bi:4:003:1 -115 4096 <
ffff88b97e752840 1546135263 C Bi:4:003:1 0 479 = 5b5ddf01 d7010001 a5fd0000 0c01cc0d 00005f5f fdfa0800 fffd04fd 02fb0403
ffff88b97e752840 1546135268 S Bi:4:003:1 -115 4096 <
ffff88b97e752a80 1546137396 C Bi:4:003:1 0 487 = 5b5de001 d7010001 b3d70100 0c01cc0d 00005c80 00bf1a13 16102711 0511faef
ffff88b97e752a80 1546137401 S Bi:4:003:1 -115 4096 <
ffff88b97e752f00 1546139147 C Bi:4:003:1 0 478 = 5b5de101 d6010001 b4cb1000 0701cb0d 00006d6a fcfe0402 fb09f900 0200fcfe
ffff88b97e752f00 1546139158 S Bi:4:003:1 -115 4096 <
ffff88b97e7520c0 1546141149 C Bi:4:003:1 0 488 = 5b5de201 d6010001 c2c51100 0701cb0d 00006e80 01541ffa 02fee70f 0d030105
ffff88b97e7520c0 1546141155 S Bi:4:003:1 -115 4096 <
ffff88b97e752840 1546142904 C Bi:4:003:1 0 479 = 5b5de301 d7010001 c39d0000 0c01cc0d 0000615f 00fe04ff 01fb05fd 01fe0104
ffff88b97e752840 1546142908 S Bi:4:003:1 -115 4096 <
ffff88b97e752a80 1546145023 C Bi:4:003:1 0 487 = 5b5de401 d7010001 d1710100 0c01cc0d 00005e80 00c61312 1d0f240f 0611f8f3
ffff88b97e752a80 1546145028 S Bi:4:003:1 -115 4096 <
ffff88b97e752f00 1546146770 C Bi:4:003:1 0 478 = 5b5de501 d6010001 d2661000 0701cb0d 00006c6c 00fd0202 f907f900 03ff01ff
ffff88b97e752f00 1546146782 S Bi:4:003:1 -115 4096 <
ffff88b97e7520c0 1546148770 C Bi:4:003:1 0 486 = 5b5de601 d6010001 e05e1100 0701cb0d 00006980 014f20f7 07f8e512 1006fc0a
ffff88b97e7520c0 1546148776 S Bi:4:003:1 -115 4096 <
ffff88b97e752840 1546150521 C Bi:4:003:1 0 479 = 5b5de701 d7010001 e1360000 0c01cc0d 00005f5b 00ff0400 03fb02fe 02fe0004
ffff88b97e752840 1546150525 S Bi:4:003:1 -115 4096 <
ffff88b97e752a80 1546152535 C Bi:4:003:1 0 487 = 5b5de801 d7010001 ef0f0100 0c01cc0d 00005c80 00c01612 1b0f2712 0411fcec
ffff88b97e752a80 1546152540 S Bi:4:003:1 -115 4096 <
ffff88b97e752f00 1546154275 C Bi:4:003:1 0 478 = 5b5de901 d6010001 f0031000 0701cb0d 00006b63 04fe02fe fe03fc09 fffc01ff
ffff88b97e752f00 1546154286 S Bi:4:003:1 -115 4096 <
ffff88b97e7520c0 1546156280 C Bi:4:003:1 0 488 = 5b5dea01 d6010001 fdfb1100 0701cb0d 00006d80 01551af7 07fce711 0e04000a
ffff88b97e7520c0 1546156285 S Bi:4:003:1 -115 4096 <
ffff88b97e752840 1546158146 C Bi:4:003:1 0 479 = 5b5deb01 d7010001 fed40000 0c01cc0d 0000615f fb030103 01fc03fe fefe0501
ffff88b97e752840 1546158150 S Bi:4:003:1 -115 4096 <
ffff88b97e752a80 1546160167 C Bi:4:003:1 0 487 = 5b5dec01 d7010001 0ca90100 0c01cc0d 00005e80 00c21715 170f2712 040ffded
ffff88b97e752a80 1546160171 S Bi:4:003:1 -115 4096 <
ffff88b97e752f00 1546161895 C Bi:4:003:1 0 478 = 5b5ded01 d6010001 0d9d1000 0701cb0d 00006c6c f9ff0105 ff06f8ff ff05fcff
ffff88b97e752f00 1546161907 S Bi:4:003:1 -115 4096 <
ffff88b97e7520c0 1546163909 C Bi:4:003:1 0 488 = 5b5dee01 d6010001 1b8f1100 0701cb0d 00006d80 01521ef5 08fde511 0d030009
ffff88b97e7520c0 1546163915 S Bi:4:003:1 -115 4096 <
ffff88b97e752840 1546165772 C Bi:4:003:1 0 479 = 5b5def01 d7010001 1c680000 0c01cc0d 0000605d 01fa06ff 03fb0400 fcff0400
ffff88b97e752840 1546165776 S Bi:4:003:1 -115 4096 <
ffff88b97e752a80 1546167771 C Bi:4:003:1 0 487 = 5b5df001 d7010001 2a410100 0c01cc0d 00006080 00c61212 1d0e250f 0614f9ef
ffff88b97e752a80 1546167775 S Bi:4:003:1 -115 4096 <
ffff88b97e752f00 1546169522 C Bi:4:003:1 0 478 = 5b5df101 d6010001 2b361000 0701cb0d 00006c69 feff0205 fa04fbff fa06fe06
ffff88b97e752f00 1546169533 S Bi:4:003:1 -115 4096 <
ffff88b97e7520c0 1546171521 C Bi:4:003:1 0 488 = 5b5df201 d6010001 392e1100 0701cb0d 00007080 01521efd 03fce70f 0d08fc08
ffff88b97e7520c0 1546171527 S Bi:4:003:1 -115 4096 <
ffff88b97e752840 1546173263 C Bi:4:003:1 0 479 = 5b5df301 d7010001 3a060000 0c01cc0d 00005f5b 01fc0300 05fb03fe 00fd0400
ffff88b97e752840 1546173268 S Bi:4:003:1 -115 4096 <
ffff88b97e752a80 1546175398 C Bi:4:003:1 0 487 = 5b5df401 d7010001 47e20100 0c01cc0d 00005e80 00c11814 18112211 0713f9ec
ffff88b97e752a80 1546175402 S Bi:4:003:1 -115 4096 <
ffff88b97e752f00 1546177146 C Bi:4:003:1 0 478 = 5b5df501 d6010001 48d61000 0701cb0d 00006e6e fcfa0400 ff0af800 02fefc04
ffff88b97e752f00 1546177151 S Bi:4:003:1 -115 4096 <
ffff88b97e7520c0 1546179146 C Bi:4:003:1 0 488 = 5b5df601 d6010001 56c81100 0701cb0d 00006a80 01521df3 0afce510 0c0afd08
ffff88b97e7520c0 1546179151 S Bi:4:003:1 -115 4096 <
ffff88b97e752840 1546180900 C Bi:4:003:1 0 479 = 5b5df701 d7010001 57a10000 0c01cc0d 00005e5b 02fc0302 03fbff01 ffffff06
ffff88b97e752840 1546180904 S Bi:4:003:1 -115 4096 <
ffff88b97e752a80 1546183025 C Bi:4:003:1 0 485 = 5b5df801 d7010001 657b0100 0c01cc0d 00005f80 00c31415 1d0a290e 0714f8ee
ffff88b97e752a80 1546183029 S Bi:4:003:1 -115 4096 <
ffff88b97e752f00 1546184767 C Bi:4:003:1 0 478 = 5b5df901 d6010001 666f1000 0701cb0d 0000706c fffb08ff fe0bf6ff ff01fd02
ffff88b97e752f00 1546184779 S Bi:4:003:1 -115 4096 <
ffff88b97e7520c0 1546186794 C Bi:4:003:1 0 488 = 5b5dfa01 d6010001 74651100 0701cb0d 00007080 01561ff6 06fbeb11 0906fe09
ffff88b97e7520c0 1546186800 S Bi:4:003:1 -115 4096 <
ffff88b97e752840 1546188521 C Bi:4:003:1 0 479 = 5b5dfb01 d7010001 753e0000 0c01cc0d 00006260 00ff03fe fe020000 00fe0202
ffff88b97e752840 1546188525 S Bi:4:003:1 -115 4096 <
ffff88b97e752a80 1546190526 C Bi:4:003:1 0 485 = 5b5dfc01 d7010001 831a0100 0c01cc0d 00006080 00c41616 190d290f 0512f8f0
ffff88b97e752a80 1546190531 S Bi:4:003:1 -115 4096 <
ffff88b97e752f00 1546192275 C Bi:4:003:1 0 478 = 5b5dfd01 d6010001 840e1000 0701cb0d 00006d6c fbff0300 fd0bf702 fdff01fc
ffff88b97e752f00 1546192287 S Bi:4:003:1 -115 4096 <
ffff88b97e7520c0 1546194280 C Bi:4:003:1 0 488 = 5b5dfe01 d6010001 91fe1100 0701cb0d 00006d80 01551bfc 06f9e70f 10000106
ffff88b97e7520c0 1546194286 S Bi:4:003:1 -115 4096 <
ffff88b97e752840 1546196145 C Bi:4:003:1 0 479 = 5b5dff01 d7010001 92d70000 0c01cc0d 00006161 fd00fc03 05fa06fe fff90701
ffff88b97e752840 1546196150 S Bi:4:003:1 -115 4096 <
ffff88b97e752a80 1546198169 C Bi:4:003:1 0 485 = 5b5d0001 d7010001 a0b10100 0c01cc0d 00005d80 00c21b0c 1c112510 0711fbeb
ffff88b97e752a80 1546198173 S Bi:4:003:1 -115 4096 <
ffff88b97e752f00 1546199899 C Bi:4:003:1 0 478 = 5b5d0101 d6010001 a1a61000 0701cb0d 00006e6a 02fe02fd fa09faff 04fe0103
ffff88b97e752f00 1546199911 S Bi:4:003:1 -115 4096 <
ffff88b97e7520c0 1546201887 C Bi:4:003:1 0 488 = 5b5d0201 d6010001 af9c1100 0701cb0d 00006b80 015417fb 04fceb0c 1107ff00
ffff88b97e7520c0 1546201893 S Bi:4:003:1 -115 4096 <
ffff88b97e752840 1546203772 C Bi:4:003:1 0 479 = 5b5d0301 d7010001 b0740000 0c01cc0d 0000605e ff0002fe 05fa02fd 00ff07fe
ffff88b97e752840 1546203776 S Bi:4:003:1 -115 4096 <
ffff88b97e752a80 1546205771 C Bi:4:003:1 0 485 = 5b5d0401 d7010001 be4e0100 0c01cc0d 00006180 00c51911 1a12220e 0912f9ec
ffff88b97e752a80 1546205775 S Bi:4:003:1 -115 4096 <
ffff88b97e752f00 1546207521 C Bi:4:003:1 0 478 = 5b5d0501 d6010001 bf431000 0701cb0d 00006f6e 00fb03ff 0006f700 0100ffff
ffff88b97e752f00 1546207526 S Bi:4:003:1 -115 4096 <
ffff88b97e7520c0 1546209521 C Bi:4:003:1 0 486 = 5b5d0601 d6010001 cd351100 0701cb0d 00006c80 01561cf9 04ffe50d 1104fb0c
ffff88b97e7520c0 1546209527 S Bi:4:003:1 -115 4096 <
ffff88b97e752840 1546211270 C Bi:4:003:1 0 479 = 5b5d0701 d7010001 ce0d0000 0c01cc0d 0000605c 03fe01fd 04fd0104 fbfe07fe
ffff88b97e752840 1546211275 S Bi:4:003:1 -115 4096 <
ffff88b97e752a80 1546213397 C Bi:4:003:1 0 485 = 5b5d0801 d7010001 dbe60100 0c01cc0d 00005c80 00c01a10 1c092c0d 0714fbeb
ffff88b97e752a80 1546213402 S Bi:4:003:1 -115 4096 <
ffff88b97e752f00 1546215148 C Bi:4:003:1 0 478 = 5b5d0901 d6010001 dcdb1000 0701cb0d 00006e6a 04f805ff fc06fb01 05fefffc
ffff88b97e752f00 1546215160 S Bi:4:003:1 -115 4096 <
ffff88b97e7520c0 1546217146 C Bi:4:003:1 0 488 = 5b5d0a01 d6010001 ead11100 0701cb0d 00006c80 015220f9 07f9e514 0908fe07
ffff88b97e7520c0 1546217152 S Bi:4:003:1 -115 4096 <
ffff88b97e752840 1546218910 C Bi:4:003:1 0 479 = 5b5d0b01 d7010001 ebaa0000 0c01cc0d 0000615d 01fe0201 02fd03ff fd0004fc
ffff88b97e752840 1546218915 S Bi:4:003:1 -115 4096 <
ffff88b97e752a80 1546221025 C Bi:4:003:1 0 485 = 5b5d0c01 d7010001 f9840100 0c01cc0d 00005e80 00be1b13 16142710 0315fcef
ffff88b97e752a80 1546221029 S Bi:4:003:1 -115 4096 <
ffff88b97e752f00 1546222771 C Bi:4:003:1 0 478 = 5b5d0d01 d6010001 fa781000 0701cb0d 00006e6e fcfd0402 fd0af6ff fc01fe04
ffff88b97e752f00 1546222777 S Bi:4:003:1 -115 4096 <
ffff88b97e7520c0 1546224775 C Bi:4:003:1 0 488 = 5b5d0e01 d6010001 086a1100 0701cb0d 00006d80 01551cf9 0000e80f 0f06fa09
ffff88b97e7520c0 1546224781 S Bi:4:003:1 -115 4096 <
ffff88b97e752840 1546226522 C Bi:4:003:1 0 479 = 5b5d0f01 d7010001 09430000 0c01cc0d 00005e5d fe0003ff 00ff02fe fe0006fe
ffff88b97e752840 1546226527 S Bi:4:003:1 -115 4096 <
ffff88b97e752a80 1546228529 C Bi:4:003:1 0 485 = 5b5d1001 d7010001 171c0100 0c01cc0d 00005d80 00be1a12 1c0e290e 0313f6ef
ffff88b97e752a80 1546228534 S Bi:4:003:1 -115 4096 <
ffff88b97e752f00 1546230272 C Bi:4:003:1 0 478 = 5b5d1101 d6010001 18111000 0701cb0d 00006e6b 04fb0300 fa08fa01 fcfe0602
ffff88b97e752f00 1546230283 S Bi:4:003:1 -115 4096 <
ffff88b97e7520c0 1546232280 C Bi:4:003:1 0 488 = 5b5d1201 d6010001 26071100 0701cb0d 00006b80 01541bf8 0af9e609 1506fd0d
ffff88b97e7520c0 1546232286 S Bi:4:003:1 -115 4096 <
ffff88b97e752840 1546234146 C Bi:4:003:1 0 479 = 5b5d1301 d7010001 26e00000 0c01cc0d 0000605e fdff07fc 0300fc03 fffb0502
ffff88b97e752840 1546234151 S Bi:4:003:1 -115 4096 <
ffff88b97e752a80 1546236140 C Bi:4:003:1 0 485 = 5b5d1401 d7010001 34ba0100 0c01cc0d 00005e80 00bf200c 18152511 080ffaea
ffff88b97e752a80 1546236144 S Bi:4:003:1 -115 4096 <
ffff88b97e752f00 1546237897 C Bi:4:003:1 0 478 = 5b5d1501 d6010001 35af1000 0701cb0d 00006b67 02fb04fc fd08fd03 f909fefc
ffff88b97e752f00 1546237909 S Bi:4:003:1 -115 4096 <
ffff88b97e7520c0 1546239890 C Bi:4:003:1 0 488 = 5b5d1601 d6010001 43a01100 0701cb0d 00006c80 01521df9 04fce90e 0f08fb09
ffff88b97e7520c0 1546239896 S Bi:4:003:1 -115 4096 <
ffff88b97e752840 1546241771 C Bi:4:003:1 0 479 = 5b5d1701 d7010001 44790000 0c01cc0d 0000605e fffd06ff 03fb02fe fe05feff
ffff88b97e752840 1546241776 S Bi:4:003:1 -115 4096 <
ffff88b97e752a80 1546243778 C Bi:4:003:1 0 485 = 5b5d1801 d7010001 52530100 0c01cc0d 00006080 00bb1d17 190f260e 0512fbef
ffff88b97e752a80 1546243783 S Bi:4:003:1 -115 4096 <
ffff88b97e752f00 1546245525 C Bi:4:003:1 0 478 = 5b5d1901 d6010001 53471000 0701cb0d 00006b68 fcff01fe 0205fb04 03fdfdfb
ffff88b97e752f00 1546245530 S Bi:4:003:1 -115 4096 <
ffff88b97e7520c0 1546247521 C Bi:4:003:1 0 488 = 5b5d1a01 d6010001 613e1100 0701cb0d 00006e80 015718f8 05f8f20d 090afd09
ffff88b97e7520c0 1546247527 S Bi:4:003:1 -115 4096 <
ffff88b97e752840 1546249279 C Bi:4:003:1 0 479 = 5b5d1b01 d7010001 62160000 0c01cc0d 00005f5c ff010103 00f904fc 06f90801
ffff88b97e752840 1546249283 S Bi:4:003:1 -115 4096 <
ffff88b97e752a80 1546251396 C Bi:4:003:1 0 485 = 5b5d1c01 d7010001 6ff00100 0c01cc0d 00006080 00c11911 1b10290a 0d0ef9f0
ffff88b97e752a80 1546251401 S Bi:4:003:1 -115 4096 <
ffff88b97e752f00 1546253147 C Bi:4:003:1 0 478 = 5b5d1d01 d6010001 70e51000 0701cb0d 00006d6e fdff02ff fd02fd03 fdff05fc
ffff88b97e752f00 1546253153 S Bi:4:003:1 -115 4096 <
ffff88b97e7520c0 1546255147 C Bi:4:003:1 0 488 = 5b5d1e01 d6010001 7ed51100 0701cb0d 00006980 01541bf7 04fee60d 1205f60f
ffff88b97e7520c0 1546255152 S Bi:4:003:1 -115 4096 <
ffff88b97e752840 1546256914 C Bi:4:003:1 0 479 = 5b5d1f01 d7010001 7fae0000 0c01cc0d 00005f5e ff01ff01 02fa06fe fefe0403
ffff88b97e752840 1546256919 S Bi:4:003:1 -115 4096 <
ffff88b97e752a80 1546259025 C Bi:4:003:1 0 485 = 5b5d2001 d7010001 8d890100 0c01cc0d 00005d80 00c11910 15182310 0415f8ef
ffff88b97e752a80 1546259029 S Bi:4:003:1 -115 4096 <
ffff88b97e752f00 1546260772 C Bi:4:003:1 0 478 = 5b5d2101 d6010001 8e7e1000 0701cb0d 00006d69 fa020400 fd05fa03 fc02fdfe
ffff88b97e752f00 1546260778 S Bi:4:003:1 -115 4096 <
ffff88b97e7520c0 1546262773 C Bi:4:003:1 0 488 = 5b5d2201 d6010001 9c741100 0701cb0d 00006b80 01521ef8 05fde30e 100bfa09
ffff88b97e7520c0 1546262779 S Bi:4:003:1 -115 4096 <
ffff88b97e752840 1546264527 C Bi:4:003:1 0 479 = 5b5d2301 d7010001 9d4d0000 0c01cc0d 0000615e 00fe04fe 03fc0002 00fc0102
ffff88b97e752840 1546264531 S Bi:4:003:1 -115 4096 <
ffff88b97e752a80 1546266537 C Bi:4:003:1 0 485 = 5b5d2401 d7010001 ab260100 0c01cc0d 00005e80 00be1c10 1c0f280e 0411fdeb
ffff88b97e752a80 1546266541 S Bi:4:003:1 -115 4096 <
ffff88b97e752f00 1546268265 C Bi:4:003:1 0 478 = 5b5d2501 d6010001 ac1b1000 0701cb0d 00006f6c 00fb0201 fc08fa02 0201ffff
ffff88b97e752f00 1546268277 S Bi:4:003:1 -115 4096 <
ffff88b97e7520c0 1546270290 C Bi:4:003:1 0 488 = 5b5d2601 d6010001 ba0b1100 0701cb0d 00006c80 01541ef6 05fde70a 1108fe0a
ffff88b97e7520c0 1546270295 S Bi:4:003:1 -115 4096 <
ffff88b97e752840 1546272148 C Bi:4:003:1 0 479 = 5b5d2701 d7010001 bae40000 0c01cc0d 0000625f ffff03fb 07fb04fd 04fc0201
ffff88b97e752840 1546272152 S Bi:4:003:1 -115 4096 <
ffff88b97e752a80 1546274145 C Bi:4:003:1 0 485 = 5b5d2801 d7010001 c8bf0100 0c01cc0d 00005e80 00be1615 1a11280d 0711faef
ffff88b97e752a80 1546274150 S Bi:4:003:1 -115 4096 <
ffff88b97e752f00 1546275903 C Bi:4:003:1 0 478 = 5b5d2901 d6010001 c9b41000 0701cb0d 00006c6b fb00ff00 000af706 fa00ffff
ffff88b97e752f00 1546275914 S Bi:4:003:1 -115 4096 <
ffff88b97e7520c0 1546277890 C Bi:4:003:1 0 488 = 5b5d2a01 d6010001 d7aa1100 0701cb0d 00006b80 015121fc 03f9e80e 0d06fd09
ffff88b97e7520c0 1546277896 S Bi:4:003:1 -115 4096 <
ffff88b97e752840 1546279773 C Bi:4:003:1 0 479 = 5b5d2b01 d7010001 d8830000 0c01cc0d 0000605b 03fd0200 01fe0100 00fe03fe
ffff88b97e752840 1546279778 S Bi:4:003:1 -115 4096 <
ffff88b97e752a80 1546281781 C Bi:4:003:1 0 485 = 5b5d2c01 d7010001 e65d0100 0c01cc0d 00005e80 00be1a13 1915220e 0514fbed
ffff88b97e752a80 1546281785 S Bi:4:003:1 -115 4096 <
ffff88b97e752f00 1546283522 C Bi:4:003:1 0 478 = 5b5d2d01 d6010001 e7511000 0701cb0d 00006765 ff00fefe 0104fd01 00ffff01
ffff88b97e752f00 1546283527 S Bi:4:003:1 -115 4096 <
ffff88b97e7520c0 1546285522 C Bi:4:003:1 0 488 = 5b5d2e01 d6010001 f5411100 0701cb0d 00006b80 01521ef9 0200e60f 1005fd07
ffff88b97e7520c0 1546285528 S Bi:4:003:1 -115 4096 <
ffff88b97e752840 1546287273 C Bi:4:003:1 0 479 = 5b5d2f01 d7010001 f61a0000 0c01cc0d 0000605c fc030300 00fe0003 fffc0401
ffff88b97e752840 1546287277 S Bi:4:003:1 -115 4096 <
ffff88b97e752a80 1546289397 C Bi:4:003:1 0 485 = 5b5d3001 d7010001 03ef0100 0c01cc0d 00005d80 00c3190c 1b13270d 0810fded
ffff88b97e752a80 1546289402 S Bi:4:003:1 -115 4096 <
ffff88b97e752f00 1546291146 C Bi:4:003:1 0 478 = 5b5d3101 d6010001 04e41000 0701cb0d 00006d66 08fafd06 f907fb01 0202f903
ffff88b97e752f00 1546291152 S Bi:4:003:1 -115 4096 <
ffff88b97e7520c0 1546293147 C Bi:4:003:1 0 488 = 5b5d3201 d6010001 12da1100 0701cb0d 00006f80 01551dfd 04f7ea12 0a06fa0a
ffff88b97e7520c0 1546293152 S Bi:4:003:1 -115 4096 <
ffff88b97e752840 1546294915 C Bi:4:003:1 0 479 = 5b5d3301 d7010001 13b30000 0c01cc0d 00006662 020001ff fe020100 00fc03ff
ffff88b97e752840 1546294919 S Bi:4:003:1 -115 4096 <
ffff88b97e752a80 1546297023 C Bi:4:003:1 0 485 = 5b5d3401 d7010001 218d0100 0c01cc0d 00005f80 00c51413 1714250c 0a15f7ec
ffff88b97e752a80 1546297027 S Bi:4:003:1 -115 4096 <
ffff88b97e752f00 1546298772 C Bi:4:003:1 0 478 = 5b5d3501 d6010001 22811000 0701cb0d 00006f6c feffff06 ff06f602 fefc0504
ffff88b97e752f00 1546298784 S Bi:4:003:1 -115 4096 <
ffff88b97e7520c0 1546300773 C Bi:4:003:1 0 488 = 5b5d3601 d6010001 30781100 0701cb0d 00006d80 01521ff9 05fee70e 0b06ff09
ffff88b97e7520c0 1546300792 S Bi:4:003:1 -115 4096 <
ffff88b97e752840 1546302523 C Bi:4:003:1 0 479 = 5b5d3701 d7010001 31500000 0c01cc0d 0000635f 01fe0301 01fb06fc fefe0401
ffff88b97e752840 1546302527 S Bi:4:003:1 -115 4096 <
ffff88b97e752a80 1546304538 C Bi:4:003:1 0 485 = 5b5d3801 d7010001 3f240100 0c01cc0d 00006080 00c21414 1e10260e 0316fbed
ffff88b97e752a80 1546304542 S Bi:4:003:1 -115 4096 <
ffff88b97e752f00 1546306263 C Bi:4:003:1 0 478 = 5b5d3901 d6010001 40191000 0701cb0d 00006b69 00fff907 fb06fc04 fb05fefd
ffff88b97e752f00 1546306269 S Bi:4:003:1 -115 4096 <
ffff88b97e7520c0 1546308276 C Bi:4:003:1 0 488 = 5b5d3a01 d6010001 4e0f1100 0701cb0d 00007080 01581cf8 0101e710 0d08fb04
ffff88b97e7520c0 1546308281 S Bi:4:003:1 -115 4096 <
ffff88b97e752840 1546310172 C Bi:4:003:1 0 479 = 5b5d3b01 d7010001 4ee80000 0c01cc0d 00006261 00fffd02 04fd01ff fffd0501
ffff88b97e752840 1546310176 S Bi:4:003:1 -115 4096 <
ffff88b97e752a80 1546312147 C Bi:4:003:1 0 485 = 5b5d3c01 d7010001 5cc20100 0c01cc0d 00005e80 00be1d0f 1b0e280d 0911feea
ffff88b97e752a80 1546312151 S Bi:4:003:1 -115 4096 <
ffff88b97e752f00 1546313896 C Bi:4:003:1 0 478 = 5b5d3d01 d6010001 5db61000 0701cb0d 00006c68 03fe03fd fc09f401 09fcff06
ffff88b97e752f00 1546313902 S Bi:4:003:1 -115 4096 <
ffff88b97e7520c0 1546315889 C Bi:4:003:1 0 488 = 5b5d3e01 d6010001 6bad1100 0701cb0d 00006c80 015320f1 0bf9ea10 0c060007
ffff88b97e7520c0 1546315895 S Bi:4:003:1 -115 4096 <
ffff88b97e752840 1546317770 C Bi:4:003:1 0 479 = 5b5d3f01 d7010001 6c850000 0c01cc0d 00005e5b fd010302 01fd0000 fdfe0106
ffff88b97e752840 1546317775 S Bi:4:003:1 -115 4096 <
ffff88b97e752a80 1546319779 C Bi:4:003:1 0 485 = 5b5d4001 d7010001 7a590100 0c01cc0d 00005f80 00c41713 1b0f270e 0512faea
ffff88b97e752a80 1546319783 S Bi:4:003:1 -115 4096 <
ffff88b97e752f00 1546321524 C Bi:4:003:1 0 478 = 5b5d4101 d6010001 7b4e1000 0701cb0d 00006e6c fd00fd08 fd06f8ff 02fb0303
ffff88b97e752f00 1546321536 S Bi:4:003:1 -115 4096 <
ffff88b97e7520c0 1546323524 C Bi:4:003:1 0 488 = 5b5d4201 d6010001 89451100 0701cb0d 00006c80 01521ff9 03fee90e 1002fe07
ffff88b97e7520c0 1546323530 S Bi:4:003:1 -115 4096 <
ffff88b97e752840 1546325268 C Bi:4:003:1 0 479 = 5b5d4301 d7010001 8a1e0000 0c01cc0d 00006360 00fe00ff 04fd0102 fdfd0301
ffff88b97e752840 1546325272 S Bi:4:003:1 -115 4096 <
ffff88b97e752a80 1546327399 C Bi:4:003:1 0 485 = 5b5d4401 d7010001 97f80100 0c01cc0d 00005d80 00bd1a16 1a082d0b 0b10f3f4
ffff88b97e752a80 1546327403 S Bi:4:003:1 -115 4096 <
ffff88b97e752f00 1546329151 C Bi:4:003:1 0 478 = 5b5d4501 d6010001 98ec1000 0701cb0d 00006d69 03fc0103 fa08fa01 0102fa00
ffff88b97e752f00 1546329163 S Bi:4:003:1 -115 4096 <
ffff88b97e7520c0 1546331147 C Bi:4:003:1 0 488 = 5b5d4601 d6010001 a6e31100 0701cb0d 00006d80 015120f5 09fce410 0c080004
ffff88b97e7520c0 1546331153 S Bi:4:003:1 -115 4096 <
ffff88b97e752840 1546332898 C Bi:4:003:1 0 479 = 5b5d4701 d7010001 a7bb0000 0c01cc0d 00005e5c 01fd0201 02fb03ff 01fd0302
ffff88b97e752840 1546332902 S Bi:4:003:1 -115 4096 <
ffff88b97e752a80 1546335047 C Bi:4:003:1 0 485 = 5b5d4801 d7010001 b58f0100 0c01cc0d 00005c80 00c31417 12132712 0213f7ef
ffff88b97e752a80 1546335051 S Bi:4:003:1 -115 4096 <
ffff88b97e752f00 1546336773 C Bi:4:003:1 0 478 = 5b5d4901 d6010001 b6831000 0701cb0d 00006a67 00fd0000 0201fc02 0101fffe
ffff88b97e752f00 1546336784 S Bi:4:003:1 -115 4096 <
ffff88b97e7520c0 1546338772 C Bi:4:003:1 0 488 = 5b5d4a01 d6010001 c47b1100 0701cb0d 00006a80 014e20fb 04fae70c 0e0afc0c
ffff88b97e7520c0 1546338778 S Bi:4:003:1 -115 4096 <
ffff88b97e752840 1546340523 C Bi:4:003:1 0 479 = 5b5d4b01 d7010001 c5540000 0c01cc0d 00005e5e fc0105fc 02ff03fc 01fe0102
ffff88b97e752840 1546340527 S Bi:4:003:1 -115 4096 <
ffff88b97e752a80 1546342538 C Bi:4:003:1 0 485 = 5b5d4c01 d7010001 d32e0100 0c01cc0d 00005c80 00c11318 1b0f240e 0714faef
ffff88b97e752a80 1546342542 S Bi:4:003:1 -115 4096 <
ffff88b97e752f00 1546344266 C Bi:4:003:1 0 478 = 5b5d4d01 d6010001 d4221000 0701cb0d 00006c69 00fe0101 fc06fc02 ff00ff07
ffff88b97e752f00 1546344278 S Bi:4:003:1 -115 4096 <
ffff88b97e7520c0 1546346281 C Bi:4:003:1 0 488 = 5b5d4e01 d6010001 e2191100 0701cb0d 00006e80 01541cfd 01ffe60b 0f05f811
ffff88b97e7520c0 1546346287 S Bi:4:003:1 -115 4096 <
ffff88b97e752840 1546348148 C Bi:4:003:1 0 479 = 5b5d4f01 d7010001 e2f20000 0c01cc0d 0000615f 00fc0500 fffe06fe fdfe0302
ffff88b97e752840 1546348153 S Bi:4:003:1 -115 4096 <
ffff88b97e752a80 1546350141 C Bi:4:003:1 0 485 = 5b5d5001 d7010001 f0c50100 0c01cc0d 00005f80 00c11816 1b0b280c 0912f9ef
ffff88b97e752a80 1546350145 S Bi:4:003:1 -115 4096 <
ffff88b97e752f00 1546351897 C Bi:4:003:1 0 478 = 5b5d5101 d6010001 f1ba1000 0701cb0d 00006c66 01000003 fd06f901 feff0202
ffff88b97e752f00 1546351909 S Bi:4:003:1 -115 4096 <
ffff88b97e7520c0 1546353891 C Bi:4:003:1 0 488 = 5b5d5201 d6010001 ffb01100 0701cb0d 00006d80 01561df7 03fee80d 0c0af809
ffff88b97e7520c0 1546353897 S Bi:4:003:1 -115 4096 <
ffff88b97e752840 1546355775 C Bi:4:003:1 0 479 = 5b5d5301 d7010001 00890000 0c01cc0d 0000605b 00000105 fefc02ff fffe0600
ffff88b97e752840 1546355779 S Bi:4:003:1 -115 4096 <
ffff88b97e752a80 1546357773 C Bi:4:003:1 0 485 = 5b5d5401 d7010001 0e630100 0c01cc0d 00005e80 00bf1b14 1a11260c 0514f9ee
ffff88b97e752a80 1546357777 S Bi:4:003:1 -115 4096 <
ffff88b97e752f00 1546359523 C Bi:4:003:1 0 478 = 5b5d5501 d6010001 0f571000 0701cb0d 00006f6a 04fe02ff fd05fb01 00ffff04
ffff88b97e752f00 1546359535 S Bi:4:003:1 -115 4096 <
ffff88b97e7520c0 1546361524 C Bi:4:003:1 0 488 = 5b5d5601 d6010001 1d4e1100 0701cb0d 00006d80 01541ef9 04fee50e 0e07fb0a
ffff88b97e7520c0 1546361530 S Bi:4:003:1 -115 4096 <
ffff88b97e752840 1546363272 C Bi:4:003:1 0 479 = 5b5d5701 d7010001 1e260000 0c01cc0d 00006160 fffd03ff 03f70801 00fa0600
ffff88b97e752840 1546363277 S Bi:4:003:1 -115 4096 <
ffff88b97e752a80 1546365401 C Bi:4:003:1 0 485 = 5b5d5801 d7010001 2bfa0100 0c01cc0d 00005e80 00be1917 1610260e 0912f7ee
ffff88b97e752a80 1546365405 S Bi:4:003:1 -115 4096 <
ffff88b97e752f00 1546367149 C Bi:4:003:1 0 478 = 5b5d5901 d6010001 2cee1000 0701cb0d 00006d6c fafd07ff fe08f804 fdfd0201
ffff88b97e752f00 1546367155 S Bi:4:003:1 -115 4096 <
ffff88b97e7520c0 1546369148 C Bi:4:003:1 0 488 = 5b5d5a01 d6010001 3ae51100 0701cb0d 00007180 01551cfb 0400e310 0f03fd09
ffff88b97e7520c0 1546369154 S Bi:4:003:1 -115 4096 <
ffff88b97e752840 1546370908 C Bi:4:003:1 0 479 = 5b5d5b01 d7010001 3bbe0000 0c01cc0d 0000605a 02ff01fe 06fd0100 00f80803
ffff88b97e752840 1546370912 S Bi:4:003:1 -115 4096 <
ffff88b97e752a80 1546373023 C Bi:4:003:1 0 485 = 5b5d5c01 d7010001 49990100 0c01cc0d 00006180 00c2190e 1d11260e 090ffaeb
ffff88b97e752a80 1546373028 S Bi:4:003:1 -115 4096 <
ffff88b97e752f00 1546374774 C Bi:4:003:1 0 478 = 5b5d5d01 d6010001 4a8e1000 0701cb0d 00007070 fbfffb06 0304f8fe ff01ff03
ffff88b97e752f00 1546374785 S Bi:4:003:1 -115 4096 <
ffff88b97e7520c0 1546376774 C Bi:4:003:1 0 486 = 5b5d5e01 d6010001 58841100 0701cb0d 00007380 015620f7 05feea0a 0c05fc09
ffff88b97e7520c0 1546376780 S Bi:4:003:1 -115 4096 <
ffff88b97e752840 1546378525 C Bi:4:003:1 0 479 = 5b5d5f01 d7010001 595d0000 0c01cc0d 0000625e 0001fb05 01ff0101 fdfe05fb
ffff88b97e752840 1546378530 S Bi:4:003:1 -115 4096 <
ffff88b97e752a80 1546380539 C Bi:4:003:1 0 485 = 5b5d6001 d7010001 672f0100 0c01cc0d 00005b80 00ba1d0f 1d11270d 0514f9ed
ffff88b97e752a80 1546380543 S Bi:4:003:1 -115 4096 <
ffff88b97e752f00 1546382275 C Bi:4:003:1 0 478 = 5b5d6101 d6010001 68241000 0701cb0d 00006c6a ff000101 fe06f800 fffe04fe
ffff88b97e752f00 1546382287 S Bi:4:003:1 -115 4096 <
ffff88b97e7520c0 1546384290 C Bi:4:003:1 0 488 = 5b5d6201 d6010001 761a1100 0701cb0d 00006c80 014e23f5 0af8e70f 0b0bfb07
ffff88b97e7520c0 1546384296 S Bi:4:003:1 -115 4096 <
ffff88b97e752840 1546386148 C Bi:4:003:1 0 479 = 5b5d6301 d7010001 76f30000 0c01cc0d 00006460 0100fffe 0500fffd 01000104
ffff88b97e752840 1546386152 S Bi:4:003:1 -115 4096 <
ffff88b97e752a80 1546388141 C Bi:4:003:1 0 485 = 5b5d6401 d7010001 84ce0100 0c01cc0d 00005f80 00c11914 1b0d260e 0811f9f1
ffff88b97e752a80 1546388145 S Bi:4:003:1 -115 4096 <
ffff88b97e752f00 1546390773 C Bi:4:003:1 0 2471 = 5b5d6509 9f020201 015c083d 00001012 02061013 02011011 03061014 43011015
ffff88b97e752f00 1546390777 S Bi:4:003:1 -115 4096 <
ffff88b97e7520c0 1546392273 C Bi:4:003:1 0 478 = 5b5d6601 d6010001 85c31000 0701cb8d 00006f6c 03fa0202 0003fcfe 01fe0003
ffff88b97e7520c0 1546392285 S Bi:4:003:1 -115 4096 <
ffff88b97e752840 1546395266 C Bi:4:003:1 0 488 = 5b5d6701 d6010001 a0d31100 0701cb8d 00007080 015021f6 06fee710 0e05fd0a
ffff88b97e752840 1546395271 S Bi:4:003:1 -115 4096 <
ffff88b97e752a80 1546397650 C Bi:4:003:1 0 479 = 5b5d6801 d7010001 a1ab0000 0c01cc8d 0000625d ff010100 02fffe02 feff0302
ffff88b97e752a80 1546397654 S Bi:4:003:1 -115 4096 <
ffff88b97e752f00 1546401151 C Bi:4:003:1 0 485 = 5b5d6901 d7010001 b17d0100 0c01cc8d 00005f80 00c11714 18112710 0511fced
ffff88b97e752f00 1546401155 S Bi:4:003:1 -115 4096 <
ffff88b97e7520c0 1546403776 C Bi:4:003:1 0 478 = 5b5d6a01 d6010001 b2711000 0701cb0d 00006a65 03fcff03 fb07fa03 ff0100fe
ffff88b97e7520c0 1546403788 S Bi:4:003:1 -115 4096 <
ffff88b97e752840 1546405774 C Bi:4:003:1 0 488 = 5b5d6b01 d6010001 c95e1100 0701cb0d 00006a80 01511ef8 02ffe70b 1407f90d
ffff88b97e752840 1546405779 S Bi:4:003:1 -115 4096 <
ffff88b97e752a80 1546407523 C Bi:4:003:1 0 479 = 5b5d6c01 d7010001 ca360000 0c01cc0d 00006261 fffd04ff 01fc0103 fcfe0400
ffff88b97e752a80 1546407527 S Bi:4:003:1 -115 4096 <
ffff88b97e752f00 1546409517 C Bi:4:003:1 0 485 = 5b5d6d01 d7010001 d8100100 0c01cc0d 00005d80 00c11610 200c2610 0812f7ee
ffff88b97e752f00 1546409521 S Bi:4:003:1 -115 4096 <
ffff88b97e7520c0 1546411279 C Bi:4:003:1 0 478 = 5b5d6e01 d6010001 d9051000 0701cb0d 00006e6b feff0301 fb08f801 fd0201ff
ffff88b97e7520c0 1546411290 S Bi:4:003:1 -115 4096 <
ffff88b97e752840 1546413265 C Bi:4:003:1 0 488 = 5b5d6f01 d6010001 e6fb1100 0701cb0d 00006a80 014c24fa 01fbe70e 0c0bfd08
ffff88b97e752840 1546413271 S Bi:4:003:1 -115 4096 <
ffff88b97e752a80 1546415148 C Bi:4:003:1 0 479 = 5b5d7001 d7010001 e7d40000 0c01cc0d 00005e5a 02fc0301 02fb06fd 00fe0200
ffff88b97e752a80 1546415153 S Bi:4:003:1 -115 4096 <
ffff88b97e752f00 1546417152 C Bi:4:003:1 0 485 = 5b5d7101 d7010001 f5ae0100 0c01cc0d 00005e80 00bf1912 1c0e280f 0711faef
ffff88b97e752f00 1546417156 S Bi:4:003:1 -115 4096 <
ffff88b97e7520c0 1546418898 C Bi:4:003:1 0 478 = 5b5d7201 d6010001 f6a31000 0701cb0d 00006c6a fcfb0603 fe06fb02 fffdfe03
ffff88b97e7520c0 1546418910 S Bi:4:003:1 -115 4096 <
ffff88b97e752840 1546420898 C Bi:4:003:1 0 488 = 5b5d7301 d6010001 04941100 0701cb0d 00006b80 015024f6 04faec0d 0d040007
ffff88b97e752840 1546420904 S Bi:4:003:1 -115 4096 <
ffff88b97e752a80 1546422774 C Bi:4:003:1 0 479 = 5b5d7401 d7010001 056d0000 0c01cc0d 0000605d 03fc0300 03fc0000 fd000403
ffff88b97e752a80 1546422778 S Bi:4:003:1 -115 4096 <
ffff88b97e752f00 1546424772 C Bi:4:003:1 0 485 = 5b5d7501 d7010001 13400100 0c01cc0d 00006080 00c5170f 1d0f2310 0617f4ef
ffff88b97e752f00 1546424776 S Bi:4:003:1 -115 4096 <
ffff88b97e7520c0 1546426522 C Bi:4:003:1 0 478 = 5b5d7601 d6010001 14351000 0701cb0d 00006a6a fefb0200 ff08f809 fcf90100
ffff88b97e7520c0 1546426528 S Bi:4:003:1 -115 4096 <
ffff88b97e752840 1546428524 C Bi:4:003:1 0 488 = 5b5d7701 d6010001 222b1100 0701cb0d 00006b80 01551cfa ffffea0d 0c0afe04
ffff88b97e752840 1546428530 S Bi:4:003:1 -115 4096 <
ffff88b97e752a80 1546430290 C Bi:4:003:1 0 479 = 5b5d7801 d7010001 23040000 0c01cc0d 00005d5c fe010001 00ff01ff 02fb08fd
ffff88b97e752a80 1546430295 S Bi:4:003:1 -115 4096 <
ffff88b97e752f00 1546432398 C Bi:4:003:1 0 485 = 5b5d7901 d7010001 30de0100 0c01cc0d 00005d80 00c01a12 1810260c 0a13f3f5
ffff88b97e752f00 1546432402 S Bi:4:003:1 -115 4096 <
ffff88b97e7520c0 1546434020 C Bi:4:003:1 0 478 = 5b5d7a01 d6010001 31d21000 0701cb0d 00006b67 00fd06fc fe05fa00 02010002
ffff88b97e7520c0 1546434035 S Bi:4:003:1 -115 4096 <
ffff88b97e752840 1546436148 C Bi:4:003:1 0 488 = 5b5d7b01 d6010001 3fc81100 0701cb0d 00006d80 014e27f1 0afce60d 0e050104
ffff88b97e752840 1546436160 S Bi:4:003:1 -115 4096 <
ffff88b97e752a80 1546437898 C Bi:4:003:1 0 479 = 5b5d7c01 d7010001 40a10000 0c01cc0d 00005e5c 00fb0201 07fcfe00 00ff0400
ffff88b97e752a80 1546437909 S Bi:4:003:1 -115 4096 <
ffff88b97e752f00 1546439915 C Bi:4:003:1 0 485 = 5b5d7d01 d7010001 4e750100 0c01cc0d 00005e80 00c41713 1712250e 0615f7f0
ffff88b97e752f00 1546439926 S Bi:4:003:1 -115 4096 <
ffff88b97e7520c0 1546441773 C Bi:4:003:1 0 478 = 5b5d7e01 d6010001 4f691000 0701cb0d 00006e68 00010102 fb0af602 ffffff07
ffff88b97e7520c0 1546441792 S Bi:4:003:1 -115 4096 <
ffff88b97e752840 1546443773 C Bi:4:003:1 0 488 = 5b5d7f01 d6010001 5d5f1100 0701cb0d 00006e80 015816fd 02fde712 0f05f80a
ffff88b97e752840 1546443785 S Bi:4:003:1 -115 4096 <
ffff88b97e752a80 1546445525 C Bi:4:003:1 0 479 = 5b5d8001 d7010001 5e380000 0c01cc0d 0000615f 01fe0102 03f808fc 00fb06ff
ffff88b97e752a80 1546445536 S Bi:4:003:1 -115 4096 <
ffff88b97e752f00 1546447516 C Bi:4:003:1 0 485 = 5b5d8101 d7010001 6c120100 0c01cc0d 00005e80 00c61511 1d0b2612 0314fce9
ffff88b97e752f00 1546447527 S Bi:4:003:1 -115 4096 <
ffff88b97e7520c0 1546449273 C Bi:4:003:1 0 478 = 5b5d8201 d6010001 6d061000 0701cb0d 00006d6b 00fd0104 fb07f701 fd06fd02
ffff88b97e7520c0 1546449292 S Bi:4:003:1 -115 4096 <
ffff88b97e752840 1546451267 C Bi:4:003:1 0 488 = 5b5d8301 d6010001 7afd1100 0701cb0d 00006980 014e1ef8 07fce40e 1107fb0b
ffff88b97e752840 1546451279 S Bi:4:003:1 -115 4096 <
ffff88b97e752a80 1546453149 C Bi:4:003:1 0 479 = 5b5d8401 d7010001 7bd50000 0c01cc0d 0000615e 0000ff04 02f807fe fcff0400
ffff88b97e752a80 1546453161 S Bi:4:003:1 -115 4096 <
ffff88b97e752f00 1546455154 C Bi:4:003:1 0 485 = 5b5d8501 d7010001 89ab0100 0c01cc0d 00005d80 00bf1c0e 1e0d2213 0712fde9
ffff88b97e752f00 1546455165 S Bi:4:003:1 -115 4096 <
ffff88b97e7520c0 1546456900 C Bi:4:003:1 0 478 = 5b5d8601 d6010001 8a9f1000 0701cb0d 00006f6c 00fb05ff fa07fb02 fe04ff02
ffff88b97e7520c0 1546456919 S Bi:4:003:1 -115 4096 <
ffff88b97e752840 1546458898 C Bi:4:003:1 0 488 = 5b5d8701 d6010001 98951100 0701cb0d 00006d80 015323f7 01fceb11 0b030006
ffff88b97e752840 1546458911 S Bi:4:003:1 -115 4096 <
ffff88b97e752a80 1546460775 C Bi:4:003:1 0 479 = 5b5d8801 d7010001 996e0000 0c01cc0d 0000605c 05f906ff 03fa04ff fdfe07fc
ffff88b97e752a80 1546460786 S Bi:4:003:1 -115 4096 <
ffff88b97e752f00 1546462774 C Bi:4:003:1 0 487 = 5b5d8901 d7010001 a7480100 0c01cc0d 00005e80 00c01813 1b0a2811 0414fbed
ffff88b97e752f00 1546462785 S Bi:4:003:1 -115 4096 <
ffff88b97e7520c0 1546464524 C Bi:4:003:1 0 478 = 5b5d8a01 d6010001 a83c1000 0701cb0d 00006a67 03fcfd03 fb08f605 020300fd
ffff88b97e7520c0 1546464542 S Bi:4:003:1 -115 4096 <
ffff88b97e752840 1546466527 C Bi:4:003:1 0 488 = 5b5d8b01 d6010001 b6341100 0701cb0d 00006980 01511ef2 0cfde40e 0f02010a
ffff88b97e752840 1546466539 S Bi:4:003:1 -115 4096 <
ffff88b97e752a80 1546468287 C Bi:4:003:1 0 479 = 5b5d8c01 d7010001 b70d0000 0c01cc0d 0000615c 030100fe 03fb04fe fe0104fc
ffff88b97e752a80 1546468298 S Bi:4:003:1 -115 4096 <
ffff88b97e752f00 1546470400 C Bi:4:003:1 0 485 = 5b5d8d01 d7010001 c4e20100 0c01cc0d 00006080 00c6150e 1e11260c 0a0dfcf0
ffff88b97e752f00 1546470411 S Bi:4:003:1 -115 4096 <
ffff88b97e7520c0 1546472024 C Bi:4:003:1 0 478 = 5b5d8e01 d6010001 c5d61000 0701cb0d 00006c69 03fd01fc fe0af407 ffff0001
ffff88b97e7520c0 1546472036 S Bi:4:003:1 -115 4096 <
ffff88b97e752840 1546474150 C Bi:4:003:1 0 488 = 5b5d8f01 d6010001 d3cd1100 0701cb0d 00006f80 015420f7 05fde513 0dfe0207
ffff88b97e752840 1546474162 S Bi:4:003:1 -115 4096 <
ffff88b97e752a80 1546475900 C Bi:4:003:1 0 479 = 5b5d9001 d7010001 d4a50000 0c01cc0d 0000615e fc0204fe 05fb0001 00fc0203
ffff88b97e752a80 1546475911 S Bi:4:003:1 -115 4096 <
ffff88b97e752f00 1546477916 C Bi:4:003:1 0 485 = 5b5d9101 d7010001 e27f0100 0c01cc0d 00005f80 00c21814 1b11240e 0612faef
ffff88b97e752f00 1546477927 S Bi:4:003:1 -115 4096 <
ffff88b97e7520c0 1546479775 C Bi:4:003:1 0 478 = 5b5d9201 d6010001 e3741000 0701cb0d 00006d6c fcfd06ff fd09f901 ff01fdfe
ffff88b97e7520c0 1546479788 S Bi:4:003:1 -115 4096 <
ffff88b97e752840 1546481774 C Bi:4:003:1 0 488 = 5b5d9301 d6010001 f16a1100 0701cb0d 00006d80 01561af9 03fbeb0a 1406fc04
ffff88b97e752840 1546481786 S Bi:4:003:1 -115 4096 <
ffff88b97e752a80 1546483524 C Bi:4:003:1 0 479 = 5b5d9401 d7010001 f2430000 0c01cc0d 00005f5d fefd07fc 05fc04fe fefc07fe
ffff88b97e752a80 1546483535 S Bi:4:003:1 -115 4096 <
ffff88b97e752f00 1546485518 C Bi:4:003:1 0 485 = 5b5d9501 d7010001 00170100 0c01cc0d 00005f80 00c11a15 190d260e 090ff7f2
ffff88b97e752f00 1546485529 S Bi:4:003:1 -115 4096 <
ffff88b97e7520c0 1546487274 C Bi:4:003:1 0 478 = 5b5d9601 d6010001 010b1000 0701cb0d 00006a66 0300fe00 fb0af802 04fd05fb
ffff88b97e7520c0 1546487293 S Bi:4:003:1 -115 4096 <
ffff88b97e752840 1546489267 C Bi:4:003:1 0 488 = 5b5d9701 d6010001 0f011100 0701cb0d 00007080 01551dfb 01fee90b 110afb05
ffff88b97e752840 1546489280 S Bi:4:003:1 -115 4096 <
ffff88b97e752a80 1546491150 C Bi:4:003:1 0 479 = 5b5d9801 d7010001 0fda0000 0c01cc0d 00005f5c fd0006fd 02fd04fc ffff0404
ffff88b97e752a80 1546491161 S Bi:4:003:1 -115 4096 <
ffff88b97e752f00 1546493155 C Bi:4:003:1 0 485 = 5b5d9901 d7010001 1db40100 0c01cc0d 00005d80 00c11814 190d2515 ff17f8ee
ffff88b97e752f00 1546493166 S Bi:4:003:1 -115 4096 <
ffff88b97e7520c0 1546494899 C Bi:4:003:1 0 478 = 5b5d9a01 d6010001 1ea91000 0701cb0d 00006a65 00fe03ff fc09f905 fdffff01
ffff88b97e7520c0 1546494918 S Bi:4:003:1 -115 4096 <
ffff88b97e752840 1546496901 C Bi:4:003:1 0 488 = 5b5d9b01 d6010001 2c9f1100 0701cb0d 00006b80 01541afa 03ffe410 0c080109
ffff88b97e752840 1546496913 S Bi:4:003:1 -115 4096 <
ffff88b97e752a80 1546498774 C Bi:4:003:1 0 479 = 5b5d9c01 d7010001 2d780000 0c01cc0d 0000605d 02fb04ff 04fb0101 fb000401
ffff88b97e752a80 1546498785 S Bi:4:003:1 -115 4096 <
ffff88b97e752f00 1546500774 C Bi:4:003:1 0 485 = 5b5d9d01 d7010001 3b4b0100 0c01cc0d 00006080 00c11d0e 1b0e280f 0911f8ed
ffff88b97e752f00 1546500785 S Bi:4:003:1 -115 4096 <
ffff88b97e7520c0 1546502524 C Bi:4:003:1 0 478 = 5b5d9e01 d6010001 3c401000 0701cb0d 00006d6a 00feff08 fe04f408 fdfc0203
ffff88b97e7520c0 1546502544 S Bi:4:003:1 -115 4096 <
ffff88b97e752840 1546504523 C Bi:4:003:1 0 488 = 5b5d9f01 d6010001 4a381100 0701cb0d 00007080 015420f9 04fee90c 0e07fb08
ffff88b97e752840 1546504536 S Bi:4:003:1 -115 4096 <
ffff88b97e752a80 1546506268 C Bi:4:003:1 0 479 = 5b5da001 d7010001 4b110000 0c01cc0d 00005f5a fe020405 fdfd02fe fefd0503
ffff88b97e752a80 1546506279 S Bi:4:003:1 -115 4096 <
ffff88b97e752f00 1546508401 C Bi:4:003:1 0 485 = 5b5da101 d7010001 58ea0100 0c01cc0d 00005e80 00c21b11 170f2610 0315f8ef
ffff88b97e752f00 1546508412 S Bi:4:003:1 -115 4096 <
ffff88b97e7520c0 1546510150 C Bi:4:003:1 0 478 = 5b5da201 d6010001 59df1000 0701cb0d 00006b64 07f90102 f80ef606 fefefe01
ffff88b97e7520c0 1546510168 S Bi:4:003:1 -115 4096 <
ffff88b97e752840 1546512150 C Bi:4:003:1 0 488 = 5b5da301 d6010001 67d51100 0701cb0d 00006e80 015617fc 08fae810 0e04f90f
ffff88b97e752840 1546512163 S Bi:4:003:1 -115 4096 <
ffff88b97e752a80 1546513899 C Bi:4:003:1 0 479 = 5b5da401 d7010001 68ae0000 0c01cc0d 00006462 ff000003 00ff01ff fefd06fd
ffff88b97e752a80 1546513910 S Bi:4:003:1 -115 4096 <
ffff88b97e752f00 1546515916 C Bi:4:003:1 0 485 = 5b5da501 d7010001 76820100 0c01cc0d 00005a80 00be1816 16122412 0612f7ec
ffff88b97e752f00 1546515927 S Bi:4:003:1 -115 4096 <
ffff88b97e7520c0 1546517774 C Bi:4:003:1 0 478 = 5b5da601 d6010001 77761000 0701cb0d 00006c6f f8ff0102 ff09f603 fd01f908
ffff88b97e7520c0 1546517787 S Bi:4:003:1 -115 4096 <
ffff88b97e752840 1546519778 C Bi:4:003:1 0 488 = 5b5da701 d6010001 856e1100 0701cb0d 00006a80 01511ff8 04fce90d 0b08ff0a
ffff88b97e752840 1546519790 S Bi:4:003:1 -115 4096 <
ffff88b97e752a80 1546521525 C Bi:4:003:1 0 479 = 5b5da801 d7010001 86470000 0c01cc0d 0000605d 00ff0202 01fd00fe 00fd0400
ffff88b97e752a80 1546521536 S Bi:4:003:1 -115 4096 <
ffff88b97e752f00 1546523518 C Bi:4:003:1 0 483 = 5b5da901 d7010001 94210100 0c01cc0d 00005d80 00c31713 16102b0d 0610fcee
ffff88b97e752f00 1546523529 S Bi:4:003:1 -115 4096 <
ffff88b97e7520c0 1546525277 C Bi:4:003:1 0 478 = 5b5daa01 d6010001 95151000 0701cb0d 00006d6c fbfb09ff f90afc00 00fa0003
ffff88b97e7520c0 1546525297 S Bi:4:003:1 -115 4096 <
ffff88b97e752840 1546527268 C Bi:4:003:1 0 488 = 5b5dab01 d6010001 a30b1100 0701cb0d 00006e80 01541ff7 07fbe60b 1106fb0b
ffff88b97e752840 1546527280 S Bi:4:003:1 -115 4096 <
ffff88b97e752a80 1546529042 C Bi:4:003:1 0 479 = 5b5dac01 d7010001 a3e40000 0c01cc0d 0000615f fe0001ff 04fe03fa 02000100
ffff88b97e752a80 1546529053 S Bi:4:003:1 -115 4096 <
ffff88b97e752f00 1546531154 C Bi:4:003:1 0 483 = 5b5dad01 d7010001 b1b70100 0c01cc0d 00005f80 00bb1c11 1a11280e 0a0efceb
ffff88b97e752f00 1546531164 S Bi:4:003:1 -115 4096 <
ffff88b97e7520c0 1546532900 C Bi:4:003:1 0 478 = 5b5dae01 d6010001 b2ae1000 0701cb0d 00006d67 04fa03fe ff06fb04 01fefffc
ffff88b97e7520c0 1546532919 S Bi:4:003:1 -115 4096 <
ffff88b97e752840 1546534899 C Bi:4:003:1 0 488 = 5b5daf01 d6010001 c09f1100 0701cb0d 00007280 01581ef8 03ffe511 0a0af809
ffff88b97e752840 1546534912 S Bi:4:003:1 -115 4096 <
ffff88b97e752a80 1546536777 C Bi:4:003:1 0 479 = 5b5db001 d7010001 c1780000 0c01cc0d 00005c59 01fc05ff 0100ff03 fcff0301
ffff88b97e752a80 1546536788 S Bi:4:003:1 -115 4096 <
ffff88b97e752f00 1546538778 C Bi:4:003:1 0 485 = 5b5db101 d7010001 cf520100 0c01cc0d 00006180 00c51516 15132311 0711fcec
ffff88b97e752f00 1546538789 S Bi:4:003:1 -115 4096 <
ffff88b97e7520c0 1546540524 C Bi:4:003:1 0 478 = 5b5db201 d6010001 d0461000 0701cb0d 00006a68 fdf90a02 fb07f8ff fb06ff01
ffff88b97e7520c0 1546540537 S Bi:4:003:1 -115 4096 <
ffff88b97e752840 1546542526 C Bi:4:003:1 0 488 = 5b5db301 d6010001 de3c1100 0701cb0d 00006f80 01551efa 03fcec0d 0c06fc08
ffff88b97e752840 1546542539 S Bi:4:003:1 -115 4096 <
ffff88b97e752a80 1546544294 C Bi:4:003:1 0 479 = 5b5db401 d7010001 df150000 0c01cc0d 00006160 fb020102 02fb02fe 01fd05fe
ffff88b97e752a80 1546544305 S Bi:4:003:1 -115 4096 <
ffff88b97e752f00 1546546400 C Bi:4:003:1 0 485 = 5b5db501 d7010001 ece90100 0c01cc0d 00005d80 00bf1916 1411280c 0812fceb
ffff88b97e752f00 1546546411 S Bi:4:003:1 -115 4096 <
ffff88b97e7520c0 1546548044 C Bi:4:003:1 0 478 = 5b5db601 d6010001 eddd1000 0701cb0d 00006b65 05fb02fe fe07fc02 0000ffff
ffff88b97e7520c0 1546548064 S Bi:4:003:1 -115 4096 <
ffff88b97e752840 1546550150 C Bi:4:003:1 0 488 = 5b5db701 d6010001 fbcd1100 0701cb0d 00006a80 015319fa 06fce411 1007fe07
ffff88b97e752840 1546550163 S Bi:4:003:1 -115 4096 <
ffff88b97e752a80 1546551899 C Bi:4:003:1 0 479 = 5b5db801 d7010001 fca60000 0c01cc0d 0000605d 00ff0001 0201fffd 01fe03ff
ffff88b97e752a80 1546551910 S Bi:4:003:1 -115 4096 <
ffff88b97e752f00 1546553908 C Bi:4:003:1 0 485 = 5b5db901 d7010001 0a820100 0c01cc0d 00006180 00c51912 170e2c08 0b10f9ed
ffff88b97e752f00 1546553919 S Bi:4:003:1 -115 4096 <
ffff88b97e7520c0 1546555779 C Bi:4:003:1 0 478 = 5b5dba01 d6010001 0b761000 0701cb0d 00006f6d fefd0301 fb09f602 02fefe05
ffff88b97e7520c0 1546555791 S Bi:4:003:1 -115 4096 <
ffff88b97e752840 1546557775 C Bi:4:003:1 0 488 = 5b5dbb01 d6010001 196c1100 0701cb0d 00006f80 015321f8 04fce80d 0f05fe06
ffff88b97e752840 1546557788 S Bi:4:003:1 -115 4096 <
ffff88b97e752a80 1546559525 C Bi:4:003:1 0 479 = 5b5dbc01 d7010001 1a450000 0c01cc0d 0000615d 000200ff 02fe02fe 02f90502
ffff88b97e752a80 1546559536 S Bi:4:003:1 -115 4096 <
ffff88b97e752f00 1546561516 C Bi:4:003:1 0 485 = 5b5dbd01 d7010001 281f0100 0c01cc0d 00006080 00c21b0f 1a10250f 0811fbf1
ffff88b97e752f00 1546561527 S Bi:4:003:1 -115 4096 <
ffff88b97e7520c0 1546563276 C Bi:4:003:1 0 478 = 5b5dbe01 d6010001 29131000 0701cb0d 00006c6a fffd05fe fd09f503 03fc0303
ffff88b97e7520c0 1546563309 S Bi:4:003:1 -115 4096 <
ffff88b97e752840 1546565267 C Bi:4:003:1 0 488 = 5b5dbf01 d6010001 37031100 0701cb0d 00006c80 015222f6 08fce312 0908ff08
ffff88b97e752840 1546565280 S Bi:4:003:1 -115 4096 <
ffff88b97e752a80 1546567150 C Bi:4:003:1 0 479 = 5b5dc001 d7010001 37dc0000 0c01cc0d 0000615c 01000202 02f90201 fffd0302
ffff88b97e752a80 1546567161 S Bi:4:003:1 -115 4096 <
ffff88b97e752f00 1546569149 C Bi:4:003:1 0 485 = 5b5dc101 d7010001 45b80100 0c01cc0d 00006180 00c5190f 1d0a280f 0613faf1
ffff88b97e752f00 1546569161 S Bi:4:003:1 -115 4096 <
ffff88b97e7520c0 1546570903 C Bi:4:003:1 0 478 = 5b5dc201 d6010001 46ac1000 0701cb0d 00006c66 07fefffe fc09f804 fe0003ff
ffff88b97e7520c0 1546570915 S Bi:4:003:1 -115 4096 <
ffff88b97e752840 1546572899 C Bi:4:003:1 0 486 = 5b5dc301 d6010001 54a31100 0701cb0d 00007080 015917f5 09fee70d 1308fb07
ffff88b97e752840 1546572912 S Bi:4:003:1 -115 4096 <
ffff88b97e752a80 1546574776 C Bi:4:003:1 0 479 = 5b5dc401 d7010001 557b0000 0c01cc0d 00006260 ff0005ff fffffe04 fdfe0206
ffff88b97e752a80 1546574787 S Bi:4:003:1 -115 4096 <
ffff88b97e752f00 1546576775 C Bi:4:003:1 0 485 = 5b5dc501 d7010001 63540100 0c01cc0d 00006080 00c21713 1912260c 090ffced
ffff88b97e752f00 1546576786 S Bi:4:003:1 -115 4096 <
ffff88b97e7520c0 1546578526 C Bi:4:003:1 0 478 = 5b5dc601 d6010001 64491000 0701cb0d 00006e6e fffdff05 fefffb02 fa0800fb
ffff88b97e7520c0 1546578545 S Bi:4:003:1 -115 4096 <
ffff88b97e752840 1546580530 C Bi:4:003:1 0 488 = 5b5dc701 d6010001 72391100 0701cb0d 00006d80 01531afc 04faec0d 0f0afa05
ffff88b97e752840 1546580543 S Bi:4:003:1 -115 4096 <
ffff88b97e752a80 1546582292 C Bi:4:003:1 0 479 = 5b5dc801 d7010001 73110000 0c01cc0d 00005f5d ff000002 04f608fc fe020102
ffff88b97e752a80 1546582303 S Bi:4:003:1 -115 4096 <
ffff88b97e752f00 1546584401 C Bi:4:003:1 0 485 = 5b5dc901 d7010001 80ed0100 0c01cc0d 00006080 00c81115 1811280d 0414f8f1
ffff88b97e752f00 1546584412 S Bi:4:003:1 -115 4096 <
ffff88b97e7520c0 1546586035 C Bi:4:003:1 0 478 = 5b5dca01 d6010001 81e21000 0701cb0d 00006d6c fdfeff03 ff06fa03 ff01fefe
ffff88b97e7520c0 1546586055 S Bi:4:003:1 -115 4096 <
ffff88b97e752840 1546588151 C Bi:4:003:1 0 488 = 5b5dcb01 d6010001 8fd81100 0701cb0d 00006d80 01571bf4 08fcec0b 0e08fb08
ffff88b97e752840 1546588164 S Bi:4:003:1 -115 4096 <
ffff88b97e752a80 1546589901 C Bi:4:003:1 0 479 = 5b5dcc01 d7010001 90b10000 0c01cc0d 0000655e 030003fc 020001fd 00fb09ff
ffff88b97e752a80 1546589912 S Bi:4:003:1 -115 4096 <
ffff88b97e752f00 1546591916 C Bi:4:003:1 0 485 = 5b5dcd01 d7010001 9e8b0100 0c01cc0d 00005e80 00c2180e 1d11260f 0611faf0
ffff88b97e752f00 1546591927 S Bi:4:003:1 -115 4096 <
ffff88b97e7520c0 1546593777 C Bi:4:003:1 0 478 = 5b5dce01 d6010001 9f7f1000 0701cb0d 00006965 06f80101 fc06ffff 0100fd02
ffff88b97e7520c0 1546593789 S Bi:4:003:1 -115 4096 <
ffff88b97e752840 1546595776 C Bi:4:003:1 0 488 = 5b5dcf01 d6010001 ad6f1100 0701cb0d 00007080 015420f6 04feeb0c 0e06fc09
ffff88b97e752840 1546595788 S Bi:4:003:1 -115 4096 <
ffff88b97e752a80 1546597525 C Bi:4:003:1 0 479 = 5b5dd001 d7010001 ae480000 0c01cc0d 00005e5e feff05fd 02fd02fe fffd0403
ffff88b97e752a80 1546597536 S Bi:4:003:1 -115 4096 <
ffff88b97e752f00 1546599519 C Bi:4:003:1 0 485 = 5b5dd101 d7010001 bc220100 0c01cc0d 00005b80 00be121a 18102611 0512fced
ffff88b97e752f00 1546599530 S Bi:4:003:1 -115 4096 <
ffff88b97e7520c0 1546601282 C Bi:4:003:1 0 478 = 5b5dd201 d6010001 bd171000 0701cb0d 00006b6c faff03fe 0206f906 f9ff02fe
ffff88b97e7520c0 1546601301 S Bi:4:003:1 -115 4096 <
ffff88b97e752840 1546603267 C Bi:4:003:1 0 488 = 5b5dd301 d6010001 cb0f1100 0701cb0d 00007080 01541efc ff00e513 0e03ff06
ffff88b97e752840 1546603280 S Bi:4:003:1 -115 4096 <
ffff88b97e752a80 1546605151 C Bi:4:003:1 0 479 = 5b5dd401 d7010001 cbe70000 0c01cc0d 0000605f 00fb0600 01fb0200 feff0300
ffff88b97e752a80 1546605162 S Bi:4:003:1 -115 4096 <
ffff88b97e752f00 1546607155 C Bi:4:003:1 0 485 = 5b5dd501 d7010001 d9c10100 0c01cc0d 00005d80 00c11c0e 1b0f240e 0614f8f2
ffff88b97e752f00 1546607166 S Bi:4:003:1 -115 4096 <
ffff88b97e7520c0 1546608901 C Bi:4:003:1 0 478 = 5b5dd601 d6010001 dab61000 0701cb0d 00006d6a 03fefffe ff05fa03 ffff0201
ffff88b97e7520c0 1546608919 S Bi:4:003:1 -115 4096 <
ffff88b97e752840 1546610905 C Bi:4:003:1 0 488 = 5b5dd701 d6010001 e8a61100 0701cb0d 00006c80 01541cf6 07faec0c 100afa08
ffff88b97e752840 1546610918 S Bi:4:003:1 -115 4096 <
ffff88b97e752a80 1546612776 C Bi:4:003:1 0 479 = 5b5dd801 d7010001 e97f0000 0c01cc0d 0000605d 02fc0303 fefd05fc 01ff0101
ffff88b97e752a80 1546612787 S Bi:4:003:1 -115 4096 <
ffff88b97e752f00 1546614776 C Bi:4:003:1 0 485 = 5b5dd901 d7010001 f7580100 0c01cc0d 00005e80 00c41513 180d2c10 0213f8ee
ffff88b97e752f00 1546614787 S Bi:4:003:1 -115 4096 <
ffff88b97e7520c0 1546616525 C Bi:4:003:1 0 478 = 5b5dda01 d6010001 f84d1000 0701cb0d 00006a66 02fc0004 fd09f903 fdfe00fe
ffff88b97e7520c0 1546616538 S Bi:4:003:1 -115 4096 <
ffff88b97e752840 1546618526 C Bi:4:003:1 0 488 = 5b5ddb01 d6010001 06451100 0701cb0d 00006f80 01581df6 04fde812 0b030106
ffff88b97e752840 1546618539 S Bi:4:003:1 -115 4096 <
ffff88b97e752a80 1546620298 C Bi:4:003:1 0 479 = 5b5ddc01 d7010001 071e0000 0c01cc0d 00005f5e fefe0202 03fcfe04 fdfd0502
ffff88b97e752a80 1546620309 S Bi:4:003:1 -115 4096 <
ffff88b97e752f00 1546622401 C Bi:4:003:1 0 485 = 5b5ddd01 d7010001 14f80100 0c01cc0d 00005f80 00bd1915 1e0d250f 080efcee
ffff88b97e752f00 1546622412 S Bi:4:003:1 -115 4096 <
ffff88b97e7520c0 1546624151 C Bi:4:003:1 0 478 = 5b5dde01 d6010001 15ec1000 0701cb0d 00006b69 ffff0001 ff04f906 0000fdfe
ffff88b97e7520c0 1546624164 S Bi:4:003:1 -115 4096 <
ffff88b97e752840 1546626151 C Bi:4:003:1 0 488 = 5b5ddf01 d6010001 23dc1100 0701cb0d 00006a80 01511cf8 04fcec0e 11030103
ffff88b97e752840 1546626163 S Bi:4:003:1 -115 4096 <
ffff88b97e752a80 1546627901 C Bi:4:003:1 0 479 = 5b5de001 d7010001 24b50000 0c01cc0d 00006059 00020202 00fd02ff fffb0601
ffff88b97e752a80 1546627912 S Bi:4:003:1 -115 4096 <
ffff88b97e752f00 1546630027 C Bi:4:003:1 0 487 = 5b5de101 d7010001 328f0100 0c01cc0d 00005c80 00c11515 1413270f 0512f9ef
ffff88b97e752f00 1546630038 S Bi:4:003:1 -115 4096 <
ffff88b97e7520c0 1546631776 C Bi:4:003:1 0 478 = 5b5de201 d6010001 33831000 0701cb0d 00006e69 fe000300 fd0bf501 fff90801
ffff88b97e7520c0 1546631795 S Bi:4:003:1 -115 4096 <
ffff88b97e752840 1546633775 C Bi:4:003:1 0 488 = 5b5de301 d6010001 417d1100 0701cb0d 00007080 01571cf9 03fee90a 10060106
ffff88b97e752840 1546633788 S Bi:4:003:1 -115 4096 <
ffff88b97e752a80 1546635525 C Bi:4:003:1 0 479 = 5b5de401 d7010001 42550000 0c01cc0d 00005f5e fefe03ff 04fd03ff fefe04fe
ffff88b97e752a80 1546635537 S Bi:4:003:1 -115 4096 <
ffff88b97e752f00 1546637522 C Bi:4:003:1 0 485 = 5b5de501 d7010001 502f0100 0c01cc0d 00005e80 00c01a12 1812240d 0810fbf1
ffff88b97e752f00 1546637533 S Bi:4:003:1 -115 4096 <
ffff88b97e7520c0 1546639277 C Bi:4:003:1 0 478 = 5b5de601 d6010001 51241000 0701cb0d 00006a69 fffdfe00 0406f804 fefe00fe
ffff88b97e7520c0 1546639297 S Bi:4:003:1 -115 4096 <
ffff88b97e752840 1546641271 C Bi:4:003:1 0 488 = 5b5de701 d6010001 5f141100 0701cb0d 00006d80 015320f9 03faeb0f 0e01ff06
ffff88b97e752840 1546641283 S Bi:4:003:1 -115 4096 <
ffff88b97e752a80 1546643152 C Bi:4:003:1 0 479 = 5b5de801 d7010001 5fed0000 0c01cc0d 0000615f fffe0302 01fc02ff feff0402
ffff88b97e752a80 1546643163 S Bi:4:003:1 -115 4096 <
ffff88b97e752f00 1546645163 C Bi:4:003:1 0 485 = 5b5de901 d7010001 6dc60100 0c01cc0d 00006080 00c41814 190f2011 0614f7ed
ffff88b97e752f00 1546645175 S Bi:4:003:1 -115 4096 <
ffff88b97e7520c0 1546646900 C Bi:4:003:1 0 478 = 5b5dea01 d6010001 6ebb1000 0701cb0d 00006d6a fdfffe07 fd0bf801 fc00fd00
ffff88b97e7520c0 1546646912 S Bi:4:003:1 -115 4096 <
ffff88b97e752840 1546648907 C Bi:4:003:1 0 488 = 5b5deb01 d6010001 7cb11100 0701cb0d 00006d80 01551af9 06fbe316 0d040006
ffff88b97e752840 1546648920 S Bi:4:003:1 -115 4096 <
ffff88b97e752a80 1546650776 C Bi:4:003:1 0 479 = 5b5dec01 d7010001 7d8a0000 0c01cc0d 00005e5c 00fb06fe 06fb03fd 00fe06fa
ffff88b97e752a80 1546650787 S Bi:4:003:1 -115 4096 <
ffff88b97e752f00 1546652776 C Bi:4:003:1 0 485 = 5b5ded01 d7010001 8b660100 0c01cc0d 00006080 00c21911 1a11240f 0511fced
ffff88b97e752f00 1546652788 S Bi:4:003:1 -115 4096 <
ffff88b97e7520c0 1546654527 C Bi:4:003:1 0 478 = 5b5dee01 d6010001 8c5a1000 0701cb0d 00006e6d fafb0903 fd05f700 05fb02ff
ffff88b97e7520c0 1546654546 S Bi:4:003:1 -115 4096 <
ffff88b97e752840 1546656526 C Bi:4:003:1 0 488 = 5b5def01 d6010001 9a4a1100 0701cb0d 00006980 01511ff3 0bf8e60d 0d0aff07
ffff88b97e752840 1546656539 S Bi:4:003:1 -115 4096 <
ffff88b97e752a80 1546658280 C Bi:4:003:1 0 479 = 5b5df001 d7010001 9b230000 0c01cc0d 00005f5d feff0400 02fc01ff fffe0303
ffff88b97e752a80 1546658291 S Bi:4:003:1 -115 4096 <
ffff88b97e752f00 1546660402 C Bi:4:003:1 0 483 = 5b5df101 d7010001 a8f70100 0c01cc0d 00005f80 00c51910 16132110 0515f7f1
ffff88b97e752f00 1546660414 S Bi:4:003:1 -115 4096 <
ffff88b97e7520c0 1546662026 C Bi:4:003:1 0 478 = 5b5df201 d6010001 a9eb1000 0701cb0d 00006d68 03fc01fe fe0cf802 01fefe00
ffff88b97e7520c0 1546662044 S Bi:4:003:1 -115 4096 <
ffff88b97e752840 1546664150 C Bi:4:003:1 0 488 = 5b5df301 d6010001 b7e11100 0701cb0d 00006a80 01531df8 05fce80f 0d040204
ffff88b97e752840 1546664163 S Bi:4:003:1 -115 4096 <
ffff88b97e752a80 1546665902 C Bi:4:003:1 0 479 = 5b5df401 d7010001 b8b90000 0c01cc0d 00005f5a 02fd05fd 0201fd01 01fd0203
ffff88b97e752a80 1546665913 S Bi:4:003:1 -115 4096 <
ffff88b97e752f00 1546667902 C Bi:4:003:1 0 483 = 5b5df501 d7010001 c6950100 0c01cc0d 00005d80 00bf121a 1610260e 0911f8eb
ffff88b97e752f00 1546667913 S Bi:4:003:1 -115 4096 <
ffff88b97e7520c0 1546669778 C Bi:4:003:1 0 478 = 5b5df601 d6010001 c7891000 0701cb0d 00006e6e fd00fe03 fe03fa01 01000001
ffff88b97e7520c0 1546669791 S Bi:4:003:1 -115 4096 <
ffff88b97e752840 1546671776 C Bi:4:003:1 0 488 = 5b5df701 d6010001 d5781100 0701cb0d 00006b80 014e20f9 06fbe314 0e04fa10
ffff88b97e752840 1546671789 S Bi:4:003:1 -115 4096 <
ffff88b97e752a80 1546673526 C Bi:4:003:1 0 479 = 5b5df801 d7010001 d6510000 0c01cc0d 0000625e 05f90302 03f706ff fc0105fe
ffff88b97e752a80 1546673537 S Bi:4:003:1 -115 4096 <
ffff88b97e752f00 1546675519 C Bi:4:003:1 0 483 = 5b5df901 d7010001 e4250100 0c01cc0d 00005c80 00bf1216 180e2c07 0818f7ec
ffff88b97e752f00 1546675530 S Bi:4:003:1 -115 4096 <
ffff88b97e7520c0 1546677275 C Bi:4:003:1 0 478 = 5b5dfa01 d6010001 e5191000 0701cb0d 00006d67 04fd0201 fd03f704 05fc0003
ffff88b97e7520c0 1546677295 S Bi:4:003:1 -115 4096 <
ffff88b97e752840 1546679291 C Bi:4:003:1 0 488 = 5b5dfb01 d6010001 f30f1100 0701cb0d 00006c80 01541af9 04f8e915 0a09fb0d
ffff88b97e752840 1546679304 S Bi:4:003:1 -115 4096 <
ffff88b97e752a80 1546681154 C Bi:4:003:1 0 479 = 5b5dfc01 d7010001 f3e70000 0c01cc0d 0000605e fffe0300 03fd00fe ff010201
ffff88b97e752a80 1546681165 S Bi:4:003:1 -115 4096 <
ffff88b97e752f00 1546683151 C Bi:4:003:1 0 483 = 5b5dfd01 d7010001 01c30100 0c01cc0d 00006080 00c41613 1b0f240f 0611faed
ffff88b97e752f00 1546683162 S Bi:4:003:1 -115 4096 <
ffff88b97e7520c0 1546684900 C Bi:4:003:1 0 478 = 5b5dfe01 d6010001 02b71000 0701cb0d 00006f6d fffc01fe 0204f903 03fbff02
ffff88b97e7520c0 1546684913 S Bi:4:003:1 -115 4096 <
ffff88b97e752840 1546686903 C Bi:4:003:1 0 486 = 5b5dff01 d6010001 10ad1100 0701cb0d 00006d80 01541ef5 08fbe90f 0d05fe09
ffff88b97e752840 1546686916 S Bi:4:003:1 -115 4096 <
ffff88b97e752a80 1546688775 C Bi:4:003:1 0 479 = 5b5d0001 d7010001 11850000 0c01cc0d 0000605b 02ff0101 03fb0103 fefd0500
ffff88b97e752a80 1546688786 S Bi:4:003:1 -115 4096 <
ffff88b97e752f00 1546690778 C Bi:4:003:1 0 483 = 5b5d0101 d7010001 1f580100 0c01cc0d 00005e80 00c71411 19102310 0415fbe9
ffff88b97e752f00 1546690789 S Bi:4:003:1 -115 4096 <
ffff88b97e7520c0 1546692527 C Bi:4:003:1 0 478 = 5b5d0201 d6010001 204c1000 0701cb0d 00006a69 f905fc01 0207f804 fdfeffff
ffff88b97e7520c0 1546692547 S Bi:4:003:1 -115 4096 <
ffff88b97e752840 1546694529 C Bi:4:003:1 0 488 = 5b5d0301 d6010001 2e421100 0701cb0d 00006980 014b22f6 09f8e90c 0f09fa0b
ffff88b97e752840 1546694542 S Bi:4:003:1 -115 4096 <
ffff88b97e752a80 1546696280 C Bi:4:003:1 0 479 = 5b5d0401 d7010001 2f1a0000 0c01cc0d 00005f5e fd000201 ffff00fe 00fd0501
ffff88b97e752a80 1546696291 S Bi:4:003:1 -115 4096 <
ffff88b97e752f00 1546698401 C Bi:4:003:1 0 483 = 5b5d0501 d7010001 3cf40100 0c01cc0d 00005e80 00c31a0d 1a10260f 0312fbef
ffff88b97e752f00 1546698412 S Bi:4:003:1 -115 4096 <
ffff88b97e7520c0 1546700027 C Bi:4:003:1 0 478 = 5b5d0601 d6010001 3de81000 0701cb0d 00006c69 02fc00ff ff04fa06 fe0104fb
ffff88b97e7520c0 1546700040 S Bi:4:003:1 -115 4096 <
ffff88b97e752840 1546702151 C Bi:4:003:1 0 488 = 5b5d0701 d6010001 4be01100 0701cb0d 00006a80 015121f9 fb06e60e 0d06fa0a
ffff88b97e752840 1546702164 S Bi:4:003:1 -115 4096 <
ffff88b97e752a80 1546703903 C Bi:4:003:1 0 479 = 5b5d0801 d7010001 4cb80000 0c01cc0d 00005e5a 01fe0103 00fc02ff 01fd0103
ffff88b97e752a80 1546703914 S Bi:4:003:1 -115 4096 <
ffff88b97e752f00 1546705907 C Bi:4:003:1 0 483 = 5b5d0901 d7010001 5a8c0100 0c01cc0d 00005a80 00c11710 1b0d290b 0813f8ed
ffff88b97e752f00 1546705919 S Bi:4:003:1 -115 4096 <
ffff88b97e7520c0 1546707779 C Bi:4:003:1 0 478 = 5b5d0a01 d6010001 5b801000 0701cb0d 00006a69 01fb02ff fa0ef601 0000ffff
ffff88b97e7520c0 1546707798 S Bi:4:003:1 -115 4096 <
ffff88b97e752840 1546709777 C Bi:4:003:1 0 488 = 5b5d0b01 d6010001 69761100 0701cb0d 00006d80 01551cf6 09fae313 0e08fe05
ffff88b97e752840 1546709789 S Bi:4:003:1 -115 4096 <
ffff88b97e752a80 1546711526 C Bi:4:003:1 0 479 = 5b5d0c01 d7010001 6a4f0000 0c01cc0d 00005e5b feff0401 05faff00 fffd0500
ffff88b97e752a80 1546711537 S Bi:4:003:1 -115 4096 <
ffff88b97e752f00 1546713519 C Bi:4:003:1 0 483 = 5b5d0d01 d7010001 78280100 0c01cc0d 00005c80 00c11912 1811230f 080ffced
ffff88b97e752f00 1546713530 S Bi:4:003:1 -115 4096 <
ffff88b97e7520c0 1546715279 C Bi:4:003:1 0 478 = 5b5d0e01 d6010001 791d1000 0701cb0d 00006f6c fefd0400 fc08f7ff 0500fc03
ffff88b97e7520c0 1546715291 S Bi:4:003:1 -115 4096 <
ffff88b97e752840 1546717269 C Bi:4:003:1 0 488 = 5b5d0f01 d6010001 87141100 0701cb0d 00006d80 01531cfa 0102ea0b 0f06fc0a
ffff88b97e752840 1546717281 S Bi:4:003:1 -115 4096 <
ffff88b97e752a80 1546719036 C Bi:4:003:1 0 479 = 5b5d1001 d7010001 87ed0000 0c01cc0d 00005f60 fbfe0601 01fb0103 fb020202
ffff88b97e752a80 1546719047 S Bi:4:003:1 -115 4096 <
ffff88b97e752f00 1546721152 C Bi:4:003:1 0 485 = 5b5d1101 d7010001 95c00100 0c01cc0d 00006180 00c41d0f 170e260e 0910faf1
ffff88b97e752f00 1546721163 S Bi:4:003:1 -115 4096 <
ffff88b97e7520c0 1546722901 C Bi:4:003:1 0 478 = 5b5d1201 d6010001 96b51000 0701cb0d 00006a68 03f80400 fe05fb02 fefe0103
ffff88b97e7520c0 1546722913 S Bi:4:003:1 -115 4096 <
ffff88b97e752840 1546724902 C Bi:4:003:1 0 486 = 5b5d1301 d6010001 a4ab1100 0701cb0d 00006c80 01501efb 03fee313 0d060007
ffff88b97e752840 1546724915 S Bi:4:003:1 -115 4096 <
ffff88b97e752a80 1546726776 C Bi:4:003:1 0 479 = 5b5d1401 d7010001 a5840000 0c01cc0d 00006061 fbfe02fe 08fdff02 fcff0403
ffff88b97e752a80 1546726787 S Bi:4:003:1 -115 4096 <
ffff88b97e752f00 1546728776 C Bi:4:003:1 0 485 = 5b5d1501 d7010001 b35c0100 0c01cc0d 00005f80 00c51713 160e2611 0710f8ec
ffff88b97e752f00 1546728787 S Bi:4:003:1 -115 4096 <
ffff88b97e7520c0 1546730529 C Bi:4:003:1 0 478 = 5b5d1601 d6010001 b4511000 0701cb0d 00006e67 03fd03ff fc0af703 fc030100
ffff88b97e7520c0 1546730541 S Bi:4:003:1 -115 4096 <
ffff88b97e752840 1546732529 C Bi:4:003:1 0 486 = 5b5d1701 d6010001 c2491100 0701cb0d 00006c80 015219fc 06fce111 1107fd0c
ffff88b97e752840 1546732542 S Bi:4:003:1 -115 4096 <
ffff88b97e752a80 1546734277 C Bi:4:003:1 0 479 = 5b5d1801 d7010001 c3220000 0c01cc0d 0000615d ff0201fe 03fe0101 fa030300
ffff88b97e752a80 1546734288 S Bi:4:003:1 -115 4096 <
ffff88b97e752f00 1546736401 C Bi:4:003:1 0 485 = 5b5d1901 d7010001 d0f40100 0c01cc0d 00005d80 00c31a0f 1a0f2313 040cffef
ffff88b97e752f00 1546736413 S Bi:4:003:1 -115 4096 <
ffff88b97e7520c0 1546738028 C Bi:4:003:1 0 478 = 5b5d1a01 d6010001 d1e91000 0701cb0d 00006e6a 04fd01fe ff06f403 07fa0109
ffff88b97e7520c0 1546738046 S Bi:4:003:1 -115 4096 <
ffff88b97e752840 1546740152 C Bi:4:003:1 0 488 = 5b5d1b01 d6010001 dfdf1100 0701cb0d 00006f80 015420fa 04fde70c 0c09fc09
ffff88b97e752840 1546740165 S Bi:4:003:1 -115 4096 <
ffff88b97e752a80 1546741912 C Bi:4:003:1 0 479 = 5b5d1c01 d7010001 e0b80000 0c01cc0d 00005e5b 02fc04ff 04f506ff 01fe03ff
ffff88b97e752a80 1546741923 S Bi:4:003:1 -115 4096 <
ffff88b97e752f00 1546743912 C Bi:4:003:1 0 485 = 5b5d1d01 d7010001 ee920100 0c01cc0d 00005f80 00c21d0e 190f270b 0815fbed
ffff88b97e752f00 1546743924 S Bi:4:003:1 -115 4096 <
ffff88b97e7520c0 1546745780 C Bi:4:003:1 0 478 = 5b5d1e01 d6010001 ef861000 0701cb0d 00006d6a fffd0600 fb07f702 00ff0003
ffff88b97e7520c0 1546745799 S Bi:4:003:1 -115 4096 <
ffff88b97e752840 1546747777 C Bi:4:003:1 0 486 = 5b5d1f01 d6010001 fd7d1100 0701cb0d 00006b80 015023f9 03fee30f 090afd07
ffff88b97e752840 1546747789 S Bi:4:003:1 -115 4096 <
ffff88b97e752a80 1546749525 C Bi:4:003:1 0 479 = 5b5d2001 d7010001 fe550000 0c01cc0d 0000605d ff000100 04fa0202 fcfe06ff
ffff88b97e752a80 1546749536 S Bi:4:003:1 -115 4096 <
ffff88b97e752f00 1546751518 C Bi:4:003:1 0 485 = 5b5d2101 d7010001 0c2a0100 0c01cc0d 00005e80 00bf1a15 190b2a0c 0a11fbe4
ffff88b97e752f00 1546751529 S Bi:4:003:1 -115 4096 <
ffff88b97e7520c0 1546753276 C Bi:4:003:1 0 478 = 5b5d2201 d6010001 0d1e1000 0701cb0d 00006b69 0100fe00 fe04f905 fe0101ff
ffff88b97e7520c0 1546753295 S Bi:4:003:1 -115 4096 <
ffff88b97e752840 1546755281 C Bi:4:003:1 0 486 = 5b5d2301 d6010001 1b151100 0701cb0d 00006d80 01531ef4 07fbe611 10070105
ffff88b97e752840 1546755308 S Bi:4:003:1 -115 4096 <
ffff88b97e752a80 1546757154 C Bi:4:003:1 0 479 = 5b5d2401 d7010001 1bed0000 0c01cc0d 0000605f 00fb0500 03fb02fd 02fd05fe
ffff88b97e752a80 1546757165 S Bi:4:003:1 -115 4096 <
ffff88b97e752f00 1546759151 C Bi:4:003:1 0 485 = 5b5d2501 d7010001 29c60100 0c01cc0d 00005b80 00bc1e11 170d260d 0a12faee
ffff88b97e752f00 1546759162 S Bi:4:003:1 -115 4096 <
ffff88b97e7520c0 1546760902 C Bi:4:003:1 0 478 = 5b5d2601 d6010001 2abb1000 0701cb0d 00006d6b fefb06fa 0208f903 fdfe0000
ffff88b97e7520c0 1546760921 S Bi:4:003:1 -115 4096 <
ffff88b97e752840 1546762904 C Bi:4:003:1 0 486 = 5b5d2701 d6010001 38b11100 0701cb0d 00006c80 01521ef6 07fae911 0f06ff02
ffff88b97e752840 1546762916 S Bi:4:003:1 -115 4096 <
ffff88b97e752a80 1546764777 C Bi:4:003:1 0 479 = 5b5d2801 d7010001 398a0000 0c01cc0d 0000605e fe0004fe 05fa0104 fa010101
ffff88b97e752a80 1546764788 S Bi:4:003:1 -115 4096 <
ffff88b97e752f00 1546766777 C Bi:4:003:1 0 483 = 5b5d2901 d7010001 475e0100 0c01cc0d 00006180 00c41514 1b0c2613 0113fbee
ffff88b97e752f00 1546766788 S Bi:4:003:1 -115 4096 <
ffff88b97e7520c0 1546768524 C Bi:4:003:1 0 478 = 5b5d2a01 d6010001 48531000 0701cb0d 0000716d 00fdfe05 0005f703 fe000100
ffff88b97e7520c0 1546768543 S Bi:4:003:1 -115 4096 <
ffff88b97e752840 1546770528 C Bi:4:003:1 0 488 = 5b5d2b01 d6010001 56481100 0701cb0d 00006b80 014f24f4 0700e112 0b040209
ffff88b97e752840 1546770541 S Bi:4:003:1 -115 4096 <
ffff88b97e752a80 1546772295 C Bi:4:003:1 0 479 = 5b5d2c01 d7010001 57210000 0c01cc0d 0000615d ff0004fe 04fa0200 fdfe0502
ffff88b97e752a80 1546772306 S Bi:4:003:1 -115 4096 <
ffff88b97e752f00 1546774405 C Bi:4:003:1 0 483 = 5b5d2d01 d7010001 64fb0100 0c01cc0d 00005f80 00c31813 1a0f240e 0515f5f1
ffff88b97e752f00 1546774416 S Bi:4:003:1 -115 4096 <
ffff88b97e7520c0 1546776038 C Bi:4:003:1 0 478 = 5b5d2e01 d6010001 65f01000 0701cb0d 00006d6a 03fb0001 fd0201ff 0500f902
ffff88b97e7520c0 1546776057 S Bi:4:003:1 -115 4096 <
ffff88b97e752840 1546778151 C Bi:4:003:1 0 486 = 5b5d2f01 d6010001 73e51100 0701cb0d 00006b80 01531cfa 03fcea0f 0e030106
ffff88b97e752840 1546778164 S Bi:4:003:1 -115 4096 <
ffff88b97e752a80 1546779902 C Bi:4:003:1 0 479 = 5b5d3001 d7010001 74be0000 0c01cc0d 0000605e fd0100ff 06fa04fe 00fb0501
ffff88b97e752a80 1546779913 S Bi:4:003:1 -115 4096 <
ffff88b97e752f00 1546781909 C Bi:4:003:1 0 485 = 5b5d3101 d7010001 82920100 0c01cc0d 00005b80 00bf1513 1b11230f 0515f8ec
ffff88b97e752f00 1546781920 S Bi:4:003:1 -115 4096 <
ffff88b97e7520c0 1546783652 C Bi:4:003:1 0 478 = 5b5d3201 d6010001 83861000 0701cb0d 00006b65 0200ffff fe05fe05 fdfb03ff
ffff88b97e7520c0 1546783672 S Bi:4:003:1 -115 4096 <
ffff88b97e752840 1546785775 C Bi:4:003:1 0 486 = 5b5d3301 d6010001 91771100 0701cb0d 00006b80 015619f7 05ffe413 0c07ff0a
ffff88b97e752840 1546785786 S Bi:4:003:1 -115 4096 <
ffff88b97e752a80 1546787527 C Bi:4:003:1 0 479 = 5b5d3401 d7010001 924f0000 0c01cc0d 00005f5f fdfefe05 03fc04fd fffd0403
ffff88b97e752a80 1546787538 S Bi:4:003:1 -115 4096 <
ffff88b97e752f00 1546789537 C Bi:4:003:1 0 483 = 5b5d3501 d7010001 a0280100 0c01cc0d 00005e80 00c21712 1b0b2a07 0a14fbec
ffff88b97e752f00 1546789548 S Bi:4:003:1 -115 4096 <
ffff88b97e7520c0 1546791279 C Bi:4:003:1 0 478 = 5b5d3601 d6010001 a11c1000 0701cb0d 00006d6e fcfe0003 fd09f605 fff60207
ffff88b97e7520c0 1546791291 S Bi:4:003:1 -115 4096 <
ffff88b97e752840 1546793289 C Bi:4:003:1 0 486 = 5b5d3701 d6010001 af121100 0701cb0d 00006e80 015223f6 03fde80f 13fe0107
ffff88b97e752840 1546793301 S Bi:4:003:1 -115 4096 <
ffff88b97e752a80 1546795047 C Bi:4:003:1 0 479 = 5b5d3801 d7010001 afeb0000 0c01cc0d 0000615f 01fc0202 01fc0400 fbff0201
ffff88b97e752a80 1546795058 S Bi:4:003:1 -115 4096 <
ffff88b97e752f00 1546797151 C Bi:4:003:1 0 483 = 5b5d3901 d7010001 bdbd0100 0c01cc0d 00005d80 00c01c11 180c2811 0316f6ed
ffff88b97e752f00 1546797162 S Bi:4:003:1 -115 4096 <
ffff88b97e7520c0 1546798901 C Bi:4:003:1 0 478 = 5b5d3a01 d6010001 beb21000 0701cb0d 00006a66 02fc0202 f610f305 02fe00fd
ffff88b97e7520c0 1546798921 S Bi:4:003:1 -115 4096 <
ffff88b97e752840 1546800903 C Bi:4:003:1 0 486 = 5b5d3b01 d6010001 cca31100 0701cb0d 00006b80 01551cf7 0300e60e 0f030409
ffff88b97e752840 1546800916 S Bi:4:003:1 -115 4096 <
ffff88b97e752a80 1546802668 C Bi:4:003:1 0 479 = 5b5d3c01 d7010001 cd7b0000 0c01cc0d 00006160 fdff07fe ff01fd01 00fe0101
ffff88b97e752a80 1546802679 S Bi:4:003:1 -115 4096 <
ffff88b97e752f00 1546804777 C Bi:4:003:1 0 485 = 5b5d3d01 d7010001 db540100 0c01cc0d 00005f80 00bd161a 1713240d 0412feec
ffff88b97e752f00 1546804788 S Bi:4:003:1 -115 4096 <
ffff88b97e7520c0 1546806527 C Bi:4:003:1 0 478 = 5b5d3e01 d6010001 dc481000 0701cb0d 00006d6b 00fd04fd 0007f802 fffdff04
ffff88b97e7520c0 1546806545 S Bi:4:003:1 -115 4096 <
ffff88b97e752840 1546808527 C Bi:4:003:1 0 486 = 5b5d3f01 d6010001 ea3f1100 0701cb0d 00007080 01581ef7 02fded10 070afd03
ffff88b97e752840 1546808540 S Bi:4:003:1 -115 4096 <
ffff88b97e752a80 1546810280 C Bi:4:003:1 0 479 = 5b5d4001 d7010001 eb180000 0c01cc0d 0000615d 00020002 fffe0100 01fc05fd
ffff88b97e752a80 1546810291 S Bi:4:003:1 -115 4096 <
ffff88b97e752f00 1546812401 C Bi:4:003:1 0 483 = 5b5d4101 d7010001 f8f00100 0c01cc0d 00005e80 00c01a14 1a10250a 0810fcec
ffff88b97e752f00 1546812412 S Bi:4:003:1 -115 4096 <
ffff88b97e7520c0 1546814021 C Bi:4:003:1 0 478 = 5b5d4201 d6010001 f9e51000 0701cb0d 00006e69 02fdfe00 0107f906 fffb01fd
ffff88b97e7520c0 1546814040 S Bi:4:003:1 -115 4096 <
ffff88b97e752840 1546816152 C Bi:4:003:1 0 486 = 5b5d4301 d6010001 07d61100 0701cb0d 00006d80 015916f9 07f9ed10 0b060004
ffff88b97e752840 1546816164 S Bi:4:003:1 -115 4096 <
ffff88b97e752a80 1546817897 C Bi:4:003:1 0 479 = 5b5d4401 d7010001 08ae0000 0c01cc0d 0000605e 00fe0002 04fb0101 01fb0006
ffff88b97e752a80 1546817909 S Bi:4:003:1 -115 4096 <
ffff88b97e752f00 1546819894 C Bi:4:003:1 0 483 = 5b5d4501 d7010001 16870100 0c01cc0d 00005e80 00c11c0c 1c112310 0711f4f4
ffff88b97e752f00 1546819905 S Bi:4:003:1 -115 4096 <
ffff88b97e7520c0 1546821644 C Bi:4:003:1 0 478 = 5b5d4601 d6010001 177b1000 0701cb0d 00006e6b 01fc0300 fa0af209 fc010200
ffff88b97e7520c0 1546821663 S Bi:4:003:1 -115 4096 <
ffff88b97e752840 1546823797 C Bi:4:003:1 0 486 = 5b5d4701 d6010001 25711100 0701cb0d 00007180 015a16fd 03ffe410 1303fc06
ffff88b97e752840 1546823810 S Bi:4:003:1 -115 4096 <
ffff88b97e752a80 1546825530 C Bi:4:003:1 0 479 = 5b5d4801 d7010001 264a0000 0c01cc0d 0000605e feff0202 04f90204 fbff0204
ffff88b97e752a80 1546825541 S Bi:4:003:1 -115 4096 <
ffff88b97e752f00 1546827530 C Bi:4:003:1 0 485 = 5b5d4901 d7010001 34220100 0c01cc0d 00005b80 00be1c10 1911230b 0b15f4f0
ffff88b97e752f00 1546827541 S Bi:4:003:1 -115 4096 <
ffff88b97e7520c0 1546829277 C Bi:4:003:1 0 478 = 5b5d4a01 d6010001 35171000 0701cb0d 00006a65 06f905fd ff07fa03 fffffd01
ffff88b97e7520c0 1546829290 S Bi:4:003:1 -115 4096 <
ffff88b97e752840 1546831280 C Bi:4:003:1 0 486 = 5b5d4b01 d6010001 43091100 0701cb0d 00006f80 01581df6 03ffe613 0b05fe09
ffff88b97e752840 1546831292 S Bi:4:003:1 -115 4096 <
ffff88b97e752a80 1546833036 C Bi:4:003:1 0 479 = 5b5d4c01 d7010001 43e10000 0c01cc0d 0000615f fffd0201 02fb04fd 03fa0600
ffff88b97e752a80 1546833047 S Bi:4:003:1 -115 4096 <
ffff88b97e752f00 1546835152 C Bi:4:003:1 0 485 = 5b5d4d01 d7010001 51ba0100 0c01cc0d 00005d80 00c41610 180d2912 0311fbee
ffff88b97e752f00 1546835163 S Bi:4:003:1 -115 4096 <
ffff88b97e7520c0 1546836903 C Bi:4:003:1 0 478 = 5b5d4e01 d6010001 52af1000 0701cb0d 00006b68 01fc0100 fc0af903 01fffefe
ffff88b97e7520c0 1546836922 S Bi:4:003:1 -115 4096 <
ffff88b97e752840 1546838901 C Bi:4:003:1 0 488 = 5b5d4f01 d6010001 60a51100 0701cb0d 00006a80 01551bf8 02fce90c 1207fc0a
ffff88b97e752840 1546838914 S Bi:4:003:1 -115 4096 <
ffff88b97e752a80 1546840656 C Bi:4:003:1 0 479 = 5b5d5001 d7010001 617e0000 0c01cc0d 0000605d fe000101 04fa01ff 02fd0201
ffff88b97e752a80 1546840667 S Bi:4:003:1 -115 4096 <
ffff88b97e752f00 1546842777 C Bi:4:003:1 0 483 = 5b5d5101 d7010001 6f580100 0c01cc0d 00006080 00c51912 180e280c 0610ffed
ffff88b97e752f00 1546842788 S Bi:4:003:1 -115 4096 <
ffff88b97e7520c0 1546844420 C Bi:4:003:1 0 478 = 5b5d5201 d6010001 704d1000 0701cb0d 00006d67 06fa0202 fb07fb00 01ff01fe
ffff88b97e7520c0 1546844439 S Bi:4:003:1 -115 4096 <
ffff88b97e752840 1546846527 C Bi:4:003:1 0 488 = 5b5d5301 d6010001 7e3c1100 0701cb0d 00006980 01501ff9 05fbe70e 1004fb0c
ffff88b97e752840 1546846540 S Bi:4:003:1 -115 4096 <
ffff88b97e752a80 1546848280 C Bi:4:003:1 0 479 = 5b5d5401 d7010001 7f140000 0c01cc0d 00006262 fb010200 03fc04f9 01fe0204
ffff88b97e752a80 1546848291 S Bi:4:003:1 -115 4096 <
ffff88b97e752f00 1546850405 C Bi:4:003:1 0 485 = 5b5d5501 d7010001 8cf00100 0c01cc0d 00005d80 00c1190e 1f0b260b 0d0ff6f2
ffff88b97e752f00 1546850416 S Bi:4:003:1 -115 4096 <
ffff88b97e7520c0 1546852025 C Bi:4:003:1 0 478 = 5b5d5601 d6010001 8de41000 0701cb0d 00006d69 03fd0001 fd06f703 04fd0003
ffff88b97e7520c0 1546852038 S Bi:4:003:1 -115 4096 <
ffff88b97e752840 1546854048 C Bi:4:003:1 0 488 = 5b5d5701 d6010001 9bdb1100 0701cb0d 00006d80 015123f8 03fce80e 0e05fe07
ffff88b97e752840 1546854061 S Bi:4:003:1 -115 4096 <
ffff88b97e752a80 1546855903 C Bi:4:003:1 0 479 = 5b5d5801 d7010001 9cb40000 0c01cc0d 00005e5f f902ff01 05fd00fd 02fe02ff
ffff88b97e752a80 1546855914 S Bi:4:003:1 -115 4096 <
ffff88b97e752f00 1546857900 C Bi:4:003:1 0 483 = 5b5d5901 d7010001 aa8e0100 0c01cc0d 00005f80 00c41612 1b0e2211 0611fdec
ffff88b97e752f00 1546857911 S Bi:4:003:1 -115 4096 <
ffff88b97e7520c0 1546859665 C Bi:4:003:1 0 478 = 5b5d5a01 d6010001 ab821000 0701cb0d 00006d6b fb030204 fd04f702 fefd05fc
ffff88b97e7520c0 1546859683 S Bi:4:003:1 -115 4096 <
ffff88b97e752840 1546861780 C Bi:4:003:1 0 488 = 5b5d5b01 d6010001 b9711100 0701cb0d 00006c80 01551bf2 0cfbe80e 0f04ff09
ffff88b97e752840 1546861807 S Bi:4:003:1 -115 4096 <
ffff88b97e752a80 1546863527 C Bi:4:003:1 0 479 = 5b5d5c01 d7010001 ba4a0000 0c01cc0d 00005e5d fffc0400 02fd03fd fefb0903
ffff88b97e752a80 1546863538 S Bi:4:003:1 -115 4096 <
ffff88b97e752f00 1546865530 C Bi:4:003:1 0 483 = 5b5d5d01 d7010001 c8260100 0c01cc0d 00005e80 00c21b0e 1a112411 0414f7f0
ffff88b97e752f00 1546865541 S Bi:4:003:1 -115 4096 <
ffff88b97e7520c0 1546867279 C Bi:4:003:1 0 478 = 5b5d5e01 d6010001 c91a1000 0701cb0d 00006d6a fffe03ff ff09f9fd 01fe00fc
ffff88b97e7520c0 1546867291 S Bi:4:003:1 -115 4096 <
ffff88b97e752840 1546869285 C Bi:4:003:1 0 488 = 5b5d5f01 d6010001 d70f1100 0701cb0d 00006e80 015719fa 06fde90e 0c04fb0b
ffff88b97e752840 1546869297 S Bi:4:003:1 -115 4096 <
ffff88b97e752a80 1546871037 C Bi:4:003:1 0 479 = 5b5d6001 d7010001 d7e80000 0c01cc0d 00006163 fcfe03ff 02feff00 fd0005fe
ffff88b97e752a80 1546871048 S Bi:4:003:1 -115 4096 <
ffff88b97e752f00 1546873154 C Bi:4:003:1 0 483 = 5b5d6101 d7010001 e5c20100 0c01cc0d 00005b80 00bb200b 1a14220f 0813fbeb
ffff88b97e752f00 1546873165 S Bi:4:003:1 -115 4096 <
ffff88b97e7520c0 1546874904 C Bi:4:003:1 0 478 = 5b5d6201 d6010001 e6b61000 0701cb0d 0000696a fefb01fe 0207fa07 fffa01fc
ffff88b97e7520c0 1546874916 S Bi:4:003:1 -115 4096 <
ffff88b97e752840 1546876904 C Bi:4:003:1 0 488 = 5b5d6301 d6010001 f4a51100 0701cb0d 00006d80 01521ff7 09fae90f 0d05f90c
ffff88b97e752840 1546876916 S Bi:4:003:1 -115 4096 <
ffff88b97e752a80 1546878671 C Bi:4:003:1 0 479 = 5b5d6401 d7010001 f57e0000 0c01cc0d 00006160 fdfe0201 03ff01fd 01fc0404
ffff88b97e752a80 1546878682 S Bi:4:003:1 -115 4096 <
ffff88b97e752f00 1546880781 C Bi:4:003:1 0 483 = 5b5d6501 d7010001 035a0100 0c01cc0d 00005f80 00c2190f 1914230b 0a14f7ee
ffff88b97e752f00 1546880792 S Bi:4:003:1 -115 4096 <
ffff88b97e7520c0 1546882528 C Bi:4:003:1 0 478 = 5b5d6601 d6010001 044e1000 0701cb0d 00006c67 03fe02ff fb09f900 03fc0006
ffff88b97e7520c0 1546882547 S Bi:4:003:1 -115 4096 <
ffff88b97e752840 1546884534 C Bi:4:003:1 0 488 = 5b5d6701 d6010001 12441100 0701cb0d 00006d80 015120f8 07fbe312 070bfd0c
ffff88b97e752840 1546884547 S Bi:4:003:1 -115 4096 <
ffff88b97e752a80 1546886279 C Bi:4:003:1 0 479 = 5b5d6801 d7010001 131c0000 0c01cc0d 0000605f fffd0203 04f408fe fd020102
ffff88b97e752a80 1546886290 S Bi:4:003:1 -115 4096 <
ffff88b97e752f00 1546888407 C Bi:4:003:1 0 483 = 5b5d6901 d7010001 20f60100 0c01cc0d 00005b80 00be1a0e 1d0d270e 0613fced
ffff88b97e752f00 1546888418 S Bi:4:003:1 -115 4096 <
ffff88b97e7520c0 1546890028 C Bi:4:003:1 0 478 = 5b5d6a01 d6010001 21eb1000 0701cb0d 00006a63 09f90001 f70ff901 0102faff
ffff88b97e7520c0 1546890041 S Bi:4:003:1 -115 4096 <
ffff88b97e752840 1546892154 C Bi:4:003:1 0 488 = 5b5d6b01 d6010001 2fda1100 0701cb0d 00006a80 01511ff5 0af5ea10 0f06fc0a
ffff88b97e752840 1546892166 S Bi:4:003:1 -115 4096 <
ffff88b97e752a80 1546893902 C Bi:4:003:1 0 479 = 5b5d6c01 d7010001 30b30000 0c01cc0d 00006160 fefd0200 04fb03fe ff0104ff
ffff88b97e752a80 1546893913 S Bi:4:003:1 -115 4096 <
ffff88b97e752f00 1546895900 C Bi:4:003:1 0 483 = 5b5d6d01 d7010001 3e8c0100 0c01cc0d 00005e80 00c31710 1b12210e 0812fdee
ffff88b97e752f00 1546895911 S Bi:4:003:1 -115 4096 <
ffff88b97e7520c0 1546897652 C Bi:4:003:1 0 478 = 5b5d6e01 d6010001 3f811000 0701cb0d 00006a67 02fd0002 fd08f705 0001fd00
ffff88b97e7520c0 1546897671 S Bi:4:003:1 -115 4096 <
ffff88b97e752840 1546899781 C Bi:4:003:1 0 488 = 5b5d6f01 d6010001 4d781100 0701cb0d 00006b80 01521bfa 07fce514 0b08fa0b
ffff88b97e752840 1546899794 S Bi:4:003:1 -115 4096 <
ffff88b97e752a80 1546901526 C Bi:4:003:1 0 479 = 5b5d7001 d7010001 4e510000 0c01cc0d 00006160 ffffff02 02fa0400 00fc0402
ffff88b97e752a80 1546901537 S Bi:4:003:1 -115 4096 <
ffff88b97e752f00 1546903537 C Bi:4:003:1 0 483 = 5b5d7101 d7010001 5c2a0100 0c01cc0d 00005e80 00c31a0f 1a0d290e 0414faee
ffff88b97e752f00 1546903548 S Bi:4:003:1 -115 4096 <
ffff88b97e7520c0 1546905279 C Bi:4:003:1 0 478 = 5b5d7201 d6010001 5d1f1000 0701cb0d 00006b69 01fd03fd fc09f705 010003fc
ffff88b97e7520c0 1546905298 S Bi:4:003:1 -115 4096 <
ffff88b97e752840 1546907285 C Bi:4:003:1 0 488 = 5b5d7301 d6010001 6b0e1100 0701cb0d 00006a80 01501ef9 07fde113 0b04ff09
ffff88b97e752840 1546907297 S Bi:4:003:1 -115 4096 <
ffff88b97e752a80 1546909022 C Bi:4:003:1 0 479 = 5b5d7401 d7010001 6be70000 0c01cc0d 00005d5c ffff0300 fe01fd04 fd010103
ffff88b97e752a80 1546909033 S Bi:4:003:1 -115 4096 <
ffff88b97e752f00 1546911153 C Bi:4:003:1 0 483 = 5b5d7501 d7010001 79ba0100 0c01cc0d 00005d80 00c41314 1b0d2609 0f0efcea
ffff88b97e752f00 1546911164 S Bi:4:003:1 -115 4096 <
ffff88b97e7520c0 1546912903 C Bi:4:003:1 0 478 = 5b5d7601 d6010001 7aaf1000 0701cb0d 00007070 fbfe0104 fc0bf7fe fffe0101
ffff88b97e7520c0 1546912915 S Bi:4:003:1 -115 4096 <
ffff88b97e752840 1546914903 C Bi:4:003:1 0 488 = 5b5d7701 d6010001 88a61100 0701cb0d 00006c80 015618f7 09ffe511 0b0bfb02
ffff88b97e752840 1546914915 S Bi:4:003:1 -115 4096 <
ffff88b97e752a80 1546916668 C Bi:4:003:1 0 479 = 5b5d7801 d7010001 897f0000 0c01cc0d 00005f5a 04fc0200 02fc0201 fcfe0702
ffff88b97e752a80 1546916678 S Bi:4:003:1 -115 4096 <
ffff88b97e752f00 1546918777 C Bi:4:003:1 0 485 = 5b5d7901 d7010001 97590100 0c01cc0d 00006080 00c71610 1b0f260d 080efbee
ffff88b97e752f00 1546918788 S Bi:4:003:1 -115 4096 <
ffff88b97e7520c0 1546920404 C Bi:4:003:1 0 478 = 5b5d7a01 d6010001 984d1000 0701cb0d 00006c68 01fb0201 0309f203 fffb0401
ffff88b97e7520c0 1546920422 S Bi:4:003:1 -115 4096 <
ffff88b97e752840 1546922528 C Bi:4:003:1 0 488 = 5b5d7b01 d6010001 a6441100 0701cb0d 00007080 01561cfa 08f8e911 0809fc07
ffff88b97e752840 1546922540 S Bi:4:003:1 -115 4096 <
ffff88b97e752a80 1546924279 C Bi:4:003:1 0 479 = 5b5d7c01 d7010001 a71c0000 0c01cc0d 0000615c ff0002fc 07fc00ff 01fd05fe
ffff88b97e752a80 1546924290 S Bi:4:003:1 -115 4096 <
ffff88b97e752f00 1546926291 C Bi:4:003:1 0 483 = 5b5d7d01 d7010001 b4f00100 0c01cc0d 00005b80 00c21215 1a0f260c 080b02ec
ffff88b97e752f00 1546926302 S Bi:4:003:1 -115 4096 <
ffff88b97e7520c0 1546928027 C Bi:4:003:1 0 478 = 5b5d7e01 d6010001 b5e51000 0701cb0d 00006c69 05f70105 fb04fd04 fd03fefd
ffff88b97e7520c0 1546928046 S Bi:4:003:1 -115 4096 <
ffff88b97e752840 1546930042 C Bi:4:003:1 0 486 = 5b5d7f01 d6010001 c3dc1100 0701cb0d 00006f80 01531dfd 02fbe910 0d04fc07
ffff88b97e752840 1546930055 S Bi:4:003:1 -115 4096 <
ffff88b97e752a80 1546931904 C Bi:4:003:1 0 479 = 5b5d8001 d7010001 c4b40000 0c01cc0d 00005f5b 02fd06fe 00ff0000 fffc04ff
ffff88b97e752a80 1546931915 S Bi:4:003:1 -115 4096 <
ffff88b97e752f00 1546933897 C Bi:4:003:1 0 483 = 5b5d8101 d7010001 d28d0100 0c01cc0d 00005e80 00c11911 1c11200d 090fffec
ffff88b97e752f00 1546933908 S Bi:4:003:1 -115 4096 <
ffff88b97e7520c0 1546935652 C Bi:4:003:1 0 478 = 5b5d8201 d6010001 d3811000 0701cb0d 00006b67 030002fb fd09f607 fefe0302
ffff88b97e7520c0 1546935671 S Bi:4:003:1 -115 4096 <
ffff88b97e752840 1546937644 C Bi:4:003:1 0 486 = 5b5d8301 d6010001 e1771100 0701cb0d 00006a80 014f21f8 07f8e515 0a07fe09
ffff88b97e752840 1546937656 S Bi:4:003:1 -115 4096 <
ffff88b97e752a80 1546939529 C Bi:4:003:1 0 479 = 5b5d8401 d7010001 e24f0000 0c01cc0d 00005f5d 00fb05ff 03fe02fa 03fe0402
ffff88b97e752a80 1546939541 S Bi:4:003:1 -115 4096 <
ffff88b97e752f00 1546941530 C Bi:4:003:1 0 483 = 5b5d8501 d7010001 f0220100 0c01cc0d 00005d80 00c11813 1d0a250f 0514faea
ffff88b97e752f00 1546941541 S Bi:4:003:1 -115 4096 <
ffff88b97e7520c0 1546943278 C Bi:4:003:1 0 478 = 5b5d8601 d6010001 f1161000 0701cb0d 00006a67 00fefe05 fc08f800 06fafe02
ffff88b97e7520c0 1546943290 S Bi:4:003:1 -115 4096 <
ffff88b97e752840 1546945278 C Bi:4:003:1 0 486 = 5b5d8701 d6010001 ff0c1100 0701cb0d 00006c80 01561afa 04fae714 0a09fa0b
ffff88b97e752840 1546945290 S Bi:4:003:1 -115 4096 <
ffff88b97e752a80 1546947032 C Bi:4:003:1 0 479 = 5b5d8801 d7010001 ffe40000 0c01cc0d 0000625f 01fe0202 fffc0102 fc0105fc
ffff88b97e752a80 1546947043 S Bi:4:003:1 -115 4096 <
ffff88b97e752f00 1546949152 C Bi:4:003:1 0 483 = 5b5d8901 d7010001 0dbf0100 0c01cc0d 00005f80 00c1190f 1e0d2410 0414fbee
ffff88b97e752f00 1546949163 S Bi:4:003:1 -115 4096 <
ffff88b97e7520c0 1546950904 C Bi:4:003:1 0 478 = 5b5d8a01 d6010001 0eb41000 0701cb0d 00006865 00ff00fe 0206f906 fefb02fc
ffff88b97e7520c0 1546950917 S Bi:4:003:1 -115 4096 <
ffff88b97e752840 1546952903 C Bi:4:003:1 0 486 = 5b5d8b01 d6010001 1ca91100 0701cb0d 00006980 01501bfb 03fee412 0d0afa05
ffff88b97e752840 1546952916 S Bi:4:003:1 -115 4096 <
ffff88b97e752a80 1546954654 C Bi:4:003:1 0 479 = 5b5d8c01 d7010001 1d810000 0c01cc0d 00005f5d 01fb0401 05fb02fc 01ff02fe
ffff88b97e752a80 1546954665 S Bi:4:003:1 -115 4096 <
ffff88b97e752f00 1546956779 C Bi:4:003:1 0 483 = 5b5d8d01 d7010001 2b540100 0c01cc0d 00005b80 00bf1815 150f250f 0911fbec
ffff88b97e752f00 1546956790 S Bi:4:003:1 -115 4096 <
ffff88b97e7520c0 1546958410 C Bi:4:003:1 0 478 = 5b5d8e01 d6010001 2c491000 0701cb0d 00006f6b 01fdfc05 f80ff902 02fcfffc
ffff88b97e7520c0 1546958422 S Bi:4:003:1 -115 4096 <
ffff88b97e752840 1546960529 C Bi:4:003:1 0 486 = 5b5d8f01 d6010001 3a3e1100 0701cb0d 00007180 015d17f9 06fee613 0904fe07
ffff88b97e752840 1546960542 S Bi:4:003:1 -115 4096 <
ffff88b97e752a80 1546962278 C Bi:4:003:1 0 479 = 5b5d9001 d7010001 3b170000 0c01cc0d 0000605f 00feff00 05ff01fb fffe0106
ffff88b97e752a80 1546962289 S Bi:4:003:1 -115 4096 <
ffff88b97e752f00 1546964286 C Bi:4:003:1 0 483 = 5b5d9101 d7010001 48f10100 0c01cc0d 00006080 00c61416 1a0b280d 0811fbe9
ffff88b97e752f00 1546964297 S Bi:4:003:1 -115 4096 <
ffff88b97e7520c0 1546966021 C Bi:4:003:1 0 478 = 5b5d9201 d6010001 49e51000 0701cb0d 00006d68 03fe05fc fb0af800 01ff0100
ffff88b97e7520c0 1546966040 S Bi:4:003:1 -115 4096 <
ffff88b97e752840 1546968043 C Bi:4:003:1 0 486 = 5b5d9301 d6010001 57db1100 0701cb0d 00006b80 015021fa 06fbe30e 10040105
ffff88b97e752840 1546968056 S Bi:4:003:1 -115 4096 <
ffff88b97e752a80 1546969903 C Bi:4:003:1 0 479 = 5b5d9401 d7010001 58b30000 0c01cc0d 00006161 fb000004 00fe01fe fd020500
ffff88b97e752a80 1546969914 S Bi:4:003:1 -115 4096 <
ffff88b97e752f00 1546971896 C Bi:4:003:1 0 483 = 5b5d9501 d7010001 66860100 0c01cc0d 00005f80 00bf1d0d 1e0e2017 050cffee
ffff88b97e752f00 1546971907 S Bi:4:003:1 -115 4096 <
ffff88b97e7520c0 1546973653 C Bi:4:003:1 0 478 = 5b5d9601 d6010001 677a1000 0701cb0d 00006d6a 000002ff fe04f8ff 08f904ff
ffff88b97e7520c0 1546973672 S Bi:4:003:1 -115 4096 <
ffff88b97e752840 1546975666 C Bi:4:003:1 0 486 = 5b5d9701 d6010001 75701100 0701cb0d 00006f80 015221fa 07fce410 0c05fe0a
ffff88b97e752840 1546975679 S Bi:4:003:1 -115 4096 <
ffff88b97e752a80 1546977530 C Bi:4:003:1 0 479 = 5b5d9801 d7010001 76480000 0c01cc0d 00006161 fd01fffb 08fb03fe fe020103
ffff88b97e752a80 1546977541 S Bi:4:003:1 -115 4096 <
ffff88b97e752f00 1546979530 C Bi:4:003:1 0 485 = 5b5d9901 d7010001 84230100 0c01cc0d 00005d80 00bc1e0f 1d082c10 0512f7ee
ffff88b97e752f00 1546979542 S Bi:4:003:1 -115 4096 <
ffff88b97e7520c0 1546981282 C Bi:4:003:1 0 478 = 5b5d9a01 d6010001 85171000 0701cb0d 00006965 03fc0203 f906f902 0300ff00
ffff88b97e7520c0 1546981294 S Bi:4:003:1 -115 4096 <
ffff88b97e752840 1546983281 C Bi:4:003:1 0 486 = 5b5d9b01 d6010001 930e1100 0701cb0d 00006c80 015420f7 05fbe90c 1004fb0c
ffff88b97e752840 1546983293 S Bi:4:003:1 -115 4096 <
ffff88b97e752a80 1546985020 C Bi:4:003:1 0 479 = 5b5d9c01 d7010001 93e60000 0c01cc0d 0000605b 0300fe04 02fa03ff fffc04ff
ffff88b97e752a80 1546985032 S Bi:4:003:1 -115 4096 <
ffff88b97e752f00 1546987154 C Bi:4:003:1 0 483 = 5b5d9d01 d7010001 a1b90100 0c01cc0d 00006280 00c71512 1c0e2311 090dfaef
ffff88b97e752f00 1546987165 S Bi:4:003:1 -115 4096 <
ffff88b97e7520c0 1546988904 C Bi:4:003:1 0 478 = 5b5d9e01 d6010001 a2ad1000 0701cb0d 00006b65 02ff0000 fe08f803 00ff02fe
ffff88b97e7520c0 1546988923 S Bi:4:003:1 -115 4096 <
ffff88b97e752840 1546990904 C Bi:4:003:1 0 486 = 5b5d9f01 d6010001 b0a31100 0701cb0d 00007080 01561bfb 05fce511 1002fe09
ffff88b97e752840 1546990917 S Bi:4:003:1 -115 4096 <
ffff88b97e752a80 1546992654 C Bi:4:003:1 0 479 = 5b5da001 d7010001 b17b0000 0c01cc0d 0000625e ff000301 fffd0100 fffa0801
ffff88b97e752a80 1546992665 S Bi:4:003:1 -115 4096 <
ffff88b97e752f00 1546994777 C Bi:4:003:1 0 485 = 5b5da101 d7010001 bf540100 0c01cc0d 00005e80 00bf1814 17141e15 0216f9ee
ffff88b97e752f00 1546994789 S Bi:4:003:1 -115 4096 <
ffff88b97e7520c0 1546996414 C Bi:4:003:1 0 478 = 5b5da201 d6010001 c0481000 0701cb0d 00006e6b fdfdff0a f807fefe fffeff01
ffff88b97e7520c0 1546996433 S Bi:4:003:1 -115 4096 <
ffff88b97e752840 1546998543 C Bi:4:003:1 0 488 = 5b5da301 d6010001 ce3f1100 0701cb0d 00006a80 015419f9 06fae910 0d06fe08
ffff88b97e752840 1546998556 S Bi:4:003:1 -115 4096 <
ffff88b97e752a80 1547000280 C Bi:4:003:1 0 479 = 5b5da401 d7010001 cf180000 0c01cc0d 0000625f 00ff04fd 03fb0401 fbff0400
ffff88b97e752a80 1547000291 S Bi:4:003:1 -115 4096 <
ffff88b97e752f00 1547002284 C Bi:4:003:1 0 483 = 5b5da501 d7010001 dceb0100 0c01cc0d 00006180 00c51a0f 14162412 0311fcec
ffff88b97e752f00 1547002295 S Bi:4:003:1 -115 4096 <
ffff88b97e7520c0 1547004026 C Bi:4:003:1 0 478 = 5b5da601 d6010001 dde01000 0701cb0d 00006f6c fdff02fc 0306f70a fafe01fc
ffff88b97e7520c0 1547004047 S Bi:4:003:1 -115 4096 <
ffff88b97e752840 1547006035 C Bi:4:003:1 0 486 = 5b5da701 d6010001 ebd51100 0701cb0d 00006a80 01541bf9 03fce80d 1206fc0a
ffff88b97e752840 1547006048 S Bi:4:003:1 -115 4096 <
ffff88b97e752a80 1547007904 C Bi:4:003:1 0 479 = 5b5da801 d7010001 ecae0000 0c01cc0d 0000635f ff010201 00fe0000 fffd0401
ffff88b97e752a80 1547007915 S Bi:4:003:1 -115 4096 <
ffff88b97e752f00 1547009918 C Bi:4:003:1 0 483 = 5b5da901 d7010001 fa860100 0c01cc0d 00006080 00c4190d 1d0b2b0c 080f00e7
ffff88b97e752f00 1547009929 S Bi:4:003:1 -115 4096 <
ffff88b97e7520c0 1547011657 C Bi:4:003:1 0 478 = 5b5daa01 d6010001 fb7b1000 0701cb0d 00006c6f f9fe0102 0101fe03 f903fcfd
ffff88b97e7520c0 1547011675 S Bi:4:003:1 -115 4096 <
ffff88b97e752840 1547013667 C Bi:4:003:1 0 486 = 5b5dab01 d6010001 09721100 0701cb0d 00006c80 01521dfa 07fbe510 0b040209
ffff88b97e752840 1547013680 S Bi:4:003:1 -115 4096 <
ffff88b97e752a80 1547015426 C Bi:4:003:1 0 479 = 5b5dac01 d7010001 0a4b0000 0c01cc0d 0000625e 01fb0501 00fe00ff fc0204ff
ffff88b97e752a80 1547015437 S Bi:4:003:1 -115 4096 <
ffff88b97e752f00 1547017540 C Bi:4:003:1 0 483 = 5b5dad01 d7010001 181d0100 0c01cc0d 00005e80 00c41614 18171d13 0215f9ed
ffff88b97e752f00 1547017551 S Bi:4:003:1 -115 4096 <
ffff88b97e7520c0 1547019278 C Bi:4:003:1 0 478 = 5b5dae01 d6010001 19121000 0701cb0d 00006d69 02fd0200 0003f907 fffdfd01
ffff88b97e7520c0 1547019291 S Bi:4:003:1 -115 4096 <
ffff88b97e752840 1547021279 C Bi:4:003:1 0 488 = 5b5daf01 d6010001 27071100 0701cb0d 00006b80 01551af8 08f8e712 0d060103
ffff88b97e752840 1547021292 S Bi:4:003:1 -115 4096 <
ffff88b97e752a80 1547023021 C Bi:4:003:1 0 479 = 5b5db001 d7010001 27e00000 0c01cc0d 00005d5a fd0006fd 08f901ff 00fa0505
ffff88b97e752a80 1547023032 S Bi:4:003:1 -115 4096 <
ffff88b97e752f00 1547025155 C Bi:4:003:1 0 483 = 5b5db101 d7010001 35ba0100 0c01cc0d 00005d80 00c3170f 1f0d250e 0415fbec
ffff88b97e752f00 1547025166 S Bi:4:003:1 -115 4096 <
ffff88b97e7520c0 1547026907 C Bi:4:003:1 0 478 = 5b5db201 d6010001 36af1000 0701cb0d 00006f6c fdff09fd fb06f802 05fdfd00
ffff88b97e7520c0 1547026919 S Bi:4:003:1 -115 4096 <
ffff88b97e752840 1547028905 C Bi:4:003:1 0 488 = 5b5db301 d6010001 44a61100 0701cb0d 00007180 01571df8 07fde711 0d02fe05
ffff88b97e752840 1547028917 S Bi:4:003:1 -115 4096 <
ffff88b97e752a80 1547030662 C Bi:4:003:1 0 479 = 5b5db401 d7010001 457e0000 0c01cc0d 0000605d 010001fd 03fe03fd 00fe04fe
ffff88b97e752a80 1547030673 S Bi:4:003:1 -115 4096 <
ffff88b97e752f00 1547032782 C Bi:4:003:1 0 483 = 5b5db501 d7010001 53520100 0c01cc0d 00005c80 00c01810 1f0b250f 0811faef
ffff88b97e752f00 1547032793 S Bi:4:003:1 -115 4096 <
ffff88b97e7520c0 1547034404 C Bi:4:003:1 0 478 = 5b5db601 d6010001 54471000 0701cb0d 00006a69 fcfe02fd 0307f60a fa01fefe
ffff88b97e7520c0 1547034417 S Bi:4:003:1 -115 4096 <
ffff88b97e752840 1547036530 C Bi:4:003:1 0 488 = 5b5db701 d6010001 62361100 0701cb0d 00006f80 015915fc 08faeb0c 1007f70a
ffff88b97e752840 1547036542 S Bi:4:003:1 -115 4096 <
ffff88b97e752a80 1547038282 C Bi:4:003:1 0 479 = 5b5db801 d7010001 630e0000 0c01cc0d 00005e5d fefe04ff 01fd0200 fffd05ff
ffff88b97e752a80 1547038293 S Bi:4:003:1 -115 4096 <
ffff88b97e752f00 1547040276 C Bi:4:003:1 0 483 = 5b5db901 d7010001 70e80100 0c01cc0d 00005b80 00bf1d0f 1810260c 0514f9ed
ffff88b97e752f00 1547040288 S Bi:4:003:1 -115 4096 <
ffff88b97e7520c0 1547042030 C Bi:4:003:1 0 478 = 5b5dba01 d6010001 71dd1000 0701cb0d 00006a67 fe0402ff fc07f601 01fe0301
ffff88b97e7520c0 1547042049 S Bi:4:003:1 -115 4096 <
ffff88b97e752840 1547044023 C Bi:4:003:1 0 488 = 5b5dbb01 d6010001 7fd21100 0701cb0d 00006c80 015518fd 05fae712 0c070006
ffff88b97e752840 1547044036 S Bi:4:003:1 -115 4096 <
ffff88b97e752a80 1547045904 C Bi:4:003:1 0 479 = 5b5dbc01 d7010001 80ab0000 0c01cc0d 0000625f fffc06fb 07fb04fb 02ff0202
ffff88b97e752a80 1547045915 S Bi:4:003:1 -115 4096 <
ffff88b97e752f00 1547047919 C Bi:4:003:1 0 483 = 5b5dbd01 d7010001 8e840100 0c01cc0d 00005d80 00c21910 1e0a270d 0713f9ed
ffff88b97e752f00 1547047930 S Bi:4:003:1 -115 4096 <
ffff88b97e7520c0 1547049654 C Bi:4:003:1 0 478 = 5b5dbe01 d6010001 8f791000 0701cb0d 00006c69 fffd0200 0003fa05 02fafc04
ffff88b97e7520c0 1547049673 S Bi:4:003:1 -115 4096 <
ffff88b97e752840 1547051658 C Bi:4:003:1 0 488 = 5b5dbf01 d6010001 9d681100 0701cb0d 00006d80 01581401 02fce70e 1105fc07
ffff88b97e752840 1547051680 S Bi:4:003:1 -115 4096 <
ffff88b97e752a80 1547053407 C Bi:4:003:1 0 479 = 5b5dc001 d7010001 9e410000 0c01cc0d 00006060 fffc0302 01fc0000 fffd0402
ffff88b97e752a80 1547053418 S Bi:4:003:1 -115 4096 <
ffff88b97e752f00 1547055530 C Bi:4:003:1 0 483 = 5b5dc101 d7010001 ac1a0100 0c01cc0d 00005f80 00c7140f 200c230d 0a0efded
ffff88b97e752f00 1547055541 S Bi:4:003:1 -115 4096 <
ffff88b97e7520c0 1547057279 C Bi:4:003:1 0 478 = 5b5dc201 d6010001 ad0f1000 0701cb0d 00006f6b 02fe03fb ff08f503 00000002
ffff88b97e7520c0 1547057298 S Bi:4:003:1 -115 4096 <
ffff88b97e752840 1547059279 C Bi:4:003:1 0 488 = 5b5dc301 d6010001 bb041100 0701cb0d 00006f80 01561df8 08f9e60f 1105fa0c
ffff88b97e752840 1547059292 S Bi:4:003:1 -115 4096 <
ffff88b97e752a80 1547061046 C Bi:4:003:1 0 479 = 5b5dc401 d7010001 bbdd0000 0c01cc0d 00006160 fd01ff02 03fdff02 fd0004ff
ffff88b97e752a80 1547061057 S Bi:4:003:1 -115 4096 <
ffff88b97e752f00 1547063157 C Bi:4:003:1 0 485 = 5b5dc501 d7010001 c9b90100 0c01cc0d 00005e80 00c80d1a 1412270a 0910ffeb
ffff88b97e752f00 1547063168 S Bi:4:003:1 -115 4096 <
ffff88b97e7520c0 1547064905 C Bi:4:003:1 0 478 = 5b5dc601 d6010001 caad1000 0701cb0d 00006d68 0301feff ff05f707 ff00fe00
ffff88b97e7520c0 1547064923 S Bi:4:003:1 -115 4096 <
ffff88b97e752840 1547066905 C Bi:4:003:1 0 488 = 5b5dc701 d6010001 d89e1100 0701cb0d 00006e80 01551dfa 04fde610 0e06f906
ffff88b97e752840 1547066918 S Bi:4:003:1 -115 4096 <
ffff88b97e752a80 1547068654 C Bi:4:003:1 0 479 = 5b5dc801 d7010001 d9760000 0c01cc0d 0000605b 010103fe 01fe02fd 01fc06fe
ffff88b97e752a80 1547068666 S Bi:4:003:1 -115 4096 <
ffff88b97e752f00 1547070779 C Bi:4:003:1 0 483 = 5b5dc901 d7010001 e7500100 0c01cc0d 00005c80 00c31710 1b0f260a 0c12f6f1
ffff88b97e752f00 1547070790 S Bi:4:003:1 -115 4096 <
ffff88b97e7520c0 1547072410 C Bi:4:003:1 0 478 = 5b5dca01 d6010001 e8451000 0701cb0d 00006e6b 00fb0201 fe07f7ff 05010001
ffff88b97e7520c0 1547072429 S Bi:4:003:1 -115 4096 <
ffff88b97e752840 1547074530 C Bi:4:003:1 0 488 = 5b5dcb01 d6010001 f63a1100 0701cb0d 00006d80 01551df8 05fee612 0c05fd05
ffff88b97e752840 1547074543 S Bi:4:003:1 -115 4096 <
ffff88b97e752a80 1547076279 C Bi:4:003:1 0 479 = 5b5dcc01 d7010001 f7130000 0c01cc0d 0000615d 01fe05fc 04fd01fc 04fe0003
ffff88b97e752a80 1547076290 S Bi:4:003:1 -115 4096 <
ffff88b97e752f00 1547078277 C Bi:4:003:1 0 483 = 5b5dcd01 d7010001 04ee0100 0c01cc0d 00005f80 00c21a12 1c082a0f 0512f8ee
ffff88b97e752f00 1547078288 S Bi:4:003:1 -115 4096 <
ffff88b97e7520c0 1547080031 C Bi:4:003:1 0 478 = 5b5dce01 d6010001 05e31000 0701cb0d 00006a68 fb010004 fc0bf30a fcfb0000
ffff88b97e7520c0 1547080050 S Bi:4:003:1 -115 4096 <
ffff88b97e752840 1547082029 C Bi:4:003:1 0 488 = 5b5dcf01 d6010001 13d21100 0701cb0d 00006c80 01541bf9 06f9e415 0d0af90b
ffff88b97e752840 1547082041 S Bi:4:003:1 -115 4096 <
ffff88b97e752a80 1547083905 C Bi:4:003:1 0 479 = 5b5dd001 d7010001 14ab0000 0c01cc0d 00006160 fcfe0700 01fdffff 01fc06ff
ffff88b97e752a80 1547083916 S Bi:4:003:1 -115 4096 <
ffff88b97e752f00 1547085916 C Bi:4:003:1 0 483 = 5b5dd101 d7010001 22850100 0c01cc0d 00005f80 00c41711 1a0e2612 040efcec
ffff88b97e752f00 1547085927 S Bi:4:003:1 -115 4096 <
ffff88b97e7520c0 1547087654 C Bi:4:003:1 0 478 = 5b5dd201 d6010001 23791000 0701cb0d 00006d6a fb00ff05 0204fa01 fc000002
ffff88b97e7520c0 1547087674 S Bi:4:003:1 -115 4096 <
ffff88b97e752840 1547089660 C Bi:4:003:1 0 486 = 5b5dd301 d6010001 316e1100 0701cb0d 00006980 014d20f8 09fbe70d 0e04fd0b
ffff88b97e752840 1547089672 S Bi:4:003:1 -115 4096 <
ffff88b97e752a80 1547091424 C Bi:4:003:1 0 479 = 5b5dd401 d7010001 32470000 0c01cc0d 0000625f ff020000 03fb02ff fd010302
ffff88b97e752a80 1547091435 S Bi:4:003:1 -115 4096 <
ffff88b97e752f00 1547093531 C Bi:4:003:1 0 483 = 5b5dd501 d7010001 40210100 0c01cc0d 00006080 00c61414 190e260e 0514fcea
ffff88b97e752f00 1547093541 S Bi:4:003:1 -115 4096 <
ffff88b97e7520c0 1547095281 C Bi:4:003:1 0 478 = 5b5dd601 d6010001 41161000 0701cb0d 00007073 fbfe0400 fa09f407 0000fc00
ffff88b97e7520c0 1547095300 S Bi:4:003:1 -115 4096 <
ffff88b97e752840 1547097280 C Bi:4:003:1 0 486 = 5b5dd701 d6010001 4f051100 0701cb0d 00006e80 015221f8 0201ea0a 0f05fc06
ffff88b97e752840 1547097292 S Bi:4:003:1 -115 4096 <
ffff88b97e752a80 1547099031 C Bi:4:003:1 0 479 = 5b5dd801 d7010001 4fde0000 0c01cc0d 00005e5b 03fb04fe 05fc00ff 00ff0203
ffff88b97e752a80 1547099041 S Bi:4:003:1 -115 4096 <
ffff88b97e752f00 1547101150 C Bi:4:003:1 0 485 = 5b5dd901 d7010001 5db60100 0c01cc0d 00006080 00c71212 1d0d2610 0611fcec
ffff88b97e752f00 1547101161 S Bi:4:003:1 -115 4096 <
ffff88b97e7520c0 1547102905 C Bi:4:003:1 0 478 = 5b5dda01 d6010001 5eab1000 0701cb0d 00006d69 01fd0201 f807fd04 000003fb
ffff88b97e7520c0 1547102924 S Bi:4:003:1 -115 4096 <
ffff88b97e752840 1547104905 C Bi:4:003:1 0 486 = 5b5ddb01 d6010001 6ca11100 0701cb0d 00006d80 015220f7 07fbe611 0d06fb07
ffff88b97e752840 1547104917 S Bi:4:003:1 -115 4096 <
ffff88b97e752a80 1547106657 C Bi:4:003:1 0 479 = 5b5ddc01 d7010001 6d7a0000 0c01cc0d 00005f5f fefd06fc 04fb06f9 03fc07ff
ffff88b97e752a80 1547106668 S Bi:4:003:1 -115 4096 <
ffff88b97e752f00 1547108780 C Bi:4:003:1 0 483 = 5b5ddd01 d7010001 7b520100 0c01cc0d 00005e80 00c11810 1d0c2415 0311fbef
ffff88b97e752f00 1547108791 S Bi:4:003:1 -115 4096 <
ffff88b97e7520c0 1547110405 C Bi:4:003:1 0 478 = 5b5dde01 d6010001 7c471000 0701cb0d 00006c6a fcfb0600 fc07fb01 ff0000fa
ffff88b97e7520c0 1547110424 S Bi:4:003:1 -115 4096 <
ffff88b97e752840 1547112533 C Bi:4:003:1 0 486 = 5b5ddf01 d6010001 8a381100 0701cb0d 00006b80 01511cfc 05f9e414 0a08fe0a
ffff88b97e752840 1547112546 S Bi:4:003:1 -115 4096 <
ffff88b97e752a80 1547114284 C Bi:4:003:1 0 479 = 5b5de001 d7010001 8b100000 0c01cc0d 0000605b 010200fe 02ffff01 fffe05fe
ffff88b97e752a80 1547114294 S Bi:4:003:1 -115 4096 <
ffff88b97e752f00 1547116276 C Bi:4:003:1 0 485 = 5b5de101 d7010001 98e90100 0c01cc0d 00006080 00c61316 190e260f 0314faed
ffff88b97e752f00 1547116287 S Bi:4:003:1 -115 4096 <
ffff88b97e7520c0 1547118032 C Bi:4:003:1 0 478 = 5b5de201 d6010001 99dd1000 0701cb0d 00006b6a fffa03fb 0506f901 00fc06fc
ffff88b97e7520c0 1547118050 S Bi:4:003:1 -115 4096 <
ffff88b97e752840 1547120024 C Bi:4:003:1 0 488 = 5b5de301 d6010001 a7d41100 0701cb0d 00006b80 01551af8 06fae60d 0e0ef90d
ffff88b97e752840 1547120037 S Bi:4:003:1 -115 4096 <
ffff88b97e752a80 1547121905 C Bi:4:003:1 0 479 = 5b5de401 d7010001 a8ad0000 0c01cc0d 00006161 fefc0401 01fd03fe fd010500
ffff88b97e752a80 1547121916 S Bi:4:003:1 -115 4096 <
ffff88b97e752f00 1547123917 C Bi:4:003:1 0 485 = 5b5de501 d7010001 b6870100 0c01cc0d 00005f80 00c41412 1e112211 0411fcee
ffff88b97e752f00 1547123928 S Bi:4:003:1 -115 4096 <
ffff88b97e7520c0 1547125658 C Bi:4:003:1 0 478 = 5b5de601 d6010001 b77b1000 0701cb0d 00006b6a fefa0303 ff0af405 fe00fe00
ffff88b97e7520c0 1547125670 S Bi:4:003:1 -115 4096 <
ffff88b97e752840 1547127668 C Bi:4:003:1 0 486 = 5b5de701 d6010001 c56d1100 0701cb0d 00006780 01501bf6 0afbe415 0c06fd0a
ffff88b97e752840 1547127681 S Bi:4:003:1 -115 4096 <
ffff88b97e752a80 1547129405 C Bi:4:003:1 0 479 = 5b5de801 d7010001 c6460000 0c01cc0d 0000605e 02ffff01 03fc02fd 02fd0300
ffff88b97e752a80 1547129416 S Bi:4:003:1 -115 4096 <
ffff88b97e752f00 1547131530 C Bi:4:003:1 0 485 = 5b5de901 d7010001 d41f0100 0c01cc0d 00005e80 00be1d12 1b0f2011 050effec
ffff88b97e752f00 1547131541 S Bi:4:003:1 -115 4096 <
ffff88b97e7520c0 1547133280 C Bi:4:003:1 0 478 = 5b5dea01 d6010001 d5131000 0701cb0d 0000706b 00ff0201 fc04f906 ffff0001
ffff88b97e7520c0 1547133299 S Bi:4:003:1 -115 4096 <
ffff88b97e752840 1547135279 C Bi:4:003:1 0 486 = 5b5deb01 d6010001 e30a1100 0701cb0d 00006b80 01531df8 07fbe312 0c09fb0a
ffff88b97e752840 1547135292 S Bi:4:003:1 -115 4096 <
ffff88b97e752a80 1547137023 C Bi:4:003:1 0 479 = 5b5dec01 d7010001 e3e20000 0c01cc0d 00005d5d fffc0104 01fefd04 fdfe0400
ffff88b97e752a80 1547137034 S Bi:4:003:1 -115 4096 <
ffff88b97e752f00 1547139158 C Bi:4:003:1 0 485 = 5b5ded01 d7010001 f1bb0100 0c01cc0d 00006080 00c71510 1f0c250e 0216fcec
ffff88b97e752f00 1547139169 S Bi:4:003:1 -115 4096 <
ffff88b97e7520c0 1547140906 C Bi:4:003:1 0 478 = 5b5dee01 d6010001 f2b01000 0701cb0d 00006d6c fbfd05ff fe09f807 fdfc02ff
ffff88b97e7520c0 1547140918 S Bi:4:003:1 -115 4096 <
ffff88b97e752840 1547142905 C Bi:4:003:1 0 486 = 5b5def01 d6010001 00a21100 0701cb0d 00006e80 015b19f8 07fde413 0cfe0305
ffff88b97e752840 1547142917 S Bi:4:003:1 -115 4096 <
ffff88b97e752a80 1547144655 C Bi:4:003:1 0 479 = 5b5df001 d7010001 017a0000 0c01cc0d 0000625f 01ffffff 04fe04fd fefe05ff
ffff88b97e752a80 1547144666 S Bi:4:003:1 -115 4096 <
ffff88b97e752f00 1547146779 C Bi:4:003:1 0 483 = 5b5df101 d7010001 0f530100 0c01cc0d 00005f80 00c41813 190e250c 0612fcef
ffff88b97e752f00 1547146790 S Bi:4:003:1 -115 4096 <
ffff88b97e7520c0 1547148406 C Bi:4:003:1 0 478 = 5b5df201 d6010001 10471000 0701cb0d 00006e6a 01fb04fe fd0afb01 fffc0000
ffff88b97e7520c0 1547148425 S Bi:4:003:1 -115 4096 <
ffff88b97e752840 1547150425 C Bi:4:003:1 0 486 = 5b5df301 d6010001 1e3d1100 0701cb0d 00006b80 015a15f9 07f9e910 0c07fc0b
ffff88b97e752840 1547150438 S Bi:4:003:1 -115 4096 <
ffff88b97e752a80 1547152280 C Bi:4:003:1 0 479 = 5b5df401 d7010001 1f150000 0c01cc0d 0000615e 01fb05fe 05fb02fe 02f909fc
ffff88b97e752a80 1547152291 S Bi:4:003:1 -115 4096 <
ffff88b97e752f00 1547154273 C Bi:4:003:1 0 485 = 5b5df501 d7010001 2cee0100 0c01cc0d 00005e80 00bf1b13 1c0a250d 0616faec
ffff88b97e752f00 1547154283 S Bi:4:003:1 -115 4096 <
ffff88b97e7520c0 1547156026 C Bi:4:003:1 0 478 = 5b5df601 d6010001 2de21000 0701cb0d 00006f6f fdfffd01 0109fa00 fe00fe02
ffff88b97e7520c0 1547156061 S Bi:4:003:1 -115 4096 <
ffff88b97e752840 1547158026 C Bi:4:003:1 0 486 = 5b5df701 d6010001 3bd31100 0701cb0d 00006e80 015619fb 04ffe511 0e07f808
ffff88b97e752840 1547158038 S Bi:4:003:1 -115 4096 <
ffff88b97e752a80 1547159903 C Bi:4:003:1 0 479 = 5b5df801 d7010001 3cac0000 0c01cc0d 0000605e 00fe02ff 04fc03ff fffa0602
ffff88b97e752a80 1547159914 S Bi:4:003:1 -115 4096 <
ffff88b97e752f00 1547161909 C Bi:4:003:1 0 483 = 5b5df901 d7010001 4a800100 0c01cc0d 00006080 00c41a12 1412250d 0612fbed
ffff88b97e752f00 1547161922 S Bi:4:003:1 -115 4096 <
ffff88b97e7520c0 1547163653 C Bi:4:003:1 0 478 = 5b5dfa01 d6010001 4b741000 0701cb0d 00006d69 05fdfd03 fc04f807 01fa05ff
ffff88b97e7520c0 1547163671 S Bi:4:003:1 -115 4096 <
ffff88b97e752840 1547165657 C Bi:4:003:1 0 488 = 5b5dfb01 d6010001 596a1100 0701cb0d 00006e80 01561ff8 05f9e811 0a08f80d
ffff88b97e752840 1547165670 S Bi:4:003:1 -115 4096 <
ffff88b97e752a80 1547167414 C Bi:4:003:1 0 479 = 5b5dfc01 d7010001 5a420000 0c01cc0d 0000615f 02fb0301 04f903fe fe000202
ffff88b97e752a80 1547167425 S Bi:4:003:1 -115 4096 <
ffff88b97e752f00 1547169530 C Bi:4:003:1 0 485 = 5b5dfd01 d7010001 681c0100 0c01cc0d 00005e80 00bf1616 1d0c2310 0612fbea
ffff88b97e752f00 1547169541 S Bi:4:003:1 -115 4096 <
ffff88b97e7520c0 1547171281 C Bi:4:003:1 0 478 = 5b5dfe01 d6010001 69111000 0701cb0d 00006c67 03fb0101 ff08f605 02fffc00
ffff88b97e7520c0 1547171294 S Bi:4:003:1 -115 4096 <
ffff88b97e752840 1547173280 C Bi:4:003:1 0 486 = 5b5dff01 d6010001 77071100 0701cb0d 00006880 014e1efb 07f9e40e 1006fd08
ffff88b97e752840 1547173292 S Bi:4:003:1 -115 4096 <
ffff88b97e752a80 1547175046 C Bi:4:003:1 0 479 = 5b5d0001 d7010001 77e00000 0c01cc0d 00005e5b 02fdff05 01fc05fc 00fc0106
ffff88b97e752a80 1547175057 S Bi:4:003:1 -115 4096 <
ffff88b97e752f00 1547177156 C Bi:4:003:1 0 483 = 5b5d0101 d7010001 85b40100 0c01cc0d 00005d80 00be1b0d 22072b0e 0412f8f0
ffff88b97e752f00 1547177167 S Bi:4:003:1 -115 4096 <
ffff88b97e7520c0 1547178920 C Bi:4:003:1 0 478 = 5b5d0201 d6010001 86a81000 0701cb0d 00006c67 0002fe01 fd08f900 ff01fd06
ffff88b97e7520c0 1547178939 S Bi:4:003:1 -115 4096 <
ffff88b97e752840 1547180905 C Bi:4:003:1 0 488 = 5b5d0301 d6010001 949e1100 0701cb0d 00006d80 01591af9 06fbe50e 0f05fa08
ffff88b97e752840 1547180917 S Bi:4:003:1 -115 4096 <
ffff88b97e752a80 1547182656 C Bi:4:003:1 0 479 = 5b5d0401 d7010001 95770000 0c01cc0d 00006160 01fc0100 04fb0202 fb020003
ffff88b97e752a80 1547182667 S Bi:4:003:1 -115 4096 <
ffff88b97e752f00 1547184781 C Bi:4:003:1 0 483 = 5b5d0501 d7010001 a3500100 0c01cc0d 00005c80 00be1a15 170e2512 0412fceb
ffff88b97e752f00 1547184792 S Bi:4:003:1 -115 4096 <
ffff88b97e7520c0 1547186406 C Bi:4:003:1 0 478 = 5b5d0601 d6010001 a4451000 0701cb0d 00006f6b 03f905fe 0006f503 ff020001
ffff88b97e7520c0 1547186425 S Bi:4:003:1 -115 4096 <
ffff88b97e752840 1547188420 C Bi:4:003:1 0 486 = 5b5d0701 d6010001 b23a1100 0701cb0d 00006a80 015025f1 0af9e80c 1004fe0b
ffff88b97e752840 1547188433 S Bi:4:003:1 -115 4096 <
ffff88b97e752a80 1547190284 C Bi:4:003:1 0 479 = 5b5d0801 d7010001 b3130000 0c01cc0d 0000615f 00fc0401 ffff0101 feff0400
ffff88b97e752a80 1547190295 S Bi:4:003:1 -115 4096 <
ffff88b97e752f00 1547192273 C Bi:4:003:1 0 483 = 5b5d0901 d7010001 c0e70100 0c01cc0d 00005d80 00c01c0d 1f0b2410 0712fcec
ffff88b97e752f00 1547192284 S Bi:4:003:1 -115 4096 <
ffff88b97e7520c0 1547194030 C Bi:4:003:1 0 478 = 5b5d0a01 d6010001 c1dc1000 0701cb0d 00006d6e fbfb0504 fc05fd01 fdff00fc
ffff88b97e7520c0 1547194049 S Bi:4:003:1 -115 4096 <
ffff88b97e752840 1547196022 C Bi:4:003:1 0 488 = 5b5d0b01 d6010001 cfd11100 0701cb0d 00006c80 01561bf9 03ffe90d 0b08fb09
ffff88b97e752840 1547196035 S Bi:4:003:1 -115 4096 <
ffff88b97e752a80 1547197907 C Bi:4:003:1 0 479 = 5b5d0c01 d7010001 d0aa0000 0c01cc0d 0000615f fe000204 fefe0000 fffd0303
ffff88b97e752a80 1547197918 S Bi:4:003:1 -115 4096 <
ffff88b97e752f00 1547199910 C Bi:4:003:1 0 485 = 5b5d0d01 d7010001 de840100 0c01cc0d 00005e80 00c31c0d 1b0b2611 0710f9f0
ffff88b97e752f00 1547199921 S Bi:4:003:1 -115 4096 <
ffff88b97e7520c0 1547201655 C Bi:4:003:1 0 478 = 5b5d0e01 d6010001 df781000 0701cb0d 00006a66 03f80203 f90df801 ff02fffd
ffff88b97e7520c0 1547201668 S Bi:4:003:1 -115 4096 <
ffff88b97e752840 1547203658 C Bi:4:003:1 0 488 = 5b5d0f01 d6010001 ed6f1100 0701cb0d 00006e80 01591cf8 02fde815 0707fc09
ffff88b97e752840 1547203671 S Bi:4:003:1 -115 4096 <
ffff88b97e752a80 1547205408 C Bi:4:003:1 0 479 = 5b5d1001 d7010001 ee480000 0c01cc0d 0000625e 03fe02ff 03fb02ff 00f80904
ffff88b97e752a80 1547205419 S Bi:4:003:1 -115 4096 <
ffff88b97e752f00 1547207533 C Bi:4:003:1 0 485 = 5b5d1101 d7010001 fc1b0100 0c01cc0d 00005e80 00c11a0e 1c10250f 0611faec
ffff88b97e752f00 1547207544 S Bi:4:003:1 -115 4096 <
ffff88b97e7520c0 1547209281 C Bi:4:003:1 0 478 = 5b5d1201 d6010001 fd101000 0701cb0d 00006964 01fc01ff 0502fb02 02fc01ff
ffff88b97e7520c0 1547209300 S Bi:4:003:1 -115 4096 <
ffff88b97e752840 1547211282 C Bi:4:003:1 0 486 = 5b5d1301 d6010001 0b081100 0701cb0d 00006f80 015a1af7 0af5ec11 0b05fc06
ffff88b97e752840 1547211295 S Bi:4:003:1 -115 4096 <
ffff88b97e752a80 1547213044 C Bi:4:003:1 0 479 = 5b5d1401 d7010001 0be10000 0c01cc0d 0000615e 00fc0400 03fd0001 fdfc0603
ffff88b97e752a80 1547213055 S Bi:4:003:1 -115 4096 <
ffff88b97e752f00 1547215154 C Bi:4:003:1 0 483 = 5b5d1501 d7010001 19ba0100 0c01cc0d 00005c80 00c61211 18112610 0412f9ee
ffff88b97e752f00 1547215165 S Bi:4:003:1 -115 4096 <
ffff88b97e7520c0 1547216905 C Bi:4:003:1 0 478 = 5b5d1601 d6010001 1aae1000 0701cb0d 00006d6a fffd0003 0102fe02 fc02fffd
ffff88b97e7520c0 1547216925 S Bi:4:003:1 -115 4096 <
ffff88b97e752840 1547218905 C Bi:4:003:1 0 486 = 5b5d1701 d6010001 28a31100 0701cb0d 00006e80 01561aff 00fce811 0f02fd08
ffff88b97e752840 1547218918 S Bi:4:003:1 -115 4096 <
ffff88b97e752a80 1547220657 C Bi:4:003:1 0 479 = 5b5d1801 d7010001 297c0000 0c01cc0d 00005f5e fd010100 04fd02fe fffd05fe
ffff88b97e752a80 1547220668 S Bi:4:003:1 -115 4096 <
ffff88b97e752f00 1547222780 C Bi:4:003:1 0 485 = 5b5d1901 d7010001 374e0100 0c01cc0d 00005e80 00c31710 1c0c280e 0414f9ee
ffff88b97e752f00 1547222791 S Bi:4:003:1 -115 4096 <
ffff88b97e7520c0 1547224399 C Bi:4:003:1 0 478 = 5b5d1a01 d6010001 38431000 0701cb0d 00006a65 03fc0200 fa0ff404 01feff00
ffff88b97e7520c0 1547224418 S Bi:4:003:1 -115 4096 <
ffff88b97e752840 1547226422 C Bi:4:003:1 0 488 = 5b5d1b01 d6010001 463b1100 0701cb0d 00006f80 01591cf8 04fce711 0b05ff08
ffff88b97e752840 1547226434 S Bi:4:003:1 -115 4096 <
ffff88b97e752a80 1547228280 C Bi:4:003:1 0 479 = 5b5d1c01 d7010001 47140000 0c01cc0d 00005f59 030003fb 05fefffe 02fd0102
ffff88b97e752a80 1547228291 S Bi:4:003:1 -115 4096 <
ffff88b97e752f00 1547230277 C Bi:4:003:1 0 483 = 5b5d1d01 d7010001 54ee0100 0c01cc0d 00005f80 00c61510 1c0f240a 0b12fcec
ffff88b97e752f00 1547230288 S Bi:4:003:1 -115 4096 <
ffff88b97e7520c0 1547232031 C Bi:4:003:1 0 478 = 5b5d1e01 d6010001 55e31000 0701cb0d 00006964 06f80200 fc08fa05 fb01ff01
ffff88b97e7520c0 1547232043 S Bi:4:003:1 -115 4096 <
ffff88b97e752840 1547234023 C Bi:4:003:1 0 486 = 5b5d1f01 d6010001 63d81100 0701cb0d 00006a80 015121f6 08f8e80c 1107fc09
ffff88b97e752840 1547234035 S Bi:4:003:1 -115 4096 <
ffff88b97e752a80 1547235906 C Bi:4:003:1 0 479 = 5b5d2001 d7010001 64b10000 0c01cc0d 0000605d 00fd0402 fe00fe03 fefb08fe
ffff88b97e752a80 1547235917 S Bi:4:003:1 -115 4096 <
ffff88b97e752f00 1547237911 C Bi:4:003:1 0 483 = 5b5d2101 d7010001 72830100 0c01cc0d 00005e80 00c41710 1a10230f 0514fdec
ffff88b97e752f00 1547237922 S Bi:4:003:1 -115 4096 <
ffff88b97e7520c0 1547239656 C Bi:4:003:1 0 478 = 5b5d2201 d6010001 73781000 0701cb0d 00006d6c faff04fd 030af401 00fd0301
ffff88b97e7520c0 1547239668 S Bi:4:003:1 -115 4096 <
ffff88b97e752840 1547241656 C Bi:4:003:1 0 486 = 5b5d2301 d6010001 816f1100 0701cb0d 00006d80 015120fb 05fbe70c 0f0af310
ffff88b97e752840 1547241668 S Bi:4:003:1 -115 4096 <
ffff88b97e752a80 1547243413 C Bi:4:003:1 0 479 = 5b5d2401 d7010001 82480000 0c01cc0d 0000605c 02ff0101 04fa0101 f9030400
ffff88b97e752a80 1547243424 S Bi:4:003:1 -115 4096 <
ffff88b97e752f00 1547245533 C Bi:4:003:1 0 485 = 5b5d2501 d7010001 90200100 0c01cc0d 00005f80 00c11614 1f06290f 0712f8ef
ffff88b97e752f00 1547245544 S Bi:4:003:1 -115 4096 <
ffff88b97e7520c0 1547247283 C Bi:4:003:1 0 478 = 5b5d2601 d6010001 91151000 0701cb0d 00006c6d f8fa0901 fe08f702 01fe02fb
ffff88b97e7520c0 1547247303 S Bi:4:003:1 -115 4096 <
ffff88b97e752840 1547249281 C Bi:4:003:1 0 486 = 5b5d2701 d6010001 9f0b1100 0701cb0d 00006b80 01541afa 07fbe90c 1108fa0d
ffff88b97e752840 1547249294 S Bi:4:003:1 -115 4096 <
ffff88b97e752a80 1547251036 C Bi:4:003:1 0 479 = 5b5d2801 d7010001 9fe40000 0c01cc0d 0000615f fc020000 02fc06fb 01fc0600
ffff88b97e752a80 1547251047 S Bi:4:003:1 -115 4096 <
ffff88b97e752f00 1547253155 C Bi:4:003:1 0 483 = 5b5d2901 d7010001 adb60100 0c01cc0d 00005b80 00bf1515 160c2c0f 0611faec
ffff88b97e752f00 1547253166 S Bi:4:003:1 -115 4096 <
ffff88b97e7520c0 1547254906 C Bi:4:003:1 0 478 = 5b5d2a01 d6010001 aeab1000 0701cb0d 00006c64 000400ff fd06fb01 02ff01fa
ffff88b97e7520c0 1547254925 S Bi:4:003:1 -115 4096 <
ffff88b97e752840 1547256907 C Bi:4:003:1 0 486 = 5b5d2b01 d6010001 bca01100 0701cb0d 00006b80 01531ef7 09f4ea11 0c07ff0a
ffff88b97e752840 1547256918 S Bi:4:003:1 -115 4096 <
ffff88b97e752a80 1547258659 C Bi:4:003:1 0 479 = 5b5d2c01 d7010001 bd790000 0c01cc0d 0000605c 00000103 00fdffff 03fa0403
ffff88b97e752a80 1547258670 S Bi:4:003:1 -115 4096 <
ffff88b97e752f00 1547260781 C Bi:4:003:1 0 483 = 5b5d2d01 d7010001 cb530100 0c01cc0d 00005c80 00c21415 1b0e240e 0218fae9
ffff88b97e752f00 1547260792 S Bi:4:003:1 -115 4096 <
ffff88b97e7520c0 1547262405 C Bi:4:003:1 0 478 = 5b5d2e01 d6010001 cc481000 0701cb0d 00006c6b fef90303 ff06f806 fb01fd00
ffff88b97e7520c0 1547262424 S Bi:4:003:1 -115 4096 <
ffff88b97e752840 1547264421 C Bi:4:003:1 0 486 = 5b5d2f01 d6010001 da3d1100 0701cb0d 00006d80 01571bfa 05fce608 0f0bfe07
ffff88b97e752840 1547264434 S Bi:4:003:1 -115 4096 <
ffff88b97e752a80 1547266281 C Bi:4:003:1 0 479 = 5b5d3001 d7010001 db160000 0c01cc0d 0000615b 0202fd03 0000ff01 fcff0601
ffff88b97e752a80 1547266293 S Bi:4:003:1 -115 4096 <
ffff88b97e752f00 1547268273 C Bi:4:003:1 0 483 = 5b5d3101 d7010001 e8e80100 0c01cc0d 00005c80 00be1a11 1a12240f 0611f9ef
ffff88b97e752f00 1547268284 S Bi:4:003:1 -115 4096 <
ffff88b97e7520c0 1547270031 C Bi:4:003:1 0 478 = 5b5d3201 d6010001 e9e31000 0701cb0d 00006d6b 01fd05fc f90bfaff 03fd03fe
ffff88b97e7520c0 1547270050 S Bi:4:003:1 -115 4096 <
ffff88b97e752840 1547272024 C Bi:4:003:1 0 486 = 5b5d3301 d6010001 f7d21100 0701cb0d 00006a80 01541ef5 06fae70e 1403fd09
ffff88b97e752840 1547272036 S Bi:4:003:1 -115 4096 <
ffff88b97e752a80 1547273906 C Bi:4:003:1 0 479 = 5b5d3401 d7010001 f8ab0000 0c01cc0d 0000615f 00fd02fe 000201ff 02f906ff
ffff88b97e752a80 1547273918 S Bi:4:003:1 -115 4096 <
ffff88b97e752f00 1547275913 C Bi:4:003:1 0 483 = 5b5d3501 d7010001 06850100 0c01cc0d 00005f80 00c31715 15132010 0615f9ef
ffff88b97e752f00 1547275924 S Bi:4:003:1 -115 4096 <
ffff88b97e7520c0 1547277659 C Bi:4:003:1 0 478 = 5b5d3601 d6010001 077a1000 0701cb0d 00006b65 07fb0100 fc03fe04 ff00fefd
ffff88b97e7520c0 1547277671 S Bi:4:003:1 -115 4096 <
ffff88b97e752840 1547279659 C Bi:4:003:1 0 486 = 5b5d3701 d6010001 156f1100 0701cb0d 00006b80 015121fa 06fbe211 0b050209
ffff88b97e752840 1547279671 S Bi:4:003:1 -115 4096 <
ffff88b97e752a80 1547281406 C Bi:4:003:1 0 479 = 5b5d3801 d7010001 16480000 0c01cc0d 00006360 03fa0002 04fe00ff 00fd05fe
ffff88b97e752a80 1547281417 S Bi:4:003:1 -115 4096 <
ffff88b97e752f00 1547283531 C Bi:4:003:1 0 483 = 5b5d3901 d7010001 241a0100 0c01cc0d 00005e80 00c7180a 200c2210 0615f6ef
ffff88b97e752f00 1547283542 S Bi:4:003:1 -115 4096 <
ffff88b97e7520c0 1547285282 C Bi:4:003:1 0 478 = 5b5d3a01 d6010001 250f1000 0701cb0d 00006c68 04fa0101 fb0afa05 fefffc00
ffff88b97e7520c0 1547285294 S Bi:4:003:1 -115 4096 <
ffff88b97e752840 1547287281 C Bi:4:003:1 0 488 = 5b5d3b01 d6010001 32fe1100 0701cb0d 00006a80 015021f6 0af7e90e 0c06ff0b
ffff88b97e752840 1547287293 S Bi:4:003:1 -115 4096 <
ffff88b97e752a80 1547289036 C Bi:4:003:1 0 479 = 5b5d3c01 d7010001 33d70000 0c01cc0d 0000605e ffffff04 02fcff00 00fe0202
ffff88b97e752a80 1547289047 S Bi:4:003:1 -115 4096 <
ffff88b97e752f00 1547291171 C Bi:4:003:1 0 483 = 5b5d3d01 d7010001 41b30100 0c01cc0d 00005f80 00c71412 1a0e260f 0415faeb
ffff88b97e752f00 1547291182 S Bi:4:003:1 -115 4096 <
ffff88b97e7520c0 1547292795 C Bi:4:003:1 0 478 = 5b5d3e01 d6010001 42a71000 0701cb0d 00006b6c fb010001 ff09f7fd 02fc0401
ffff88b97e7520c0 1547292814 S Bi:4:003:1 -115 4096 <
ffff88b97e752840 1547294907 C Bi:4:003:1 0 486 = 5b5d3f01 d6010001 509d1100 0701cb0d 00006a80 01511ffa 01fbeb10 0d07fa07
ffff88b97e752840 1547294919 S Bi:4:003:1 -115 4096 <
ffff88b97e752a80 1547296659 C Bi:4:003:1 0 479 = 5b5d4001 d7010001 51750000 0c01cc0d 00005f5e 03faff03 03fd01ff 00fd05fe
ffff88b97e752a80 1547296670 S Bi:4:003:1 -115 4096 <
ffff88b97e752f00 1547298784 C Bi:4:003:1 0 483 = 5b5d4101 d7010001 5f4e0100 0c01cc0d 00006180 00c71411 1f0e250a 0814f7f2
ffff88b97e752f00 1547298795 S Bi:4:003:1 -115 4096 <
ffff88b97e7520c0 1547300407 C Bi:4:003:1 0 478 = 5b5d4201 d6010001 60421000 0701cb0d 00006c67 0501f903 fc08f609 fffd0001
ffff88b97e7520c0 1547300425 S Bi:4:003:1 -115 4096 <
ffff88b97e752840 1547302415 C Bi:4:003:1 0 488 = 5b5d4301 d6010001 6e311100 0701cb0d 00006b80 01531df8 09f9e80d 0e08fb0b
ffff88b97e752840 1547302428 S Bi:4:003:1 -115 4096 <
ffff88b97e752a80 1547304282 C Bi:4:003:1 0 479 = 5b5d4401 d7010001 6f0a0000 0c01cc0d 00005d5b fffd0302 03fb01ff 01fe0104
ffff88b97e752a80 1547304293 S Bi:4:003:1 -115 4096 <
ffff88b97e752f00 1547306273 C Bi:4:003:1 0 485 = 5b5d4501 d7010001 7ce40100 0c01cc0d 00005d80 00c21710 1c0d280b 0a13f8ed
ffff88b97e752f00 1547306284 S Bi:4:003:1 -115 4096 <
ffff88b97e7520c0 1547308032 C Bi:4:003:1 0 478 = 5b5d4601 d6010001 7dd91000 0701cb0d 00006d69 04fa0100 ff03fa05 ff0103ff
ffff88b97e7520c0 1547308051 S Bi:4:003:1 -115 4096 <
ffff88b97e752840 1547310024 C Bi:4:003:1 0 486 = 5b5d4701 d6010001 8bd11100 0701cb0d 00006d80 015718fa 06fce513 0d04fe08
ffff88b97e752840 1547310037 S Bi:4:003:1 -115 4096 <
ffff88b97e752a80 1547311784 C Bi:4:003:1 0 479 = 5b5d4801 d7010001 8caa0000 0c01cc0d 0000605e 02f80700 02ff03fd fefc0500
ffff88b97e752a80 1547311795 S Bi:4:003:1 -115 4096 <
ffff88b97e752f00 1547313907 C Bi:4:003:1 0 485 = 5b5d4901 d7010001 9a820100 0c01cc0d 00005e80 00c31513 170b2c0d 0712fcec
ffff88b97e752f00 1547313918 S Bi:4:003:1 -115 4096 <
ffff88b97e7520c0 1547316538 C Bi:4:003:1 0 2471 = 5b5d4a09 9f020201 015c083d 00001012 02061013 02011011 03061014 43011015
ffff88b97e7520c0 1547316549 S Bi:4:003:1 -115 4096 <
ffff88b97e752840 1547318030 C Bi:4:003:1 0 478 = 5b5d4b01 d6010001 9b771000 0701cb8d 00006f6f fa0005fb 0101fd02 fb030101
ffff88b97e752840 1547318049 S Bi:4:003:1 -115 4096 <
ffff88b97e752a80 1547321033 C Bi:4:003:1 0 488 = 5b5d4c01 d6010001 b68f1100 0701cb8d 00006d80 01541df7 09f9e411 0d06fe09
ffff88b97e752a80 1547321046 S Bi:4:003:1 -115 4096 <
ffff88b97e752f00 1547323277 C Bi:4:003:1 0 479 = 5b5d4d01 d7010001 b7670000 0c01cc8d 0000625d 03fa0500 ffff02fe ffff0402
ffff88b97e752f00 1547323288 S Bi:4:003:1 -115 4096 <
ffff88b97e7520c0 1547326906 C Bi:4:003:1 0 485 = 5b5d4e01 d7010001 c73a0100 0c01cc8d 00006080 00c41811 18142010 0810fbed
ffff88b97e7520c0 1547326917 S Bi:4:003:1 -115 4096 <
ffff88b97e752840 1548253923 C Bi:4:003:1 0 478 = 5b5d4f01 d6010001 de0d1000 0701cb0d 00006b65 04fa06fe fc08f708 fdfefe01
ffff88b97e752840 1548253952 S Bi:4:003:1 -115 4096 <
ffff88b97e752a80 1548255915 C Bi:4:003:1 0 484 = 5b5d5001 d6010001 efbd1100 0701cb0d 00006e7d ff0303fc f413f904 f3080601
ffff88b97e752a80 1548255935 S Bi:4:003:1 -115 4096 <
ffff88b97e752f00 1548257657 C Bi:4:003:1 0 479 = 5b5d5101 d7010001 f0960000 0c01cc0d 00005d58 00f80700 03fe03fe 01fc04fc
ffff88b97e752f00 1548257668 S Bi:4:003:1 -115 4096 <
ffff88b97e7520c0 1548259790 C Bi:4:003:1 0 485 = 5b5d5201 d7010001 fe6e0100 0c01cc0d 00005f80 00c01914 16102a0f 0411fced
ffff88b97e7520c0 1548259801 S Bi:4:003:1 -115 4096 <
ffff88b97e752840 1548261415 C Bi:4:003:1 0 478 = 5b5d5301 d6010001 ff621000 0701cb0d 00006d69 03fc02ff 0109f303 0200fd01
ffff88b97e752840 1548261435 S Bi:4:003:1 -115 4096 <
ffff88b97e752a80 1548263541 C Bi:4:003:1 0 486 = 5b5d5401 d6010001 0d5a1100 0701cb0d 00006f80 008801fb 0400ee1b fafdf907
ffff88b97e752a80 1548263561 S Bi:4:003:1 -115 4096 <
ffff88b97e752f00 1548265289 C Bi:4:003:1 0 479 = 5b5d5501 d7010001 0e330000 0c01cc0d 0000615e 00fd02ff 0201fcff 03fd03fe
ffff88b97e752f00 1548265300 S Bi:4:003:1 -115 4096 <
ffff88b97e7520c0 1548267306 C Bi:4:003:1 0 485 = 5b5d5601 d7010001 1c0c0100 0c01cc0d 00005f80 00be1c0f 1e0c280f 0414faee
ffff88b97e7520c0 1548267317 S Bi:4:003:1 -115 4096 <
ffff88b97e752840 1548269032 C Bi:4:003:1 0 478 = 5b5d5701 d6010001 1d001000 0701cb0d 00006a67 00fd0100 0202f908 fefb01ff
ffff88b97e752840 1548269051 S Bi:4:003:1 -115 4096 <
ffff88b97e752a80 1548271055 C Bi:4:003:1 0 486 = 5b5d5801 d6010001 2af11100 0701cb0d 00006e80 008208fb 01fbf31a f702fb09
ffff88b97e752a80 1548271075 S Bi:4:003:1 -115 4096 <
ffff88b97e752f00 1548272914 C Bi:4:003:1 0 479 = 5b5d5901 d7010001 2bc90000 0c01cc0d 00005f5c fd0100fa 09fdfe01 00fe04fe
ffff88b97e752f00 1548272926 S Bi:4:003:1 -115 4096 <
ffff88b97e7520c0 1548274914 C Bi:4:003:1 0 485 = 5b5d5a01 d7010001 39a20100 0c01cc0d 00005f80 00c01c13 12132510 0611faee
ffff88b97e7520c0 1548274925 S Bi:4:003:1 -115 4096 <
ffff88b97e752840 1548276680 C Bi:4:003:1 0 478 = 5b5d5b01 d6010001 3a961000 0701cb0d 00006d68 02fffe01 fe07fc02 0100fc00
ffff88b97e752840 1548276699 S Bi:4:003:1 -115 4096 <
ffff88b97e752a80 1548278657 C Bi:4:003:1 0 486 = 5b5d5c01 d6010001 488f1100 0701cb0d 00006d80 008207f9 0105f017 f505f508
ffff88b97e752a80 1548278677 S Bi:4:003:1 -115 4096 <
ffff88b97e752f00 1548280515 C Bi:4:003:1 0 479 = 5b5d5d01 d7010001 49670000 0c01cc0d 0000605a 03fa03fe 050000fd 000003fc
ffff88b97e752f00 1548280524 S Bi:4:003:1 -115 4096 <
ffff88b97e7520c0 1548282544 C Bi:4:003:1 0 485 = 5b5d5e01 d7010001 57400100 0c01cc0d 00005d80 00c51115 1d0b250e 0911fbee
ffff88b97e7520c0 1548282555 S Bi:4:003:1 -115 4096 <
ffff88b97e752840 1548284287 C Bi:4:003:1 0 478 = 5b5d5f01 d6010001 58341000 0701cb0d 00006c6c fcfefd07 fd07f705 fe00fd02
ffff88b97e752840 1548284305 S Bi:4:003:1 -115 4096 <
ffff88b97e752a80 1548286290 C Bi:4:003:1 0 486 = 5b5d6001 d6010001 66251100 0701cb0d 00006c80 008104fd 05fdef19 f902fd01
ffff88b97e752a80 1548286310 S Bi:4:003:1 -115 4096 <
ffff88b97e752f00 1548288040 C Bi:4:003:1 0 479 = 5b5d6101 d7010001 66fd0000 0c01cc0d 0000605e fefc04fe 04fd01fe 0001ff00
ffff88b97e752f00 1548288051 S Bi:4:003:1 -115 4096 <
ffff88b97e7520c0 1548290185 C Bi:4:003:1 0 485 = 5b5d6201 d7010001 74d00100 0c01cc0d 00005e80 00c61510 1c0b2a0c 0813f9eb
ffff88b97e7520c0 1548290196 S Bi:4:003:1 -115 4096 <
ffff88b97e752840 1548291918 C Bi:4:003:1 0 478 = 5b5d6301 d6010001 75c51000 0701cb0d 00006d6c fe00fd05 fc06f507 fefa0500
ffff88b97e752840 1548291930 S Bi:4:003:1 -115 4096 <
ffff88b97e752a80 1548293915 C Bi:4:003:1 0 486 = 5b5d6401 d6010001 83bd1100 0701cb0d 00007080 0089fefd 0205f210 f80cf406
ffff88b97e752a80 1548293927 S Bi:4:003:1 -115 4096 <
ffff88b97e752f00 1548295664 C Bi:4:003:1 0 479 = 5b5d6501 d7010001 84950000 0c01cc0d 0000615d fffe01fd 06fc03fc 02fc07fb
ffff88b97e752f00 1548295675 S Bi:4:003:1 -115 4096 <
ffff88b97e7520c0 1548297793 C Bi:4:003:1 0 485 = 5b5d6601 d7010001 926e0100 0c01cc0d 00005f80 00c01917 14112a0a 0513fbec
ffff88b97e7520c0 1548297804 S Bi:4:003:1 -115 4096 <
ffff88b97e752840 1548299415 C Bi:4:003:1 0 478 = 5b5d6701 d6010001 93631000 0701cb0d 00006b69 03fafb06 fc06fc02 0101fdfd
ffff88b97e752840 1548299434 S Bi:4:003:1 -115 4096 <
ffff88b97e752a80 1548301540 C Bi:4:003:1 0 486 = 5b5d6801 d6010001 a1531100 0701cb0d 00006d80 008200ff 0300f018 fa02f60b
ffff88b97e752a80 1548301560 S Bi:4:003:1 -115 4096 <
ffff88b97e752f00 1548303290 C Bi:4:003:1 0 479 = 5b5d6901 d7010001 a22c0000 0c01cc0d 0000625d 02fffe01 04fd01fa 04fd04fe
ffff88b97e752f00 1548303301 S Bi:4:003:1 -115 4096 <
ffff88b97e7520c0 1548305297 C Bi:4:003:1 0 485 = 5b5d6a01 d7010001 affe0100 0c01cc0d 00005d80 00c31712 17152508 0c10faee
ffff88b97e7520c0 1548305308 S Bi:4:003:1 -115 4096 <
ffff88b97e752840 1548307039 C Bi:4:003:1 0 478 = 5b5d6b01 d6010001 b0f31000 0701cb0d 00006c66 06fdfeff fd07f805 fd0402fe
ffff88b97e752840 1548307057 S Bi:4:003:1 -115 4096 <
ffff88b97e752a80 1548309037 C Bi:4:003:1 0 486 = 5b5d6c01 d6010001 bee91100 0701cb0d 00006d80 008502fe 0300f117 fbfcf808
ffff88b97e752a80 1548309057 S Bi:4:003:1 -115 4096 <
ffff88b97e752f00 1548310916 C Bi:4:003:1 0 479 = 5b5d6d01 d7010001 bfc20000 0c01cc0d 0000615b 02fd04f5 0aff00fd 02ff02fc
ffff88b97e752f00 1548310927 S Bi:4:003:1 -115 4096 <
ffff88b97e7520c0 1548312906 C Bi:4:003:1 0 485 = 5b5d6e01 d7010001 cd9c0100 0c01cc0d 00006080 00c41c0b 200d220f 0613fae8
ffff88b97e7520c0 1548312917 S Bi:4:003:1 -115 4096 <
ffff88b97e752840 1548315665 C Bi:4:003:1 0 2471 = 5b5d6f09 9f020201 015c083d 00001012 02061013 02011011 03061014 43011015
ffff88b97e752840 1548315676 S Bi:4:003:1 -115 4096 <
ffff88b97e752a80 1548317054 C Bi:4:003:1 0 478 = 5b5d7001 d6010001 ce911000 0701cb8d 00006a65 07fa02ff fe03fb04 01fe0002
ffff88b97e752a80 1548317073 S Bi:4:003:1 -115 4096 <
ffff88b97e752f00 1548320046 C Bi:4:003:1 0 486 = 5b5d7101 d6010001 e9c01100 0701cb8d 00006e80 0087fefe 0202f115 f902f609
ffff88b97e752f00 1548320066 S Bi:4:003:1 -115 4096 <
ffff88b97e7520c0 1548322416 C Bi:4:003:1 0 479 = 5b5d7201 d7010001 ea990000 0c01cc8d 00005e59 fe01ff00 06fcfffe 02fc04ff
ffff88b97e7520c0 1548322427 S Bi:4:003:1 -115 4096 <
ffff88b97e752840 1548326039 C Bi:4:003:1 0 485 = 5b5d7301 d7010001 fa690100 0c01cc8d 00005d80 00be1a11 1a112212 0710f9ee
ffff88b97e752840 1548326050 S Bi:4:003:1 -115 4096 <
ffff88b97e752a80 1548328544 C Bi:4:003:1 0 478 = 5b5d7401 d6010001 fb5e1000 0701cb0d 00006f69 01fb0600 0300f905 fbfe0301
ffff88b97e752a80 1548328562 S Bi:4:003:1 -115 4096 <
ffff88b97e752f00 1548330547 C Bi:4:003:1 0 486 = 5b5d7501 d6010001 127f1100 0701cb0d 00006f80 008c00fe 0002ef17 f902f507
ffff88b97e752f00 1548330567 S Bi:4:003:1 -115 4096 <
ffff88b97e7520c0 1548332298 C Bi:4:003:1 0 479 = 5b5d7601 d7010001 13580000 0c01cc0d 0000605c 02fffeff 08fa02fc 03fd02fe
ffff88b97e7520c0 1548332309 S Bi:4:003:1 -115 4096 <
ffff88b97e752840 1548334414 C Bi:4:003:1 0 485 = 5b5d7701 d7010001 21310100 0c01cc0d 00005f80 00c4180f 1d0f2211 0611faf0
ffff88b97e752840 1548334425 S Bi:4:003:1 -115 4096 <
ffff88b97e752a80 1548336166 C Bi:4:003:1 0 478 = 5b5d7801 d6010001 22251000 0701cb0d 00006b6b feff0001 fb0afafd 01fffe01
ffff88b97e752a80 1548336185 S Bi:4:003:1 -115 4096 <
ffff88b97e752f00 1548338165 C Bi:4:003:1 0 486 = 5b5d7901 d6010001 301c1100 0701cb0d 00006e80 00840400 fc00f419 fbfff606
ffff88b97e752f00 1548338184 S Bi:4:003:1 -115 4096 <
ffff88b97e7520c0 1548339923 C Bi:4:003:1 0 479 = 5b5d7a01 d7010001 30f40000 0c01cc0d 00005f5d fefd02fe 06fe01f9 04fd05fd
ffff88b97e7520c0 1548339934 S Bi:4:003:1 -115 4096 <
ffff88b97e752840 1548342041 C Bi:4:003:1 0 485 = 5b5d7b01 d7010001 3ecd0100 0c01cc0d 00006280 00c21618 1412260f 0514f7f0
ffff88b97e752840 1548342052 S Bi:4:003:1 -115 4096 <
ffff88b97e752a80 1548343793 C Bi:4:003:1 0 478 = 5b5d7c01 d6010001 3fc11000 0701cb0d 00006b69 fffd0000 0206f905 fefdff01
ffff88b97e752a80 1548343812 S Bi:4:003:1 -115 4096 <
ffff88b97e752f00 1548345791 C Bi:4:003:1 0 486 = 5b5d7d01 d6010001 4db41100 0701cb0d 00006d80 008300fa 08fff017 f904f50b
ffff88b97e752f00 1548345804 S Bi:4:003:1 -115 4096 <
ffff88b97e7520c0 1548347541 C Bi:4:003:1 0 479 = 5b5d7e01 d7010001 4e8c0000 0c01cc0d 0000605c ffff04fb 06fd01fd 02fe0200
ffff88b97e7520c0 1548347552 S Bi:4:003:1 -115 4096 <
ffff88b97e752840 1548349557 C Bi:4:003:1 0 485 = 5b5d7f01 d7010001 5c650100 0c01cc0d 00005d80 00be1b13 180d2510 0711fcee
ffff88b97e752840 1548349568 S Bi:4:003:1 -115 4096 <
ffff88b97e752a80 1548351282 C Bi:4:003:1 0 478 = 5b5d8001 d6010001 5d591000 0701cb0d 00006b67 02fb05fe fb0af301 08fc0300
ffff88b97e752a80 1548351301 S Bi:4:003:1 -115 4096 <
ffff88b97e752f00 1548353302 C Bi:4:003:1 0 484 = 5b5d8101 d6010001 6b501100 0701cb0d 0000707e 06fc0103 ef15fc01 f60dff01
ffff88b97e752f00 1548353315 S Bi:4:003:1 -115 4096 <
ffff88b97e7520c0 1548355164 C Bi:4:003:1 0 479 = 5b5d8201 d7010001 6c290000 0c01cc0d 0000615c 00fe0200 02fc03fd fe0202fe
ffff88b97e7520c0 1548355175 S Bi:4:003:1 -115 4096 <
ffff88b97e752840 1548357163 C Bi:4:003:1 0 485 = 5b5d8301 d7010001 7a000100 0c01cc0d 00005d80 00c41811 1c0c260c 0515faec
ffff88b97e752840 1548357174 S Bi:4:003:1 -115 4096 <
ffff88b97e752a80 1548358929 C Bi:4:003:1 0 478 = 5b5d8401 d6010001 7af51000 0701cb0d 00006b68 02fbfd07 fa0cf404 02fdfffe
ffff88b97e752a80 1548358949 S Bi:4:003:1 -115 4096 <
ffff88b97e752f00 1548360908 C Bi:4:003:1 0 484 = 5b5d8501 d6010001 88e71100 0701cb0d 00006f7d 03fe0401 ef10fd02 f30c0202
ffff88b97e752f00 1548360928 S Bi:4:003:1 -115 4096 <
ffff88b97e7520c0 1548362790 C Bi:4:003:1 0 479 = 5b5d8601 d7010001 89c00000 0c01cc0d 00005f5c feff02fc 06fe05f7 05fb07f9
ffff88b97e7520c0 1548362802 S Bi:4:003:1 -115 4096 <
ffff88b97e752840 1548364795 C Bi:4:003:1 0 485 = 5b5d8701 d7010001 97970100 0c01cc0d 00005f80 00c31317 1810260f 0610fceb
ffff88b97e752840 1548364806 S Bi:4:003:1 -115 4096 <
ffff88b97e752a80 1548366543 C Bi:4:003:1 0 478 = 5b5d8801 d6010001 988c1000 0701cb0d 00006e6d fdfd0301 fd08f506 fdf90800
ffff88b97e752a80 1548366561 S Bi:4:003:1 -115 4096 <
ffff88b97e752f00 1548368542 C Bi:4:003:1 0 484 = 5b5d8901 d6010001 a6831100 0701cb0d 00006d7d 03ff03fc ef17f8fe fb080100
ffff88b97e752f00 1548368555 S Bi:4:003:1 -115 4096 <
ffff88b97e7520c0 1548370298 C Bi:4:003:1 0 479 = 5b5d8a01 d7010001 a75b0000 0c01cc0d 00005e58 010001fd 04fe02fc 01ff01fd
ffff88b97e7520c0 1548370309 S Bi:4:003:1 -115 4096 <
ffff88b97e752840 1548372415 C Bi:4:003:1 0 485 = 5b5d8b01 d7010001 b5330100 0c01cc0d 00005f80 00c71312 1c0e2609 0b13f7ef
ffff88b97e752840 1548372426 S Bi:4:003:1 -115 4096 <
ffff88b97e752a80 1548374165 C Bi:4:003:1 0 478 = 5b5d8c01 d6010001 b6281000 0701cb0d 00006d6a 06f604ff fa0bf20c fdfc05fe
ffff88b97e752a80 1548374185 S Bi:4:003:1 -115 4096 <
ffff88b97e752f00 1548376165 C Bi:4:003:1 0 484 = 5b5d8d01 d6010001 c41a1100 0701cb0d 00006a7b fffa0302 f014fe03 f20902fd
ffff88b97e752f00 1548376178 S Bi:4:003:1 -115 4096 <
ffff88b97e7520c0 1548377918 C Bi:4:003:1 0 479 = 5b5d8e01 d7010001 c4f20000 0c01cc0d 0000605d 00ff00fb 09fc00fc 020004fd
ffff88b97e7520c0 1548377929 S Bi:4:003:1 -115 4096 <
ffff88b97e752840 1548380043 C Bi:4:003:1 0 487 = 5b5d8f01 d7010001 d2ca0100 0c01cc0d 00005d80 00bc1c11 1c0f2411 0414faec
ffff88b97e752840 1548380054 S Bi:4:003:1 -115 4096 <
ffff88b97e752a80 1548381792 C Bi:4:003:1 0 478 = 5b5d9001 d6010001 d3bf1000 0701cb0d 00006f6c 01fd00ff 0201fa01 0201fe06
ffff88b97e752a80 1548381811 S Bi:4:003:1 -115 4096 <
ffff88b97e752f00 1548383787 C Bi:4:003:1 0 484 = 5b5d9101 d6010001 e1b71100 0701cb0d 00006c77 09f507ff ee17f706 f50a00fd
ffff88b97e752f00 1548383807 S Bi:4:003:1 -115 4096 <
ffff88b97e7520c0 1548385540 C Bi:4:003:1 0 479 = 5b5d9201 d7010001 e28f0000 0c01cc0d 00005d5a fe0100fe 06fb02fb 06fc04fa
ffff88b97e7520c0 1548385569 S Bi:4:003:1 -115 4096 <
ffff88b97e752840 1548387556 C Bi:4:003:1 0 485 = 5b5d9301 d7010001 f0670100 0c01cc0d 00005b80 00c1180c 1b172409 0814fceb
ffff88b97e752840 1548387567 S Bi:4:003:1 -115 4096 <
ffff88b97e752a80 1548389282 C Bi:4:003:1 0 478 = 5b5d9401 d6010001 f15c1000 0701cb0d 00006d66 03feff03 fc08fa03 ff02fffd
ffff88b97e752a80 1548389300 S Bi:4:003:1 -115 4096 <
ffff88b97e752f00 1548391418 C Bi:4:003:1 0 486 = 5b5d9501 d6010001 ff4c1100 0701cb0d 00006d80 0080fbfe ff02f21a f8fdf60a
ffff88b97e752f00 1548391439 S Bi:4:003:1 -115 4096 <
ffff88b97e7520c0 1548393169 C Bi:4:003:1 0 479 = 5b5d9601 d7010001 00260000 0c01cc0d 0000615b 04fdfffe 03fe0000 00000001
ffff88b97e7520c0 1548393180 S Bi:4:003:1 -115 4096 <
ffff88b97e752840 1548395168 C Bi:4:003:1 0 487 = 5b5d9701 d7010001 0dff0100 0c01cc0d 00005d80 00c0190c 1f0d270c 0814fbef
ffff88b97e752840 1548395179 S Bi:4:003:1 -115 4096 <
ffff88b97e752a80 1548396920 C Bi:4:003:1 0 478 = 5b5d9801 d6010001 0ef41000 0701cb0d 00006d6e fdfe02fd 0003f9ff 0afd00ff
ffff88b97e752a80 1548396939 S Bi:4:003:1 -115 4096 <
ffff88b97e752f00 1548398908 C Bi:4:003:1 0 486 = 5b5d9901 d6010001 1ceb1100 0701cb0d 00006f80 009902ef fafcf115 f403f805
ffff88b97e752f00 1548398921 S Bi:4:003:1 -115 4096 <
ffff88b97e7520c0 1548400786 C Bi:4:003:1 0 479 = 5b5d9a01 d7010001 1dc40000 0c01cc0d 00005f5b fd0103fa 06fc03fb 030003fc
ffff88b97e7520c0 1548400798 S Bi:4:003:1 -115 4096 <
ffff88b97e752840 1548402797 C Bi:4:003:1 0 485 = 5b5d9b01 d7010001 2b9d0100 0c01cc0d 00005e80 00be1a14 1812250e 0413fced
ffff88b97e752840 1548402808 S Bi:4:003:1 -115 4096 <
ffff88b97e752a80 1548404541 C Bi:4:003:1 0 478 = 5b5d9c01 d6010001 2c911000 0701cb0d 00006e6b ffff02ff fe05f904 02fc0302
ffff88b97e752a80 1548404560 S Bi:4:003:1 -115 4096 <
ffff88b97e752f00 1548406546 C Bi:4:003:1 0 486 = 5b5d9d01 d6010001 3a821100 0701cb0d 00006780 00b3fee5 ecfaec11 f900f60b
ffff88b97e752f00 1548406565 S Bi:4:003:1 -115 4096 <
ffff88b97e7520c0 1548408299 C Bi:4:003:1 0 479 = 5b5d9e01 d7010001 3b5a0000 0c01cc0d 0000605c fdfe03fd 06fefffc 05fc02fe
ffff88b97e7520c0 1548408311 S Bi:4:003:1 -115 4096 <
ffff88b97e752840 1548410416 C Bi:4:003:1 0 485 = 5b5d9f01 d7010001 49350100 0c01cc0d 00006180 00c61317 1c0a250f 0516f3ef
ffff88b97e752840 1548410427 S Bi:4:003:1 -115 4096 <
ffff88b97e752a80 1548412165 C Bi:4:003:1 0 478 = 5b5da001 d6010001 4a291000 0701cb0d 00006e6a 04fd01ff fe05f40a 010001fe
ffff88b97e752a80 1548412185 S Bi:4:003:1 -115 4096 <
ffff88b97e752f00 1548414165 C Bi:4:003:1 0 486 = 5b5da101 d6010001 58201100 0701cb0d 00006e80 00dafddf e3eded12 f204f809
ffff88b97e752f00 1548414185 S Bi:4:003:1 -115 4096 <
ffff88b97e7520c0 1548415908 C Bi:4:003:1 0 479 = 5b5da201 d7010001 58f80000 0c01cc0d 00005d5a ffff00fc 07ff00fc 02fe03fc
ffff88b97e7520c0 1548415919 S Bi:4:003:1 -115 4096 <
ffff88b97e752840 1548418026 C Bi:4:003:1 0 485 = 5b5da301 d7010001 66d10100 0c01cc0d 00005f80 00c4101d 14102512 0115faea
ffff88b97e752840 1548418037 S Bi:4:003:1 -115 4096 <
ffff88b97e752a80 1548419794 C Bi:4:003:1 0 478 = 5b5da401 d6010001 67c51000 0701cb0d 00006e70 f6fe0601 ff09f700 00f907fe
ffff88b97e752a80 1548419806 S Bi:4:003:1 -115 4096 <
ffff88b97e752f00 1548421792 C Bi:4:003:1 0 486 = 5b5da501 d6010001 75b61100 0701cb0d 00006a80 00effadb dbebec0b f606ee0b
ffff88b97e752f00 1548421811 S Bi:4:003:1 -115 4096 <
ffff88b97e7520c0 1548423541 C Bi:4:003:1 0 479 = 5b5da601 d7010001 768f0000 0c01cc0d 00005f59 01ff01fd 06fc02fc 04ff00fd
ffff88b97e7520c0 1548423553 S Bi:4:003:1 -115 4096 <
ffff88b97e752840 1548425556 C Bi:4:003:1 0 485 = 5b5da701 d7010001 84630100 0c01cc0d 00005d80 00bc1817 190e290c 090ff7ef
ffff88b97e752840 1548425568 S Bi:4:003:1 -115 4096 <
ffff88b97e752a80 1548427294 C Bi:4:003:1 0 478 = 5b5da801 d6010001 85571000 0701cb0d 00006a6a fdfb05fd 000af8ff 01ff01fe
ffff88b97e752a80 1548427313 S Bi:4:003:1 -115 4096 <
ffff88b97e752f00 1548429298 C Bi:4:003:1 0 486 = 5b5da901 d6010001 934e1100 0701cb0d 00006e80 010602d5 cdeae50f fafcf706
ffff88b97e752f00 1548429317 S Bi:4:003:1 -115 4096 <
ffff88b97e7520c0 1548431166 C Bi:4:003:1 0 479 = 5b5daa01 d7010001 94260000 0c01cc0d 0000605e 00fc00fd 05fe03fc 02ff04fa
ffff88b97e7520c0 1548431177 S Bi:4:003:1 -115 4096 <
ffff88b97e752840 1548433159 C Bi:4:003:1 0 485 = 5b5dab01 d7010001 a1ff0100 0c01cc0d 00005e80 00c51410 1e0c2710 0213fcec
ffff88b97e752840 1548433170 S Bi:4:003:1 -115 4096 <
ffff88b97e752a80 1548434916 C Bi:4:003:1 0 478 = 5b5dac01 d6010001 a2f31000 0701cb0d 00006c6d fbfe0403 fa08f805 fc00fd04
ffff88b97e752a80 1548434935 S Bi:4:003:1 -115 4096 <
ffff88b97e752f00 1548436908 C Bi:4:003:1 0 486 = 5b5dad01 d6010001 b0ea1100 0701cb0d 00006a80 011006dd cfd9e00d f1fff60b
ffff88b97e752f00 1548436927 S Bi:4:003:1 -115 4096 <
ffff88b97e7520c0 1548438793 C Bi:4:003:1 0 479 = 5b5dae01 d7010001 b1c30000 0c01cc0d 0000615c 02fc00fe 04ff02f7 06fe04fc
ffff88b97e7520c0 1548438804 S Bi:4:003:1 -115 4096 <
ffff88b97e752840 1548440795 C Bi:4:003:1 0 485 = 5b5daf01 d7010001 bf950100 0c01cc0d 00005f80 00c41910 1a0c2a09 0814fae8
ffff88b97e752840 1548440806 S Bi:4:003:1 -115 4096 <
ffff88b97e752a80 1548442540 C Bi:4:003:1 0 478 = 5b5db001 d6010001 c08a1000 0701cb0d 00006c6c fbff0000 fd09f905 fffdfc01
ffff88b97e752a80 1548442558 S Bi:4:003:1 -115 4096 <
ffff88b97e752f00 1548444544 C Bi:4:003:1 0 486 = 5b5db101 d6010001 ce801100 0701cb0d 00006c80 01250cdd ced3dd05 ebfff606
ffff88b97e752f00 1548444564 S Bi:4:003:1 -115 4096 <
ffff88b97e7520c0 1548446300 C Bi:4:003:1 0 479 = 5b5db201 d7010001 cf590000 0c01cc0d 0000615f fefe03fa 07fe00fd 010003ff
ffff88b97e7520c0 1548446311 S Bi:4:003:1 -115 4096 <
ffff88b97e752840 1548448416 C Bi:4:003:1 0 485 = 5b5db301 d7010001 dd320100 0c01cc0d 00005c80 00c21514 1812270c 0213faed
ffff88b97e752840 1548448427 S Bi:4:003:1 -115 4096 <
ffff88b97e752a80 1548450168 C Bi:4:003:1 0 478 = 5b5db401 d6010001 de261000 0701cb0d 00006c69 00fffb02 0005fefe 0300fdfd
ffff88b97e752a80 1548450180 S Bi:4:003:1 -115 4096 <
ffff88b97e752f00 1548452166 C Bi:4:003:1 0 486 = 5b5db501 d6010001 ec1d1100 0701cb0d 00007080 013d08e8 d8ceceff e9f5f60a
ffff88b97e752f00 1548452186 S Bi:4:003:1 -115 4096 <
ffff88b97e7520c0 1548453933 C Bi:4:003:1 0 479 = 5b5db601 d7010001 ecf50000 0c01cc0d 0000605b 02feffff 05fd03fd 00fe01fe
ffff88b97e7520c0 1548453945 S Bi:4:003:1 -115 4096 <
ffff88b97e752840 1548456041 C Bi:4:003:1 0 485 = 5b5db701 d7010001 fac80100 0c01cc0d 00005f80 00c31711 1e0c2312 0713f7f0
ffff88b97e752840 1548456052 S Bi:4:003:1 -115 4096 <
ffff88b97e752a80 1548457794 C Bi:4:003:1 0 478 = 5b5db801 d6010001 fbbd1000 0701cb0d 00006963 000103fd fb0af807 fefffd02
ffff88b97e752a80 1548457813 S Bi:4:003:1 -115 4096 <
ffff88b97e752f00 1548459790 C Bi:4:003:1 0 486 = 5b5db901 d6010001 09b51100 0701cb0d 00006e80 014114e9 e1d6c3ee edf2f009
ffff88b97e752f00 1548459809 S Bi:4:003:1 -115 4096 <
ffff88b97e7520c0 1548461540 C Bi:4:003:1 0 479 = 5b5dba01 d7010001 0a8e0000 0c01cc0d 0000615c 00ff03fb 07fb03fa ff0401fb
ffff88b97e7520c0 1548461551 S Bi:4:003:1 -115 4096 <
ffff88b97e752840 1548463557 C Bi:4:003:1 0 485 = 5b5dbb01 d7010001 18660100 0c01cc0d 00005b80 00bc1815 1a112113 0314faef
ffff88b97e752840 1548463568 S Bi:4:003:1 -115 4096 <
ffff88b97e752a80 1548465291 C Bi:4:003:1 0 478 = 5b5dbc01 d6010001 195b1000 0701cb0d 00006e68 05fa0100 0008f906 fdfef809
ffff88b97e752a80 1548465310 S Bi:4:003:1 -115 4096 <
ffff88b97e752f00 1548467306 C Bi:4:003:1 0 486 = 5b5dbd01 d6010001 27511100 0701cb0d 00006980 014712f0 f4dabff2 dceae506
ffff88b97e752f00 1548467326 S Bi:4:003:1 -115 4096 <
ffff88b97e7520c0 1548469165 C Bi:4:003:1 0 479 = 5b5dbe01 d7010001 282a0000 0c01cc0d 0000605f fcff04fa 06fd02fb 020003fd
ffff88b97e7520c0 1548469176 S Bi:4:003:1 -115 4096 <
ffff88b97e752840 1548471159 C Bi:4:003:1 0 485 = 5b5dbf01 d7010001 35fd0100 0c01cc0d 00006080 00c41516 1c0f230c 0614faed
ffff88b97e752840 1548471170 S Bi:4:003:1 -115 4096 <
ffff88b97e752a80 1548472916 C Bi:4:003:1 0 478 = 5b5dc001 d6010001 36f11000 0701cb0d 00006d66 06fc01fd fb0ff405 01fffefe
ffff88b97e752a80 1548472935 S Bi:4:003:1 -115 4096 <
ffff88b97e752f00 1548474909 C Bi:4:003:1 0 486 = 5b5dc101 d6010001 44ea1100 0701cb0d 00006d80 014b1cf4 f8e4caf0 d8dce0fc
ffff88b97e752f00 1548474928 S Bi:4:003:1 -115 4096 <
ffff88b97e7520c0 1548476790 C Bi:4:003:1 0 479 = 5b5dc201 d7010001 45c20000 0c01cc0d 0000605a 03fc03fb 06fd04f8 07f903ff
ffff88b97e7520c0 1548476802 S Bi:4:003:1 -115 4096 <
ffff88b97e752840 1548478798 C Bi:4:003:1 0 485 = 5b5dc301 d7010001 539b0100 0c01cc0d 00005e80 00c01a12 16142310 0313feec
ffff88b97e752840 1548478809 S Bi:4:003:1 -115 4096 <
ffff88b97e752a80 1548480541 C Bi:4:003:1 0 478 = 5b5dc401 d6010001 54901000 0701cb0d 00006c6c fbfd0302 0009f102 02fd0202
ffff88b97e752a80 1548480553 S Bi:4:003:1 -115 4096 <
ffff88b97e752f00 1548482544 C Bi:4:003:1 0 486 = 5b5dc501 d6010001 62861100 0701cb0d 00006b80 014a1ef4 00e8d3ef ddd6daf4
ffff88b97e752f00 1548482564 S Bi:4:003:1 -115 4096 <
ffff88b97e7520c0 1548484291 C Bi:4:003:1 0 479 = 5b5dc601 d7010001 635f0000 0c01cc0d 00005f5f 00fa0300 04fb02fb 03fd0200
ffff88b97e7520c0 1548484302 S Bi:4:003:1 -115 4096 <
ffff88b97e752840 1548486415 C Bi:4:003:1 0 485 = 5b5dc701 d7010001 71310100 0c01cc0d 00006080 00c01b13 1710270e 080ff9f2
ffff88b97e752840 1548486426 S Bi:4:003:1 -115 4096 <
ffff88b97e752a80 1548488166 C Bi:4:003:1 0 478 = 5b5dc801 d6010001 72261000 0701cb0d 00006d69 04fdfe03 fc05f905 01fb02fe
ffff88b97e752a80 1548488185 S Bi:4:003:1 -115 4096 <
ffff88b97e752f00 1548490165 C Bi:4:003:1 0 486 = 5b5dc901 d6010001 801c1100 0701cb0d 00006880 014c19f9 fdf2d3f5 e4dfc9f1
ffff88b97e752f00 1548490184 S Bi:4:003:1 -115 4096 <
ffff88b97e7520c0 1548491916 C Bi:4:003:1 0 479 = 5b5dca01 d7010001 80f50000 0c01cc0d 0000615f fffb05fb 06fe03fb 01fb04ff
ffff88b97e7520c0 1548491927 S Bi:4:003:1 -115 4096 <
ffff88b97e752840 1548494042 C Bi:4:003:1 0 485 = 5b5dcb01 d7010001 8ece0100 0c01cc0d 00005e80 00c01a11 1b0d250f 0614fbea
ffff88b97e752840 1548494053 S Bi:4:003:1 -115 4096 <
ffff88b97e752a80 1548495791 C Bi:4:003:1 0 478 = 5b5dcc01 d6010001 8fc21000 0701cb0d 00006d6d fdfd0700 f706fa03 fe03fd02
ffff88b97e752a80 1548495810 S Bi:4:003:1 -115 4096 <
ffff88b97e752f00 1548497791 C Bi:4:003:1 0 486 = 5b5dcd01 d6010001 9db91100 0701cb0d 00006c80 01501af6 02f4d6fa eee2c6e6
ffff88b97e752f00 1548497810 S Bi:4:003:1 -115 4096 <
ffff88b97e7520c0 1548499541 C Bi:4:003:1 0 479 = 5b5dce01 d7010001 9e920000 0c01cc0d 00005f5e fdff02fb 0700fefc 02ff05fb
ffff88b97e7520c0 1548499552 S Bi:4:003:1 -115 4096 <
ffff88b97e752840 1548501558 C Bi:4:003:1 0 485 = 5b5dcf01 d7010001 ac640100 0c01cc0d 00005f80 00c61215 1b0b260f 0616f9ee
ffff88b97e752840 1548501569 S Bi:4:003:1 -115 4096 <
ffff88b97e752a80 1548503290 C Bi:4:003:1 0 478 = 5b5dd001 d6010001 ad581000 0701cb0d 00006d6b 02fc0300 fc04f802 01fe0301
ffff88b97e752a80 1548503309 S Bi:4:003:1 -115 4096 <
ffff88b97e752f00 1548505306 C Bi:4:003:1 0 486 = 5b5dd101 d6010001 bb4f1100 0701cb0d 00006d80 014c1ef8 05f7d8fb f3e3c6dc
ffff88b97e752f00 1548505326 S Bi:4:003:1 -115 4096 <
ffff88b97e7520c0 1548507166 C Bi:4:003:1 0 479 = 5b5dd201 d7010001 bc280000 0c01cc0d 0000605e fffd01fb 06fe03f9 030104fb
ffff88b97e7520c0 1548507178 S Bi:4:003:1 -115 4096 <
ffff88b97e752840 1548509159 C Bi:4:003:1 0 485 = 5b5dd301 d7010001 ca020100 0c01cc0d 00006080 00c11b12 1714220f 0512f9ee
ffff88b97e752840 1548509170 S Bi:4:003:1 -115 4096 <
ffff88b97e752a80 1548510924 C Bi:4:003:1 0 478 = 5b5dd401 d6010001 caf71000 0701cb0d 00006c67 04fdffff 0300f905 00fe05fd
ffff88b97e752a80 1548510942 S Bi:4:003:1 -115 4096 <
ffff88b97e752f00 1548512909 C Bi:4:003:1 0 486 = 5b5dd501 d6010001 d8ed1100 0701cb0d 00006d80 014e20fb 00f4e2fc fbe4c7d7
ffff88b97e752f00 1548512929 S Bi:4:003:1 -115 4096 <
ffff88b97e7520c0 1548514790 C Bi:4:003:1 0 479 = 5b5dd601 d7010001 d9c60000 0c01cc0d 00005e5e fcfd02fd 09fcfefd 02fe04fb
ffff88b97e7520c0 1548514801 S Bi:4:003:1 -115 4096 <
ffff88b97e752840 1548516796 C Bi:4:003:1 0 485 = 5b5dd701 d7010001 e7980100 0c01cc0d 00005e80 00c51418 190a2a0b 0316faed
ffff88b97e752840 1548516807 S Bi:4:003:1 -115 4096 <
ffff88b97e752a80 1548518542 C Bi:4:003:1 0 478 = 5b5dd801 d6010001 e88d1000 0701cb0d 00006b6b fefa0301 fd0bf706 fcfeff02
ffff88b97e752a80 1548518561 S Bi:4:003:1 -115 4096 <
ffff88b97e752f00 1548520547 C Bi:4:003:1 0 486 = 5b5dd901 d6010001 f6831100 0701cb0d 00006a80 014c1dfd fff7da06 fbebcfd6
ffff88b97e752f00 1548520566 S Bi:4:003:1 -115 4096 <
ffff88b97e7520c0 1548522301 C Bi:4:003:1 0 479 = 5b5dda01 d7010001 f75c0000 0c01cc0d 0000605a ff02fe00 05fb03fb 030101ff
ffff88b97e7520c0 1548522312 S Bi:4:003:1 -115 4096 <
ffff88b97e752840 1548524416 C Bi:4:003:1 0 487 = 5b5ddb01 d7010001 05360100 0c01cc0d 00005e80 00c5160d 1d0f250f 0515f6ef
ffff88b97e752840 1548524427 S Bi:4:003:1 -115 4096 <
ffff88b97e752a80 1548526165 C Bi:4:003:1 0 478 = 5b5ddc01 d6010001 062b1000 0701cb0d 00006b67 04fffd00 fd08f706 fdfd0204
ffff88b97e752a80 1548526177 S Bi:4:003:1 -115 4096 <
ffff88b97e752f00 1548528168 C Bi:4:003:1 0 486 = 5b5ddd01 d6010001 14231100 0701cb0d 00006f80 01531bfb 00fae102 faf0c9e0
ffff88b97e752f00 1548528187 S Bi:4:003:1 -115 4096 <
ffff88b97e7520c0 1548529931 C Bi:4:003:1 0 479 = 5b5dde01 d7010001 14fb0000 0c01cc0d 00005f58 03fd0200 05fb02fc 02ff02ff
ffff88b97e7520c0 1548529942 S Bi:4:003:1 -115 4096 <
ffff88b97e752840 1548532042 C Bi:4:003:1 0 485 = 5b5ddf01 d7010001 22ce0100 0c01cc0d 00006080 00c61219 190a260e 0615faec
ffff88b97e752840 1548532053 S Bi:4:003:1 -115 4096 <
ffff88b97e752a80 1548533792 C Bi:4:003:1 0 478 = 5b5de001 d6010001 23c21000 0701cb0d 00006e68 0100fd01 fe05fd02 ffff02fe
ffff88b97e752a80 1548533811 S Bi:4:003:1 -115 4096 <
ffff88b97e752f00 1548535791 C Bi:4:003:1 0 486 = 5b5de101 d6010001 31b91100 0701cb0d 00006a80 014e19fa 06f6dd09 fff1d2dc
ffff88b97e752f00 1548535811 S Bi:4:003:1 -115 4096 <
ffff88b97e7520c0 1548537541 C Bi:4:003:1 0 479 = 5b5de201 d7010001 32920000 0c01cc0d 0000625d fd02feff 04ff04f9 02fd05fe
ffff88b97e7520c0 1548537552 S Bi:4:003:1 -115 4096 <
ffff88b97e752840 1548539556 C Bi:4:003:1 0 485 = 5b5de301 d7010001 406c0100 0c01cc0d 00006180 00c3131b 180e240f 0513f8f0
ffff88b97e752840 1548539567 S Bi:4:003:1 -115 4096 <
ffff88b97e752a80 1548541286 C Bi:4:003:1 0 478 = 5b5de401 d6010001 41611000 0701cb0d 00006d6d fffd0102 fc06f902 fe000002
ffff88b97e752a80 1548541305 S Bi:4:003:1 -115 4096 <
ffff88b97e752f00 1548543304 C Bi:4:003:1 0 486 = 5b5de501 d6010001 4f571100 0701cb0d 00006b80 014f1cf9 02fadd04 fef7d3e1
ffff88b97e752f00 1548543323 S Bi:4:003:1 -115 4096 <
ffff88b97e7520c0 1548545189 C Bi:4:003:1 0 479 = 5b5de601 d7010001 50300000 0c01cc0d 00005c5a fffe02fd 05fcfe03 feff0101
ffff88b97e7520c0 1548545200 S Bi:4:003:1 -115 4096 <
ffff88b97e752840 1548547159 C Bi:4:003:1 0 485 = 5b5de701 d7010001 5e020100 0c01cc0d 00005d80 00c21618 180e1d13 0714f9ed
ffff88b97e752840 1548547184 S Bi:4:003:1 -115 4096 <
ffff88b97e752a80 1548548918 C Bi:4:003:1 0 478 = 5b5de801 d6010001 5ef71000 0701cb0d 00006d6d fff801ff 0403fd03 fe0000fe
ffff88b97e752a80 1548548937 S Bi:4:003:1 -115 4096 <
ffff88b97e752f00 1548550926 C Bi:4:003:1 0 486 = 5b5de901 d6010001 6ce71100 0701cb0d 00006a80 014a23fa 02fadfff 03f2cee1
ffff88b97e752f00 1548550938 S Bi:4:003:1 -115 4096 <
ffff88b97e7520c0 1548552793 C Bi:4:003:1 0 479 = 5b5dea01 d7010001 6dc00000 0c01cc0d 0000615c 00fd01fe 07fc01fd 02fd0100
ffff88b97e7520c0 1548552804 S Bi:4:003:1 -115 4096 <
ffff88b97e752840 1548554793 C Bi:4:003:1 0 485 = 5b5deb01 d7010001 7b980100 0c01cc0d 00006080 00c3170f 1b132110 0711fbe8
ffff88b97e752840 1548554805 S Bi:4:003:1 -115 4096 <
ffff88b97e752a80 1548556545 C Bi:4:003:1 0 478 = 5b5dec01 d6010001 7c8d1000 0701cb0d 00006a67 0001ffff ff04f608 fffe03fc
ffff88b97e752a80 1548556564 S Bi:4:003:1 -115 4096 <
ffff88b97e752f00 1548558542 C Bi:4:003:1 0 486 = 5b5ded01 d6010001 8a851100 0701cb0d 00006d80 014f1bfc 04f5e305 fef2d2df
ffff88b97e752f00 1548558561 S Bi:4:003:1 -115 4096 <
ffff88b97e7520c0 1548560292 C Bi:4:003:1 0 479 = 5b5dee01 d7010001 8b5e0000 0c01cc0d 0000615d 02fc04f8 060000fa 03fe04fc
ffff88b97e7520c0 1548560303 S Bi:4:003:1 -115 4096 <
ffff88b97e752840 1548562416 C Bi:4:003:1 0 487 = 5b5def01 d7010001 99360100 0c01cc0d 00005e80 00c11b0e 1d0f260e 0711f9ed
ffff88b97e752840 1548562427 S Bi:4:003:1 -115 4096 <
ffff88b97e752a80 1548564167 C Bi:4:003:1 0 478 = 5b5df001 d6010001 9a2b1000 0701cb0d 00006e67 05fe04fb ff05fa02 00fdff07
ffff88b97e752a80 1548564186 S Bi:4:003:1 -115 4096 <
ffff88b97e752f00 1548566166 C Bi:4:003:1 0 486 = 5b5df101 d6010001 a81c1100 0701cb0d 00006f80 015518fc 03f8e104 fdf2cee1
ffff88b97e752f00 1548566185 S Bi:4:003:1 -115 4096 <
ffff88b97e7520c0 1548567932 C Bi:4:003:1 0 479 = 5b5df201 d7010001 a8f50000 0c01cc0d 00005f5b 000004fa 08fafcff 05fd03ff
ffff88b97e7520c0 1548567943 S Bi:4:003:1 -115 4096 <
ffff88b97e752840 1548570042 C Bi:4:003:1 0 485 = 5b5df301 d7010001 b6ce0100 0c01cc0d 00006080 00c31712 1e0a250e 0418faea
ffff88b97e752840 1548570053 S Bi:4:003:1 -115 4096 <
ffff88b97e752a80 1548571791 C Bi:4:003:1 0 478 = 5b5df401 d6010001 b7c21000 0701cb0d 00006e6f 00fb0002 fe05fa00 01fd0100
ffff88b97e752a80 1548571811 S Bi:4:003:1 -115 4096 <
ffff88b97e752f00 1548573793 C Bi:4:003:1 0 486 = 5b5df501 d6010001 c5ba1100 0701cb0d 00006980 014e1bf9 01f8e1fd 06efcbda
ffff88b97e752f00 1548573812 S Bi:4:003:1 -115 4096 <
ffff88b97e7520c0 1548575542 C Bi:4:003:1 0 479 = 5b5df601 d7010001 c6930000 0c01cc0d 0000605d fffffe00 04fe01fb 01010201
ffff88b97e7520c0 1548575553 S Bi:4:003:1 -115 4096 <
ffff88b97e752840 1548577558 C Bi:4:003:1 0 487 = 5b5df701 d7010001 d46c0100 0c01cc0d 00006080 00c21813 1c0f220f 0217fbee
ffff88b97e752840 1548577569 S Bi:4:003:1 -115 4096 <
ffff88b97e752a80 1548579291 C Bi:4:003:1 0 478 = 5b5df801 d6010001 d5601000 0701cb0d 00006a66 05fbff00 fe07f506 00ff0102
ffff88b97e752a80 1548579309 S Bi:4:003:1 -115 4096 <
ffff88b97e752f00 1548581304 C Bi:4:003:1 0 486 = 5b5df901 d6010001 e3521100 0701cb0d 00006a80 014c1efa 02f8e1fa 02f1cdd9
ffff88b97e752f00 1548581324 S Bi:4:003:1 -115 4096 <
ffff88b97e7520c0 1548583168 C Bi:4:003:1 0 479 = 5b5dfa01 d7010001 e42a0000 0c01cc0d 0000605b 0000fffd 06fa04fd 00fc06ff
ffff88b97e7520c0 1548583179 S Bi:4:003:1 -115 4096 <
ffff88b97e752840 1548585159 C Bi:4:003:1 0 485 = 5b5dfb01 d7010001 f2030100 0c01cc0d 00005d80 00c11512 1b10260f 0313fcec
ffff88b97e752840 1548585170 S Bi:4:003:1 -115 4096 <
ffff88b97e752a80 1548586924 C Bi:4:003:1 0 478 = 5b5dfc01 d6010001 f2f71000 0701cb0d 00006d69 02fa0303 fb09f606 fefe00fe
ffff88b97e752a80 1548586943 S Bi:4:003:1 -115 4096 <
ffff88b97e752f00 1548588909 C Bi:4:003:1 0 486 = 5b5dfd01 d6010001 00f01100 0701cb0d 00007180 014e20fa 04f7dc06 f7efcad8
ffff88b97e752f00 1548588929 S Bi:4:003:1 -115 4096 <
ffff88b97e7520c0 1548590791 C Bi:4:003:1 0 479 = 5b5dfe01 d7010001 01c90000 0c01cc0d 0000615c ff01ff01 04fb00fb 060003fb
ffff88b97e7520c0 1548590802 S Bi:4:003:1 -115 4096 <
ffff88b97e752840 1548592799 C Bi:4:003:1 0 485 = 5b5dff01 d7010001 0fa10100 0c01cc0d 00005f80 00c21a11 1a0a2a0d 0713fbed
ffff88b97e752840 1548592810 S Bi:4:003:1 -115 4096 <
ffff88b97e752a80 1548594542 C Bi:4:003:1 0 478 = 5b5d0001 d6010001 10961000 0701cb0d 00006f6a fffc0300 fb04ff04 0101ff00
ffff88b97e752a80 1548594560 S Bi:4:003:1 -115 4096 <
ffff88b97e752f00 1548596548 C Bi:4:003:1 0 486 = 5b5d0101 d6010001 1e861100 0701cb0d 00006980 014d19fe 02f5dc02 f7f3c7dc
ffff88b97e752f00 1548596568 S Bi:4:003:1 -115 4096 <
ffff88b97e7520c0 1548598301 C Bi:4:003:1 0 479 = 5b5d0201 d7010001 1f5f0000 0c01cc0d 0000625d 01fd02fd 06fa01ff 01fe02fd
ffff88b97e7520c0 1548598312 S Bi:4:003:1 -115 4096 <
ffff88b97e752840 1548600417 C Bi:4:003:1 0 485 = 5b5d0301 d7010001 2d370100 0c01cc0d 00005c80 00bd1a0f 1e0c270d 0715faed
ffff88b97e752840 1548600428 S Bi:4:003:1 -115 4096 <
ffff88b97e752a80 1548602170 C Bi:4:003:1 0 478 = 5b5d0401 d6010001 2e2c1000 0701cb0d 00006c6d 00fa05fc fc07fafc 07ff0100
ffff88b97e752a80 1548602189 S Bi:4:003:1 -115 4096 <
ffff88b97e752f00 1548604167 C Bi:4:003:1 0 486 = 5b5d0501 d6010001 3c221100 0701cb0d 00006c80 014e1df8 06f3dfff f7efc6dd
ffff88b97e752f00 1548604187 S Bi:4:003:1 -115 4096 <
ffff88b97e7520c0 1548605910 C Bi:4:003:1 0 479 = 5b5d0601 d7010001 3cfb0000 0c01cc0d 00005d57 0200fe00 0300fffb 0401fffe
ffff88b97e7520c0 1548605921 S Bi:4:003:1 -115 4096 <
ffff88b97e752840 1548608042 C Bi:4:003:1 0 485 = 5b5d0701 d7010001 4ad50100 0c01cc0d 00005e80 00c71114 1b0c2510 0416faed
ffff88b97e752840 1548608053 S Bi:4:003:1 -115 4096 <
ffff88b97e752a80 1548609791 C Bi:4:003:1 0 478 = 5b5d0801 d6010001 4bca1000 0701cb0d 00006a64 03fd0102 fb09f904 fe05f9fd
ffff88b97e752a80 1548609809 S Bi:4:003:1 -115 4096 <
ffff88b97e752f00 1548611796 C Bi:4:003:1 0 486 = 5b5d0901 d6010001 59ba1100 0701cb0d 00006f80 014f1cf9 05f6d9fd fcebc4e7
ffff88b97e752f00 1548611815 S Bi:4:003:1 -115 4096 <
ffff88b97e7520c0 1548613546 C Bi:4:003:1 0 479 = 5b5d0a01 d7010001 5a930000 0c01cc0d 0000605a 01fd03fe 05fb02fd fc0503fb
ffff88b97e7520c0 1548613557 S Bi:4:003:1 -115 4096 <
ffff88b97e752840 1548615557 C Bi:4:003:1 0 485 = 5b5d0b01 d7010001 686c0100 0c01cc0d 00005f80 00c31514 1a0b280d 0911faee
ffff88b97e752840 1548615567 S Bi:4:003:1 -115 4096 <
ffff88b97e752a80 1548617286 C Bi:4:003:1 0 478 = 5b5d0c01 d6010001 69601000 0701cb0d 00006b67 ffff0100 fd07fcff 0203fc00
ffff88b97e752a80 1548617305 S Bi:4:003:1 -115 4096 <
ffff88b97e752f00 1548619307 C Bi:4:003:1 0 486 = 5b5d0d01 d6010001 77571100 0701cb0d 00006e80 015416fa 00fad7fd f7e5cbdb
ffff88b97e752f00 1548619327 S Bi:4:003:1 -115 4096 <
ffff88b97e7520c0 1548621167 C Bi:4:003:1 0 479 = 5b5d0e01 d7010001 782f0000 0c01cc0d 0000635c 06f902fb 08fe03fb 02fe01ff
ffff88b97e7520c0 1548621179 S Bi:4:003:1 -115 4096 <
ffff88b97e752840 1548623161 C Bi:4:003:1 0 485 = 5b5d0f01 d7010001 860a0100 0c01cc0d 00005d80 00c01815 190d260f 060ffeeb
ffff88b97e752840 1548623172 S Bi:4:003:1 -115 4096 <
ffff88b97e752a80 1548624919 C Bi:4:003:1 0 478 = 5b5d1001 d6010001 86fe1000 0701cb0d 00006e6e fa000500 fa0ff102 01fa0201
ffff88b97e752a80 1548624937 S Bi:4:003:1 -115 4096 <
ffff88b97e752f00 1548626910 C Bi:4:003:1 0 486 = 5b5d1101 d6010001 94ee1100 0701cb0d 00006880 014821f6 00f5d7f8 ede8c2e7
ffff88b97e752f00 1548626930 S Bi:4:003:1 -115 4096 <
ffff88b97e7520c0 1548628793 C Bi:4:003:1 0 479 = 5b5d1201 d7010001 95c70000 0c01cc0d 0000605c 03fb00f8 0efcfdff 02fe04fe
ffff88b97e7520c0 1548628804 S Bi:4:003:1 -115 4096 <
ffff88b97e752840 1548630799 C Bi:4:003:1 0 485 = 5b5d1301 d7010001 a3a00100 0c01cc0d 00005e80 00c51113 1c0e240e 0813fde9
ffff88b97e752840 1548630810 S Bi:4:003:1 -115 4096 <
ffff88b97e752a80 1548632542 C Bi:4:003:1 0 478 = 5b5d1401 d6010001 a4941000 0701cb0d 00006b64 04ff0003 fc06f706 fffd05f9
ffff88b97e752a80 1548632561 S Bi:4:003:1 -115 4096 <
ffff88b97e752f00 1548634543 C Bi:4:003:1 0 486 = 5b5d1501 d6010001 b28b1100 0701cb0d 00006d80 014c20f9 fdf2d7f2 efe3c5e6
ffff88b97e752f00 1548634563 S Bi:4:003:1 -115 4096 <
ffff88b97e7520c0 1548636302 C Bi:4:003:1 0 479 = 5b5d1601 d7010001 b3630000 0c01cc0d 0000605d fc01ffff 05ff01fb 05fc03fd
ffff88b97e7520c0 1548636313 S Bi:4:003:1 -115 4096 <
ffff88b97e752840 1548638417 C Bi:4:003:1 0 485 = 5b5d1701 d7010001 c13e0100 0c01cc0d 00005b80 00c01712 18112111 0512ffe9
ffff88b97e752840 1548638428 S Bi:4:003:1 -115 4096 <
ffff88b97e752a80 1548640167 C Bi:4:003:1 0 478 = 5b5d1801 d6010001 c2321000 0701cb0d 00006b64 06f906fd fe08f502 03fe0202
ffff88b97e752a80 1548640180 S Bi:4:003:1 -115 4096 <
ffff88b97e752f00 1548642172 C Bi:4:003:1 0 486 = 5b5d1901 d6010001 d0231100 0701cb0d 00006b80 014f18f7 fff0d5f4 e5e1c8ef
ffff88b97e752f00 1548642190 S Bi:4:003:1 -115 4096 <
ffff88b97e7520c0 1548643932 C Bi:4:003:1 0 479 = 5b5d1a01 d7010001 d0fb0000 0c01cc0d 00006461 fffd04fc 06fa02fb 04ff01ff
ffff88b97e7520c0 1548643943 S Bi:4:003:1 -115 4096 <
ffff88b97e752840 1548646042 C Bi:4:003:1 0 485 = 5b5d1b01 d7010001 ded40100 0c01cc0d 00005e80 00c31514 1b10240e 060efbf0
ffff88b97e752840 1548646052 S Bi:4:003:1 -115 4096 <
ffff88b97e752a80 1548647796 C Bi:4:003:1 0 478 = 5b5d1c01 d6010001 dfc91000 0701cb0d 00006f71 fcfb0501 f80ef5ff 03fcff04
ffff88b97e752a80 1548647815 S Bi:4:003:1 -115 4096 <
ffff88b97e752f00 1548649794 C Bi:4:003:1 0 486 = 5b5d1d01 d6010001 edbf1100 0701cb0d 00006f80 015218fb f9eecff4 d9e1d2f0
ffff88b97e752f00 1548649813 S Bi:4:003:1 -115 4096 <
ffff88b97e7520c0 1548651541 C Bi:4:003:1 0 479 = 5b5d1e01 d7010001 ee980000 0c01cc0d 00005e58 03fdfe02 05fc00fc 020102fb
ffff88b97e7520c0 1548651552 S Bi:4:003:1 -115 4096 <
ffff88b97e752840 1548653669 C Bi:4:003:1 0 485 = 5b5d1f01 d7010001 fc710100 0c01cc0d 00005d80 00bd1a14 1a0f270f 0214fdea
ffff88b97e752840 1548653680 S Bi:4:003:1 -115 4096 <
ffff88b97e752a80 1548655293 C Bi:4:003:1 0 478 = 5b5d2001 d6010001 fd661000 0701cb0d 00006e6e 00fb0103 fe07f403 fe0103fa
ffff88b97e752a80 1548655312 S Bi:4:003:1 -115 4096 <
ffff88b97e752f00 1548657307 C Bi:4:003:1 0 486 = 5b5d2101 d6010001 0b581100 0701cb0d 00006d80 014a1af7 fde5ccef dbdbdcfa
ffff88b97e752f00 1548657326 S Bi:4:003:1 -115 4096 <
ffff88b97e7520c0 1548659168 C Bi:4:003:1 0 479 = 5b5d2201 d7010001 0c300000 0c01cc0d 00005f5a 02fd00fe 0601fcfd 03fd03fd
ffff88b97e7520c0 1548659179 S Bi:4:003:1 -115 4096 <
ffff88b97e752840 1548661166 C Bi:4:003:1 0 485 = 5b5d2301 d7010001 1a090100 0c01cc0d 00005e80 00c31215 1b0b2412 0414fce9
ffff88b97e752840 1548661177 S Bi:4:003:1 -115 4096 <
ffff88b97e752a80 1548662931 C Bi:4:003:1 0 478 = 5b5d2401 d6010001 1afe1000 0701cb0d 00006a68 01ff0000 ff04fafe 04ff0001
ffff88b97e752a80 1548662950 S Bi:4:003:1 -115 4096 <
ffff88b97e752f00 1548664911 C Bi:4:003:1 0 486 = 5b5d2501 d6010001 28f41100 0701cb0d 00006e80 014a1cf0 f9e2c8ea d9e5e3f8
ffff88b97e752f00 1548664930 S Bi:4:003:1 -115 4096 <
ffff88b97e7520c0 1548666793 C Bi:4:003:1 0 479 = 5b5d2601 d7010001 29cd0000 0c01cc0d 0000605a 00fe02ff 04fb04fa 02fe05fd
ffff88b97e7520c0 1548666804 S Bi:4:003:1 -115 4096 <
ffff88b97e752840 1548668800 C Bi:4:003:1 0 485 = 5b5d2701 d7010001 37a50100 0c01cc0d 00005e80 00bf1812 1e0a270e 0513faee
ffff88b97e752840 1548668811 S Bi:4:003:1 -115 4096 <
ffff88b97e752a80 1548670543 C Bi:4:003:1 0 478 = 5b5d2801 d6010001 389a1000 0701cb0d 00006c65 07fbfe04 ff07fa00 00feff01
ffff88b97e752a80 1548670562 S Bi:4:003:1 -115 4096 <
ffff88b97e752f00 1548672550 C Bi:4:003:1 0 486 = 5b5d2901 d6010001 468c1100 0701cb0d 00006e80 014b15ed f4dec3f1 d7e8e703
ffff88b97e752f00 1548672569 S Bi:4:003:1 -115 4096 <
ffff88b97e7520c0 1548674297 C Bi:4:003:1 0 479 = 5b5d2a01 d7010001 47650000 0c01cc0d 00005d5a 00fd00fe 05fe00fe 02fe03ff
ffff88b97e7520c0 1548674308 S Bi:4:003:1 -115 4096 <
ffff88b97e752840 1548676418 C Bi:4:003:1 0 485 = 5b5d2b01 d7010001 55370100 0c01cc0d 00005e80 00c31610 1c122210 0613f8ec
ffff88b97e752840 1548676429 S Bi:4:003:1 -115 4096 <
ffff88b97e752a80 1548678168 C Bi:4:003:1 0 478 = 5b5d2c01 d6010001 562c1000 0701cb0d 00006f6e fdfe03fc 0207f504 fefb0800
ffff88b97e752a80 1548678187 S Bi:4:003:1 -115 4096 <
ffff88b97e752f00 1548680168 C Bi:4:003:1 0 486 = 5b5d2d01 d6010001 64231100 0701cb0d 00006f80 014510f0 e2d2caf4 e0f0e60c
ffff88b97e752f00 1548680187 S Bi:4:003:1 -115 4096 <
ffff88b97e7520c0 1548681918 C Bi:4:003:1 0 479 = 5b5d2e01 d7010001 64fb0000 0c01cc0d 00006059 04fe01fc 08f904f9 04fd04fc
ffff88b97e7520c0 1548681929 S Bi:4:003:1 -115 4096 <
ffff88b97e752840 1548684040 C Bi:4:003:1 0 485 = 5b5d2f01 d7010001 72d40100 0c01cc0d 00005e80 00c21713 1a0b280f 0512f9ec
ffff88b97e752840 1548684052 S Bi:4:003:1 -115 4096 <
ffff88b97e752a80 1548685794 C Bi:4:003:1 0 478 = 5b5d3001 d6010001 73c81000 0701cb0d 00006d66 00020002 fc08f605 0201f803
ffff88b97e752a80 1548685806 S Bi:4:003:1 -115 4096 <
ffff88b97e752f00 1548687793 C Bi:4:003:1 0 486 = 5b5d3101 d6010001 81c11100 0701cb0d 00006d80 01310be2 d2cad30d e9f9f704
ffff88b97e752f00 1548687812 S Bi:4:003:1 -115 4096 <
ffff88b97e7520c0 1548689542 C Bi:4:003:1 0 479 = 5b5d3201 d7010001 82990000 0c01cc0d 0000605c ff01ff00 04fd01fc 000005fa
ffff88b97e7520c0 1548689553 S Bi:4:003:1 -115 4096 <
ffff88b97e752840 1548691560 C Bi:4:003:1 0 485 = 5b5d3301 d7010001 906c0100 0c01cc0d 00005d80 00c11812 1a0e290d 0514f4f5
ffff88b97e752840 1548691585 S Bi:4:003:1 -115 4096 <
ffff88b97e752a80 1548693294 C Bi:4:003:1 0 478 = 5b5d3401 d6010001 91601000 0701cb0d 00006b68 00fc0006 fd08f705 fa0001ff
ffff88b97e752a80 1548693306 S Bi:4:003:1 -115 4096 <
ffff88b97e752f00 1548695299 C Bi:4:003:1 0 486 = 5b5d3501 d6010001 9f571100 0701cb0d 00006d80 010000d4 d3eae510 f6fdf708
ffff88b97e752f00 1548695318 S Bi:4:003:1 -115 4096 <
ffff88b97e7520c0 1548697171 C Bi:4:003:1 0 479 = 5b5d3601 d7010001 a0300000 0c01cc0d 00005e5c 00fb04fb 0501fdfb 040102f9
ffff88b97e7520c0 1548697182 S Bi:4:003:1 -115 4096 <
ffff88b97e752840 1548699167 C Bi:4:003:1 0 485 = 5b5d3701 d7010001 ae080100 0c01cc0d 00005b80 00b81d10 1d0c270f 0615f8ed
ffff88b97e752840 1548699178 S Bi:4:003:1 -115 4096 <
ffff88b97e752a80 1548700934 C Bi:4:003:1 0 478 = 5b5d3801 d6010001 aefd1000 0701cb0d 00006c6f fcfb0303 fc04f906 faff0101
ffff88b97e752a80 1548700953 S Bi:4:003:1 -115 4096 <
ffff88b97e752f00 1548702912 C Bi:4:003:1 0 486 = 5b5d3901 d6010001 bcf31100 0701cb0d 00006d80 00b4f4e9 f3f6ef16 fbfbfb08
ffff88b97e752f00 1548702931 S Bi:4:003:1 -115 4096 <
ffff88b97e7520c0 1548704794 C Bi:4:003:1 0 479 = 5b5d3a01 d7010001 bdcc0000 0c01cc0d 0000615e feff02fe 04fefefc 000302fc
ffff88b97e7520c0 1548704806 S Bi:4:003:1 -115 4096 <
ffff88b97e752840 1548706797 C Bi:4:003:1 0 485 = 5b5d3b01 d7010001 cba00100 0c01cc0d 00005d80 00c41414 1c0d220e 0a0dffed
ffff88b97e752840 1548706808 S Bi:4:003:1 -115 4096 <
ffff88b97e752a80 1548708542 C Bi:4:003:1 0 478 = 5b5d3c01 d6010001 cc951000 0701cb0d 00006a67 03fcfeff 0405f407 ffff0200
ffff88b97e752a80 1548708554 S Bi:4:003:1 -115 4096 <
ffff88b97e752f00 1548710544 C Bi:4:003:1 0 486 = 5b5d3d01 d6010001 da8b1100 0701cb0d 00006f80 008202fb 00fcf213 fafef90a
ffff88b97e752f00 1548710557 S Bi:4:003:1 -115 4096 <
ffff88b97e7520c0 1548712306 C Bi:4:003:1 0 479 = 5b5d3e01 d7010001 db640000 0c01cc0d 0000615d fd0102fa 0700fdfd 03fc06fa
ffff88b97e7520c0 1548712317 S Bi:4:003:1 -115 4096 <
ffff88b97e752840 1548714419 C Bi:4:003:1 0 485 = 5b5d3f01 d7010001 e93c0100 0c01cc0d 00005f80 00c21f0c 1a0f230e 0518f9e9
ffff88b97e752840 1548714430 S Bi:4:003:1 -115 4096 <
ffff88b97e752a80 1548716171 C Bi:4:003:1 0 478 = 5b5d4001 d6010001 ea311000 0701cb0d 00006d67 04fc02ff fc08f706 fe030000
ffff88b97e752a80 1548716190 S Bi:4:003:1 -115 4096 <
ffff88b97e752f00 1548718167 C Bi:4:003:1 0 484 = 5b5d4101 d6010001 f8271100 0701cb0d 00006d7e fefc0001 f61af200 f8070100
ffff88b97e752f00 1548718186 S Bi:4:003:1 -115 4096 <
ffff88b97e7520c0 1548719918 C Bi:4:003:1 0 479 = 5b5d4201 d7010001 f9000000 0c01cc0d 00005f5b 00fc04fc 06fc02fa 07fd02fc
ffff88b97e7520c0 1548719929 S Bi:4:003:1 -115 4096 <
ffff88b97e752840 1548722044 C Bi:4:003:1 0 485 = 5b5d4301 d7010001 06d40100 0c01cc0d 00005f80 00c21e0f 170f2610 0312faed
ffff88b97e752840 1548722054 S Bi:4:003:1 -115 4096 <
ffff88b97e752a80 1548723794 C Bi:4:003:1 0 478 = 5b5d4401 d6010001 07c81000 0701cb0d 00006c6f f8fb0602 fd0af8fe fa06fe05
ffff88b97e752a80 1548723806 S Bi:4:003:1 -115 4096 <
ffff88b97e752f00 1548725793 C Bi:4:003:1 0 484 = 5b5d4501 d6010001 15bf1100 0701cb0d 00006c7d fbfe07fa f71cf3fd f80a0106
ffff88b97e752f00 1548725812 S Bi:4:003:1 -115 4096 <
ffff88b97e7520c0 1548727543 C Bi:4:003:1 0 479 = 5b5d4601 d7010001 16970000 0c01cc0d 0000615e fffd05fd 03fe01fa 04fe0001
ffff88b97e7520c0 1548727554 S Bi:4:003:1 -115 4096 <
ffff88b97e752840 1548729558 C Bi:4:003:1 0 485 = 5b5d4701 d7010001 246f0100 0c01cc0d 00005f80 00c41712 1a0a2a0d 0616f8ec
ffff88b97e752840 1548729569 S Bi:4:003:1 -115 4096 <
ffff88b97e752a80 1548731294 C Bi:4:003:1 0 478 = 5b5d4801 d6010001 25641000 0701cb0d 00006c65 06fc0103 fd06f9fd 040100fe
ffff88b97e752a80 1548731306 S Bi:4:003:1 -115 4096 <
ffff88b97e752f00 1548733306 C Bi:4:003:1 0 484 = 5b5d4901 d6010001 335a1100 0701cb0d 00006a7a 02000003 f316f903 f40b06fe
ffff88b97e752f00 1548733325 S Bi:4:003:1 -115 4096 <
ffff88b97e7520c0 1548735168 C Bi:4:003:1 0 479 = 5b5d4a01 d7010001 34330000 0c01cc0d 00005d58 02fc02fe 07fb02fd 00000100
ffff88b97e7520c0 1548735179 S Bi:4:003:1 -115 4096 <
ffff88b97e752840 1548737162 C Bi:4:003:1 0 485 = 5b5d4b01 d7010001 42070100 0c01cc0d 00005e80 00c31216 1b0c2b0a 0511f8f6
ffff88b97e752840 1548737173 S Bi:4:003:1 -115 4096 <
ffff88b97e752a80 1548738919 C Bi:4:003:1 0 478 = 5b5d4c01 d6010001 42fb1000 0701cb0d 00006b64 05f708fd fe05fc04 02fbff04
ffff88b97e752a80 1548738931 S Bi:4:003:1 -115 4096 <
ffff88b97e752f00 1548740940 C Bi:4:003:1 0 486 = 5b5d4d01 d6010001 50f21100 0701cb0d 00006d80 008bfefd 05fef513 fefff608
ffff88b97e752f00 1548740953 S Bi:4:003:1 -115 4096 <
ffff88b97e7520c0 1548742794 C Bi:4:003:1 0 479 = 5b5d4e01 d7010001 51cb0000 0c01cc0d 0000615d 02fc00fd 06fdfd00 02fe05fd
ffff88b97e7520c0 1548742805 S Bi:4:003:1 -115 4096 <
ffff88b97e752840 1548744800 C Bi:4:003:1 0 485 = 5b5d4f01 d7010001 5fa30100 0c01cc0d 00005d80 00c21213 1e10220e 0911f9ec
ffff88b97e752840 1548744811 S Bi:4:003:1 -115 4096 <
ffff88b97e752a80 1548746543 C Bi:4:003:1 0 478 = 5b5d5001 d6010001 60981000 0701cb0d 00006a6a fdfd06fc 0006fbff 01fdfeff
ffff88b97e752a80 1548746562 S Bi:4:003:1 -115 4096 <
ffff88b97e752f00 1548748542 C Bi:4:003:1 0 484 = 5b5d5101 d6010001 6e8f1100 0701cb0d 00006c74 09f903fa f2150200 f50afb02
ffff88b97e752f00 1548748561 S Bi:4:003:1 -115 4096 <
ffff88b97e7520c0 1548750294 C Bi:4:003:1 0 479 = 5b5d5201 d7010001 6f670000 0c01cc0d 0000615f fc01fd01 05fb06f7 06fd04fe
ffff88b97e7520c0 1548750306 S Bi:4:003:1 -115 4096 <
ffff88b97e752840 1548752419 C Bi:4:003:1 0 485 = 5b5d5301 d7010001 7d390100 0c01cc0d 00005c80 00c2160f 1a10270f 0611faef
ffff88b97e752840 1548752430 S Bi:4:003:1 -115 4096 <
ffff88b97e752a80 1548754169 C Bi:4:003:1 0 478 = 5b5d5401 d6010001 7e2e1000 0701cb0d 00006f6a 000103fe fd05fbfe 04ffff00
ffff88b97e752a80 1548754188 S Bi:4:003:1 -115 4096 <
ffff88b97e752f00 1548756169 C Bi:4:003:1 0 486 = 5b5d5501 d6010001 8c261100 0701cb0d 00006c80 014212e8 e5d5cb06 f5f1e106
ffff88b97e752f00 1548756188 S Bi:4:003:1 -115 4096 <
ffff88b97e7520c0 1548757919 C Bi:4:003:1 0 479 = 5b5d5601 d7010001 8cff0000 0c01cc0d 00005e59 000101fe 04fe01f9 06fb0301
ffff88b97e7520c0 1548757930 S Bi:4:003:1 -115 4096 <
ffff88b97e752840 1548760045 C Bi:4:003:1 0 485 = 5b5d5701 d7010001 9ad70100 0c01cc0d 00005c80 00c01a0c 1a12240e 0912fae9
ffff88b97e752840 1548760056 S Bi:4:003:1 -115 4096 <
ffff88b97e752a80 1548761795 C Bi:4:003:1 0 478 = 5b5d5801 d6010001 9bcc1000 0701cb0d 00006965 feff0202 fa06fd04 00fff903
ffff88b97e752a80 1548761807 S Bi:4:003:1 -115 4096 <
ffff88b97e752f00 1548763792 C Bi:4:003:1 0 488 = 5b5d5901 d6010001 a9c31100 0701cb0d 00006c80 015619fd 03fce90c 0f04fe06
ffff88b97e752f00 1548763805 S Bi:4:003:1 -115 4096 <
ffff88b97e7520c0 1548765543 C Bi:4:003:1 0 479 = 5b5d5a01 d7010001 aa9b0000 0c01cc0d 00005f5c 00ff0301 01fa0400 fdff0400
ffff88b97e7520c0 1548765554 S Bi:4:003:1 -115 4096 <
ffff88b97e752840 1548767542 C Bi:4:003:1 0 485 = 5b5d5b01 d7010001 b86f0100 0c01cc0d 00005c80 00bf1c0d 1d092a10 0017fde8
ffff88b97e752840 1548767553 S Bi:4:003:1 -115 4096 <
ffff88b97e752a80 1548769287 C Bi:4:003:1 0 478 = 5b5d5c01 d6010001 b9631000 0701cb0d 00006d6a fefc0501 fd08f801 01fb0002
ffff88b97e752a80 1548769299 S Bi:4:003:1 -115 4096 <
ffff88b97e752f00 1548771309 C Bi:4:003:1 0 486 = 5b5d5d01 d6010001 c75c1100 0701cb0d 00006d80 015616ff 04fee80b 0f08fc07
ffff88b97e752f00 1548771321 S Bi:4:003:1 -115 4096 <
ffff88b97e7520c0 1548773169 C Bi:4:003:1 0 479 = 5b5d5e01 d7010001 c8350000 0c01cc0d 0000605d ff0002ff 0100fe00 02fc0400
ffff88b97e7520c0 1548773180 S Bi:4:003:1 -115 4096 <
ffff88b97e752840 1548775161 C Bi:4:003:1 0 485 = 5b5d5f01 d7010001 d60d0100 0c01cc0d 00005d80 00c11615 180c2b0c 0417fce8
ffff88b97e752840 1548775172 S Bi:4:003:1 -115 4096 <
ffff88b97e752a80 1548776919 C Bi:4:003:1 0 478 = 5b5d6001 d6010001 d7021000 0701cb0d 00006f6b 06f900ff ff04f60c fb0103fc
ffff88b97e752a80 1548776937 S Bi:4:003:1 -115 4096 <
ffff88b97e752f00 1548778911 C Bi:4:003:1 0 486 = 5b5d6101 d6010001 e4f81100 0701cb0d 00007080 01551b00 fffce90d 0e04fe03
ffff88b97e752f00 1548778924 S Bi:4:003:1 -115 4096 <
ffff88b97e7520c0 1548780794 C Bi:4:003:1 0 479 = 5b5d6201 d7010001 e5d10000 0c01cc0d 0000615c 01000201 02fb08fa 01fc0501
ffff88b97e7520c0 1548780804 S Bi:4:003:1 -115 4096 <
ffff88b97e752840 1548782800 C Bi:4:003:1 0 485 = 5b5d6301 d7010001 f3a30100 0c01cc0d 00005d80 00c01514 1912270a 0810fcee
ffff88b97e752840 1548782811 S Bi:4:003:1 -115 4096 <
ffff88b97e752a80 1548784543 C Bi:4:003:1 0 478 = 5b5d6401 d6010001 f49e1000 0701cb0d 00006b65 02fe00fe 0004fc04 0104fcfe
ffff88b97e752a80 1548784556 S Bi:4:003:1 -115 4096 <
ffff88b97e752f00 1548786549 C Bi:4:003:1 0 486 = 5b5d6501 d6010001 02901100 0701cb0d 00006c80 01551cfa 0af4e610 0f06ff08
ffff88b97e752f00 1548786562 S Bi:4:003:1 -115 4096 <
ffff88b97e7520c0 1548788301 C Bi:4:003:1 0 479 = 5b5d6601 d7010001 03690000 0c01cc0d 0000605e 02fb0204 01fa05fe fd000301
ffff88b97e7520c0 1548788312 S Bi:4:003:1 -115 4096 <
ffff88b97e752840 1548790420 C Bi:4:003:1 0 485 = 5b5d6701 d7010001 11410100 0c01cc0d 00005e80 00c31811 1a102411 0115faec
ffff88b97e752840 1548790431 S Bi:4:003:1 -115 4096 <
ffff88b97e752a80 1548792169 C Bi:4:003:1 0 478 = 5b5d6801 d6010001 12361000 0701cb0d 00006d6e fcfc0500 ff08f602 fefdfd09
ffff88b97e752a80 1548792188 S Bi:4:003:1 -115 4096 <
ffff88b97e752f00 1548794168 C Bi:4:003:1 0 488 = 5b5d6901 d6010001 202c1100 0701cb0d 00006d80 01541bf7 0bf7ea0f 0d050202
ffff88b97e752f00 1548794180 S Bi:4:003:1 -115 4096 <
ffff88b97e7520c0 1548795919 C Bi:4:003:1 0 479 = 5b5d6a01 d7010001 21050000 0c01cc0d 00006361 00ff02fd 05fc03ff fc000104
ffff88b97e7520c0 1548795930 S Bi:4:003:1 -115 4096 <
ffff88b97e752840 1548798043 C Bi:4:003:1 0 485 = 5b5d6b01 d7010001 2ed90100 0c01cc0d 00005f80 00c31614 15112908 0c15f3ee
ffff88b97e752840 1548798054 S Bi:4:003:1 -115 4096 <
ffff88b97e752a80 1548799795 C Bi:4:003:1 0 478 = 5b5d6c01 d6010001 2fcd1000 0701cb0d 00006d69 04fc02ff ff05f704 01feff00
ffff88b97e752a80 1548799807 S Bi:4:003:1 -115 4096 <
ffff88b97e752f00 1548801795 C Bi:4:003:1 0 486 = 5b5d6d01 d6010001 3dbe1100 0701cb0d 00006c80 01521efc 08f8e212 0c03010a
ffff88b97e752f00 1548801808 S Bi:4:003:1 -115 4096 <
ffff88b97e7520c0 1548803543 C Bi:4:003:1 0 479 = 5b5d6e01 d7010001 3e960000 0c01cc0d 00005f5e 01fb0003 04fa0100 00ff0203
ffff88b97e7520c0 1548803554 S Bi:4:003:1 -115 4096 <
ffff88b97e752840 1548805558 C Bi:4:003:1 0 483 = 5b5d6f01 d7010001 4c710100 0c01cc0d 00005e80 00c21315 1416240e 0614fced
ffff88b97e752840 1548805569 S Bi:4:003:1 -115 4096 <
ffff88b97e752a80 1548807294 C Bi:4:003:1 0 478 = 5b5d7001 d6010001 4d651000 0701cb0d 00006e6d fffc0300 fa0afafe 04fe0201
ffff88b97e752a80 1548807313 S Bi:4:003:1 -115 4096 <
ffff88b97e752f00 1548809300 C Bi:4:003:1 0 486 = 5b5d7101 d6010001 5b5a1100 0701cb0d 00006d80 01551dfc 03f9e810 0a0bf905
ffff88b97e752f00 1548809313 S Bi:4:003:1 -115 4096 <
ffff88b97e7520c0 1548811168 C Bi:4:003:1 0 479 = 5b5d7201 d7010001 5c330000 0c01cc0d 00006160 feff0102 00fe0001 fefe05fd
ffff88b97e7520c0 1548811179 S Bi:4:003:1 -115 4096 <
ffff88b97e752840 1548813162 C Bi:4:003:1 0 483 = 5b5d7301 d7010001 6a0c0100 0c01cc0d 00005f80 00c7150e 1e0e270e 0411faf1
ffff88b97e752840 1548813173 S Bi:4:003:1 -115 4096 <
ffff88b97e752a80 1548814922 C Bi:4:003:1 0 478 = 5b5d7401 d6010001 6b011000 0701cb0d 00006d68 00fc03ff 0204fa04 01fdfefd
ffff88b97e752a80 1548814940 S Bi:4:003:1 -115 4096 <
ffff88b97e752f00 1548816911 C Bi:4:003:1 0 488 = 5b5d7501 d6010001 78f01100 0701cb0d 00007080 015a18fc 05fbe611 0e02fe07
ffff88b97e752f00 1548816924 S Bi:4:003:1 -115 4096 <
ffff88b97e7520c0 1548818794 C Bi:4:003:1 0 479 = 5b5d7601 d7010001 79c80000 0c01cc0d 0000605f 00fd0103 fe0003fd 02fe0001
ffff88b97e7520c0 1548818805 S Bi:4:003:1 -115 4096 <
ffff88b97e752840 1548820797 C Bi:4:003:1 0 483 = 5b5d7701 d7010001 87a40100 0c01cc0d 00005e80 00bf1a15 170f270e 0414faee
ffff88b97e752840 1548820808 S Bi:4:003:1 -115 4096 <
ffff88b97e752a80 1548822547 C Bi:4:003:1 0 478 = 5b5d7801 d6010001 88991000 0701cb0d 00006b69 00fc02fc ff0bfa01 00ff0100
ffff88b97e752a80 1548822567 S Bi:4:003:1 -115 4096 <
ffff88b97e752f00 1548824545 C Bi:4:003:1 0 486 = 5b5d7901 d6010001 968e1100 0701cb0d 00007080 01561cf8 07fde80e 0d07fc08
ffff88b97e752f00 1548824558 S Bi:4:003:1 -115 4096 <
ffff88b97e7520c0 1548826295 C Bi:4:003:1 0 479 = 5b5d7a01 d7010001 97670000 0c01cc0d 0000605d fe000200 04fc03fd 01fc0304
ffff88b97e7520c0 1548826306 S Bi:4:003:1 -115 4096 <
ffff88b97e752840 1548828421 C Bi:4:003:1 0 485 = 5b5d7b01 d7010001 a53f0100 0c01cc0d 00005e80 00bf1d0f 1d0c240e 0713fbed
ffff88b97e752840 1548828432 S Bi:4:003:1 -115 4096 <
ffff88b97e752a80 1548830170 C Bi:4:003:1 0 478 = 5b5d7c01 d6010001 a6341000 0701cb0d 00006c67 00000101 fd09f700 0401fcff
ffff88b97e752a80 1548830183 S Bi:4:003:1 -115 4096 <
ffff88b97e752f00 1548832169 C Bi:4:003:1 0 486 = 5b5d7d01 d6010001 b4241100 0701cb0d 00007080 015917fe fffdec11 0a06fd07
ffff88b97e752f00 1548832181 S Bi:4:003:1 -115 4096 <
ffff88b97e7520c0 1548833936 C Bi:4:003:1 0 479 = 5b5d7e01 d7010001 b4fc0000 0c01cc0d 0000605d 01fdfd09 00fb0200 fefd07ff
ffff88b97e7520c0 1548833947 S Bi:4:003:1 -115 4096 <
ffff88b97e752840 1548836044 C Bi:4:003:1 0 483 = 5b5d7f01 d7010001 c2d70100 0c01cc0d 00005c80 00bf1811 1412280f 0713faf0
ffff88b97e752840 1548836055 S Bi:4:003:1 -115 4096 <
ffff88b97e752a80 1548837793 C Bi:4:003:1 0 478 = 5b5d8001 d6010001 c3cb1000 0701cb0d 00006a63 07fc02fd fe030100 00ff00fe
ffff88b97e752a80 1548837806 S Bi:4:003:1 -115 4096 <
ffff88b97e752f00 1548839797 C Bi:4:003:1 0 486 = 5b5d8101 d6010001 d1c11100 0701cb0d 00006c80 015817fa 05fde50f 0e05fe0b
ffff88b97e752f00 1548839809 S Bi:4:003:1 -115 4096 <
ffff88b97e7520c0 1548841545 C Bi:4:003:1 0 479 = 5b5d8201 d7010001 d2990000 0c01cc0d 0000615c 000204fd 03fc01fe fe0101ff
ffff88b97e7520c0 1548841556 S Bi:4:003:1 -115 4096 <
ffff88b97e752840 1548843559 C Bi:4:003:1 0 483 = 5b5d8301 d7010001 e0720100 0c01cc0d 00005f80 00c21a10 1d0a290b 0617f8ed
ffff88b97e752840 1548843570 S Bi:4:003:1 -115 4096 <
ffff88b97e752a80 1548845294 C Bi:4:003:1 0 478 = 5b5d8401 d6010001 e1671000 0701cb0d 00006c6d fff905fe 0004fb03 00fd0000
ffff88b97e752a80 1548845306 S Bi:4:003:1 -115 4096 <
ffff88b97e752f00 1548847303 C Bi:4:003:1 0 488 = 5b5d8501 d6010001 ef561100 0701cb0d 00006a80 015219fb 07f6e812 1104fa0d
ffff88b97e752f00 1548847315 S Bi:4:003:1 -115 4096 <
ffff88b97e7520c0 1548849170 C Bi:4:003:1 0 479 = 5b5d8601 d7010001 f02f0000 0c01cc0d 0000615f ff01fd02 000001fd 010005fe
ffff88b97e7520c0 1548849181 S Bi:4:003:1 -115 4096 <
ffff88b97e752840 1548851162 C Bi:4:003:1 0 483 = 5b5d8701 d7010001 fe080100 0c01cc0d 00006180 00c41316 1d0d250e 0513fdea
ffff88b97e752840 1548851173 S Bi:4:003:1 -115 4096 <
ffff88b97e752a80 1548852921 C Bi:4:003:1 0 478 = 5b5d8801 d6010001 fefd1000 0701cb0d 00006765 06f704fe f90df701 05fefdfc
ffff88b97e752a80 1548852933 S Bi:4:003:1 -115 4096 <
ffff88b97e752f00 1548854910 C Bi:4:003:1 0 488 = 5b5d8901 d6010001 0cf41100 0701cb0d 00006f80 015a17fd 06f5ef0e 0b050103
ffff88b97e752f00 1548854922 S Bi:4:003:1 -115 4096 <
ffff88b97e7520c0 1548856796 C Bi:4:003:1 0 479 = 5b5d8a01 d7010001 0dcd0000 0c01cc0d 00005f5e fe0200fe 05fd00fe 01fd0401
ffff88b97e7520c0 1548856807 S Bi:4:003:1 -115 4096 <
ffff88b97e752840 1548858795 C Bi:4:003:1 0 483 = 5b5d8b01 d7010001 1ba60100 0c01cc0d 00006080 00c41910 1a10240e 0a0efaf0
ffff88b97e752840 1548858806 S Bi:4:003:1 -115 4096 <
ffff88b97e752a80 1548860544 C Bi:4:003:1 0 478 = 5b5d8c01 d6010001 1c9b1000 0701cb0d 00006c6a fefe0203 fc07f901 fb030300
ffff88b97e752a80 1548860563 S Bi:4:003:1 -115 4096 <
ffff88b97e752f00 1548862545 C Bi:4:003:1 0 488 = 5b5d8d01 d6010001 2a8a1100 0701cb0d 00006e80 01551dfc 02ffe70f 0a08fc08
ffff88b97e752f00 1548862557 S Bi:4:003:1 -115 4096 <
ffff88b97e7520c0 1548864295 C Bi:4:003:1 0 479 = 5b5d8e01 d7010001 2b630000 0c01cc0d 00005e5d feff0101 05fa0201 fcff0600
ffff88b97e7520c0 1548864306 S Bi:4:003:1 -115 4096 <
ffff88b97e752840 1548866418 C Bi:4:003:1 0 485 = 5b5d8f01 d7010001 393d0100 0c01cc0d 00005e80 00c11318 1513250c 0912faef
ffff88b97e752840 1548866429 S Bi:4:003:1 -115 4096 <
ffff88b97e752a80 1548868170 C Bi:4:003:1 0 478 = 5b5d9001 d6010001 3a311000 0701cb0d 00006c68 fffc0005 fd0af804 fc00fefd
ffff88b97e752a80 1548868182 S Bi:4:003:1 -115 4096 <
ffff88b97e752f00 1548870171 C Bi:4:003:1 0 488 = 5b5d9101 d6010001 48291100 0701cb0d 00006c80 01541af9 08fae80e 0d080105
ffff88b97e752f00 1548870183 S Bi:4:003:1 -115 4096 <
ffff88b97e7520c0 1548871920 C Bi:4:003:1 0 479 = 5b5d9201 d7010001 49020000 0c01cc0d 00005f5b 02fe0300 01fe00fe 04fc04ff
ffff88b97e7520c0 1548871931 S Bi:4:003:1 -115 4096 <
ffff88b97e752840 1548874045 C Bi:4:003:1 0 483 = 5b5d9301 d7010001 56dc0100 0c01cc0d 00005b80 00bf1a12 180d270f 0911f8ef
ffff88b97e752840 1548874056 S Bi:4:003:1 -115 4096 <
ffff88b97e752a80 1548875795 C Bi:4:003:1 0 478 = 5b5d9401 d6010001 57d01000 0701cb0d 00006c63 05fe0101 fa07fd06 f605fe01
ffff88b97e752a80 1548875814 S Bi:4:003:1 -115 4096 <
ffff88b97e752f00 1548877794 C Bi:4:003:1 0 488 = 5b5d9501 d6010001 65bf1100 0701cb0d 00006a80 01531bf9 05fce612 0e08fa07
ffff88b97e752f00 1548877807 S Bi:4:003:1 -115 4096 <
ffff88b97e7520c0 1548879544 C Bi:4:003:1 0 479 = 5b5d9601 d7010001 66980000 0c01cc0d 0000615e 02fd0201 ff000200 fcff05fe
ffff88b97e7520c0 1548879555 S Bi:4:003:1 -115 4096 <
ffff88b97e752840 1548881560 C Bi:4:003:1 0 483 = 5b5d9701 d7010001 74720100 0c01cc0d 00005c80 00bd1b11 170f2812 0611faeb
ffff88b97e752840 1548881571 S Bi:4:003:1 -115 4096 <
ffff88b97e752a80 1548883287 C Bi:4:003:1 0 478 = 5b5d9801 d6010001 75661000 0701cb0d 0000706d 03fd01fe ff02fb04 00ff0200
ffff88b97e752a80 1548883306 S Bi:4:003:1 -115 4096 <
ffff88b97e752f00 1548885303 C Bi:4:003:1 0 488 = 5b5d9901 d6010001 835d1100 0701cb0d 00006a80 01521df7 06fcdf19 0c07fb0b
ffff88b97e752f00 1548885316 S Bi:4:003:1 -115 4096 <
ffff88b97e7520c0 1548887169 C Bi:4:003:1 0 479 = 5b5d9a01 d7010001 84360000 0c01cc0d 0000605f fa04ff00 06fdfe03 fb010300
ffff88b97e7520c0 1548887180 S Bi:4:003:1 -115 4096 <
ffff88b97e752840 1548889162 C Bi:4:003:1 0 483 = 5b5d9b01 d7010001 92100100 0c01cc0d 00005f80 00c51710 1612250e 0a0ffaee
ffff88b97e752840 1548889173 S Bi:4:003:1 -115 4096 <
ffff88b97e752a80 1548890922 C Bi:4:003:1 0 478 = 5b5d9c01 d6010001 93041000 0701cb0d 00006d6d fc03f706 0007fa02 fdfd01fe
ffff88b97e752a80 1548890942 S Bi:4:003:1 -115 4096 <
ffff88b97e752f00 1548892911 C Bi:4:003:1 0 486 = 5b5d9d01 d6010001 a0f41100 0701cb0d 00006c80 01541afc 03ffe611 0e06fb08
ffff88b97e752f00 1548892924 S Bi:4:003:1 -115 4096 <
ffff88b97e7520c0 1548894794 C Bi:4:003:1 0 479 = 5b5d9e01 d7010001 a1cc0000 0c01cc0d 00006161 fd0000ff 04fa05fc ff0004fe
ffff88b97e7520c0 1548894805 S Bi:4:003:1 -115 4096 <
ffff88b97e752840 1548896797 C Bi:4:003:1 0 483 = 5b5d9f01 d7010001 afa50100 0c01cc0d 00005d80 00c1190e 1d0b280e 0515f9ed
ffff88b97e752840 1548896808 S Bi:4:003:1 -115 4096 <
ffff88b97e752a80 1548898545 C Bi:4:003:1 0 478 = 5b5da001 d6010001 b0991000 0701cb0d 00007171 fbfd0403 fb08f803 fcff0300
ffff88b97e752a80 1548898562 S Bi:4:003:1 -115 4096 <
ffff88b97e752f00 1548900544 C Bi:4:003:1 0 486 = 5b5da101 d6010001 be8f1100 0701cb0d 00006c80 01521efc 00ffe80d 0c08fc08
ffff88b97e752f00 1548900557 S Bi:4:003:1 -115 4096 <
ffff88b97e7520c0 1548902295 C Bi:4:003:1 0 479 = 5b5da201 d7010001 bf670000 0c01cc0d 00005d5c 00fc0401 fdfe0203 00fb05ff
ffff88b97e7520c0 1548902306 S Bi:4:003:1 -115 4096 <
ffff88b97e752840 1548904423 C Bi:4:003:1 0 483 = 5b5da301 d7010001 cd420100 0c01cc0d 00005d80 00c01811 1f0a270d 0515faec
ffff88b97e752840 1548904434 S Bi:4:003:1 -115 4096 <
ffff88b97e752a80 1548906170 C Bi:4:003:1 0 478 = 5b5da401 d6010001 ce371000 0701cb0d 00006c68 02fd04fc fc08f901 01fe05ff
ffff88b97e752a80 1548906189 S Bi:4:003:1 -115 4096 <
ffff88b97e752f00 1548908170 C Bi:4:003:1 0 486 = 5b5da501 d6010001 dc261100 0701cb0d 00006c80 01541bfd feffea13 0a06fd07
ffff88b97e752f00 1548908183 S Bi:4:003:1 -115 4096 <
ffff88b97e7520c0 1548909929 C Bi:4:003:1 0 479 = 5b5da601 d7010001 dcfe0000 0c01cc0d 00005f5d 02fefe04 03fb0000 00fe0104
ffff88b97e7520c0 1548909940 S Bi:4:003:1 -115 4096 <
ffff88b97e752840 1548912046 C Bi:4:003:1 0 483 = 5b5da701 d7010001 ead10100 0c01cc0d 00006080 00c71513 190b280f 0414fbed
ffff88b97e752840 1548912057 S Bi:4:003:1 -115 4096 <
ffff88b97e752a80 1548913798 C Bi:4:003:1 0 478 = 5b5da801 d6010001 ebc51000 0701cb0d 00006c6c fcfa0804 fb06f900 0100fdfd
ffff88b97e752a80 1548913817 S Bi:4:003:1 -115 4096 <
ffff88b97e752f00 1548915796 C Bi:4:003:1 0 488 = 5b5da901 d6010001 f9ba1100 0701cb0d 00007080 01541dfa 07fee413 0908fb09
ffff88b97e752f00 1548915808 S Bi:4:003:1 -115 4096 <
ffff88b97e7520c0 1548917565 C Bi:4:003:1 0 479 = 5b5daa01 d7010001 fa930000 0c01cc0d 00005f5b 04fd0000 04fa04ff fffe0202
ffff88b97e7520c0 1548917576 S Bi:4:003:1 -115 4096 <
ffff88b97e752840 1548919549 C Bi:4:003:1 0 483 = 5b5dab01 d7010001 086f0100 0c01cc0d 00005c80 00c01b0d 1a0b290e 0813faee
ffff88b97e752840 1548919560 S Bi:4:003:1 -115 4096 <
ffff88b97e752a80 1548921308 C Bi:4:003:1 0 478 = 5b5dac01 d6010001 09631000 0701cb0d 00006a64 08f50501 f80ef700 04fffc02
ffff88b97e752a80 1548921327 S Bi:4:003:1 -115 4096 <
ffff88b97e752f00 1548923289 C Bi:4:003:1 0 488 = 5b5dad01 d6010001 17521100 0701cb0d 00006d80 01561af7 0600e511 1102fd07
ffff88b97e752f00 1548923301 S Bi:4:003:1 -115 4096 <
ffff88b97e7520c0 1548925170 C Bi:4:003:1 0 479 = 5b5dae01 d7010001 182b0000 0c01cc0d 00005e5e fb0401ff 01fe0000 fefd0500
ffff88b97e7520c0 1548925181 S Bi:4:003:1 -115 4096 <
ffff88b97e752840 1548927182 C Bi:4:003:1 0 483 = 5b5daf01 d7010001 25ff0100 0c01cc0d 00005f80 00c31612 1c0f2710 0214f6f1
ffff88b97e752840 1548927193 S Bi:4:003:1 -115 4096 <
ffff88b97e752a80 1548928920 C Bi:4:003:1 0 478 = 5b5db001 d6010001 26f31000 0701cb0d 00007371 fdfd08fc fe08f801 fc03f80a
ffff88b97e752a80 1548928939 S Bi:4:003:1 -115 4096 <
ffff88b97e752f00 1548930923 C Bi:4:003:1 0 486 = 5b5db101 d6010001 34e81100 0701cb0d 00006880 01521cf8 07fbe510 09090005
ffff88b97e752f00 1548930936 S Bi:4:003:1 -115 4096 <
ffff88b97e7520c0 1548932795 C Bi:4:003:1 0 479 = 5b5db201 d7010001 35c10000 0c01cc0d 0000615e 02fd03fe 02fd04fc fe0302ff
ffff88b97e7520c0 1548932807 S Bi:4:003:1 -115 4096 <
ffff88b97e752840 1548934796 C Bi:4:003:1 0 483 = 5b5db301 d7010001 439b0100 0c01cc0d 00005b80 00bb1a13 190f290d 0512faec
ffff88b97e752840 1548934807 S Bi:4:003:1 -115 4096 <
ffff88b97e752a80 1548936545 C Bi:4:003:1 0 478 = 5b5db401 d6010001 44901000 0701cb0d 00006d69 00fe0103 f90df306 fa01fa09
ffff88b97e752a80 1548936564 S Bi:4:003:1 -115 4096 <
ffff88b97e752f00 1548938546 C Bi:4:003:1 0 488 = 5b5db501 d6010001 52851100 0701cb0d 00006d80 01561dfb 03fbe812 0906fc06
ffff88b97e752f00 1548938558 S Bi:4:003:1 -115 4096 <
ffff88b97e7520c0 1548940286 C Bi:4:003:1 0 479 = 5b5db601 d7010001 535e0000 0c01cc0d 00005e5c fd030000 02fe01ff 00fe03ff
ffff88b97e7520c0 1548940297 S Bi:4:003:1 -115 4096 <
ffff88b97e752840 1548942421 C Bi:4:003:1 0 483 = 5b5db701 d7010001 61310100 0c01cc0d 00005f80 00c51610 16112c08 0b0efbef
ffff88b97e752840 1548942432 S Bi:4:003:1 -115 4096 <
ffff88b97e752a80 1548944173 C Bi:4:003:1 0 478 = 5b5db801 d6010001 62261000 0701cb0d 00006e67 04fd03fd fc0600ff fe05fefd
ffff88b97e752a80 1548944185 S Bi:4:003:1 -115 4096 <
ffff88b97e752f00 1548946171 C Bi:4:003:1 0 486 = 5b5db901 d6010001 701b1100 0701cb0d 00006d80 01571bf6 0500e80c 11030009
ffff88b97e752f00 1548946183 S Bi:4:003:1 -115 4096 <
ffff88b97e7520c0 1548947921 C Bi:4:003:1 0 479 = 5b5dba01 d7010001 70f40000 0c01cc0d 0000605e fc0005fd 05fb0202 fdfc06ff
ffff88b97e7520c0 1548947931 S Bi:4:003:1 -115 4096 <
ffff88b97e752840 1548950045 C Bi:4:003:1 0 483 = 5b5dbb01 d7010001 7ecd0100 0c01cc0d 00005c80 00c4150f 18102615 0610f8ed
ffff88b97e752840 1548950056 S Bi:4:003:1 -115 4096 <
ffff88b97e752a80 1548951795 C Bi:4:003:1 0 478 = 5b5dbc01 d6010001 7fc11000 0701cb0d 00006e69 04fb03ff fa09f701 0401fc08
ffff88b97e752a80 1548951814 S Bi:4:003:1 -115 4096 <
ffff88b97e752f00 1548953794 C Bi:4:003:1 0 486 = 5b5dbd01 d6010001 8db81100 0701cb0d 00006f80 015917f7 09f9ef0e 0a050006
ffff88b97e752f00 1548953806 S Bi:4:003:1 -115 4096 <
ffff88b97e7520c0 1548955546 C Bi:4:003:1 0 479 = 5b5dbe01 d7010001 8e910000 0c01cc0d 00006260 fc000103 05fb03fb 02fa0205
ffff88b97e7520c0 1548955571 S Bi:4:003:1 -115 4096 <
ffff88b97e752840 1548957543 C Bi:4:003:1 0 485 = 5b5dbf01 d7010001 9c630100 0c01cc0d 00005e80 00c11a13 1511250e 0812faec
ffff88b97e752840 1548957554 S Bi:4:003:1 -115 4096 <
ffff88b97e752a80 1548959296 C Bi:4:003:1 0 478 = 5b5dc001 d6010001 9d581000 0701cb0d 00006d69 ffff0102 fd05f9fd 08fefe04
ffff88b97e752a80 1548959314 S Bi:4:003:1 -115 4096 <
ffff88b97e752f00 1548961289 C Bi:4:003:1 0 486 = 5b5dc101 d6010001 ab4f1100 0701cb0d 00006c80 015421f8 04ffe70b 0e04fc0b
ffff88b97e752f00 1548961302 S Bi:4:003:1 -115 4096 <
ffff88b97e7520c0 1548963170 C Bi:4:003:1 0 479 = 5b5dc201 d7010001 ac270000 0c01cc0d 00006361 00f90501 02fb0102 fe000105
ffff88b97e7520c0 1548963181 S Bi:4:003:1 -115 4096 <
ffff88b97e752840 1548965180 C Bi:4:003:1 0 483 = 5b5dc301 d7010001 ba000100 0c01cc0d 00005d80 00c31217 190c2513 0414f5f0
ffff88b97e752840 1548965191 S Bi:4:003:1 -115 4096 <
ffff88b97e752a80 1548966919 C Bi:4:003:1 0 478 = 5b5dc401 d6010001 baf41000 0701cb0d 00006a67 01fb0204 f904fd04 03fcfefe
ffff88b97e752a80 1548966931 S Bi:4:003:1 -115 4096 <
ffff88b97e752f00 1548968926 C Bi:4:003:1 0 486 = 5b5dc501 d6010001 c8ec1100 0701cb0d 00006a80 01531df7 07fce80c 0a0bfe0b
ffff88b97e752f00 1548968939 S Bi:4:003:1 -115 4096 <
ffff88b97e7520c0 1548970796 C Bi:4:003:1 0 479 = 5b5dc601 d7010001 c9c40000 0c01cc0d 00006160 fcff0200 03fdff00 ffff05fe
ffff88b97e7520c0 1548970807 S Bi:4:003:1 -115 4096 <
ffff88b97e752840 1548972796 C Bi:4:003:1 0 485 = 5b5dc701 d7010001 d7970100 0c01cc0d 00005c80 00c11713 1a0d260f 0319f7e7
ffff88b97e752840 1548972807 S Bi:4:003:1 -115 4096 <
ffff88b97e752a80 1548974544 C Bi:4:003:1 0 478 = 5b5dc801 d6010001 d88b1000 0701cb0d 00006e6c fbf80805 f80bf701 00fffeff
ffff88b97e752a80 1548974563 S Bi:4:003:1 -115 4096 <
ffff88b97e752f00 1548976545 C Bi:4:003:1 0 486 = 5b5dc901 d6010001 e6821100 0701cb0d 00006c80 015a19f9 03fde90f 0c09f90a
ffff88b97e752f00 1548976558 S Bi:4:003:1 -115 4096 <
ffff88b97e7520c0 1548978309 C Bi:4:003:1 0 479 = 5b5dca01 d7010001 e75b0000 0c01cc0d 00005d5c fffd02ff 05fc04ff fc0003ff
ffff88b97e7520c0 1548978320 S Bi:4:003:1 -115 4096 <
ffff88b97e752840 1548980421 C Bi:4:003:1 0 485 = 5b5dcb01 d7010001 f5330100 0c01cc0d 00005e80 00c11117 1d0c2411 0712f8eb
ffff88b97e752840 1548980432 S Bi:4:003:1 -115 4096 <
ffff88b97e752a80 1548982173 C Bi:4:003:1 0 478 = 5b5dcc01 d6010001 f6281000 0701cb0d 00006d68 06f803ff fe0af505 ffff06fa
ffff88b97e752a80 1548982186 S Bi:4:003:1 -115 4096 <
ffff88b97e752f00 1548984172 C Bi:4:003:1 0 486 = 5b5dcd01 d6010001 04201100 0701cb0d 00006c80 015619fa 09f7e513 0b080009
ffff88b97e752f00 1548984184 S Bi:4:003:1 -115 4096 <
ffff88b97e7520c0 1548985920 C Bi:4:003:1 0 479 = 5b5dce01 d7010001 04f80000 0c01cc0d 0000625c 01000100 01fd02ff fffc07ff
ffff88b97e7520c0 1548985931 S Bi:4:003:1 -115 4096 <
ffff88b97e752840 1548988047 C Bi:4:003:1 0 485 = 5b5dcf01 d7010001 12cb0100 0c01cc0d 00005f80 00c21610 1e0e2710 0412fbe9
ffff88b97e752840 1548988058 S Bi:4:003:1 -115 4096 <
ffff88b97e752a80 1548989796 C Bi:4:003:1 0 478 = 5b5dd001 d6010001 13bf1000 0701cb0d 00006a63 03fd0200 fc04ff01 01fffc02
ffff88b97e752a80 1548989816 S Bi:4:003:1 -115 4096 <
ffff88b97e752f00 1548991797 C Bi:4:003:1 0 488 = 5b5dd101 d6010001 21b61100 0701cb0d 00006e80 015818fb 09fae611 0d05fd03
ffff88b97e752f00 1548991810 S Bi:4:003:1 -115 4096 <
ffff88b97e7520c0 1548993545 C Bi:4:003:1 0 479 = 5b5dd201 d7010001 228e0000 0c01cc0d 0000635f feff0102 01fb07fc 03fb0106
ffff88b97e7520c0 1548993555 S Bi:4:003:1 -115 4096 <
ffff88b97e752840 1548995543 C Bi:4:003:1 0 485 = 5b5dd301 d7010001 30680100 0c01cc0d 00005e80 00c31613 1b0b290b 0915f9eb
ffff88b97e752840 1548995554 S Bi:4:003:1 -115 4096 <
ffff88b97e752a80 1548997303 C Bi:4:003:1 0 478 = 5b5dd401 d6010001 315d1000 0701cb0d 00006d6d fbfc09fd ff05fc00 fd00fd02
ffff88b97e752a80 1548997312 S Bi:4:003:1 -115 4096 <
ffff88b97e752f00 1548999293 C Bi:4:003:1 0 486 = 5b5dd501 d6010001 3f541100 0701cb0d 00006d80 015a19f7 06fde512 0d07fb07
ffff88b97e752f00 1548999306 S Bi:4:003:1 -115 4096 <
ffff88b97e7520c0 1549001171 C Bi:4:003:1 0 479 = 5b5dd601 d7010001 402e0000 0c01cc0d 0000605f fffd0301 00fe01fe 00fd06fe
ffff88b97e7520c0 1549001182 S Bi:4:003:1 -115 4096 <
ffff88b97e752840 1549003183 C Bi:4:003:1 0 483 = 5b5dd701 d7010001 4e010100 0c01cc0d 00005c80 00c01811 190d2612 0512f9ee
ffff88b97e752840 1549003194 S Bi:4:003:1 -115 4096 <
ffff88b97e752a80 1549004920 C Bi:4:003:1 0 478 = 5b5dd801 d6010001 4ef51000 0701cb0d 00007171 fefc0600 fe03f704 ff00ff00
ffff88b97e752a80 1549004939 S Bi:4:003:1 -115 4096 <
ffff88b97e752f00 1549006934 C Bi:4:003:1 0 486 = 5b5dd901 d6010001 5ceb1100 0701cb0d 00006b80 01541df9 05faea0a 0f09fe09
ffff88b97e752f00 1549006946 S Bi:4:003:1 -115 4096 <
ffff88b97e7520c0 1549008796 C Bi:4:003:1 0 479 = 5b5dda01 d7010001 5dc30000 0c01cc0d 0000625f 01fa0701 fd010101 fefa0502
ffff88b97e7520c0 1549008807 S Bi:4:003:1 -115 4096 <
ffff88b97e752840 1549010796 C Bi:4:003:1 0 485 = 5b5ddb01 d7010001 6b9c0100 0c01cc0d 00006180 00c71415 180e2709 0810fef0
ffff88b97e752840 1549010807 S Bi:4:003:1 -115 4096 <
ffff88b97e752a80 1549012546 C Bi:4:003:1 0 478 = 5b5ddc01 d6010001 6c911000 0701cb0d 00006c6c fffdfe01 0103fd04 fefb04fa
ffff88b97e752a80 1549012565 S Bi:4:003:1 -115 4096 <
ffff88b97e752f00 1549014545 C Bi:4:003:1 0 486 = 5b5ddd01 d6010001 7a871100 0701cb0d 00006e80 016010fc 03fbe90d 0f07f610
ffff88b97e752f00 1549014557 S Bi:4:003:1 -115 4096 <
ffff88b97e7520c0 1549016315 C Bi:4:003:1 0 479 = 5b5dde01 d7010001 7b600000 0c01cc0d 0000625f ffff03fd 05fa0101 03fa0401
ffff88b97e7520c0 1549016326 S Bi:4:003:1 -115 4096 <
ffff88b97e752840 1549018423 C Bi:4:003:1 0 485 = 5b5ddf01 d7010001 89340100 0c01cc0d 00005d80 00bf1b0f 17102a0e 0410feec
ffff88b97e752840 1549018434 S Bi:4:003:1 -115 4096 <
ffff88b97e752a80 1549020172 C Bi:4:003:1 0 478 = 5b5de001 d6010001 8a291000 0701cb0d 00006e68 06fc02ff fc05fb00 010002ff
ffff88b97e752a80 1549020191 S Bi:4:003:1 -115 4096 <
ffff88b97e752f00 1549022171 C Bi:4:003:1 0 486 = 5b5de101 d6010001 981f1100 0701cb0d 00006c80 01541ff4 06fce80d 1108fe06
ffff88b97e752f00 1549022183 S Bi:4:003:1 -115 4096 <
ffff88b97e7520c0 1549023924 C Bi:4:003:1 0 479 = 5b5de201 d7010001 98f80000 0c01cc0d 00005f5d ffff02fc 08fcff01 01fc0202
ffff88b97e7520c0 1549023935 S Bi:4:003:1 -115 4096 <
ffff88b97e752840 1549026046 C Bi:4:003:1 0 485 = 5b5de301 d7010001 a6d10100 0c01cc0d 00005c80 00c41213 1b0f240f 0812f9f1
ffff88b97e752840 1549026057 S Bi:4:003:1 -115 4096 <
ffff88b97e752a80 1549027796 C Bi:4:003:1 0 478 = 5b5de401 d6010001 a7c61000 0701cb0d 00006e6c fdfeff00 010af807 fdfefffb
ffff88b97e752a80 1549027815 S Bi:4:003:1 -115 4096 <
ffff88b97e752f00 1549029799 C Bi:4:003:1 0 486 = 5b5de501 d6010001 b5bc1100 0701cb0d 00006880 01521df7 04fde411 0b0bfc0a
ffff88b97e752f00 1549029812 S Bi:4:003:1 -115 4096 <
ffff88b97e7520c0 1549031550 C Bi:4:003:1 0 479 = 5b5de601 d7010001 b6950000 0c01cc0d 00005f5c 000000ff 04fb02fd 03fe05fb
ffff88b97e7520c0 1549031561 S Bi:4:003:1 -115 4096 <
ffff88b97e752840 1549033544 C Bi:4:003:1 0 485 = 5b5de701 d7010001 c4690100 0c01cc0d 00005c80 00c01a0f 1c0b2511 0614f5f1
ffff88b97e752840 1549033554 S Bi:4:003:1 -115 4096 <
ffff88b97e752a80 1549035302 C Bi:4:003:1 0 478 = 5b5de801 d6010001 c55e1000 0701cb0d 00006d6d fafe0002 0104fd03 fb0000fd
ffff88b97e752a80 1549035314 S Bi:4:003:1 -115 4096 <
ffff88b97e752f00 1549037289 C Bi:4:003:1 0 486 = 5b5de901 d6010001 d34e1100 0701cb0d 00006c80 015617f9 08f7ec0e 0f07fa07
ffff88b97e752f00 1549037301 S Bi:4:003:1 -115 4096 <
ffff88b97e7520c0 1549039171 C Bi:4:003:1 0 479 = 5b5dea01 d7010001 d4270000 0c01cc0d 00005f5e 02ff01ff 03fb04fc 00fe0304
ffff88b97e7520c0 1549039182 S Bi:4:003:1 -115 4096 <
ffff88b97e752840 1549041177 C Bi:4:003:1 0 483 = 5b5deb01 d7010001 e1ff0100 0c01cc0d 00005e80 00c31411 1d0e270c 0714fee7
ffff88b97e752840 1549041188 S Bi:4:003:1 -115 4096 <
ffff88b97e752a80 1549042920 C Bi:4:003:1 0 478 = 5b5dec01 d6010001 e2f41000 0701cb0d 00006863 04fd01ff fe03f806 000003fd
ffff88b97e752a80 1549042938 S Bi:4:003:1 -115 4096 <
ffff88b97e752f00 1549044920 C Bi:4:003:1 0 486 = 5b5ded01 d6010001 f0e91100 0701cb0d 00006c80 015b17fa 04faeb0e 080cfb06
ffff88b97e752f00 1549044933 S Bi:4:003:1 -115 4096 <
ffff88b97e7520c0 1549046797 C Bi:4:003:1 0 479 = 5b5dee01 d7010001 f1c20000 0c01cc0d 0000605d ff010102 01fc01fe 01020001
ffff88b97e7520c0 1549046808 S Bi:4:003:1 -115 4096 <
ffff88b97e752840 1549048795 C Bi:4:003:1 0 483 = 5b5def01 d7010001 ff950100 0c01cc0d 00005d80 00c11318 180e2613 0214faef
ffff88b97e752840 1549048806 S Bi:4:003:1 -115 4096 <
ffff88b97e752a80 1549050546 C Bi:4:003:1 0 478 = 5b5df001 d6010001 00891000 0701cb0d 00006a67 02fefffe ff08fb01 01fcff01
ffff88b97e752a80 1549050565 S Bi:4:003:1 -115 4096 <
ffff88b97e752f00 1549052547 C Bi:4:003:1 0 486 = 5b5df101 d6010001 0e781100 0701cb0d 00006d80 015817fb 06f9ea0b 1107fb0c
ffff88b97e752f00 1549052559 S Bi:4:003:1 -115 4096 <
ffff88b97e7520c0 1549054296 C Bi:4:003:1 0 479 = 5b5df201 d7010001 0f510000 0c01cc0d 00005f5e 00fd0202 fe0001ff 01fc0401
ffff88b97e7520c0 1549054307 S Bi:4:003:1 -115 4096 <
ffff88b97e752840 1549056419 C Bi:4:003:1 0 483 = 5b5df301 d7010001 1d2a0100 0c01cc0d 00005e80 00bf1913 1a0e2810 0212fdf1
ffff88b97e752840 1549056430 S Bi:4:003:1 -115 4096 <
ffff88b97e752a80 1549058068 C Bi:4:003:1 0 478 = 5b5df401 d6010001 1e1e1000 0701cb0d 00006d69 fc040202 fc06f702 01fe0201
ffff88b97e752a80 1549058081 S Bi:4:003:1 -115 4096 <
ffff88b97e752f00 1549060171 C Bi:4:003:1 0 486 = 5b5df501 d6010001 2c141100 0701cb0d 00006f80 015b15f9 07f8ea13 0d06fc09
ffff88b97e752f00 1549060176 S Bi:4:003:1 -115 4096 <
ffff88b97e7520c0 1549061921 C Bi:4:003:1 0 479 = 5b5df601 d7010001 2cec0000 0c01cc0d 0000625f fffe0003 fe0003ff fefe06fc
ffff88b97e7520c0 1549061925 S Bi:4:003:1 -115 4096 <
ffff88b97e752840 1549063928 C Bi:4:003:1 0 485 = 5b5df701 d7010001 3ac50100 0c01cc0d 00005a80 00bd1b11 190d280f 0315fbec
ffff88b97e752840 1549063932 S Bi:4:003:1 -115 4096 <
ffff88b97e752a80 1549065670 C Bi:4:003:1 0 478 = 5b5df801 d6010001 3bb91000 0701cb0d 00006f6d fb010002 fd09fb00 00fc02fc
ffff88b97e752a80 1549065681 S Bi:4:003:1 -115 4096 <
ffff88b97e752f00 1549067795 C Bi:4:003:1 0 486 = 5b5df901 d6010001 49ac1100 0701cb0d 00007180 015c16fc 06f7ea0e 0e050007
ffff88b97e752f00 1549067801 S Bi:4:003:1 -115 4096 <
ffff88b97e7520c0 1549069546 C Bi:4:003:1 0 479 = 5b5dfa01 d7010001 4a840000 0c01cc0d 0000605d ffff0200 03fc0300 fdfd0402
ffff88b97e7520c0 1549069550 S Bi:4:003:1 -115 4096 <
ffff88b97e752840 1549071563 C Bi:4:003:1 0 483 = 5b5dfb01 d7010001 585d0100 0c01cc0d 00005c80 00bf1910 1a0e290d 0811fcec
ffff88b97e752840 1549071567 S Bi:4:003:1 -115 4096 <
ffff88b97e752a80 1549073296 C Bi:4:003:1 0 478 = 5b5dfc01 d6010001 59511000 0701cb0d 00006b69 fefc03ff ff08f903 fdff01fe
ffff88b97e752a80 1549073308 S Bi:4:003:1 -115 4096 <
ffff88b97e752f00 1549075313 C Bi:4:003:1 0 486 = 5b5dfd01 d6010001 67471100 0701cb0d 00006880 01521bff 04fde010 0f08fa08
ffff88b97e752f00 1549075318 S Bi:4:003:1 -115 4096 <
ffff88b97e7520c0 1549077060 C Bi:4:003:1 0 479 = 5b5dfe01 d7010001 68200000 0c01cc0d 00006161 fc0003fe 04fc03fc 01fe0500
ffff88b97e7520c0 1549077064 S Bi:4:003:1 -115 4096 <
ffff88b97e752840 1549079175 C Bi:4:003:1 0 483 = 5b5dff01 d7010001 75f80100 0c01cc0d 00006080 00c31e07 210e240f 080cffe9
ffff88b97e752840 1549079179 S Bi:4:003:1 -115 4096 <
ffff88b97e752a80 1549080921 C Bi:4:003:1 0 478 = 5b5d0001 d6010001 76ed1000 0701cb0d 00006a64 05f90101 f90cfc02 01fffffd
ffff88b97e752a80 1549080927 S Bi:4:003:1 -115 4096 <
ffff88b97e752f00 1549082920 C Bi:4:003:1 0 486 = 5b5d0101 d6010001 84de1100 0701cb0d 00007080 01581cfc 01ffe50f 0f03ff06
ffff88b97e752f00 1549082925 S Bi:4:003:1 -115 4096 <
ffff88b97e7520c0 1549084795 C Bi:4:003:1 0 479 = 5b5d0201 d7010001 85b60000 0c01cc0d 0000605d 0003fb03 02fd02ff fefe0100
ffff88b97e7520c0 1549084799 S Bi:4:003:1 -115 4096 <
ffff88b97e752840 1549086797 C Bi:4:003:1 0 483 = 5b5d0301 d7010001 938f0100 0c01cc0d 00005f80 00be1a15 17112211 0512f5f6
ffff88b97e752840 1549086801 S Bi:4:003:1 -115 4096 <
ffff88b97e752a80 1549088546 C Bi:4:003:1 0 478 = 5b5d0401 d6010001 94841000 0701cb0d 00006d6d fd00ffff fd05fd01 02fc0102
ffff88b97e752a80 1549088558 S Bi:4:003:1 -115 4096 <
ffff88b97e752f00 1549090549 C Bi:4:003:1 0 486 = 5b5d0501 d6010001 a2791100 0701cb0d 00006f80 01581cf5 05fdeb0f 0d06fd06
ffff88b97e752f00 1549090554 S Bi:4:003:1 -115 4096 <
ffff88b97e7520c0 1549092295 C Bi:4:003:1 0 479 = 5b5d0601 d7010001 a3520000 0c01cc0d 00006063 fdfd03fb 08fafd06 fffd07fb
ffff88b97e7520c0 1549092299 S Bi:4:003:1 -115 4096 <
ffff88b97e752840 1549094421 C Bi:4:003:1 0 483 = 5b5d0701 d7010001 b12a0100 0c01cc0d 00005e80 00c11812 1b0e2512 0611f9ec
ffff88b97e752840 1549094425 S Bi:4:003:1 -115 4096 <
ffff88b97e752a80 1549096047 C Bi:4:003:1 0 478 = 5b5d0801 d6010001 b21f1000 0701cb0d 00006b67 00fb04ff fe06f509 00fefe03
ffff88b97e752a80 1549096053 S Bi:4:003:1 -115 4096 <
ffff88b97e752f00 1549098170 C Bi:4:003:1 0 488 = 5b5d0901 d6010001 c00e1100 0701cb0d 00006e80 015a1afa 04f9eb0e 0b08fb09
ffff88b97e752f00 1549098176 S Bi:4:003:1 -115 4096 <
ffff88b97e7520c0 1549099943 C Bi:4:003:1 0 479 = 5b5d0a01 d7010001 c0e70000 0c01cc0d 00006261 feff0101 06fa02ff feff0300
ffff88b97e7520c0 1549099947 S Bi:4:003:1 -115 4096 <
ffff88b97e752840 1549101921 C Bi:4:003:1 0 483 = 5b5d0b01 d7010001 cec10100 0c01cc0d 00005e80 00c21911 1911240e 0614f8ec
ffff88b97e752840 1549101925 S Bi:4:003:1 -115 4096 <
ffff88b97e752a80 1549103685 C Bi:4:003:1 0 478 = 5b5d0c01 d6010001 cfb51000 0701cb0d 00006e6e fdfb05ff fc09fbfd 01fefe03
ffff88b97e752a80 1549103697 S Bi:4:003:1 -115 4096 <
ffff88b97e752f00 1549105797 C Bi:4:003:1 0 486 = 5b5d0d01 d6010001 ddab1100 0701cb0d 00006e80 01551bfd 02ffe40f 0f04f80d
ffff88b97e752f00 1549105802 S Bi:4:003:1 -115 4096 <
ffff88b97e7520c0 1549107546 C Bi:4:003:1 0 479 = 5b5d0e01 d7010001 de830000 0c01cc0d 00005f5c 00ff0002 04fb0101 00fd05fc
ffff88b97e7520c0 1549107550 S Bi:4:003:1 -115 4096 <
ffff88b97e752840 1549109558 C Bi:4:003:1 0 485 = 5b5d0f01 d7010001 ec5c0100 0c01cc0d 00005d80 00c41410 200a2a0d 0315faed
ffff88b97e752840 1549109562 S Bi:4:003:1 -115 4096 <
ffff88b97e752a80 1549111298 C Bi:4:003:1 0 478 = 5b5d1001 d6010001 ed511000 0701cb0d 00007474 fffc01ff fe07f902 feff0102
ffff88b97e752a80 1549111309 S Bi:4:003:1 -115 4096 <
ffff88b97e752f00 1549113312 C Bi:4:003:1 0 488 = 5b5d1101 d6010001 fb411100 0701cb0d 00006b80 01511dfb 09fbe210 0e020108
ffff88b97e752f00 1549113317 S Bi:4:003:1 -115 4096 <
ffff88b97e7520c0 1549115064 C Bi:4:003:1 0 479 = 5b5d1201 d7010001 fc1a0000 0c01cc0d 00005f5e ffff02fc 08fa0100 00fb0404
ffff88b97e7520c0 1549115068 S Bi:4:003:1 -115 4096 <
ffff88b97e752840 1549117172 C Bi:4:003:1 0 485 = 5b5d1301 d7010001 09f50100 0c01cc0d 00006080 00c51712 1c0f220f 0616f5ed
ffff88b97e752840 1549117176 S Bi:4:003:1 -115 4096 <
ffff88b97e752a80 1549118922 C Bi:4:003:1 0 478 = 5b5d1401 d6010001 0aea1000 0701cb0d 00006d6b 00fa04fe 0206fb00 03fafd00
ffff88b97e752a80 1549118934 S Bi:4:003:1 -115 4096 <
ffff88b97e752f00 1549120920 C Bi:4:003:1 0 486 = 5b5d1501 d6010001 18e01100 0701cb0d 00006d80 01561bfd 04f8e813 0b05fe07
ffff88b97e752f00 1549120926 S Bi:4:003:1 -115 4096 <
ffff88b97e7520c0 1549122796 C Bi:4:003:1 0 479 = 5b5d1601 d7010001 19b90000 0c01cc0d 0000605d 03fb05ff 03fa02fe fd0205fe
ffff88b97e7520c0 1549122800 S Bi:4:003:1 -115 4096 <
ffff88b97e752840 1549124797 C Bi:4:003:1 0 483 = 5b5d1701 d7010001 27920100 0c01cc0d 00005f80 00c21615 1810270d 0711f7f1
ffff88b97e752840 1549124801 S Bi:4:003:1 -115 4096 <
ffff88b97e752a80 1549126547 C Bi:4:003:1 0 478 = 5b5d1801 d6010001 28861000 0701cb0d 0000706f fefd0201 fe06f603 05fb00ff
ffff88b97e752a80 1549126559 S Bi:4:003:1 -115 4096 <
ffff88b97e752f00 1549128547 C Bi:4:003:1 0 488 = 5b5d1901 d6010001 36751100 0701cb0d 00006d80 01551ff8 02ffe512 0c06f90b
ffff88b97e752f00 1549128553 S Bi:4:003:1 -115 4096 <
ffff88b97e7520c0 1549130300 C Bi:4:003:1 0 479 = 5b5d1a01 d7010001 374e0000 0c01cc0d 00006160 fdfc06fd 02fe0102 fefe0304
ffff88b97e7520c0 1549130304 S Bi:4:003:1 -115 4096 <
ffff88b97e752840 1549132421 C Bi:4:003:1 0 483 = 5b5d1b01 d7010001 452a0100 0c01cc0d 00005f80 00c41713 18112313 0310feeb
ffff88b97e752840 1549132425 S Bi:4:003:1 -115 4096 <
ffff88b97e752a80 1549134027 C Bi:4:003:1 0 478 = 5b5d1c01 d6010001 461e1000 0701cb0d 00006d6a 01fb0101 fe05fd02 00fe00ff
ffff88b97e752a80 1549134032 S Bi:4:003:1 -115 4096 <
ffff88b97e752f00 1549136174 C Bi:4:003:1 0 486 = 5b5d1d01 d6010001 54141100 0701cb0d 00006a80 01521bf8 0500e40e 1007fe0a
ffff88b97e752f00 1549136180 S Bi:4:003:1 -115 4096 <
ffff88b97e7520c0 1549137923 C Bi:4:003:1 0 479 = 5b5d1e01 d7010001 54ec0000 0c01cc0d 0000605d 01fd03ff 03fa07fb 02ff0002
ffff88b97e7520c0 1549137928 S Bi:4:003:1 -115 4096 <
ffff88b97e752840 1549139923 C Bi:4:003:1 0 483 = 5b5d1f01 d7010001 62c50100 0c01cc0d 00005f80 00c21713 1b0d290b 0810fdec
ffff88b97e752840 1549139927 S Bi:4:003:1 -115 4096 <
ffff88b97e752a80 1549141672 C Bi:4:003:1 0 478 = 5b5d2001 d6010001 63b91000 0701cb0d 00006d69 01fefe01 0205f606 fefe0000
ffff88b97e752a80 1549141684 S Bi:4:003:1 -115 4096 <
ffff88b97e752f00 1549143797 C Bi:4:003:1 0 486 = 5b5d2101 d6010001 71a91100 0701cb0d 00006d80 015618fb 08f7e911 0e07fc0c
ffff88b97e752f00 1549143803 S Bi:4:003:1 -115 4096 <
ffff88b97e7520c0 1549145547 C Bi:4:003:1 0 479 = 5b5d2201 d7010001 72810000 0c01cc0d 00005f5d 03fc02ff 02fe02ff fdfd07fe
ffff88b97e7520c0 1549145551 S Bi:4:003:1 -115 4096 <
ffff88b97e752840 1549147556 C Bi:4:003:1 0 483 = 5b5d2301 d7010001 805c0100 0c01cc0d 00005e80 00c41312 1d10260f 0412faed
ffff88b97e752840 1549147561 S Bi:4:003:1 -115 4096 <
ffff88b97e752a80 1549149299 C Bi:4:003:1 0 478 = 5b5d2401 d6010001 81501000 0701cb0d 00007071 fcfe0002 0005f601 01fe05fe
ffff88b97e752a80 1549149309 S Bi:4:003:1 -115 4096 <
ffff88b97e752f00 1549151303 C Bi:4:003:1 0 486 = 5b5d2501 d6010001 8f451100 0701cb0d 00006880 014f20fb 02fae214 0e09fb09
ffff88b97e752f00 1549151308 S Bi:4:003:1 -115 4096 <
ffff88b97e7520c0 1549153067 C Bi:4:003:1 0 479 = 5b5d2601 d7010001 901e0000 0c01cc0d 0000605d ff02ff04 fefe0100 fffd0400
ffff88b97e7520c0 1549153071 S Bi:4:003:1 -115 4096 <
ffff88b97e752840 1549155173 C Bi:4:003:1 0 483 = 5b5d2701 d7010001 9df70100 0c01cc0d 00006180 00c8101a 16102210 0714faec
ffff88b97e752840 1549155177 S Bi:4:003:1 -115 4096 <
ffff88b97e752a80 1549156923 C Bi:4:003:1 0 478 = 5b5d2801 d6010001 9eeb1000 0701cb0d 00006b67 00fe02fe 0207f603 02fcff01
ffff88b97e752a80 1549156935 S Bi:4:003:1 -115 4096 <
ffff88b97e752f00 1549158922 C Bi:4:003:1 0 486 = 5b5d2901 d6010001 acda1100 0701cb0d 00006d80 01581af9 0002e90b 1403fb07
ffff88b97e752f00 1549158928 S Bi:4:003:1 -115 4096 <
ffff88b97e7520c0 1549160676 C Bi:4:003:1 0 479 = 5b5d2a01 d7010001 adb30000 0c01cc0d 0000605e 00fb0500 01fe03fe fd000300
ffff88b97e7520c0 1549160680 S Bi:4:003:1 -115 4096 <
ffff88b97e752840 1549162797 C Bi:4:003:1 0 485 = 5b5d2b01 d7010001 bb860100 0c01cc0d 00005e80 00c41416 16112311 0414f9ef
ffff88b97e752840 1549162801 S Bi:4:003:1 -115 4096 <
ffff88b97e752a80 1549164423 C Bi:4:003:1 0 478 = 5b5d2c01 d6010001 bc7a1000 0701cb0d 00006b63 02fc07ff f90bf7fe 0501fb05
ffff88b97e752a80 1549164428 S Bi:4:003:1 -115 4096 <
ffff88b97e752f00 1549166549 C Bi:4:003:1 0 486 = 5b5d2d01 d6010001 ca721100 0701cb0d 00006c80 01541ef8 07fae90c 1104fb09
ffff88b97e752f00 1549166554 S Bi:4:003:1 -115 4096 <
ffff88b97e7520c0 1549168296 C Bi:4:003:1 0 479 = 5b5d2e01 d7010001 cb4b0000 0c01cc0d 0000615a 07fcfc03 05fc0003 00fb0303
ffff88b97e7520c0 1549168300 S Bi:4:003:1 -115 4096 <
ffff88b97e752840 1549170309 C Bi:4:003:1 0 483 = 5b5d2f01 d7010001 d9230100 0c01cc0d 00005f80 00c51714 1a0a280e 0018feeb
ffff88b97e752840 1549170313 S Bi:4:003:1 -115 4096 <
ffff88b97e752a80 1549172039 C Bi:4:003:1 0 478 = 5b5d3001 d6010001 da181000 0701cb0d 00006b69 fc000002 ff02fc04 00fb02fe
ffff88b97e752a80 1549172051 S Bi:4:003:1 -115 4096 <
ffff88b97e752f00 1549174053 C Bi:4:003:1 0 486 = 5b5d3101 d6010001 e8071100 0701cb0d 00006d80 014e22f9 0bf4e811 0b0afb0a
ffff88b97e752f00 1549174058 S Bi:4:003:1 -115 4096 <
ffff88b97e7520c0 1549175919 C Bi:4:003:1 0 479 = 5b5d3201 d7010001 e8e00000 0c01cc0d 00005f5e 03f90202 01feff03 fefa07fe
ffff88b97e7520c0 1549175923 S Bi:4:003:1 -115 4096 <
ffff88b97e752840 1549177943 C Bi:4:003:1 0 483 = 5b5d3301 d7010001 f6b20100 0c01cc0d 00005f80 00c81416 15121e12 0614f7f0
ffff88b97e752840 1549177947 S Bi:4:003:1 -115 4096 <
ffff88b97e752a80 1549179672 C Bi:4:003:1 0 478 = 5b5d3401 d6010001 f7a71000 0701cb0d 00006c6a 03fa0500 fa06f901 03fc0000
ffff88b97e752a80 1549179683 S Bi:4:003:1 -115 4096 <
ffff88b97e752f00 1549181685 C Bi:4:003:1 0 486 = 5b5d3501 d6010001 059e1100 0701cb0d 00006d80 01551bfd 02ffe311 0e06fc05
ffff88b97e752f00 1549181690 S Bi:4:003:1 -115 4096 <
ffff88b97e7520c0 1549183547 C Bi:4:003:1 0 479 = 5b5d3601 d7010001 06760000 0c01cc0d 0000615f 00fe03fe 04fdff01 01fc0102
ffff88b97e7520c0 1549183552 S Bi:4:003:1 -115 4096 <
ffff88b97e752840 1549185549 C Bi:4:003:1 0 485 = 5b5d3701 d7010001 144f0100 0c01cc0d 00005d80 00c1190f 1d0c260f 0514f9ef
ffff88b97e752840 1549185553 S Bi:4:003:1 -115 4096 <
ffff88b97e752a80 1549187298 C Bi:4:003:1 0 478 = 5b5d3801 d6010001 15441000 0701cb0d 0000706d 00f907ff fc07f800 05fffe02
ffff88b97e752a80 1549187304 S Bi:4:003:1 -115 4096 <
ffff88b97e752f00 1549189301 C Bi:4:003:1 0 486 = 5b5d3901 d6010001 233a1100 0701cb0d 00006f80 01551dfb 07fae312 10ff0109
ffff88b97e752f00 1549189306 S Bi:4:003:1 -115 4096 <
ffff88b97e7520c0 1549191040 C Bi:4:003:1 0 479 = 5b5d3a01 d7010001 24130000 0c01cc0d 0000615c 01fe0200 02fc0201 fd000102
ffff88b97e7520c0 1549191044 S Bi:4:003:1 -115 4096 <
ffff88b97e752840 1549193172 C Bi:4:003:1 0 485 = 5b5d3b01 d7010001 31e50100 0c01cc0d 00005f80 00c61512 17132210 0515f7ee
ffff88b97e752840 1549193176 S Bi:4:003:1 -115 4096 <
ffff88b97e752a80 1549194921 C Bi:4:003:1 0 478 = 5b5d3c01 d6010001 32da1000 0701cb0d 00006b6d fcfa0601 fe06f901 01fbff00
ffff88b97e752a80 1549194926 S Bi:4:003:1 -115 4096 <
ffff88b97e752f00 1549196922 C Bi:4:003:1 0 486 = 5b5d3d01 d6010001 40d21100 0701cb0d 00006d80 015a17fd 05f9e611 0f03fd07
ffff88b97e752f00 1549196928 S Bi:4:003:1 -115 4096 <
ffff88b97e7520c0 1549198675 C Bi:4:003:1 0 479 = 5b5d3e01 d7010001 41ab0000 0c01cc0d 0000625e 00fe03ff 05fffffc 05fc05fc
ffff88b97e7520c0 1549198679 S Bi:4:003:1 -115 4096 <
ffff88b97e752840 1549200798 C Bi:4:003:1 0 483 = 5b5d3f01 d7010001 4f830100 0c01cc0d 00005d80 00bf1711 1f10230f 070ffaef
ffff88b97e752840 1549200802 S Bi:4:003:1 -115 4096 <
ffff88b97e752a80 1549202426 C Bi:4:003:1 0 478 = 5b5d4001 d6010001 50781000 0701cb0d 00006a67 00fcffff 0505f707 fb01ffff
ffff88b97e752a80 1549202437 S Bi:4:003:1 -115 4096 <
ffff88b97e752f00 1549204548 C Bi:4:003:1 0 486 = 5b5d4101 d6010001 5e6d1100 0701cb0d 00006e80 01551dfa 04f9ee0d 0c05fc0b
ffff88b97e752f00 1549204554 S Bi:4:003:1 -115 4096 <
ffff88b97e7520c0 1549206298 C Bi:4:003:1 0 479 = 5b5d4201 d7010001 5f460000 0c01cc0d 00006160 fd0002fe 05fb0202 fffb08fe
ffff88b97e7520c0 1549206302 S Bi:4:003:1 -115 4096 <
ffff88b97e752840 1549208304 C Bi:4:003:1 0 485 = 5b5d4301 d7010001 6d180100 0c01cc0d 00005d80 00c61711 1a0f260a 0912fcee
ffff88b97e752840 1549208308 S Bi:4:003:1 -115 4096 <
ffff88b97e752a80 1549210060 C Bi:4:003:1 0 478 = 5b5d4401 d6010001 6e0d1000 0701cb0d 00006b66 0300fdff 0002fb07 fefeff02
ffff88b97e752a80 1549210072 S Bi:4:003:1 -115 4096 <
ffff88b97e752f00 1549212048 C Bi:4:003:1 0 486 = 5b5d4501 d6010001 7c031100 0701cb0d 00006f80 01581cf8 06fee80a 0d0bf909
ffff88b97e752f00 1549212053 S Bi:4:003:1 -115 4096 <
ffff88b97e7520c0 1549213922 C Bi:4:003:1 0 479 = 5b5d4601 d7010001 7cdc0000 0c01cc0d 00005e58 01010001 03ff00ff 00fc06fe
ffff88b97e7520c0 1549213926 S Bi:4:003:1 -115 4096 <
ffff88b97e752840 1549215942 C Bi:4:003:1 0 485 = 5b5d4701 d7010001 8ab60100 0c01cc0d 00005d80 00c21612 1912230e 0710fee9
ffff88b97e752840 1549215946 S Bi:4:003:1 -115 4096 <
ffff88b97e752a80 1549217670 C Bi:4:003:1 0 478 = 5b5d4801 d6010001 8bab1000 0701cb0d 00006b66 01fc0002 f810f604 04fcfeff
ffff88b97e752a80 1549217682 S Bi:4:003:1 -115 4096 <
ffff88b97e752f00 1549219686 C Bi:4:003:1 0 486 = 5b5d4901 d6010001 99a11100 0701cb0d 00006d80 015717f5 0bf6ea14 0c08fd05
ffff88b97e752f00 1549219692 S Bi:4:003:1 -115 4096 <
ffff88b97e7520c0 1549221446 C Bi:4:003:1 0 479 = 5b5d4a01 d7010001 9a7a0000 0c01cc0d 00005f5e fefe0102 ff0201ff fd010000
ffff88b97e7520c0 1549221450 S Bi:4:003:1 -115 4096 <
ffff88b97e752840 1549223547 C Bi:4:003:1 0 483 = 5b5d4b01 d7010001 a84d0100 0c01cc0d 00005f80 00c71112 1c0e2a0b 0610fee8
ffff88b97e752840 1549223551 S Bi:4:003:1 -115 4096 <
ffff88b97e752a80 1549225297 C Bi:4:003:1 0 478 = 5b5d4c01 d6010001 a9411000 0701cb0d 0000706d 01fd0301 fb06fa00 01000001
ffff88b97e752a80 1549225309 S Bi:4:003:1 -115 4096 <
ffff88b97e752f00 1549227298 C Bi:4:003:1 0 486 = 5b5d4d01 d6010001 b7371100 0701cb0d 00006e80 015812fd 08fbe70f 100afa06
ffff88b97e752f00 1549227304 S Bi:4:003:1 -115 4096 <
ffff88b97e7520c0 1549229041 C Bi:4:003:1 0 479 = 5b5d4e01 d7010001 b80f0000 0c01cc0d 0000605e fdff04ff 04fa04fe 01fd0300
ffff88b97e7520c0 1549229045 S Bi:4:003:1 -115 4096 <
ffff88b97e752840 1549231171 C Bi:4:003:1 0 485 = 5b5d4f01 d7010001 c5ea0100 0c01cc0d 00005c80 00c3170e 1814260e 0612f8f2
ffff88b97e752840 1549231175 S Bi:4:003:1 -115 4096 <
ffff88b97e752a80 1549232922 C Bi:4:003:1 0 478 = 5b5d5001 d6010001 c6de1000 0701cb0d 00006968 fefa0303 0004fa05 f70401fe
ffff88b97e752a80 1549232933 S Bi:4:003:1 -115 4096 <
ffff88b97e752f00 1549234922 C Bi:4:003:1 0 488 = 5b5d5101 d6010001 d4d51100 0701cb0d 00006f80 01591af7 07fde510 0d09fa08
ffff88b97e752f00 1549234927 S Bi:4:003:1 -115 4096 <
ffff88b97e7520c0 1549236677 C Bi:4:003:1 0 479 = 5b5d5201 d7010001 d5ad0000 0c01cc0d 0000615e 01fd0004 03f70600 00fa06fd
ffff88b97e7520c0 1549236681 S Bi:4:003:1 -115 4096 <
ffff88b97e752840 1549238799 C Bi:4:003:1 0 485 = 5b5d5301 d7010001 e3810100 0c01cc0d 00005e80 00c1190f 1e0b260d 0b11f9f1
ffff88b97e752840 1549238803 S Bi:4:003:1 -115 4096 <
ffff88b97e752a80 1549241425 C Bi:4:003:1 0 2471 = 5b5d5409 9f020201 015c083d 00001012 02061013 02011011 03061014 43011015
ffff88b97e752a80 1549241429 S Bi:4:003:1 -115 4096 <
ffff88b97e752f00 1549242797 C Bi:4:003:1 0 478 = 5b5d5501 d6010001 e4751000 0701cb8d 00006b69 00fc0301 fc07fa03 ff03fcff
ffff88b97e752f00 1549242802 S Bi:4:003:1 -115 4096 <
ffff88b97e7520c0 1549245797 C Bi:4:003:1 0 488 = 5b5d5601 d6010001 ff881100 0701cb8d 00006a80 01521cfc 04fce50d 1102fe0a
ffff88b97e7520c0 1549245803 S Bi:4:003:1 -115 4096 <
ffff88b97e752840 1549248171 C Bi:4:003:1 0 479 = 5b5d5701 d7010001 00610000 0c01cc8d 0000615d ff0001fe 05fc0300 00f90602
ffff88b97e752840 1549248175 S Bi:4:003:1 -115 4096 <
ffff88b97e752a80 1549251797 C Bi:4:003:1 0 483 = 5b5d5801 d7010001 10320100 0c01cc8d 00005e80 00c11811 20082710 0415f8ef
ffff88b97e752a80 1549251801 S Bi:4:003:1 -115 4096 <
ffff88b97e752f00 1550228046 C Bi:4:003:1 0 478 = 5b5d5901 d6010001 e7c31000 0701cb0d 00006b63 08f70500 f611f607 00fefb02
ffff88b97e752f00 1550228058 S Bi:4:003:1 -115 4096 <
ffff88b97e7520c0 1550230083 C Bi:4:003:1 0 486 = 5b5d5a01 d6010001 f8e01100 0701cb0d 00006c80 01471eeb e29eae00 f2fdf60a
ffff88b97e7520c0 1550230085 S Bi:4:003:1 -115 4096 <
ffff88b97e752840 1550231805 C Bi:4:003:1 0 479 = 5b5d5b01 d7010001 f9b90000 0c01cc0d 0000615e 02fb0104 02fa0500 fcff0301
ffff88b97e752840 1550231809 S Bi:4:003:1 -115 4096 <
ffff88b97e752a80 1550233929 C Bi:4:003:1 0 485 = 5b5d5c01 d7010001 07930100 0c01cc0d 00005d80 00c41514 1b0d250b 0811fbee
ffff88b97e752a80 1550233933 S Bi:4:003:1 -115 4096 <
ffff88b97e752f00 1550235683 C Bi:4:003:1 0 478 = 5b5d5d01 d6010001 08881000 0701cb0d 00006c6a fffffd02 fe0cf9fd 02fa0104
ffff88b97e752f00 1550235695 S Bi:4:003:1 -115 4096 <
ffff88b97e7520c0 1550237681 C Bi:4:003:1 0 486 = 5b5d5e01 d6010001 167e1100 0701cb0d 00006b80 01440fe1 aeaddb0f f102f708
ffff88b97e7520c0 1550237686 S Bi:4:003:1 -115 4096 <
ffff88b97e752840 1550239431 C Bi:4:003:1 0 479 = 5b5d5f01 d7010001 17570000 0c01cc0d 00006260 00fe0102 02fdfe02 fdff06fe
ffff88b97e752840 1550239435 S Bi:4:003:1 -115 4096 <
ffff88b97e752a80 1550241557 C Bi:4:003:1 0 487 = 5b5d6001 d7010001 25290100 0c01cc0d 00005d80 00bf1d0e 1711260b 0b14f8ec
ffff88b97e752a80 1550241561 S Bi:4:003:1 -115 4096 <
ffff88b97e752f00 1550244183 C Bi:4:003:1 0 2471 = 5b5d6109 9f020201 015c083d 00001012 02061013 02011011 03061014 43011015
ffff88b97e752f00 1550244188 S Bi:4:003:1 -115 4096 <
ffff88b97e7520c0 1550245568 C Bi:4:003:1 0 478 = 5b5d6201 d6010001 261e1000 0701cb8d 00006d67 000104fd 0205f504 01fb04ff
ffff88b97e7520c0 1550245573 S Bi:4:003:1 -115 4096 <
ffff88b97e752840 1550248682 C Bi:4:003:1 0 486 = 5b5d6301 d6010001 41511100 0701cb8d 00006d80 013f0bce 9dcde40e f806ee0c
ffff88b97e752840 1550248694 S Bi:4:003:1 -115 4096 <
ffff88b97e752a80 1550250930 C Bi:4:003:1 0 479 = 5b5d6401 d7010001 422a0000 0c01cc8d 00005f59 02fd0103 02fefffc 05fc0403
ffff88b97e752a80 1550250934 S Bi:4:003:1 -115 4096 <
ffff88b97e752f00 1550254430 C Bi:4:003:1 0 485 = 5b5d6501 d7010001 51fa0100 0c01cc8d 00005d80 00be1716 1513240e 0613fdea
ffff88b97e752f00 1550254434 S Bi:4:003:1 -115 4096 <
ffff88b97e7520c0 1550256930 C Bi:4:003:1 0 478 = 5b5d6601 d6010001 52ef1000 0701cb0d 00006c65 01000101 fc07fafe fd030303
ffff88b97e7520c0 1550256942 S Bi:4:003:1 -115 4096 <
ffff88b97e752840 1550258932 C Bi:4:003:1 0 486 = 5b5d6701 d6010001 696d1100 0701cb0d 00006b80 014009cc 9dcce70a fb01f90b
ffff88b97e752840 1550258944 S Bi:4:003:1 -115 4096 <
ffff88b97e752a80 1550260805 C Bi:4:003:1 0 479 = 5b5d6801 d7010001 6a460000 0c01cc0d 00005f5d fe000000 02fe06fb feff04ff
ffff88b97e752a80 1550260809 S Bi:4:003:1 -115 4096 <
ffff88b97e752f00 1550262806 C Bi:4:003:1 0 485 = 5b5d6901 d7010001 781e0100 0c01cc0d 00005c80 00c31217 1a0c260c 0911fcec
ffff88b97e752f00 1550262810 S Bi:4:003:1 -115 4096 <
ffff88b97e7520c0 1550264558 C Bi:4:003:1 0 478 = 5b5d6a01 d6010001 79131000 0701cb0d 00006b68 00fe04ff fa07f9fd 0601fe05
ffff88b97e7520c0 1550264570 S Bi:4:003:1 -115 4096 <
ffff88b97e752840 1550266555 C Bi:4:003:1 0 488 = 5b5d6b01 d6010001 87051100 0701cb0d 00006e80 01430ad2 95d0e412 f7fdf50b
ffff88b97e752840 1550266567 S Bi:4:003:1 -115 4096 <
ffff88b97e752a80 1550268325 C Bi:4:003:1 0 479 = 5b5d6c01 d7010001 87de0000 0c01cc0d 00005f5d 00fc0300 03fe04fb fffd0502
ffff88b97e752a80 1550268329 S Bi:4:003:1 -115 4096 <
ffff88b97e752f00 1550270431 C Bi:4:003:1 0 485 = 5b5d6d01 d7010001 95b70100 0c01cc0d 00006080 00c7160a 220f260e 0411fee8
ffff88b97e752f00 1550270435 S Bi:4:003:1 -115 4096 <
ffff88b97e7520c0 1550272183 C Bi:4:003:1 0 478 = 5b5d6e01 d6010001 96ac1000 0701cb0d 00006a68 fffe03fd 0203fc06 f90001fe
ffff88b97e7520c0 1550272195 S Bi:4:003:1 -115 4096 <
ffff88b97e752840 1550274181 C Bi:4:003:1 0 486 = 5b5d6f01 d6010001 a4a31100 0701cb0d 00006a80 013b0fcc 9fcfdd0f f800fa05
ffff88b97e752840 1550274187 S Bi:4:003:1 -115 4096 <
ffff88b97e752a80 1550275933 C Bi:4:003:1 0 479 = 5b5d7001 d7010001 a57b0000 0c01cc0d 0000605e fdff06fc 04fe00fe 00000101
ffff88b97e752a80 1550275937 S Bi:4:003:1 -115 4096 <
ffff88b97e752f00 1550277947 C Bi:4:003:1 0 485 = 5b5d7101 d7010001 b3540100 0c01cc0d 00005e80 00c41412 1a0f2610 0612faed
ffff88b97e752f00 1550277951 S Bi:4:003:1 -115 4096 <
ffff88b97e7520c0 1550279806 C Bi:4:003:1 0 478 = 5b5d7201 d6010001 b4481000 0701cb0d 00006d68 06fa0201 fb08f904 fd0005fb
ffff88b97e7520c0 1550279812 S Bi:4:003:1 -115 4096 <
ffff88b97e752840 1550281806 C Bi:4:003:1 0 488 = 5b5d7301 d6010001 c23a1100 0701cb0d 00006d80 01430dce a1cae30f f202f508
ffff88b97e752840 1550281812 S Bi:4:003:1 -115 4096 <
ffff88b97e752a80 1550283558 C Bi:4:003:1 0 479 = 5b5d7401 d7010001 c3130000 0c01cc0d 00005f5d 00fe0200 03fffd04 fa000301
ffff88b97e752a80 1550283562 S Bi:4:003:1 -115 4096 <
ffff88b97e752f00 1550285551 C Bi:4:003:1 0 487 = 5b5d7501 d7010001 d0ed0100 0c01cc0d 00005d80 00c01b11 1b102210 070ffbed
ffff88b97e752f00 1550285555 S Bi:4:003:1 -115 4096 <
ffff88b97e7520c0 1550287310 C Bi:4:003:1 0 478 = 5b5d7601 d6010001 d1e21000 0701cb0d 00006e69 00fe04fd fe09f802 08f701fd
ffff88b97e7520c0 1550287316 S Bi:4:003:1 -115 4096 <
ffff88b97e752840 1550289299 C Bi:4:003:1 0 486 = 5b5d7701 d6010001 dfda1100 0701cb0d 00006f80 01480bd6 9ac4e40d f502f609
ffff88b97e752840 1550289304 S Bi:4:003:1 -115 4096 <
ffff88b97e752a80 1550291183 C Bi:4:003:1 0 479 = 5b5d7801 d7010001 e0b20000 0c01cc0d 00005f5c fb0303ff 04fe00fe 000002ff
ffff88b97e752a80 1550291187 S Bi:4:003:1 -115 4096 <
ffff88b97e752f00 1550293185 C Bi:4:003:1 0 487 = 5b5d7901 d7010001 ee8b0100 0c01cc0d 00005f80 00c21713 17142114 0411f8f3
ffff88b97e752f00 1550293189 S Bi:4:003:1 -115 4096 <
ffff88b97e7520c0 1550294930 C Bi:4:003:1 0 478 = 5b5d7a01 d6010001 ef7f1000 0701cb0d 00006d6a 02fdfc03 fe06fd00 02feffff
ffff88b97e7520c0 1550294936 S Bi:4:003:1 -115 4096 <
ffff88b97e752840 1550296937 C Bi:4:003:1 0 486 = 5b5d7b01 d6010001 fd711100 0701cb0d 00006b80 014209da 9cc6de10 fafdf708
ffff88b97e752840 1550296948 S Bi:4:003:1 -115 4096 <
ffff88b97e752a80 1550298808 C Bi:4:003:1 0 479 = 5b5d7c01 d7010001 fe4a0000 0c01cc0d 00005e5e fc010101 ff0100ff 00fc0501
ffff88b97e752a80 1550298812 S Bi:4:003:1 -115 4096 <
ffff88b97e752f00 1550300806 C Bi:4:003:1 0 487 = 5b5d7d01 d7010001 0c240100 0c01cc0d 00005d80 00c01e10 1a0d2311 0410fded
ffff88b97e752f00 1550300810 S Bi:4:003:1 -115 4096 <
ffff88b97e7520c0 1550302556 C Bi:4:003:1 0 478 = 5b5d7e01 d6010001 0d181000 0701cb0d 0000706e fffa0402 fd07f406 00f70afe
ffff88b97e7520c0 1550302568 S Bi:4:003:1 -115 4096 <
ffff88b97e752840 1550304556 C Bi:4:003:1 0 486 = 5b5d7f01 d6010001 1b101100 0701cb0d 00006f80 014412d6 9cc3de0f f404f408
ffff88b97e752840 1550304562 S Bi:4:003:1 -115 4096 <
ffff88b97e752a80 1550306307 C Bi:4:003:1 0 479 = 5b5d8001 d7010001 1be90000 0c01cc0d 00006360 fe0005ff 01fd03fe fefe06fd
ffff88b97e752a80 1550306311 S Bi:4:003:1 -115 4096 <
ffff88b97e752f00 1550308430 C Bi:4:003:1 0 487 = 5b5d8101 d7010001 29c10100 0c01cc0d 00006180 00c51714 190c270f 0613f9ed
ffff88b97e752f00 1550308434 S Bi:4:003:1 -115 4096 <
ffff88b97e7520c0 1550310074 C Bi:4:003:1 0 478 = 5b5d8201 d6010001 2ab61000 0701cb0d 00006e6e fcfffb04 ff0bf802 fb010101
ffff88b97e7520c0 1550310086 S Bi:4:003:1 -115 4096 <
ffff88b97e752840 1550312182 C Bi:4:003:1 0 486 = 5b5d8301 d6010001 38a81100 0701cb0d 00006e80 01460cd8 a4bfdb11 f601f40b
ffff88b97e752840 1550312188 S Bi:4:003:1 -115 4096 <
ffff88b97e752a80 1550313930 C Bi:4:003:1 0 479 = 5b5d8401 d7010001 39800000 0c01cc0d 00005f5b 00fe0400 02fc04fe 01fc0102
ffff88b97e752a80 1550313934 S Bi:4:003:1 -115 4096 <
ffff88b97e752f00 1550316033 C Bi:4:003:1 0 487 = 5b5d8501 d7010001 475b0100 0c01cc0d 00005e80 00c21913 15102510 0513fdec
ffff88b97e752f00 1550316037 S Bi:4:003:1 -115 4096 <
ffff88b97e7520c0 1550317808 C Bi:4:003:1 0 478 = 5b5d8601 d6010001 484f1000 0701cb0d 00006f67 050001fe f90afaff 05fdff02
ffff88b97e7520c0 1550317819 S Bi:4:003:1 -115 4096 <
ffff88b97e752840 1550319811 C Bi:4:003:1 0 486 = 5b5d8701 d6010001 56471100 0701cb0d 00006b80 01420cdc a7b6e00e f400f70a
ffff88b97e752840 1550319816 S Bi:4:003:1 -115 4096 <
ffff88b97e752a80 1550321559 C Bi:4:003:1 0 479 = 5b5d8801 d7010001 57200000 0c01cc0d 00006360 fe0004fe 03fc0101 fefc0507
ffff88b97e752a80 1550321563 S Bi:4:003:1 -115 4096 <
ffff88b97e752f00 1550323557 C Bi:4:003:1 0 487 = 5b5d8901 d7010001 64f80100 0c01cc0d 00005e80 00c41a09 1f0d280c 0b0ffce9
ffff88b97e752f00 1550323561 S Bi:4:003:1 -115 4096 <
ffff88b97e7520c0 1550325311 C Bi:4:003:1 0 478 = 5b5d8a01 d6010001 65ed1000 0701cb0d 00006d68 ff02fe00 fe07fc01 fe020100
ffff88b97e7520c0 1550325322 S Bi:4:003:1 -115 4096 <
ffff88b97e752840 1550327302 C Bi:4:003:1 0 488 = 5b5d8b01 d6010001 73de1100 0701cb0d 00006d80 01480edc 9ec0dd0b f902f107
ffff88b97e752840 1550327314 S Bi:4:003:1 -115 4096 <
ffff88b97e752a80 1550329183 C Bi:4:003:1 0 479 = 5b5d8c01 d7010001 74b70000 0c01cc0d 00005f5b 000002fe 05fb01ff ff0004ff
ffff88b97e752a80 1550329187 S Bi:4:003:1 -115 4096 <
ffff88b97e752f00 1550331198 C Bi:4:003:1 0 487 = 5b5d8d01 d7010001 828c0100 0c01cc0d 00005f80 00c21812 1c102113 0412f9ed
ffff88b97e752f00 1550331202 S Bi:4:003:1 -115 4096 <
ffff88b97e7520c0 1550332934 C Bi:4:003:1 0 478 = 5b5d8e01 d6010001 83811000 0701cb0d 00006867 fdfc0002 fc09fb02 01fdfe03
ffff88b97e7520c0 1550332940 S Bi:4:003:1 -115 4096 <
ffff88b97e752840 1550334940 C Bi:4:003:1 0 488 = 5b5d8f01 d6010001 91791100 0701cb0d 00006c80 014614d6 b1b2d410 f4fdfb09
ffff88b97e752840 1550334945 S Bi:4:003:1 -115 4096 <
ffff88b97e752a80 1550336808 C Bi:4:003:1 0 479 = 5b5d9001 d7010001 92510000 0c01cc0d 00005d5b fffe0500 00ff01ff fffe03ff
ffff88b97e752a80 1550336812 S Bi:4:003:1 -115 4096 <
ffff88b97e752f00 1550338808 C Bi:4:003:1 0 487 = 5b5d9101 d7010001 a02b0100 0c01cc0d 00005e80 00c11217 1d0c280c 0911f8ef
ffff88b97e752f00 1550338812 S Bi:4:003:1 -115 4096 <
ffff88b97e7520c0 1550340557 C Bi:4:003:1 0 478 = 5b5d9201 d6010001 a1201000 0701cb0d 0000706e 01fdff03 f90bf900 fe0203ff
ffff88b97e7520c0 1550340569 S Bi:4:003:1 -115 4096 <
ffff88b97e752840 1550342556 C Bi:4:003:1 0 486 = 5b5d9301 d6010001 af111100 0701cb0d 00006d80 014b0ce1 a8b0df0e f5fef508
ffff88b97e752840 1550342568 S Bi:4:003:1 -115 4096 <
ffff88b97e752a80 1550344312 C Bi:4:003:1 0 479 = 5b5d9401 d7010001 afea0000 0c01cc0d 00005f5d 00000001 02fc02ff 00fd0105
ffff88b97e752a80 1550344316 S Bi:4:003:1 -115 4096 <
ffff88b97e752f00 1550346434 C Bi:4:003:1 0 487 = 5b5d9501 d7010001 bdbc0100 0c01cc0d 00005d80 00bc1a10 1f0e2412 0313fbed
ffff88b97e752f00 1550346438 S Bi:4:003:1 -115 4096 <
ffff88b97e7520c0 1550348057 C Bi:4:003:1 0 478 = 5b5d9601 d6010001 beb11000 0701cb0d 00006e69 08fb02fb fd06f409 0000fc06
ffff88b97e7520c0 1550348063 S Bi:4:003:1 -115 4096 <
ffff88b97e752840 1550350182 C Bi:4:003:1 0 488 = 5b5d9701 d6010001 ccab1100 0701cb0d 00006f80 014a11dc aeafdc0c f5fdf40a
ffff88b97e752840 1550350193 S Bi:4:003:1 -115 4096 <
ffff88b97e752a80 1550351932 C Bi:4:003:1 0 479 = 5b5d9801 d7010001 cd830000 0c01cc0d 00006263 fefc03fe 03fc04fd 01fb0600
ffff88b97e752a80 1550351936 S Bi:4:003:1 -115 4096 <
ffff88b97e752f00 1550354057 C Bi:4:003:1 0 487 = 5b5d9901 d7010001 db5d0100 0c01cc0d 00005b80 00bd1b11 1b132011 0512fbeb
ffff88b97e752f00 1550354061 S Bi:4:003:1 -115 4096 <
ffff88b97e7520c0 1550355806 C Bi:4:003:1 0 478 = 5b5d9a01 d6010001 dc521000 0701cb0d 00006a67 fefc0005 0004fa04 fa02fe01
ffff88b97e7520c0 1550355812 S Bi:4:003:1 -115 4096 <
ffff88b97e752840 1550357806 C Bi:4:003:1 0 486 = 5b5d9b01 d6010001 ea4a1100 0701cb0d 00006980 01470cde afa9de0e f9fcf707
ffff88b97e752840 1550357812 S Bi:4:003:1 -115 4096 <
ffff88b97e752a80 1550359557 C Bi:4:003:1 0 479 = 5b5d9c01 d7010001 eb220000 0c01cc0d 0000605b 01fe0301 03fb02fe fe0102fe
ffff88b97e752a80 1550359561 S Bi:4:003:1 -115 4096 <
ffff88b97e752f00 1550361557 C Bi:4:003:1 0 487 = 5b5d9d01 d7010001 f8f50100 0c01cc0d 00005f80 00c31414 1a0f2610 0710faed
ffff88b97e752f00 1550361561 S Bi:4:003:1 -115 4096 <
ffff88b97e7520c0 1550363321 C Bi:4:003:1 0 478 = 5b5d9e01 d6010001 f9e91000 0701cb0d 00006e6a 05faff03 fc07f509 fe0001ff
ffff88b97e7520c0 1550363333 S Bi:4:003:1 -115 4096 <
ffff88b97e752840 1550365299 C Bi:4:003:1 0 486 = 5b5d9f01 d6010001 07e31100 0701cb0d 00006c80 01490fdb afacdd0b f6fff808
ffff88b97e752840 1550365305 S Bi:4:003:1 -115 4096 <
ffff88b97e752a80 1550367207 C Bi:4:003:1 0 479 = 5b5da001 d7010001 08bb0000 0c01cc0d 00005f5c 04fa05fd 05f906fe fdfe04fd
ffff88b97e752a80 1550367212 S Bi:4:003:1 -115 4096 <
ffff88b97e752f00 1550369196 C Bi:4:003:1 0 487 = 5b5da101 d7010001 16940100 0c01cc0d 00006080 00c31711 1c10270a 0814f9ec
ffff88b97e752f00 1550369200 S Bi:4:003:1 -115 4096 <
ffff88b97e7520c0 1550370935 C Bi:4:003:1 0 478 = 5b5da201 d6010001 17891000 0701cb0d 00006a66 01fa04ff f80ef903 03fa0001
ffff88b97e7520c0 1550370946 S Bi:4:003:1 -115 4096 <
ffff88b97e752840 1550372946 C Bi:4:003:1 0 486 = 5b5da301 d6010001 25811100 0701cb0d 00006b80 01460fde a8b8d90d f5fef807
ffff88b97e752840 1550372952 S Bi:4:003:1 -115 4096 <
ffff88b97e752a80 1550374808 C Bi:4:003:1 0 479 = 5b5da401 d7010001 26590000 0c01cc0d 0000615f ff00ff01 04fc03fa 03fd07fd
ffff88b97e752a80 1550374812 S Bi:4:003:1 -115 4096 <
ffff88b97e752f00 1550376810 C Bi:4:003:1 0 487 = 5b5da501 d7010001 342c0100 0c01cc0d 00005e80 00c51512 1c0e2411 0414f7ec
ffff88b97e752f00 1550376814 S Bi:4:003:1 -115 4096 <
ffff88b97e7520c0 1550378556 C Bi:4:003:1 0 478 = 5b5da601 d6010001 35201000 0701cb0d 00006b68 fefd0302 fb07f901 00fe04fe
ffff88b97e7520c0 1550378562 S Bi:4:003:1 -115 4096 <
ffff88b97e752840 1550380556 C Bi:4:003:1 0 486 = 5b5da701 d6010001 431a1100 0701cb0d 00006a80 014311d5 abb3e208 f707f40b
ffff88b97e752840 1550380568 S Bi:4:003:1 -115 4096 <
ffff88b97e752a80 1550382301 C Bi:4:003:1 0 479 = 5b5da801 d7010001 43f30000 0c01cc0d 0000605e 01fa05fe 05fa0000 00ff0202
ffff88b97e752a80 1550382320 S Bi:4:003:1 -115 4096 <
ffff88b97e752f00 1550384435 C Bi:4:003:1 0 487 = 5b5da901 d7010001 51cb0100 0c01cc0d 00005e80 00c01813 1c0f240e 0414fbeb
ffff88b97e752f00 1550384439 S Bi:4:003:1 -115 4096 <
ffff88b97e7520c0 1550386182 C Bi:4:003:1 0 478 = 5b5daa01 d6010001 52c01000 0701cb0d 0000706f 02f30bff ff00f903 fd08fefc
ffff88b97e7520c0 1550386193 S Bi:4:003:1 -115 4096 <
ffff88b97e752840 1550388185 C Bi:4:003:1 0 486 = 5b5dab01 d6010001 60b71100 0701cb0d 00006f80 014a0dd9 9bc3df0c f9fff706
ffff88b97e752840 1550388197 S Bi:4:003:1 -115 4096 <
ffff88b97e752a80 1550389933 C Bi:4:003:1 0 479 = 5b5dac01 d7010001 61900000 0c01cc0d 0000615e ff00ff02 010100fd 01fc05fe
ffff88b97e752a80 1550389937 S Bi:4:003:1 -115 4096 <
ffff88b97e752f00 1550392057 C Bi:4:003:1 0 485 = 5b5dad01 d7010001 6f620100 0c01cc0d 00006080 00c11a11 1b11250d 0613f8ee
ffff88b97e752f00 1550392061 S Bi:4:003:1 -115 4096 <
ffff88b97e7520c0 1550393806 C Bi:4:003:1 0 478 = 5b5dae01 d6010001 70571000 0701cb0d 00006a67 fffa0304 0104fb03 f80102fa
ffff88b97e7520c0 1550393818 S Bi:4:003:1 -115 4096 <
ffff88b97e752840 1550395808 C Bi:4:003:1 0 486 = 5b5daf01 d6010001 7e4e1100 0701cb0d 00006d80 014710d0 a5c2e10b f3fef807
ffff88b97e752840 1550395814 S Bi:4:003:1 -115 4096 <
ffff88b97e752a80 1550397557 C Bi:4:003:1 0 479 = 5b5db001 d7010001 7f260000 0c01cc0d 0000605b 02fe02fe 05fd02fa 01ff0202
ffff88b97e752a80 1550397561 S Bi:4:003:1 -115 4096 <
ffff88b97e752f00 1550399557 C Bi:4:003:1 0 485 = 5b5db101 d7010001 8d010100 0c01cc0d 00005e80 00c41811 1a0d2314 0411fded
ffff88b97e752f00 1550399561 S Bi:4:003:1 -115 4096 <
ffff88b97e7520c0 1550401323 C Bi:4:003:1 0 478 = 5b5db201 d6010001 8df51000 0701cb0d 00006d69 0200fd04 f80af803 00ff0000
ffff88b97e7520c0 1550401334 S Bi:4:003:1 -115 4096 <
ffff88b97e752840 1550403282 C Bi:4:003:1 0 486 = 5b5db301 d6010001 9bec1100 0701cb0d 00006b80 01400fd5 a0c3de10 f1fd0006
ffff88b97e752840 1550403290 S Bi:4:003:1 -115 4096 <
ffff88b97e752a80 1550405186 C Bi:4:003:1 0 479 = 5b5db401 d7010001 9cc40000 0c01cc0d 00005f5c 05faff02 04fcff02 fffb0502
ffff88b97e752a80 1550405191 S Bi:4:003:1 -115 4096 <
ffff88b97e752f00 1550407197 C Bi:4:003:1 0 485 = 5b5db501 d7010001 aa970100 0c01cc0d 00005e80 00bf1a14 1b092b0c 0513fbea
ffff88b97e752f00 1550407201 S Bi:4:003:1 -115 4096 <
ffff88b97e7520c0 1550408932 C Bi:4:003:1 0 478 = 5b5db601 d6010001 ab8b1000 0701cb0d 00006e6b ff020002 fc05f603 02000004
ffff88b97e7520c0 1550408938 S Bi:4:003:1 -115 4096 <
ffff88b97e752840 1550410935 C Bi:4:003:1 0 486 = 5b5db701 d6010001 b9821100 0701cb0d 00006a80 01420ad5 9ac8de12 f802f20f
ffff88b97e752840 1550410951 S Bi:4:003:1 -115 4096 <
ffff88b97e752a80 1550412806 C Bi:4:003:1 0 479 = 5b5db801 d7010001 ba5b0000 0c01cc0d 0000625e 02fd0102 00fd04fd 00fc06fd
ffff88b97e752a80 1550412811 S Bi:4:003:1 -115 4096 <
ffff88b97e752f00 1550414808 C Bi:4:003:1 0 485 = 5b5db901 d7010001 c8350100 0c01cc0d 00005c80 00c51513 16112312 0115fbea
ffff88b97e752f00 1550414812 S Bi:4:003:1 -115 4096 <
ffff88b97e7520c0 1550416558 C Bi:4:003:1 0 478 = 5b5dba01 d6010001 c9291000 0701cb0d 00007070 fcfe06fe fd05f802 04fd03fe
ffff88b97e7520c0 1550416570 S Bi:4:003:1 -115 4096 <
ffff88b97e752840 1550418556 C Bi:4:003:1 0 486 = 5b5dbb01 d6010001 d7201100 0701cb0d 00006980 01400dd0 9bc8e30f fafcfa0c
ffff88b97e752840 1550418568 S Bi:4:003:1 -115 4096 <
ffff88b97e752a80 1550420302 C Bi:4:003:1 0 479 = 5b5dbc01 d7010001 d7f90000 0c01cc0d 0000615f feff02fe 08fcff02 fffc0101
ffff88b97e752a80 1550420306 S Bi:4:003:1 -115 4096 <
ffff88b97e752f00 1550422432 C Bi:4:003:1 0 485 = 5b5dbd01 d7010001 e5cb0100 0c01cc0d 00005c80 00c1180f 1d0b280e 0612fbee
ffff88b97e752f00 1550422436 S Bi:4:003:1 -115 4096 <
ffff88b97e7520c0 1550424186 C Bi:4:003:1 0 478 = 5b5dbe01 d6010001 e6bf1000 0701cb0d 00006d6d fb010101 fd0af603 fbfe0004
ffff88b97e7520c0 1550424197 S Bi:4:003:1 -115 4096 <
ffff88b97e752840 1550426184 C Bi:4:003:1 0 486 = 5b5dbf01 d6010001 f4b61100 0701cb0d 00006f80 01490dcf a4c1e50f f6fdf40b
ffff88b97e752840 1550426196 S Bi:4:003:1 -115 4096 <
ffff88b97e752a80 1550427937 C Bi:4:003:1 0 479 = 5b5dc001 d7010001 f58e0000 0c01cc0d 0000605d 00fe05ff 02fc00fe 00ff0202
ffff88b97e752a80 1550427941 S Bi:4:003:1 -115 4096 <
ffff88b97e752f00 1550430058 C Bi:4:003:1 0 483 = 5b5dc101 d7010001 03690100 0c01cc0d 00005d80 00c41612 1612260e 0412fcea
ffff88b97e752f00 1550430062 S Bi:4:003:1 -115 4096 <
ffff88b97e7520c0 1550431806 C Bi:4:003:1 0 478 = 5b5dc201 d6010001 045d1000 0701cb0d 00006c6b fffc0200 0106fa00 00fffd01
ffff88b97e7520c0 1550431818 S Bi:4:003:1 -115 4096 <
ffff88b97e752840 1550433830 C Bi:4:003:1 0 486 = 5b5dc301 d6010001 12531100 0701cb0d 00006f80 014411d1 bcd2d313 f1010011
ffff88b97e752840 1550433841 S Bi:4:003:1 -115 4096 <
ffff88b97e752a80 1550435555 C Bi:4:003:1 0 479 = 5b5dc401 d7010001 132b0000 0c01cc0d 0000615d 03fd0003 04fa05fb ff020202
ffff88b97e752a80 1550435559 S Bi:4:003:1 -115 4096 <
ffff88b97e752f00 1550437549 C Bi:4:003:1 0 483 = 5b5dc501 d7010001 20fe0100 0c01cc0d 00005c80 00c11117 1c12220d 0615f8ef
ffff88b97e752f00 1550437553 S Bi:4:003:1 -115 4096 <
ffff88b97e7520c0 1550439307 C Bi:4:003:1 0 478 = 5b5dc601 d6010001 21f21000 0701cb0d 00006f6a 03ff01fd fe06fa01 04fc0100
ffff88b97e7520c0 1550439318 S Bi:4:003:1 -115 4096 <
ffff88b97e752840 1550441307 C Bi:4:003:1 0 486 = 5b5dc701 d6010001 2fe81100 0701cb0d 00006c80 014e14ec eae4d30f 0a09fd1c
ffff88b97e752840 1550441319 S Bi:4:003:1 -115 4096 <
ffff88b97e752a80 1550443182 C Bi:4:003:1 0 479 = 5b5dc801 d7010001 30c00000 0c01cc0d 0000625f fd0301fe 02fd0102 fa010202
ffff88b97e752a80 1550443186 S Bi:4:003:1 -115 4096 <
ffff88b97e752f00 1550445196 C Bi:4:003:1 0 483 = 5b5dc901 d7010001 3e990100 0c01cc0d 00005e80 00bc1d11 1c0d290b 0911fbeb
ffff88b97e752f00 1550445200 S Bi:4:003:1 -115 4096 <
ffff88b97e7520c0 1550446934 C Bi:4:003:1 0 478 = 5b5dca01 d6010001 3f8d1000 0701cb0d 00006d67 02feff03 0206f603 fffd0003
ffff88b97e7520c0 1550446939 S Bi:4:003:1 -115 4096 <
ffff88b97e752840 1550448939 C Bi:4:003:1 0 488 = 5b5dcb01 d6010001 4d841100 0701cb0d 00006a80 01531bfe 07f8e70e 0c05ff09
ffff88b97e752840 1550448944 S Bi:4:003:1 -115 4096 <
ffff88b97e752a80 1550450806 C Bi:4:003:1 0 479 = 5b5dcc01 d7010001 4e5d0000 0c01cc0d 0000605f fffefe06 00fc0104 fefbff07
ffff88b97e752a80 1550450810 S Bi:4:003:1 -115 4096 <
ffff88b97e752f00 1550452809 C Bi:4:003:1 0 483 = 5b5dcd01 d7010001 5c310100 0c01cc0d 00005e80 00c41513 180e2411 0618f4f1
ffff88b97e752f00 1550452813 S Bi:4:003:1 -115 4096 <
ffff88b97e7520c0 1550454561 C Bi:4:003:1 0 478 = 5b5dce01 d6010001 5d251000 0701cb0d 00007270 01fcfd09 f804fc02 fefe05ff
ffff88b97e7520c0 1550454573 S Bi:4:003:1 -115 4096 <
ffff88b97e752840 1550456557 C Bi:4:003:1 0 488 = 5b5dcf01 d6010001 6b141100 0701cb0d 00006c80 01551afc 06fae312 1102fc0c
ffff88b97e752840 1550456563 S Bi:4:003:1 -115 4096 <
ffff88b97e752a80 1550458301 C Bi:4:003:1 0 479 = 5b5dd001 d7010001 6bed0000 0c01cc0d 00005f5d fdfe07ff ffff01ff fffb08ff
ffff88b97e752a80 1550458305 S Bi:4:003:1 -115 4096 <
ffff88b97e752f00 1550460433 C Bi:4:003:1 0 483 = 5b5dd101 d7010001 79c70100 0c01cc0d 00006080 00c81213 1b0e260d 0712fbeb
ffff88b97e752f00 1550460438 S Bi:4:003:1 -115 4096 <
ffff88b97e7520c0 1550462059 C Bi:4:003:1 0 478 = 5b5dd201 d6010001 7abc1000 0701cb0d 00007471 fcfe06fc 0005f706 fcff05fe
ffff88b97e7520c0 1550462071 S Bi:4:003:1 -115 4096 <
ffff88b97e752840 1550464184 C Bi:4:003:1 0 488 = 5b5dd301 d6010001 88b31100 0701cb0d 00006d80 015618fa 09f8e310 120bf70d
ffff88b97e752840 1550464190 S Bi:4:003:1 -115 4096 <
ffff88b97e752a80 1550465933 C Bi:4:003:1 0 479 = 5b5dd401 d7010001 898b0000 0c01cc0d 00006161 fefc0203 03f905fd 00fc0401
ffff88b97e752a80 1550465938 S Bi:4:003:1 -115 4096 <
ffff88b97e752f00 1550467939 C Bi:4:003:1 0 483 = 5b5dd501 d7010001 975f0100 0c01cc0d 00005d80 00c01b12 17102212 0613f9ed
ffff88b97e752f00 1550467943 S Bi:4:003:1 -115 4096 <
ffff88b97e7520c0 1550469807 C Bi:4:003:1 0 478 = 5b5dd601 d6010001 98541000 0701cb0d 00006e6a 03fe0205 f706f902 01ffff03
ffff88b97e7520c0 1550469818 S Bi:4:003:1 -115 4096 <
ffff88b97e752840 1550471811 C Bi:4:003:1 0 488 = 5b5dd701 d6010001 a6431100 0701cb0d 00006e80 01551ef9 00ffec0c 0e07fa08
ffff88b97e752840 1550471816 S Bi:4:003:1 -115 4096 <
ffff88b97e752a80 1550473557 C Bi:4:003:1 0 479 = 5b5dd801 d7010001 a71c0000 0c01cc0d 00005e5b 010001fc 07fd03fe fefe03ff
ffff88b97e752a80 1550473562 S Bi:4:003:1 -115 4096 <
ffff88b97e752f00 1550475580 C Bi:4:003:1 0 483 = 5b5dd901 d7010001 b4f50100 0c01cc0d 00005f80 00c51811 1e09290b 0911fcea
ffff88b97e752f00 1550475584 S Bi:4:003:1 -115 4096 <
ffff88b97e7520c0 1550477308 C Bi:4:003:1 0 478 = 5b5dda01 d6010001 b5ea1000 0701cb0d 00006a66 03f903fa 0507fb01 fffc03fe
ffff88b97e7520c0 1550477314 S Bi:4:003:1 -115 4096 <
ffff88b97e752840 1550479300 C Bi:4:003:1 0 486 = 5b5ddb01 d6010001 c3e11100 0701cb0d 00006e80 015915f8 0cfae711 0c0af906
ffff88b97e752840 1550479306 S Bi:4:003:1 -115 4096 <
ffff88b97e752a80 1550481062 C Bi:4:003:1 0 479 = 5b5ddc01 d7010001 c4ba0000 0c01cc0d 00005d5b fefd0500 0101fe00 00fe0203
ffff88b97e752a80 1550481066 S Bi:4:003:1 -115 4096 <
ffff88b97e752f00 1550483182 C Bi:4:003:1 0 483 = 5b5ddd01 d7010001 d2920100 0c01cc0d 00005c80 00c41116 1b0d2411 0413f9f2
ffff88b97e752f00 1550483186 S Bi:4:003:1 -115 4096 <
ffff88b97e7520c0 1550484934 C Bi:4:003:1 0 478 = 5b5dde01 d6010001 d3871000 0701cb0d 00006a68 fffd02fa 0703fc04 fffa02ff
ffff88b97e7520c0 1550484946 S Bi:4:003:1 -115 4096 <
ffff88b97e752840 1550486933 C Bi:4:003:1 0 486 = 5b5ddf01 d6010001 e1761100 0701cb0d 00007080 015918f8 07fdea0b 1005fc07
ffff88b97e752840 1550486939 S Bi:4:003:1 -115 4096 <
ffff88b97e752a80 1550488808 C Bi:4:003:1 0 479 = 5b5de001 d7010001 e24f0000 0c01cc0d 00006061 fdfe02ff 04fa05fd 01fd0202
ffff88b97e752a80 1550488812 S Bi:4:003:1 -115 4096 <
ffff88b97e752f00 1550490809 C Bi:4:003:1 0 483 = 5b5de101 d7010001 f0270100 0c01cc0d 00005f80 00be1a12 1a112310 0612f9f1
ffff88b97e752f00 1550490813 S Bi:4:003:1 -115 4096 <
ffff88b97e7520c0 1550492560 C Bi:4:003:1 0 478 = 5b5de201 d6010001 f11c1000 0701cb0d 00006c6b fefffd00 0402fc04 00fcff01
ffff88b97e7520c0 1550492572 S Bi:4:003:1 -115 4096 <
ffff88b97e752840 1550494562 C Bi:4:003:1 0 488 = 5b5de301 d6010001 ff111100 0701cb0d 00006c80 015912fd 06f9ec0e 0c0bf50d
ffff88b97e752840 1550494567 S Bi:4:003:1 -115 4096 <
ffff88b97e752a80 1550496327 C Bi:4:003:1 0 479 = 5b5de401 d7010001 ffea0000 0c01cc0d 0000605f fdff0302 00fb05fc 01fb08fe
ffff88b97e752a80 1550496331 S Bi:4:003:1 -115 4096 <
ffff88b97e752f00 1550498436 C Bi:4:003:1 0 483 = 5b5de501 d7010001 0dc60100 0c01cc0d 00005c80 00bc1a14 1e0b260c 0416fdea
ffff88b97e752f00 1550498440 S Bi:4:003:1 -115 4096 <
ffff88b97e7520c0 1550500055 C Bi:4:003:1 0 478 = 5b5de601 d6010001 0eba1000 0701cb0d 0000706c 01fc0204 fd04f604 fc040001
ffff88b97e7520c0 1550500061 S Bi:4:003:1 -115 4096 <
ffff88b97e752840 1550502187 C Bi:4:003:1 0 488 = 5b5de701 d6010001 1ca91100 0701cb0d 00006b80 01561ef3 0afae60f 0c03020b
ffff88b97e752840 1550502192 S Bi:4:003:1 -115 4096 <
ffff88b97e752a80 1550503934 C Bi:4:003:1 0 479 = 5b5de801 d7010001 1d820000 0c01cc0d 00005e5b 04fb04fe 04feffff 01fc05fe
ffff88b97e752a80 1550503938 S Bi:4:003:1 -115 4096 <
ffff88b97e752f00 1550505939 C Bi:4:003:1 0 483 = 5b5de901 d7010001 2b5c0100 0c01cc0d 00005e80 00c41316 180d290b 0810faef
ffff88b97e752f00 1550505943 S Bi:4:003:1 -115 4096 <
ffff88b97e7520c0 1550507809 C Bi:4:003:1 0 478 = 5b5dea01 d6010001 2c501000 0701cb0d 00006c68 04fa0200 fd07f00e fdfd05ff
ffff88b97e7520c0 1550507820 S Bi:4:003:1 -115 4096 <
ffff88b97e752840 1550509810 C Bi:4:003:1 0 488 = 5b5deb01 d6010001 3a461100 0701cb0d 00006c80 015917fa 08f9e812 0c05fd09
ffff88b97e752840 1550509815 S Bi:4:003:1 -115 4096 <
ffff88b97e752a80 1550511559 C Bi:4:003:1 0 479 = 5b5dec01 d7010001 3b1f0000 0c01cc0d 0000615a 05ff0101 00fe01fe 02fc0204
ffff88b97e752a80 1550511563 S Bi:4:003:1 -115 4096 <
ffff88b97e752f00 1550513577 C Bi:4:003:1 0 483 = 5b5ded01 d7010001 48fa0100 0c01cc0d 00005d80 00c01518 170f260d 0815f3f1
ffff88b97e752f00 1550513581 S Bi:4:003:1 -115 4096 <
ffff88b97e7520c0 1550515307 C Bi:4:003:1 0 478 = 5b5dee01 d6010001 49ef1000 0701cb0d 00006f71 fdfb0205 f903fb01 fb0601ff
ffff88b97e7520c0 1550515318 S Bi:4:003:1 -115 4096 <
ffff88b97e752840 1550517330 C Bi:4:003:1 0 486 = 5b5def01 d6010001 57de1100 0701cb0d 00006c80 015619fe 04fce90f 0d05fa0a
ffff88b97e752840 1550517336 S Bi:4:003:1 -115 4096 <
ffff88b97e752a80 1550519067 C Bi:4:003:1 0 479 = 5b5df001 d7010001 58b60000 0c01cc0d 0000605d 01ff0101 00fd02fe 01fd0303
ffff88b97e752a80 1550519071 S Bi:4:003:1 -115 4096 <
ffff88b97e752f00 1550521185 C Bi:4:003:1 0 485 = 5b5df101 d7010001 668f0100 0c01cc0d 00005c80 00c11614 1b0e240c 0812f9ef
ffff88b97e752f00 1550521189 S Bi:4:003:1 -115 4096 <
ffff88b97e7520c0 1550522933 C Bi:4:003:1 0 478 = 5b5df201 d6010001 67831000 0701cb0d 00006d67 04fd0002 fa02fe05 fe03fd00
ffff88b97e7520c0 1550522945 S Bi:4:003:1 -115 4096 <
ffff88b97e752840 1550524933 C Bi:4:003:1 0 488 = 5b5df301 d6010001 757a1100 0701cb0d 00006e80 015520fb 02ffe60d 0d03fc0e
ffff88b97e752840 1550524938 S Bi:4:003:1 -115 4096 <
ffff88b97e752a80 1550526808 C Bi:4:003:1 0 479 = 5b5df401 d7010001 76530000 0c01cc0d 00005f5b 01ff0300 03fb04fd 01fa06fd
ffff88b97e752a80 1550526812 S Bi:4:003:1 -115 4096 <
ffff88b97e752f00 1550528808 C Bi:4:003:1 0 483 = 5b5df501 d7010001 842e0100 0c01cc0d 00005d80 00c3190f 1a10230f 0710fbf0
ffff88b97e752f00 1550528812 S Bi:4:003:1 -115 4096 <
ffff88b97e7520c0 1550530560 C Bi:4:003:1 0 478 = 5b5df601 d6010001 85231000 0701cb0d 00006b66 03fb03fe 0104f903 020002fa
ffff88b97e7520c0 1550530571 S Bi:4:003:1 -115 4096 <
ffff88b97e752840 1550532557 C Bi:4:003:1 0 486 = 5b5df701 d6010001 93121100 0701cb0d 00006d80 01541cfe 05f8e811 0d04fc0b
ffff88b97e752840 1550532563 S Bi:4:003:1 -115 4096 <
ffff88b97e752a80 1550534310 C Bi:4:003:1 0 479 = 5b5df801 d7010001 93eb0000 0c01cc0d 0000625f ff0101ff 03fb0201 00fb0502
ffff88b97e752a80 1550534314 S Bi:4:003:1 -115 4096 <
ffff88b97e752f00 1550536437 C Bi:4:003:1 0 483 = 5b5df901 d7010001 a1c30100 0c01cc0d 00005e80 00c11812 17122808 0c10f8f0
ffff88b97e752f00 1550536441 S Bi:4:003:1 -115 4096 <
ffff88b97e7520c0 1550538077 C Bi:4:003:1 0 478 = 5b5dfa01 d6010001 a2b81000 0701cb0d 00006f6e fb010300 fd07faff fe00ff03
ffff88b97e7520c0 1550538083 S Bi:4:003:1 -115 4096 <
ffff88b97e752840 1550540183 C Bi:4:003:1 0 486 = 5b5dfb01 d6010001 b0ad1100 0701cb0d 00007380 015a1cfa 08f9e611 070aff01
ffff88b97e752840 1550540189 S Bi:4:003:1 -115 4096 <
ffff88b97e752a80 1550541936 C Bi:4:003:1 0 479 = 5b5dfc01 d7010001 b1860000 0c01cc0d 0000615c 02fc0600 01fc04fb 03fc07ff
ffff88b97e752a80 1550541941 S Bi:4:003:1 -115 4096 <
ffff88b97e752f00 1550543942 C Bi:4:003:1 0 485 = 5b5dfd01 d7010001 bf5f0100 0c01cc0d 00005e80 00c21814 170e2613 0411fbec
ffff88b97e752f00 1550543946 S Bi:4:003:1 -115 4096 <
ffff88b97e7520c0 1550545683 C Bi:4:003:1 0 478 = 5b5dfe01 d6010001 c0531000 0701cb0d 00006c6a 02f80201 0104fb02 ffffff01
ffff88b97e7520c0 1550545694 S Bi:4:003:1 -115 4096 <
ffff88b97e752840 1550547809 C Bi:4:003:1 0 486 = 5b5dff01 d6010001 ce431100 0701cb0d 00006880 01521bfb 07f8e80d 0d09ff05
ffff88b97e752840 1550547814 S Bi:4:003:1 -115 4096 <
ffff88b97e752a80 1550549559 C Bi:4:003:1 0 479 = 5b5d0001 d7010001 cf1c0000 0c01cc0d 0000605e ffff0100 0400fefe 01fd02ff
ffff88b97e752a80 1550549564 S Bi:4:003:1 -115 4096 <
ffff88b97e752f00 1550551551 C Bi:4:003:1 0 487 = 5b5d0101 d7010001 dcf50100 0c01cc0d 00005d80 00c6140f 1c0e260e 0b0e00e5
ffff88b97e752f00 1550551555 S Bi:4:003:1 -115 4096 <
ffff88b97e7520c0 1550553310 C Bi:4:003:1 0 478 = 5b5d0201 d6010001 dde91000 0701cb0d 0000706c 01ffff04 fd03fa01 fe010001
ffff88b97e7520c0 1550553321 S Bi:4:003:1 -115 4096 <
ffff88b97e752840 1550555322 C Bi:4:003:1 0 488 = 5b5d0301 d6010001 ebe11100 0701cb0d 00007080 015c1bf6 07fde611 0d02fe07
ffff88b97e752840 1550555327 S Bi:4:003:1 -115 4096 <
ffff88b97e752a80 1550557184 C Bi:4:003:1 0 479 = 5b5d0401 d7010001 ecba0000 0c01cc0d 00006260 00fe0204 fefd0101 fffd0202
ffff88b97e752a80 1550557189 S Bi:4:003:1 -115 4096 <
ffff88b97e752f00 1550559185 C Bi:4:003:1 0 485 = 5b5d0501 d7010001 fa930100 0c01cc0d 00005c80 00c31114 1b10230e 091000e6
ffff88b97e752f00 1550559189 S Bi:4:003:1 -115 4096 <
ffff88b97e7520c0 1550560933 C Bi:4:003:1 0 478 = 5b5d0601 d6010001 fb881000 0701cb0d 00006f69 ff020103 fe09f108 fdfd0301
ffff88b97e7520c0 1550560945 S Bi:4:003:1 -115 4096 <
ffff88b97e752840 1550562934 C Bi:4:003:1 0 486 = 5b5d0701 d6010001 097a1100 0701cb0d 00006b80 015023f7 0afbdf12 0b08fe0a
ffff88b97e752840 1550562940 S Bi:4:003:1 -115 4096 <
ffff88b97e752a80 1550564809 C Bi:4:003:1 0 479 = 5b5d0801 d7010001 0a530000 0c01cc0d 00005f5c fe0103fe 03fc0401 fcfe0202
ffff88b97e752a80 1550564813 S Bi:4:003:1 -115 4096 <
ffff88b97e752f00 1550566809 C Bi:4:003:1 0 485 = 5b5d0901 d7010001 182b0100 0c01cc0d 00005e80 00c61314 16132312 030f02e9
ffff88b97e752f00 1550566813 S Bi:4:003:1 -115 4096 <
ffff88b97e7520c0 1550568560 C Bi:4:003:1 0 478 = 5b5d0a01 d6010001 19201000 0701cb0d 00006a63 07fe00ff fa08f509 fcff0401
ffff88b97e7520c0 1550568571 S Bi:4:003:1 -115 4096 <
ffff88b97e752840 1550570559 C Bi:4:003:1 0 488 = 5b5d0b01 d6010001 27171100 0701cb0d 00006c80 01561cfb 03f8e416 0e05fe0a
ffff88b97e752840 1550570564 S Bi:4:003:1 -115 4096 <
ffff88b97e752a80 1550572309 C Bi:4:003:1 0 479 = 5b5d0c01 d7010001 27ef0000 0c01cc0d 00005d59 01fe0400 01fe0002 fefd05fe
ffff88b97e752a80 1550572313 S Bi:4:003:1 -115 4096 <
ffff88b97e752f00 1550574433 C Bi:4:003:1 0 483 = 5b5d0d01 d7010001 35c90100 0c01cc0d 00005e80 00c01a10 1a0e2511 0613faeb
ffff88b97e752f00 1550574437 S Bi:4:003:1 -115 4096 <
ffff88b97e7520c0 1550576061 C Bi:4:003:1 0 478 = 5b5d0e01 d6010001 36be1000 0701cb0d 00006d6c fffb08fb fd09f6ff 0201ff01
ffff88b97e7520c0 1550576067 S Bi:4:003:1 -115 4096 <
ffff88b97e752840 1550578187 C Bi:4:003:1 0 486 = 5b5d0f01 d6010001 44af1100 0701cb0d 00006e80 01591cf9 02fee216 0a0af909
ffff88b97e752840 1550578193 S Bi:4:003:1 -115 4096 <
ffff88b97e752a80 1550579935 C Bi:4:003:1 0 479 = 5b5d1001 d7010001 45870000 0c01cc0d 0000615e fc0600fa 07fc0200 feff05fc
ffff88b97e752a80 1550579939 S Bi:4:003:1 -115 4096 <
ffff88b97e752f00 1550581932 C Bi:4:003:1 0 483 = 5b5d1101 d7010001 535a0100 0c01cc0d 00005d80 00c11812 1a0d260e 0813f7f1
ffff88b97e752f00 1550581936 S Bi:4:003:1 -115 4096 <
ffff88b97e7520c0 1550583689 C Bi:4:003:1 0 478 = 5b5d1201 d6010001 544e1000 0701cb0d 00006e6d fefdff04 fd05fcff ff00ff04
ffff88b97e7520c0 1550583701 S Bi:4:003:1 -115 4096 <
ffff88b97e752840 1550585809 C Bi:4:003:1 0 488 = 5b5d1301 d6010001 62441100 0701cb0d 00006b80 015020fe 05fae310 0f05fc09
ffff88b97e752840 1550585815 S Bi:4:003:1 -115 4096 <
ffff88b97e752a80 1550587561 C Bi:4:003:1 0 479 = 5b5d1401 d7010001 631c0000 0c01cc0d 00006160 fd00fd06 00fd0300 fefd0401
ffff88b97e752a80 1550587565 S Bi:4:003:1 -115 4096 <
ffff88b97e752f00 1550589571 C Bi:4:003:1 0 483 = 5b5d1501 d7010001 70f60100 0c01cc0d 00005e80 00c41613 160f260e 0712fbea
ffff88b97e752f00 1550589575 S Bi:4:003:1 -115 4096 <
ffff88b97e7520c0 1550591311 C Bi:4:003:1 0 478 = 5b5d1601 d6010001 71eb1000 0701cb0d 00006d69 02fe0102 fa04f70b fd01fe03
ffff88b97e7520c0 1550591322 S Bi:4:003:1 -115 4096 <
ffff88b97e752840 1550593323 C Bi:4:003:1 0 486 = 5b5d1701 d6010001 7fe01100 0701cb0d 00006b80 01531dfa 0bf6e710 0d02fe0f
ffff88b97e752840 1550593328 S Bi:4:003:1 -115 4096 <
ffff88b97e752a80 1550595063 C Bi:4:003:1 0 479 = 5b5d1801 d7010001 80b90000 0c01cc0d 00006260 fc010103 03fb0200 fffc0302
ffff88b97e752a80 1550595085 S Bi:4:003:1 -115 4096 <
ffff88b97e752f00 1550597186 C Bi:4:003:1 0 483 = 5b5d1901 d7010001 8e8b0100 0c01cc0d 00005e80 00c01914 1513250c 0712f8ef
ffff88b97e752f00 1550597190 S Bi:4:003:1 -115 4096 <
ffff88b97e7520c0 1550598936 C Bi:4:003:1 0 478 = 5b5d1a01 d6010001 8f801000 0701cb0d 00006965 04feffff fc07fb05 fd04fc01
ffff88b97e7520c0 1550598947 S Bi:4:003:1 -115 4096 <
ffff88b97e752840 1550600933 C Bi:4:003:1 0 486 = 5b5d1b01 d6010001 9d751100 0701cb0d 00006f80 015c16f5 0bfaeb0f 0909fc08
ffff88b97e752840 1550600939 S Bi:4:003:1 -115 4096 <
ffff88b97e752a80 1550602684 C Bi:4:003:1 0 479 = 5b5d1c01 d7010001 9e4e0000 0c01cc0d 0000605d 02fa05ff 06f903fe 02fb0205
ffff88b97e752a80 1550602688 S Bi:4:003:1 -115 4096 <
ffff88b97e752f00 1550604810 C Bi:4:003:1 0 485 = 5b5d1d01 d7010001 ac270100 0c01cc0d 00005c80 00c31115 1b122609 0614f8f0
ffff88b97e752f00 1550604814 S Bi:4:003:1 -115 4096 <
ffff88b97e7520c0 1550606436 C Bi:4:003:1 0 478 = 5b5d1e01 d6010001 ad1b1000 0701cb0d 00006f6d 00fa0001 ff0af804 fdfdfd03
ffff88b97e7520c0 1550606447 S Bi:4:003:1 -115 4096 <
ffff88b97e752840 1550608561 C Bi:4:003:1 0 486 = 5b5d1f01 d6010001 bb121100 0701cb0d 00006c80 01581afb 07fbe909 0d07fe06
ffff88b97e752840 1550608566 S Bi:4:003:1 -115 4096 <
ffff88b97e752a80 1550610308 C Bi:4:003:1 0 479 = 5b5d2001 d7010001 bbea0000 0c01cc0d 00006460 00fb0601 03fd00fd 02fb0700
ffff88b97e752a80 1550610312 S Bi:4:003:1 -115 4096 <
ffff88b97e752f00 1550612435 C Bi:4:003:1 0 485 = 5b5d2101 d7010001 c9be0100 0c01cc0d 00005e80 00c51313 1b0d290c 0512faf2
ffff88b97e752f00 1550612439 S Bi:4:003:1 -115 4096 <
ffff88b97e7520c0 1550614055 C Bi:4:003:1 0 478 = 5b5d2201 d6010001 cab31000 0701cb0d 00006f68 08fcffff fb08f40b fb08f804
ffff88b97e7520c0 1550614067 S Bi:4:003:1 -115 4096 <
ffff88b97e752840 1550616035 C Bi:4:003:1 0 486 = 5b5d2301 d6010001 d8a91100 0701cb0d 00007180 015b1ef7 04fbe812 0f01fd06
ffff88b97e752840 1550616040 S Bi:4:003:1 -115 4096 <
ffff88b97e752a80 1550617934 C Bi:4:003:1 0 479 = 5b5d2401 d7010001 d9820000 0c01cc0d 00005e5a 000001ff 04fc0301 fdfb08fe
ffff88b97e752a80 1550617938 S Bi:4:003:1 -115 4096 <
ffff88b97e752f00 1550619934 C Bi:4:003:1 0 485 = 5b5d2501 d7010001 e75b0100 0c01cc0d 00005d80 00c21714 1a0b270f 0810f8ef
ffff88b97e752f00 1550619938 S Bi:4:003:1 -115 4096 <
ffff88b97e7520c0 1550621706 C Bi:4:003:1 0 478 = 5b5d2601 d6010001 e8501000 0701cb0d 00006f6a 0003fa07 fb09f7ff 02fb06fe
ffff88b97e7520c0 1550621717 S Bi:4:003:1 -115 4096 <
ffff88b97e752840 1550623808 C Bi:4:003:1 0 486 = 5b5d2701 d6010001 f6461100 0701cb0d 00006b80 01551afa 06ffe20f 0d09fb08
ffff88b97e752840 1550623814 S Bi:4:003:1 -115 4096 <
ffff88b97e752a80 1550625560 C Bi:4:003:1 0 479 = 5b5d2801 d7010001 f71f0000 0c01cc0d 0000625d 0100fe04 01ff00ff fffd0500
ffff88b97e752a80 1550625564 S Bi:4:003:1 -115 4096 <
ffff88b97e752f00 1550627572 C Bi:4:003:1 0 483 = 5b5d2901 d7010001 04f30100 0c01cc0d 00006080 00c61416 170c2611 0612fbeb
ffff88b97e752f00 1550627576 S Bi:4:003:1 -115 4096 <
ffff88b97e7520c0 1550629310 C Bi:4:003:1 0 478 = 5b5d2a01 d6010001 05e81000 0701cb0d 00006d6a 00fdfffc 0507f702 06f902fb
ffff88b97e7520c0 1550629321 S Bi:4:003:1 -115 4096 <
ffff88b97e752840 1550631314 C Bi:4:003:1 0 486 = 5b5d2b01 d6010001 13dd1100 0701cb0d 00006b80 01581af7 0bf9e709 1103fe0b
ffff88b97e752840 1550631320 S Bi:4:003:1 -115 4096 <
ffff88b97e752a80 1550633063 C Bi:4:003:1 0 479 = 5b5d2c01 d7010001 14b60000 0c01cc0d 00006362 fe000002 01fefffd 03fd0500
ffff88b97e752a80 1550633067 S Bi:4:003:1 -115 4096 <
ffff88b97e752f00 1550635186 C Bi:4:003:1 0 485 = 5b5d2d01 d7010001 228e0100 0c01cc0d 00005f80 00c21c0d 1d0e2413 0212f9ea
ffff88b97e752f00 1550635190 S Bi:4:003:1 -115 4096 <
ffff88b97e7520c0 1550636935 C Bi:4:003:1 0 478 = 5b5d2e01 d6010001 23831000 0701cb0d 00006e70 faffff05 fa08fb01 fb03fdfe
ffff88b97e7520c0 1550636940 S Bi:4:003:1 -115 4096 <
ffff88b97e752840 1550638934 C Bi:4:003:1 0 488 = 5b5d2f01 d6010001 31791100 0701cb0d 00006d80 01541df8 08fde60e 0b030308
ffff88b97e752840 1550638939 S Bi:4:003:1 -115 4096 <
ffff88b97e752a80 1550640703 C Bi:4:003:1 0 479 = 5b5d3001 d7010001 32520000 0c01cc0d 00006161 00ff01fe 06fa03ff 00fe0103
ffff88b97e752a80 1550640707 S Bi:4:003:1 -115 4096 <
ffff88b97e752f00 1550642824 C Bi:4:003:1 0 483 = 5b5d3101 d7010001 40270100 0c01cc0d 00005d80 00c61312 1b0e2410 0316f8eb
ffff88b97e752f00 1550642829 S Bi:4:003:1 -115 4096 <
ffff88b97e7520c0 1550644560 C Bi:4:003:1 0 478 = 5b5d3201 d6010001 411c1000 0701cb0d 00006c69 03fb0102 fe06f704 ff000002
ffff88b97e7520c0 1550644565 S Bi:4:003:1 -115 4096 <
ffff88b97e752840 1550646561 C Bi:4:003:1 0 488 = 5b5d3301 d6010001 4f111100 0701cb0d 00006c80 01541ef9 06fce912 0902fd0a
ffff88b97e752840 1550646567 S Bi:4:003:1 -115 4096 <
ffff88b97e752a80 1550648309 C Bi:4:003:1 0 479 = 5b5d3401 d7010001 4fea0000 0c01cc0d 0000615c 00ff0302 00fe04fc fefb0505
ffff88b97e752a80 1550648313 S Bi:4:003:1 -115 4096 <
ffff88b97e752f00 1550650434 C Bi:4:003:1 0 483 = 5b5d3501 d7010001 5dc40100 0c01cc0d 00005f80 00c31b0d 1d0d2110 0710fcf0
ffff88b97e752f00 1550650438 S Bi:4:003:1 -115 4096 <
ffff88b97e7520c0 1550652060 C Bi:4:003:1 0 478 = 5b5d3601 d6010001 5eb81000 0701cb0d 00006e68 03fe04fe fd04f902 03ff0200
ffff88b97e7520c0 1550652071 S Bi:4:003:1 -115 4096 <
ffff88b97e752840 1550654185 C Bi:4:003:1 0 488 = 5b5d3701 d6010001 6cad1100 0701cb0d 00006e80 01551ef7 07fde50f 0e07fe08
ffff88b97e752840 1550654197 S Bi:4:003:1 -115 4096 <
ffff88b97e752a80 1550655936 C Bi:4:003:1 0 479 = 5b5d3801 d7010001 6d860000 0c01cc0d 0000605e 00fe03fd 04fd01fe 05f9ff04
ffff88b97e752a80 1550655940 S Bi:4:003:1 -115 4096 <
ffff88b97e752f00 1550657931 C Bi:4:003:1 0 483 = 5b5d3901 d7010001 7b5a0100 0c01cc0d 00006180 00c21915 150d2b0b 0515f8f0
ffff88b97e752f00 1550657936 S Bi:4:003:1 -115 4096 <
ffff88b97e7520c0 1550659684 C Bi:4:003:1 0 478 = 5b5d3a01 d6010001 7c4e1000 0701cb0d 00006a67 03fa0100 fd0bf804 02fcfd02
ffff88b97e7520c0 1550659694 S Bi:4:003:1 -115 4096 <
ffff88b97e752840 1550661809 C Bi:4:003:1 0 486 = 5b5d3b01 d6010001 8a451100 0701cb0d 00006c80 015320f9 06fae511 0f05f60c
ffff88b97e752840 1550661814 S Bi:4:003:1 -115 4096 <
ffff88b97e752a80 1550663560 C Bi:4:003:1 0 479 = 5b5d3c01 d7010001 8b1e0000 0c01cc0d 00005f5d 01fe02ff 07f901fe fffe07fa
ffff88b97e752a80 1550663564 S Bi:4:003:1 -115 4096 <
ffff88b97e752f00 1550665564 C Bi:4:003:1 0 483 = 5b5d3d01 d7010001 98f70100 0c01cc0d 00005b80 00bd1618 170d2811 080ff9f1
ffff88b97e752f00 1550665568 S Bi:4:003:1 -115 4096 <
ffff88b97e7520c0 1550667309 C Bi:4:003:1 0 478 = 5b5d3e01 d6010001 99eb1000 0701cb0d 00006d6a 00fd01fc 020af506 fef806ff
ffff88b97e7520c0 1550667314 S Bi:4:003:1 -115 4096 <
ffff88b97e752840 1550669315 C Bi:4:003:1 0 486 = 5b5d3f01 d6010001 a7e11100 0701cb0d 00006c80 015420f5 0400e60c 0f05f810
ffff88b97e752840 1550669320 S Bi:4:003:1 -115 4096 <
ffff88b97e752a80 1550671063 C Bi:4:003:1 0 479 = 5b5d4001 d7010001 a8b90000 0c01cc0d 00006160 feff0201 01ff0001 fc000104
ffff88b97e752a80 1550671067 S Bi:4:003:1 -115 4096 <
ffff88b97e752f00 1550673184 C Bi:4:003:1 0 483 = 5b5d4101 d7010001 b68c0100 0c01cc0d 00005e80 00bf1b0c 1e112112 0513fcec
ffff88b97e752f00 1550673188 S Bi:4:003:1 -115 4096 <
ffff88b97e7520c0 1550674937 C Bi:4:003:1 0 478 = 5b5d4201 d6010001 b7801000 0701cb0d 00006d6d f9fc09fc 0208fafe 0100fb04
ffff88b97e7520c0 1550674943 S Bi:4:003:1 -115 4096 <
ffff88b97e752840 1550676936 C Bi:4:003:1 0 486 = 5b5d4301 d6010001 c5781100 0701cb0d 00006d80 015025f7 06fde40f 0d01010a
ffff88b97e752840 1550676941 S Bi:4:003:1 -115 4096 <
ffff88b97e752a80 1550678700 C Bi:4:003:1 0 479 = 5b5d4401 d7010001 c6500000 0c01cc0d 0000605d 01fc0202 03fb03fe 00fd0402
ffff88b97e752a80 1550678704 S Bi:4:003:1 -115 4096 <
ffff88b97e752f00 1550680813 C Bi:4:003:1 0 485 = 5b5d4501 d7010001 d4290100 0c01cc0d 00005e80 00c41510 1f0b280e 0613fae6
ffff88b97e752f00 1550680817 S Bi:4:003:1 -115 4096 <
ffff88b97e7520c0 1550682560 C Bi:4:003:1 0 478 = 5b5d4601 d6010001 d51d1000 0701cb0d 00006d68 04fb03fe fc0bf501 020006ff
ffff88b97e7520c0 1550682572 S Bi:4:003:1 -115 4096 <
ffff88b97e752840 1550684559 C Bi:4:003:1 0 488 = 5b5d4701 d6010001 e3141100 0701cb0d 00006c80 01561afb 05fceb09 0e07fa08
ffff88b97e752840 1550684565 S Bi:4:003:1 -115 4096 <
ffff88b97e752a80 1550686311 C Bi:4:003:1 0 479 = 5b5d4801 d7010001 e3ed0000 0c01cc0d 00005f5f fc0101ff 05fb04ff fdfd0401
ffff88b97e752a80 1550686315 S Bi:4:003:1 -115 4096 <
ffff88b97e752f00 1550688435 C Bi:4:003:1 0 483 = 5b5d4901 d7010001 f1c00100 0c01cc0d 00005e80 00c51317 160e280d 0613f9ec
ffff88b97e752f00 1550688439 S Bi:4:003:1 -115 4096 <
ffff88b97e7520c0 1550690060 C Bi:4:003:1 0 478 = 5b5d4a01 d6010001 f2b51000 0701cb0d 00006e6b fffdff01 fd07fb04 00fe0000
ffff88b97e7520c0 1550690072 S Bi:4:003:1 -115 4096 <
ffff88b97e752840 1550692075 C Bi:4:003:1 0 486 = 5b5d4b01 d6010001 00ac1100 0701cb0d 00006c80 01511ffa 09f5ea0f 0e040104
ffff88b97e752840 1550692080 S Bi:4:003:1 -115 4096 <
ffff88b97e752a80 1550693935 C Bi:4:003:1 0 479 = 5b5d4c01 d7010001 01850000 0c01cc0d 00005f5d fe000100 03fc0100 fffe0401
ffff88b97e752a80 1550693939 S Bi:4:003:1 -115 4096 <
ffff88b97e752f00 1550695927 C Bi:4:003:1 0 485 = 5b5d4d01 d7010001 0f5d0100 0c01cc0d 00005f80 00c21c12 180d2116 0314f7ef
ffff88b97e752f00 1550695931 S Bi:4:003:1 -115 4096 <
ffff88b97e7520c0 1550697686 C Bi:4:003:1 0 478 = 5b5d4e01 d6010001 10521000 0701cb0d 00006e66 05fe01ff fd03ff03 ffff02fc
ffff88b97e7520c0 1550697698 S Bi:4:003:1 -115 4096 <
ffff88b97e752840 1550699809 C Bi:4:003:1 0 486 = 5b5d4f01 d6010001 1e481100 0701cb0d 00006b80 015715fe 03fae713 0c0afa09
ffff88b97e752840 1550699814 S Bi:4:003:1 -115 4096 <
ffff88b97e752a80 1550701561 C Bi:4:003:1 0 479 = 5b5d5001 d7010001 1f210000 0c01cc0d 00005f5d 00fb08fd 01ff00fd 02fd05ff
ffff88b97e752a80 1550701565 S Bi:4:003:1 -115 4096 <
ffff88b97e752f00 1550703565 C Bi:4:003:1 0 485 = 5b5d5101 d7010001 2cf30100 0c01cc0d 00006180 00c41a11 170e280f 0316fceb
ffff88b97e752f00 1550703570 S Bi:4:003:1 -115 4096 <
ffff88b97e7520c0 1550705310 C Bi:4:003:1 0 478 = 5b5d5201 d6010001 2de81000 0701cb0d 00006e6b 04fb03ff fe05fb00 00ff0200
ffff88b97e7520c0 1550705316 S Bi:4:003:1 -115 4096 <
ffff88b97e752840 1550707312 C Bi:4:003:1 0 486 = 5b5d5301 d6010001 3bd81100 0701cb0d 00006f80 01541ef9 08fce80e 0d05f80c
ffff88b97e752840 1550707318 S Bi:4:003:1 -115 4096 <
ffff88b97e752a80 1550709054 C Bi:4:003:1 0 479 = 5b5d5401 d7010001 3cb10000 0c01cc0d 0000615d 04fc01ff 05f908fb ffff04ff
ffff88b97e752a80 1550709058 S Bi:4:003:1 -115 4096 <
ffff88b97e752f00 1550711188 C Bi:4:003:1 0 485 = 5b5d5501 d7010001 4a8b0100 0c01cc0d 00005c80 00bf1b10 16142311 0511ffea
ffff88b97e752f00 1550711192 S Bi:4:003:1 -115 4096 <
ffff88b97e7520c0 1550712936 C Bi:4:003:1 0 478 = 5b5d5601 d6010001 4b801000 0701cb0d 00006b6c fbff02ff fd0df304 01fcfe03
ffff88b97e7520c0 1550712946 S Bi:4:003:1 -115 4096 <
ffff88b97e752840 1550714936 C Bi:4:003:1 0 486 = 5b5d5701 d6010001 59761100 0701cb0d 00006c80 01551ef7 06fae90f 0b06fd0c
ffff88b97e752840 1550714941 S Bi:4:003:1 -115 4096 <
ffff88b97e752a80 1550716688 C Bi:4:003:1 0 479 = 5b5d5801 d7010001 5a4f0000 0c01cc0d 0000615e fffe0105 fdfd0102 fffd0501
ffff88b97e752a80 1550716692 S Bi:4:003:1 -115 4096 <
ffff88b97e752f00 1550718810 C Bi:4:003:1 0 485 = 5b5d5901 d7010001 68270100 0c01cc0d 00005e80 00c61510 1c0f2412 0316f8ec
ffff88b97e752f00 1550718814 S Bi:4:003:1 -115 4096 <
ffff88b97e7520c0 1550720446 C Bi:4:003:1 0 478 = 5b5d5a01 d6010001 691c1000 0701cb0d 00006d69 04fbfe04 fb020005 feff04fc
ffff88b97e7520c0 1550720451 S Bi:4:003:1 -115 4096 <
ffff88b97e752840 1550722562 C Bi:4:003:1 0 486 = 5b5d5b01 d6010001 770c1100 0701cb0d 00006980 01521afa 05fae812 0c08fc07
ffff88b97e752840 1550722568 S Bi:4:003:1 -115 4096 <
ffff88b97e752a80 1550724309 C Bi:4:003:1 0 479 = 5b5d5c01 d7010001 77e50000 0c01cc0d 0000605d fe0300ff 03f609fe 00fd0205
ffff88b97e752a80 1550724314 S Bi:4:003:1 -115 4096 <
ffff88b97e752f00 1550726318 C Bi:4:003:1 0 485 = 5b5d5d01 d7010001 85bf0100 0c01cc0d 00005d80 00c11711 1b0e280d 0711fced
ffff88b97e752f00 1550726323 S Bi:4:003:1 -115 4096 <
ffff88b97e7520c0 1550728060 C Bi:4:003:1 0 478 = 5b5d5e01 d6010001 86b41000 0701cb0d 00006f6d fffe0202 0004f407 fdfc06fe
ffff88b97e7520c0 1550728072 S Bi:4:003:1 -115 4096 <
ffff88b97e752840 1550730066 C Bi:4:003:1 0 486 = 5b5d5f01 d6010001 94aa1100 0701cb0d 00007180 01581bfa 08fce80b 0e07fd05
ffff88b97e752840 1550730072 S Bi:4:003:1 -115 4096 <
ffff88b97e752a80 1550731936 C Bi:4:003:1 0 479 = 5b5d6001 d7010001 95830000 0c01cc0d 00005f5b 03fc02fe 05fd02fc 02fb0700
ffff88b97e752a80 1550731940 S Bi:4:003:1 -115 4096 <
ffff88b97e752f00 1550733926 C Bi:4:003:1 0 485 = 5b5d6101 d7010001 a35c0100 0c01cc0d 00005d80 00c3160a 220c2412 0711fcea
ffff88b97e752f00 1550733930 S Bi:4:003:1 -115 4096 <
ffff88b97e7520c0 1550735689 C Bi:4:003:1 0 478 = 5b5d6201 d6010001 a4511000 0701cb0d 00006b6b fbfe0104 fd0afa00 02f903fd
ffff88b97e7520c0 1550735694 S Bi:4:003:1 -115 4096 <
ffff88b97e752840 1550737677 C Bi:4:003:1 0 486 = 5b5d6301 d6010001 b2411100 0701cb0d 00006c80 01551cfb 07fbe513 0908fa0b
ffff88b97e752840 1550737683 S Bi:4:003:1 -115 4096 <
ffff88b97e752a80 1550739560 C Bi:4:003:1 0 479 = 5b5d6401 d7010001 b3190000 0c01cc0d 0000605d fffc07ff 01fd0300 fffc05fa
ffff88b97e752a80 1550739565 S Bi:4:003:1 -115 4096 <
ffff88b97e752f00 1550741562 C Bi:4:003:1 0 485 = 5b5d6501 d7010001 c0f40100 0c01cc0d 00005c80 00be1a13 1a0d2410 0614f7ee
ffff88b97e752f00 1550741566 S Bi:4:003:1 -115 4096 <
ffff88b97e7520c0 1550743311 C Bi:4:003:1 0 478 = 5b5d6601 d6010001 c1e81000 0701cb0d 00006864 04fb01ff ff0300ff fe010201
ffff88b97e7520c0 1550743323 S Bi:4:003:1 -115 4096 <
ffff88b97e752840 1550745310 C Bi:4:003:1 0 486 = 5b5d6701 d6010001 cfdf1100 0701cb0d 00006d80 01561df2 0df9e712 0b050008
ffff88b97e752840 1550745316 S Bi:4:003:1 -115 4096 <
ffff88b97e752a80 1550747061 C Bi:4:003:1 0 479 = 5b5d6801 d7010001 d0b80000 0c01cc0d 0000615f ff010101 ff0101fc 01fc0500
ffff88b97e752a80 1550747066 S Bi:4:003:1 -115 4096 <
ffff88b97e752f00 1550749188 C Bi:4:003:1 0 483 = 5b5d6901 d7010001 de900100 0c01cc0d 00005c80 00c11916 170b290c 0613fbec
ffff88b97e752f00 1550749192 S Bi:4:003:1 -115 4096 <
ffff88b97e7520c0 1550750936 C Bi:4:003:1 0 478 = 5b5d6a01 d6010001 df851000 0701cb0d 0000716e fefd0402 fd04f700 fd08fd00
ffff88b97e7520c0 1550750947 S Bi:4:003:1 -115 4096 <
ffff88b97e752840 1550752936 C Bi:4:003:1 0 486 = 5b5d6b01 d6010001 ed741100 0701cb0d 00006e80 01561ff7 06ffe608 1102000a
ffff88b97e752840 1550752941 S Bi:4:003:1 -115 4096 <
ffff88b97e752a80 1550754686 C Bi:4:003:1 0 479 = 5b5d6c01 d7010001 ee4d0000 0c01cc0d 0000605e 00fd05fd 0300ffff fd000200
ffff88b97e752a80 1550754690 S Bi:4:003:1 -115 4096 <
ffff88b97e752f00 1550756811 C Bi:4:003:1 0 483 = 5b5d6d01 d7010001 fc250100 0c01cc0d 00005e80 00c51512 1a10250c 0813f8ee
ffff88b97e752f00 1550756815 S Bi:4:003:1 -115 4096 <
ffff88b97e7520c0 1550758436 C Bi:4:003:1 0 478 = 5b5d6e01 d6010001 fd1a1000 0701cb0d 00006b6a fefb0102 0007f705 feffffff
ffff88b97e7520c0 1550758442 S Bi:4:003:1 -115 4096 <
ffff88b97e752840 1550760561 C Bi:4:003:1 0 486 = 5b5d6f01 d6010001 0b111100 0701cb0d 00006d80 015917fa 06fce411 0f07fd09
ffff88b97e752840 1550760566 S Bi:4:003:1 -115 4096 <
ffff88b97e752a80 1550762313 C Bi:4:003:1 0 479 = 5b5d7001 d7010001 0bea0000 0c01cc0d 0000625e 00ff0201 05fb0003 fbff04fd
ffff88b97e752a80 1550762317 S Bi:4:003:1 -115 4096 <
ffff88b97e752f00 1550764317 C Bi:4:003:1 0 483 = 5b5d7101 d7010001 19c20100 0c01cc0d 00005d80 00c31513 1c0f240f 050ffdeb
ffff88b97e752f00 1550764321 S Bi:4:003:1 -115 4096 <
ffff88b97e7520c0 1550766061 C Bi:4:003:1 0 478 = 5b5d7201 d6010001 1ab71000 0701cb0d 00006b68 03fa03ff fa0cf802 03fe01fc
ffff88b97e7520c0 1550766072 S Bi:4:003:1 -115 4096 <
ffff88b97e752840 1550768067 C Bi:4:003:1 0 486 = 5b5d7301 d6010001 28a61100 0701cb0d 00006a80 014f23f6 08fbe311 0610fe08
ffff88b97e752840 1550768072 S Bi:4:003:1 -115 4096 <
ffff88b97e752a80 1550769934 C Bi:4:003:1 0 479 = 5b5d7401 d7010001 297f0000 0c01cc0d 0000625f 00fd0304 fffe01fd 02fa0700
ffff88b97e752a80 1550769938 S Bi:4:003:1 -115 4096 <
ffff88b97e752f00 1550771946 C Bi:4:003:1 0 483 = 5b5d7501 d7010001 37570100 0c01cc0d 00005e80 00c31415 1a11240d 0a0ffdea
ffff88b97e752f00 1550771950 S Bi:4:003:1 -115 4096 <
ffff88b97e7520c0 1550773685 C Bi:4:003:1 0 478 = 5b5d7601 d6010001 384c1000 0701cb0d 00006d6b fd03fd02 fb03fd03 fe0300fb
ffff88b97e7520c0 1550773697 S Bi:4:003:1 -115 4096 <
ffff88b97e752840 1550775698 C Bi:4:003:1 0 486 = 5b5d7701 d6010001 46431100 0701cb0d 00006c80 015914f9 09faea10 0b09f70b
ffff88b97e752840 1550775703 S Bi:4:003:1 -115 4096 <
ffff88b97e752a80 1550777561 C Bi:4:003:1 0 479 = 5b5d7801 d7010001 471c0000 0c01cc0d 0000605d ffff0200 05fb02fd feff05fc
ffff88b97e752a80 1550777565 S Bi:4:003:1 -115 4096 <
ffff88b97e752f00 1550779564 C Bi:4:003:1 0 485 = 5b5d7901 d7010001 54f40100 0c01cc0d 00005d80 00c71610 1613260c 051101e8
ffff88b97e752f00 1550779568 S Bi:4:003:1 -115 4096 <
ffff88b97e7520c0 1550781310 C Bi:4:003:1 0 478 = 5b5d7a01 d6010001 55e91000 0701cb0d 00006c6a ff00ff01 fe05fb02 ffff0001
ffff88b97e7520c0 1550781316 S Bi:4:003:1 -115 4096 <
ffff88b97e752840 1550783311 C Bi:4:003:1 0 486 = 5b5d7b01 d6010001 63d91100 0701cb0d 00006e80 01571df8 05ffe310 0e06fc07
ffff88b97e752840 1550783316 S Bi:4:003:1 -115 4096 <
ffff88b97e752a80 1550785054 C Bi:4:003:1 0 479 = 5b5d7c01 d7010001 64b20000 0c01cc0d 0000615c 03fe0103 01fc02ff fefb09fe
ffff88b97e752a80 1550785058 S Bi:4:003:1 -115 4096 <
ffff88b97e752f00 1550787186 C Bi:4:003:1 0 485 = 5b5d7d01 d7010001 728b0100 0c01cc0d 00005c80 00bf1b0e 1d0a280c 0a0efeeb
ffff88b97e752f00 1550787191 S Bi:4:003:1 -115 4096 <
ffff88b97e7520c0 1550788937 C Bi:4:003:1 0 478 = 5b5d7e01 d6010001 737f1000 0701cb0d 00007170 00fb0402 f90bf302 03fe0102
ffff88b97e7520c0 1550788948 S Bi:4:003:1 -115 4096 <
ffff88b97e752840 1550790936 C Bi:4:003:1 0 486 = 5b5d7f01 d6010001 81771100 0701cb0d 00006f80 01561ff6 06fce710 1005f909
ffff88b97e752840 1550790941 S Bi:4:003:1 -115 4096 <
ffff88b97e752a80 1550792689 C Bi:4:003:1 0 479 = 5b5d8001 d7010001 82500000 0c01cc0d 0000615c 020004ff 01fc02fc 05f908ff
ffff88b97e752a80 1550792693 S Bi:4:003:1 -115 4096 <
ffff88b97e752f00 1550794814 C Bi:4:003:1 0 483 = 5b5d8101 d7010001 90290100 0c01cc0d 00005e80 00bf1914 1910270c 080efbec
ffff88b97e752f00 1550794818 S Bi:4:003:1 -115 4096 <
ffff88b97e7520c0 1550796437 C Bi:4:003:1 0 478 = 5b5d8201 d6010001 911d1000 0701cb0d 00006e6a 04fb04fc fd06fc01 02ff0001
ffff88b97e7520c0 1550796442 S Bi:4:003:1 -115 4096 <
ffff88b97e752840 1550798561 C Bi:4:003:1 0 486 = 5b5d8301 d6010001 9f0c1100 0701cb0d 00006c80 01541efa 05ffe709 0e0afb09
ffff88b97e752840 1550798567 S Bi:4:003:1 -115 4096 <
ffff88b97e752a80 1550800313 C Bi:4:003:1 0 479 = 5b5d8401 d7010001 9fe50000 0c01cc0d 0000605f fdff0101 04fc0300 fcfe0601
ffff88b97e752a80 1550800317 S Bi:4:003:1 -115 4096 <
ffff88b97e752f00 1550802316 C Bi:4:003:1 0 483 = 5b5d8501 d7010001 adbe0100 0c01cc0d 00005b80 00bf1810 21092412 0513f9ed
ffff88b97e752f00 1550802320 S Bi:4:003:1 -115 4096 <
ffff88b97e7520c0 1550804062 C Bi:4:003:1 0 478 = 5b5d8601 d6010001 aeb31000 0701cb0d 00006e6b fd0105ff fd05fa04 f9fb0701
ffff88b97e7520c0 1550804073 S Bi:4:003:1 -115 4096 <
ffff88b97e752840 1550806064 C Bi:4:003:1 0 486 = 5b5d8701 d6010001 bca81100 0701cb0d 00006a80 015519fa 07fae90b 1106fd09
ffff88b97e752840 1550806070 S Bi:4:003:1 -115 4096 <
ffff88b97e752a80 1550807939 C Bi:4:003:1 0 479 = 5b5d8801 d7010001 bd810000 0c01cc0d 0000605d 00fe0103 010000fb 01f70e01
ffff88b97e752a80 1550807943 S Bi:4:003:1 -115 4096 <
ffff88b97e752f00 1550809950 C Bi:4:003:1 0 483 = 5b5d8901 d7010001 cb5b0100 0c01cc0d 00005f80 00c31714 1711250d 0a0bfbf2
ffff88b97e752f00 1550809954 S Bi:4:003:1 -115 4096 <
ffff88b97e7520c0 1550811686 C Bi:4:003:1 0 478 = 5b5d8a01 d6010001 cc501000 0701cb0d 0000686b fcfb0003 ff04fb03 00fdfe03
ffff88b97e7520c0 1550811692 S Bi:4:003:1 -115 4096 <
ffff88b97e752840 1550813701 C Bi:4:003:1 0 488 = 5b5d8b01 d6010001 da3f1100 0701cb0d 00006b80 01511ff7 0df5e710 0d07fa0b
ffff88b97e752840 1550813707 S Bi:4:003:1 -115 4096 <
ffff88b97e752a80 1550815457 C Bi:4:003:1 0 479 = 5b5d8c01 d7010001 db180000 0c01cc0d 00006361 fe01ffff 05fb06fc fe0200fd
ffff88b97e752a80 1550815461 S Bi:4:003:1 -115 4096 <
ffff88b97e752f00 1550817563 C Bi:4:003:1 0 483 = 5b5d8d01 d7010001 e8f20100 0c01cc0d 00006180 00c41913 190e260f 0710fced
ffff88b97e752f00 1550817567 S Bi:4:003:1 -115 4096 <
ffff88b97e7520c0 1550819311 C Bi:4:003:1 0 478 = 5b5d8e01 d6010001 e9e61000 0701cb0d 00006d67 020000ff 0007f509 00fb00ff
ffff88b97e7520c0 1550819322 S Bi:4:003:1 -115 4096 <
ffff88b97e752840 1550821311 C Bi:4:003:1 0 488 = 5b5d8f01 d6010001 f7dc1100 0701cb0d 00007080 01581df8 06fce711 0c04ff08
ffff88b97e752840 1550821316 S Bi:4:003:1 -115 4096 <
ffff88b97e752a80 1550823054 C Bi:4:003:1 0 479 = 5b5d9001 d7010001 f8b40000 0c01cc0d 00005f5d ff00fe02 02fe03fe fefe0401
ffff88b97e752a80 1550823059 S Bi:4:003:1 -115 4096 <
ffff88b97e752f00 1550825187 C Bi:4:003:1 0 483 = 5b5d9101 d7010001 06900100 0c01cc0d 00006080 00c31915 170e2710 0215f7ed
ffff88b97e752f00 1550825191 S Bi:4:003:1 -115 4096 <
ffff88b97e7520c0 1550826936 C Bi:4:003:1 0 478 = 5b5d9201 d6010001 07851000 0701cb0d 0000706f f9040400 fe06f307 fcfb0402
ffff88b97e7520c0 1550826948 S Bi:4:003:1 -115 4096 <
ffff88b97e752840 1550828937 C Bi:4:003:1 0 488 = 5b5d9301 d6010001 15741100 0701cb0d 00006a80 01521cfb 09f8e711 08030108
ffff88b97e752840 1550828943 S Bi:4:003:1 -115 4096 <
ffff88b97e752a80 1550830688 C Bi:4:003:1 0 479 = 5b5d9401 d7010001 164d0000 0c01cc0d 00006360 02fc0300 03fd00fe 02fd04ff
ffff88b97e752a80 1550830692 S Bi:4:003:1 -115 4096 <
ffff88b97e752f00 1550832811 C Bi:4:003:1 0 485 = 5b5d9501 d7010001 24200100 0c01cc0d 00006180 00c41b11 1810210e 0813fbed
ffff88b97e752f00 1550832815 S Bi:4:003:1 -115 4096 <
ffff88b97e7520c0 1550834429 C Bi:4:003:1 0 478 = 5b5d9601 d6010001 25151000 0701cb0d 0000706d fd000301 fb06f703 fe02ff02
ffff88b97e7520c0 1550834440 S Bi:4:003:1 -115 4096 <
ffff88b97e752840 1550836456 C Bi:4:003:1 0 488 = 5b5d9701 d6010001 330b1100 0701cb0d 00006b80 015320f8 03fee60f 0c07f90c
ffff88b97e752840 1550836475 S Bi:4:003:1 -115 4096 <
ffff88b97e752a80 1550838311 C Bi:4:003:1 0 479 = 5b5d9801 d7010001 33e40000 0c01cc0d 0000605c 01fd0105 03fa0100 fefd0502
ffff88b97e752a80 1550838315 S Bi:4:003:1 -115 4096 <
ffff88b97e752f00 1550840310 C Bi:4:003:1 0 483 = 5b5d9901 d7010001 41c00100 0c01cc0d 00006080 00c01e0b 210d250e 0613fcea
ffff88b97e752f00 1550840314 S Bi:4:003:1 -115 4096 <
ffff88b97e7520c0 1550842062 C Bi:4:003:1 0 478 = 5b5d9a01 d6010001 42b41000 0701cb0d 00006a69 fcfdfd06 0007fb02 fc03fdff
ffff88b97e7520c0 1550842073 S Bi:4:003:1 -115 4096 <
ffff88b97e752840 1550844060 C Bi:4:003:1 0 486 = 5b5d9b01 d6010001 50aa1100 0701cb0d 00006980 014d21f9 08f7ea0d 0d06ff09
ffff88b97e752840 1550844065 S Bi:4:003:1 -115 4096 <
ffff88b97e752a80 1550845936 C Bi:4:003:1 0 479 = 5b5d9c01 d7010001 51820000 0c01cc0d 0000625a 06fd00ff 05fc03fe ff0102ff
ffff88b97e752a80 1550845940 S Bi:4:003:1 -115 4096 <
ffff88b97e752f00 1550847947 C Bi:4:003:1 0 483 = 5b5d9d01 d7010001 5f550100 0c01cc0d 00005f80 00c31714 1b0a2a0c 0611fbec
ffff88b97e752f00 1550847951 S Bi:4:003:1 -115 4096 <
ffff88b97e7520c0 1550849712 C Bi:4:003:1 0 478 = 5b5d9e01 d6010001 60491000 0701cb0d 00006e67 09fc01fe fc05f50a fefe04fe
ffff88b97e7520c0 1550849717 S Bi:4:003:1 -115 4096 <
ffff88b97e752840 1550851690 C Bi:4:003:1 0 486 = 5b5d9f01 d6010001 6e3f1100 0701cb0d 00006a80 015122f6 0301e20f 0f04fb0c
ffff88b97e752840 1550851696 S Bi:4:003:1 -115 4096 <
ffff88b97e752a80 1550853438 C Bi:4:003:1 0 479 = 5b5da001 d7010001 6f180000 0c01cc0d 00006061 fcff04ff 03fb03fd 02fd04ff
ffff88b97e752a80 1550853442 S Bi:4:003:1 -115 4096 <
ffff88b97e752f00 1550855564 C Bi:4:003:1 0 485 = 5b5da101 d7010001 7cf00100 0c01cc0d 00005c80 00c1190d 1d0f2414 010ffbf1
ffff88b97e752f00 1550855568 S Bi:4:003:1 -115 4096 <
ffff88b97e7520c0 1550857313 C Bi:4:003:1 0 478 = 5b5da201 d6010001 7de51000 0701cb0d 00006c6a 01fc0400 0005f701 01fb0601
ffff88b97e7520c0 1550857318 S Bi:4:003:1 -115 4096 <
ffff88b97e752840 1550859311 C Bi:4:003:1 0 486 = 5b5da301 d6010001 8bdd1100 0701cb0d 00006e80 01561bfa 07fde80f 0a04fd07
ffff88b97e752840 1550859317 S Bi:4:003:1 -115 4096 <
ffff88b97e752a80 1550861079 C Bi:4:003:1 0 479 = 5b5da401 d7010001 8cb60000 0c01cc0d 0000605d fe0203fe 02fd04fc 00000200
ffff88b97e752a80 1550861083 S Bi:4:003:1 -115 4096 <
ffff88b97e752f00 1550863187 C Bi:4:003:1 0 485 = 5b5da501 d7010001 9a880100 0c01cc0d 00005e80 00bf1912 190e290d 0613fcea
ffff88b97e752f00 1550863191 S Bi:4:003:1 -115 4096 <
ffff88b97e7520c0 1550864937 C Bi:4:003:1 0 478 = 5b5da601 d6010001 9b7c1000 0701cb0d 00006c6b fdfdfe03 0106fd00 fd00fffe
ffff88b97e7520c0 1550864948 S Bi:4:003:1 -115 4096 <
ffff88b97e752840 1550866949 C Bi:4:003:1 0 488 = 5b5da701 d6010001 a9731100 0701cb0d 00006c80 015617f9 0af7eb12 0b08fd07
ffff88b97e752840 1550866955 S Bi:4:003:1 -115 4096 <
ffff88b97e752a80 1550868688 C Bi:4:003:1 0 479 = 5b5da801 d7010001 aa4c0000 0c01cc0d 00006160 00fc02ff 05fc03fe fd010302
ffff88b97e752a80 1550868692 S Bi:4:003:1 -115 4096 <
ffff88b97e752f00 1550870815 C Bi:4:003:1 0 483 = 5b5da901 d7010001 b8260100 0c01cc0d 00005d80 00c41512 1810250e 0614f9ef
ffff88b97e752f00 1550870819 S Bi:4:003:1 -115 4096 <
ffff88b97e7520c0 1550872450 C Bi:4:003:1 0 478 = 5b5daa01 d6010001 b91a1000 0701cb0d 00006f6c 01fd0400 f908f802 03ffff00
ffff88b97e7520c0 1550872462 S Bi:4:003:1 -115 4096 <
ffff88b97e752840 1550874562 C Bi:4:003:1 0 486 = 5b5dab01 d6010001 c7111100 0701cb0d 00006980 01501bfc 07f8ea0e 0f040304
ffff88b97e752840 1550874568 S Bi:4:003:1 -115 4096 <
ffff88b97e752a80 1550876314 C Bi:4:003:1 0 479 = 5b5dac01 d7010001 c7ea0000 0c01cc0d 00006159 050000fd 07fc02fd 01fe0103
ffff88b97e752a80 1550876318 S Bi:4:003:1 -115 4096 <
ffff88b97e752f00 1550878309 C Bi:4:003:1 0 485 = 5b5dad01 d7010001 d5bc0100 0c01cc0d 00005c80 00c21712 170f2a0e 0315f9ea
ffff88b97e752f00 1550878313 S Bi:4:003:1 -115 4096 <
ffff88b97e7520c0 1550880067 C Bi:4:003:1 0 478 = 5b5dae01 d6010001 d6b11000 0701cb0d 00006d69 03ff01fb fc06fb05 feff0000
ffff88b97e7520c0 1550880078 S Bi:4:003:1 -115 4096 <
ffff88b97e752840 1550882055 C Bi:4:003:1 0 488 = 5b5daf01 d6010001 e4a71100 0701cb0d 00006d80 01541dfa 05fbe90e 1006fb0a
ffff88b97e752840 1550882061 S Bi:4:003:1 -115 4096 <
ffff88b97e752a80 1550883936 C Bi:4:003:1 0 479 = 5b5db001 d7010001 e5800000 0c01cc0d 0000605f fe0101ff 02fc0301 fefb07fe
ffff88b97e752a80 1550883940 S Bi:4:003:1 -115 4096 <
ffff88b97e752f00 1550885950 C Bi:4:003:1 0 485 = 5b5db101 d7010001 f35a0100 0c01cc0d 00005c80 00bf1813 1614230f 0713f9eb
ffff88b97e752f00 1550885954 S Bi:4:003:1 -115 4096 <
ffff88b97e7520c0 1550887687 C Bi:4:003:1 0 478 = 5b5db201 d6010001 f44f1000 0701cb0d 00006c65 04fc0101 f90afd00 02fefd03
ffff88b97e7520c0 1550887699 S Bi:4:003:1 -115 4096 <
ffff88b97e752840 1550889698 C Bi:4:003:1 0 486 = 5b5db301 d6010001 02471100 0701cb0d 00007080 015422f7 05fde50e 0fff040c
ffff88b97e752840 1550889704 S Bi:4:003:1 -115 4096 <
ffff88b97e752a80 1550891445 C Bi:4:003:1 0 479 = 5b5db401 d7010001 031f0000 0c01cc0d 0000605c 00000202 02fa0400 fdfd0402
ffff88b97e752a80 1550891449 S Bi:4:003:1 -115 4096 <
ffff88b97e752f00 1550893564 C Bi:4:003:1 0 483 = 5b5db501 d7010001 10f20100 0c01cc0d 00005b80 00bd1a14 190c280e 0413fceb
ffff88b97e752f00 1550893568 S Bi:4:003:1 -115 4096 <
ffff88b97e7520c0 1550895311 C Bi:4:003:1 0 478 = 5b5db601 d6010001 11e71000 0701cb0d 00006f6d fffd0401 f80af9fd fe0700fe
ffff88b97e7520c0 1550895322 S Bi:4:003:1 -115 4096 <
ffff88b97e752840 1550897311 C Bi:4:003:1 0 488 = 5b5db701 d6010001 1fdc1100 0701cb0d 00006a80 014a22fa 09fae70d 0c050009
ffff88b97e752840 1550897316 S Bi:4:003:1 -115 4096 <
ffff88b97e752a80 1550899064 C Bi:4:003:1 0 479 = 5b5db801 d7010001 20b50000 0c01cc0d 0000615e 03fa0500 00ff0000 fdfe0403
ffff88b97e752a80 1550899068 S Bi:4:003:1 -115 4096 <
ffff88b97e752f00 1550901187 C Bi:4:003:1 0 483 = 5b5db901 d7010001 2e8f0100 0c01cc0d 00005e80 00c51115 17112510 090bffec
ffff88b97e752f00 1550901191 S Bi:4:003:1 -115 4096 <
ffff88b97e7520c0 1550902936 C Bi:4:003:1 0 478 = 5b5dba01 d6010001 2f831000 0701cb0d 00006b6b 00fa02fd 0404f905 00fc01fd
ffff88b97e7520c0 1550902948 S Bi:4:003:1 -115 4096 <
ffff88b97e752840 1550904940 C Bi:4:003:1 0 486 = 5b5dbb01 d6010001 3d791100 0701cb0d 00006c80 01531ff7 03fee215 0f05fd06
ffff88b97e752840 1550904945 S Bi:4:003:1 -115 4096 <
ffff88b97e752a80 1550906688 C Bi:4:003:1 0 479 = 5b5dbc01 d7010001 3e510000 0c01cc0d 00005f5c 0003fd02 04fa02fc 03fe0101
ffff88b97e752a80 1550906692 S Bi:4:003:1 -115 4096 <
ffff88b97e752f00 1550908811 C Bi:4:003:1 0 483 = 5b5dbd01 d7010001 4c260100 0c01cc0d 00005f80 00c41712 180f280c 0514fbef
ffff88b97e752f00 1550908815 S Bi:4:003:1 -115 4096 <
ffff88b97e7520c0 1550910437 C Bi:4:003:1 0 478 = 5b5dbe01 d6010001 4d1a1000 0701cb0d 00006d67 0101fd04 f80afa02 ff0002fd
ffff88b97e7520c0 1550910449 S Bi:4:003:1 -115 4096 <
ffff88b97e752840 1550912456 C Bi:4:003:1 0 488 = 5b5dbf01 d6010001 5b0f1100 0701cb0d 00006d80 015719fb 03f9ec10 0e07fd06
ffff88b97e752840 1550912462 S Bi:4:003:1 -115 4096 <
ffff88b97e752a80 1550914313 C Bi:4:003:1 0 479 = 5b5dc001 d7010001 5be80000 0c01cc0d 0000605e ff01fd01 02fe01ff ffff0401
ffff88b97e752a80 1550914317 S Bi:4:003:1 -115 4096 <
ffff88b97e752f00 1550916311 C Bi:4:003:1 0 485 = 5b5dc101 d7010001 69c20100 0c01cc0d 00005e80 00c71510 1d0f220e 070efbf0
ffff88b97e752f00 1550916316 S Bi:4:003:1 -115 4096 <
ffff88b97e7520c0 1550918065 C Bi:4:003:1 0 478 = 5b5dc201 d6010001 6ab71000 0701cb0d 00006f6a 02fd0200 fe04fa01 00020203
ffff88b97e7520c0 1550918076 S Bi:4:003:1 -115 4096 <
ffff88b97e752840 1550920056 C Bi:4:003:1 0 486 = 5b5dc301 d6010001 78ad1100 0701cb0d 00006c80 01541df8 0afde20f 0c040107
ffff88b97e752840 1550920061 S Bi:4:003:1 -115 4096 <
ffff88b97e752a80 1550921936 C Bi:4:003:1 0 479 = 5b5dc401 d7010001 79860000 0c01cc0d 00005f5c 00000000 01fd06ff fffc0300
ffff88b97e752a80 1550921940 S Bi:4:003:1 -115 4096 <
ffff88b97e752f00 1550923950 C Bi:4:003:1 0 485 = 5b5dc501 d7010001 875a0100 0c01cc0d 00005e80 00c31a0f 1c10220f 0413fbed
ffff88b97e752f00 1550923954 S Bi:4:003:1 -115 4096 <
ffff88b97e7520c0 1550925686 C Bi:4:003:1 0 478 = 5b5dc601 d6010001 884f1000 0701cb0d 00006f6c 00fdfe06 fe05f704 fb03fe02
ffff88b97e7520c0 1550925697 S Bi:4:003:1 -115 4096 <
ffff88b97e752840 1550927697 C Bi:4:003:1 0 486 = 5b5dc701 d6010001 96451100 0701cb0d 00006a80 01511ef7 09f8e70a 0f08ff0d
ffff88b97e752840 1550927702 S Bi:4:003:1 -115 4096 <
ffff88b97e752a80 1550929435 C Bi:4:003:1 0 479 = 5b5dc801 d7010001 971e0000 0c01cc0d 0000625e ffff0400 00feff01 01fd0104
ffff88b97e752a80 1550929440 S Bi:4:003:1 -115 4096 <
ffff88b97e752f00 1550931565 C Bi:4:003:1 0 483 = 5b5dc901 d7010001 a4f60100 0c01cc0d 00005e80 00bf1815 180f2412 0316f9ee
ffff88b97e752f00 1550931569 S Bi:4:003:1 -115 4096 <
ffff88b97e7520c0 1550933311 C Bi:4:003:1 0 478 = 5b5dca01 d6010001 a5eb1000 0701cb0d 0000716e 00fe04fd 0208ef07 fc000300
ffff88b97e7520c0 1550933323 S Bi:4:003:1 -115 4096 <
ffff88b97e752840 1550935315 C Bi:4:003:1 0 488 = 5b5dcb01 d6010001 b3e01100 0701cb0d 00006e80 01551cfd 02fee40d 1104fe08
ffff88b97e752840 1550935320 S Bi:4:003:1 -115 4096 <
ffff88b97e752a80 1550937054 C Bi:4:003:1 0 479 = 5b5dcc01 d7010001 b4b90000 0c01cc0d 0000605c 04fb0300 04fb02ff fffe0302
ffff88b97e752a80 1550937058 S Bi:4:003:1 -115 4096 <
ffff88b97e752f00 1550939187 C Bi:4:003:1 0 485 = 5b5dcd01 d7010001 c28e0100 0c01cc0d 00006080 00bf1e10 1a10240e 0710fdec
ffff88b97e752f00 1550939191 S Bi:4:003:1 -115 4096 <
ffff88b97e7520c0 1550940938 C Bi:4:003:1 0 478 = 5b5dce01 d6010001 c3831000 0701cb0d 00006860 08fa02fd fb0bfa04 fe02fdff
ffff88b97e7520c0 1550940944 S Bi:4:003:1 -115 4096 <
ffff88b97e752840 1550942935 C Bi:4:003:1 0 486 = 5b5dcf01 d6010001 d1731100 0701cb0d 00006d80 01541dfb 07faea0a 0f050004
ffff88b97e752840 1550942952 S Bi:4:003:1 -115 4096 <
ffff88b97e752a80 1550944687 C Bi:4:003:1 0 479 = 5b5dd001 d7010001 d24c0000 0c01cc0d 0000605e fc0103fd 06fd01ff fd000303
ffff88b97e752a80 1550944698 S Bi:4:003:1 -115 4096 <
ffff88b97e752f00 1550946811 C Bi:4:003:1 0 485 = 5b5dd101 d7010001 e0250100 0c01cc0d 00005e80 00bf1d0b 1e0d290e 060ffceb
ffff88b97e752f00 1550946822 S Bi:4:003:1 -115 4096 <
ffff88b97e7520c0 1550948437 C Bi:4:003:1 0 478 = 5b5dd201 d6010001 e1191000 0701cb0d 00006b66 01fefc08 ff03fb01 ff00fd03
ffff88b97e7520c0 1550948456 S Bi:4:003:1 -115 4096 <
ffff88b97e752840 1550950450 C Bi:4:003:1 0 488 = 5b5dd301 d6010001 ef101100 0701cb0d 00006f80 01581ef4 07fee410 0c05fe09
ffff88b97e752840 1550950463 S Bi:4:003:1 -115 4096 <
ffff88b97e752a80 1550952312 C Bi:4:003:1 0 479 = 5b5dd401 d7010001 efe80000 0c01cc0d 00006261 fd0005fc 04fc03fe fefc0600
ffff88b97e752a80 1550952323 S Bi:4:003:1 -115 4096 <
ffff88b97e752f00 1550954307 C Bi:4:003:1 0 483 = 5b5dd501 d7010001 fdbc0100 0c01cc0d 00005e80 00c4150f 18142410 0514faee
ffff88b97e752f00 1550954318 S Bi:4:003:1 -115 4096 <
ffff88b97e7520c0 1550956063 C Bi:4:003:1 0 478 = 5b5dd601 d6010001 feb01000 0701cb0d 00006d68 02fd0003 fb05f806 00fa04ff
ffff88b97e7520c0 1550956082 S Bi:4:003:1 -115 4096 <
ffff88b97e752840 1550958054 C Bi:4:003:1 0 486 = 5b5dd701 d6010001 0ca11100 0701cb0d 00006b80 01561bf7 07fae116 1004000a
ffff88b97e752840 1550958067 S Bi:4:003:1 -115 4096 <
ffff88b97e752a80 1550959937 C Bi:4:003:1 0 479 = 5b5dd801 d7010001 0d7a0000 0c01cc0d 00006060 fdff0201 03fa0201 01fa04fe
ffff88b97e752a80 1550959946 S Bi:4:003:1 -115 4096 <
ffff88b97e752f00 1550961937 C Bi:4:003:1 0 483 = 5b5dd901 d7010001 1b530100 0c01cc0d 00005f80 00c31912 190d2115 060efee9
ffff88b97e752f00 1550961948 S Bi:4:003:1 -115 4096 <
ffff88b97e7520c0 1550963691 C Bi:4:003:1 0 478 = 5b5dda01 d6010001 1c471000 0701cb0d 00006e69 03ff0301 fb04f9fc 0afc01ff
ffff88b97e7520c0 1550963703 S Bi:4:003:1 -115 4096 <
ffff88b97e752840 1550965690 C Bi:4:003:1 0 486 = 5b5ddb01 d6010001 2a3c1100 0701cb0d 00006d80 01551bf9 05fee510 1005fb08
ffff88b97e752840 1550965703 S Bi:4:003:1 -115 4096 <
ffff88b97e752a80 1550967430 C Bi:4:003:1 0 479 = 5b5ddc01 d7010001 2b150000 0c01cc0d 0000615e 0101fd01 02fe03fe fa040003
ffff88b97e752a80 1550967441 S Bi:4:003:1 -115 4096 <
ffff88b97e752f00 1550969575 C Bi:4:003:1 0 483 = 5b5ddd01 d7010001 38ee0100 0c01cc0d 00006080 00c51a0d 21082413 050ffeed
ffff88b97e752f00 1550969586 S Bi:4:003:1 -115 4096 <
ffff88b97e7520c0 1550971311 C Bi:4:003:1 0 478 = 5b5dde01 d6010001 39e21000 0701cb0d 0000726c ff050002 f908f404 04fa0301
ffff88b97e7520c0 1550971344 S Bi:4:003:1 -115 4096 <
ffff88b97e752840 1550973312 C Bi:4:003:1 0 486 = 5b5ddf01 d6010001 47d31100 0701cb0d 00007080 015b15f8 08faed0e 0d030203
ffff88b97e752840 1550973325 S Bi:4:003:1 -115 4096 <
ffff88b97e752a80 1550975065 C Bi:4:003:1 0 479 = 5b5de001 d7010001 48ac0000 0c01cc0d 00005d5c 01fb06ff 01fd03fe fefd0401
ffff88b97e752a80 1550975076 S Bi:4:003:1 -115 4096 <
ffff88b97e752f00 1550977190 C Bi:4:003:1 0 483 = 5b5de101 d7010001 56850100 0c01cc0d 00006180 00c51316 1a0d280b 0713faef
ffff88b97e752f00 1550977201 S Bi:4:003:1 -115 4096 <
ffff88b97e7520c0 1550978813 C Bi:4:003:1 0 478 = 5b5de201 d6010001 57791000 0701cb0d 0000716d 02ff0100 fe07f701 02fe02fc
ffff88b97e7520c0 1550978831 S Bi:4:003:1 -115 4096 <
ffff88b97e752840 1550980938 C Bi:4:003:1 0 486 = 5b5de301 d6010001 656e1100 0701cb0d 00006b80 015419fc 07f9e612 0b09fe07
ffff88b97e752840 1550980951 S Bi:4:003:1 -115 4096 <
ffff88b97e752a80 1550982687 C Bi:4:003:1 0 479 = 5b5de401 d7010001 66470000 0c01cc0d 0000625e 02feff00 07f60500 fffc08ff
ffff88b97e752a80 1550982698 S Bi:4:003:1 -115 4096 <
ffff88b97e752f00 1550984812 C Bi:4:003:1 0 483 = 5b5de501 d7010001 74200100 0c01cc0d 00005f80 00bd1c11 1f0a2511 0216fcea
ffff88b97e752f00 1550984823 S Bi:4:003:1 -115 4096 <
ffff88b97e7520c0 1550986438 C Bi:4:003:1 0 478 = 5b5de601 d6010001 75141000 0701cb0d 0000706e f9040004 ff02f900 02fa07fd
ffff88b97e7520c0 1550986457 S Bi:4:003:1 -115 4096 <
ffff88b97e752840 1550988443 C Bi:4:003:1 0 486 = 5b5de701 d6010001 83051100 0701cb0d 00006b80 01561bfa 06fce80e 0a07fe03
ffff88b97e752840 1550988456 S Bi:4:003:1 -115 4096 <
ffff88b97e752a80 1550990313 C Bi:4:003:1 0 479 = 5b5de801 d7010001 83dd0000 0c01cc0d 00006160 00fefe02 03fe0000 0001fd02
ffff88b97e752a80 1550990324 S Bi:4:003:1 -115 4096 <
ffff88b97e752f00 1550992322 C Bi:4:003:1 0 483 = 5b5de901 d7010001 91b60100 0c01cc0d 00005d80 00c41714 190e240d 0911faf0
ffff88b97e752f00 1550992332 S Bi:4:003:1 -115 4096 <
ffff88b97e7520c0 1550994066 C Bi:4:003:1 0 478 = 5b5dea01 d6010001 92ab1000 0701cb0d 00006f6c 01feff05 fd01fb00 ff01fe01
ffff88b97e7520c0 1550994085 S Bi:4:003:1 -115 4096 <
ffff88b97e752840 1550996076 C Bi:4:003:1 0 486 = 5b5deb01 d6010001 a0a01100 0701cb0d 00006b80 015519fb 03fce80c 0e0a0007
ffff88b97e752840 1550996088 S Bi:4:003:1 -115 4096 <
ffff88b97e752a80 1550997813 C Bi:4:003:1 0 479 = 5b5dec01 d7010001 a1780000 0c01cc0d 0000605c 03fe0301 ffffffff fffc0502
ffff88b97e752a80 1550997824 S Bi:4:003:1 -115 4096 <
ffff88b97e752f00 1550999939 C Bi:4:003:1 0 485 = 5b5ded01 d7010001 af510100 0c01cc0d 00005c80 00bf1b0d 1d0f270b 0810feeb
ffff88b97e752f00 1550999950 S Bi:4:003:1 -115 4096 <
ffff88b97e7520c0 1551001687 C Bi:4:003:1 0 478 = 5b5dee01 d6010001 b0461000 0701cb0d 00006f6d 02fffe04 f906fa03 fc020000
ffff88b97e7520c0 1551001706 S Bi:4:003:1 -115 4096 <
ffff88b97e752840 1551003686 C Bi:4:003:1 0 486 = 5b5def01 d6010001 be361100 0701cb0d 00007080 015420f8 05fbe60f 0c070106
ffff88b97e752840 1551003699 S Bi:4:003:1 -115 4096 <
ffff88b97e752a80 1551005453 C Bi:4:003:1 0 479 = 5b5df001 d7010001 bf0e0000 0c01cc0d 0000605f fefe0003 04fa0001 00fc0700
ffff88b97e752a80 1551005465 S Bi:4:003:1 -115 4096 <
ffff88b97e752f00 1551007561 C Bi:4:003:1 0 485 = 5b5df101 d7010001 cce90100 0c01cc0d 00005e80 00c51412 190d290d 0711fee8
ffff88b97e752f00 1551007572 S Bi:4:003:1 -115 4096 <
ffff88b97e7520c0 1551009188 C Bi:4:003:1 0 478 = 5b5df201 d6010001 cdde1000 0701cb0d 00006d68 02fc0500 fa0af404 05fb0101
ffff88b97e7520c0 1551009206 S Bi:4:003:1 -115 4096 <
ffff88b97e752840 1551011316 C Bi:4:003:1 0 488 = 5b5df301 d6010001 dbd41100 0701cb0d 00006880 01521ff2 08fee215 0c060105
ffff88b97e752840 1551011328 S Bi:4:003:1 -115 4096 <
ffff88b97e752a80 1551013062 C Bi:4:003:1 0 479 = 5b5df401 d7010001 dcad0000 0c01cc0d 0000615e 00fd0204 01fa0500 fdfe0202
ffff88b97e752a80 1551013073 S Bi:4:003:1 -115 4096 <
ffff88b97e752f00 1551015060 C Bi:4:003:1 0 485 = 5b5df501 d7010001 ea870100 0c01cc0d 00005f80 00c11a15 1312270f 0413fdeb
ffff88b97e752f00 1551015071 S Bi:4:003:1 -115 4096 <
ffff88b97e7520c0 1551016808 C Bi:4:003:1 0 478 = 5b5df601 d6010001 eb7b1000 0701cb0d 00006c65 07fa0400 f50ef807 fcfdff04
ffff88b97e7520c0 1551016827 S Bi:4:003:1 -115 4096 <
ffff88b97e752840 1551018812 C Bi:4:003:1 0 486 = 5b5df701 d6010001 f96b1100 0701cb0d 00006c80 01521dfd 05fbe80c 0e03010a
ffff88b97e752840 1551018825 S Bi:4:003:1 -115 4096 <
ffff88b97e752a80 1551020689 C Bi:4:003:1 0 479 = 5b5df801 d7010001 fa440000 0c01cc0d 0000615e ff0002ff 01fd0102 fb0008fd
ffff88b97e752a80 1551020700 S Bi:4:003:1 -115 4096 <
ffff88b97e752f00 1551022688 C Bi:4:003:1 0 485 = 5b5df901 d7010001 081e0100 0c01cc0d 00005c80 00bf1514 1f072a0f 0417f8eb
ffff88b97e752f00 1551022699 S Bi:4:003:1 -115 4096 <
ffff88b97e7520c0 1551024439 C Bi:4:003:1 0 478 = 5b5dfa01 d6010001 09131000 0701cb0d 00006b67 03fdfd04 f908fc05 fdff0100
ffff88b97e7520c0 1551024451 S Bi:4:003:1 -115 4096 <
ffff88b97e752840 1551026438 C Bi:4:003:1 0 486 = 5b5dfb01 d6010001 17091100 0701cb0d 00006f80 01561df5 0bf7eb0d 1102fd09
ffff88b97e752840 1551026450 S Bi:4:003:1 -115 4096 <
ffff88b97e752a80 1551028210 C Bi:4:003:1 0 479 = 5b5dfc01 d7010001 17e20000 0c01cc0d 0000625f 01fc0400 03f80401 00fc0203
ffff88b97e752a80 1551028221 S Bi:4:003:1 -115 4096 <
ffff88b97e752f00 1551030316 C Bi:4:003:1 0 485 = 5b5dfd01 d7010001 25bb0100 0c01cc0d 00005e80 00c61411 190d290d 0516f8ec
ffff88b97e752f00 1551030327 S Bi:4:003:1 -115 4096 <
ffff88b97e7520c0 1551031939 C Bi:4:003:1 0 478 = 5b5dfe01 d6010001 26af1000 0701cb0d 00006c69 fdfc06ff fe0af503 01fdfc06
ffff88b97e7520c0 1551031952 S Bi:4:003:1 -115 4096 <
ffff88b97e752840 1551034062 C Bi:4:003:1 0 486 = 5b5dff01 d6010001 34a01100 0701cb0d 00006e80 01541df9 06fce810 0eff0109
ffff88b97e752840 1551034075 S Bi:4:003:1 -115 4096 <
ffff88b97e752a80 1551035815 C Bi:4:003:1 0 479 = 5b5d0001 d7010001 35780000 0c01cc0d 0000605d 00ff01ff 010300fe feff05fe
ffff88b97e752a80 1551035826 S Bi:4:003:1 -115 4096 <
ffff88b97e752f00 1551037816 C Bi:4:003:1 0 485 = 5b5d0101 d7010001 43530100 0c01cc0d 00005d80 00c51216 1c0a230f 090efdeb
ffff88b97e752f00 1551037827 S Bi:4:003:1 -115 4096 <
ffff88b97e7520c0 1551039563 C Bi:4:003:1 0 478 = 5b5d0201 d6010001 44471000 0701cb0d 00006e6d fdfb04ff fe0af809 f9ffff00
ffff88b97e7520c0 1551039582 S Bi:4:003:1 -115 4096 <
ffff88b97e752840 1551041577 C Bi:4:003:1 0 486 = 5b5d0301 d6010001 523e1100 0701cb0d 00006f80 015818fc 0400e30c 1005ff08
ffff88b97e752840 1551041590 S Bi:4:003:1 -115 4096 <
ffff88b97e752a80 1551043333 C Bi:4:003:1 0 479 = 5b5d0401 d7010001 53160000 0c01cc0d 0000605d 00fd0302 01fb03ff fffd08fd
ffff88b97e752a80 1551043344 S Bi:4:003:1 -115 4096 <
ffff88b97e752f00 1551045433 C Bi:4:003:1 0 483 = 5b5d0501 d7010001 60ef0100 0c01cc0d 00005d80 00bd1c0d 1b0e2a0d 070ffced
ffff88b97e752f00 1551045444 S Bi:4:003:1 -115 4096 <
ffff88b97e7520c0 1551047188 C Bi:4:003:1 0 478 = 5b5d0601 d6010001 61e31000 0701cb0d 00006e6c fff907fe fd08fa02 fcff06fb
ffff88b97e7520c0 1551047207 S Bi:4:003:1 -115 4096 <
ffff88b97e752840 1551049187 C Bi:4:003:1 0 486 = 5b5d0701 d6010001 6fd31100 0701cb0d 00007080 01571ff6 09fbe80b 0b09fb0a
ffff88b97e752840 1551049200 S Bi:4:003:1 -115 4096 <
ffff88b97e752a80 1551050944 C Bi:4:003:1 0 479 = 5b5d0801 d7010001 70ab0000 0c01cc0d 00005e5d fb0206fd 03fa02ff fffe06ff
ffff88b97e752a80 1551050955 S Bi:4:003:1 -115 4096 <
ffff88b97e752f00 1551053063 C Bi:4:003:1 0 485 = 5b5d0901 d7010001 7e840100 0c01cc0d 00005f80 00c0151a 170f270a 0616f9f0
ffff88b97e752f00 1551053074 S Bi:4:003:1 -115 4096 <
ffff88b97e7520c0 1551054812 C Bi:4:003:1 0 478 = 5b5d0a01 d6010001 7f781000 0701cb0d 0000706f fffcfc05 fd05fa06 ff0102fc
ffff88b97e7520c0 1551054824 S Bi:4:003:1 -115 4096 <
ffff88b97e752840 1551056814 C Bi:4:003:1 0 486 = 5b5d0b01 d6010001 8d711100 0701cb0d 00006a80 015716f8 0afce114 0d06fd0a
ffff88b97e752840 1551056826 S Bi:4:003:1 -115 4096 <
ffff88b97e752a80 1551058563 C Bi:4:003:1 0 479 = 5b5d0c01 d7010001 8e490000 0c01cc0d 00005f5e 00fd0103 03fa01fe 00000105
ffff88b97e752a80 1551058574 S Bi:4:003:1 -115 4096 <
ffff88b97e752f00 1551060582 C Bi:4:003:1 0 483 = 5b5d0d01 d7010001 9c220100 0c01cc0d 00005f80 00c11b13 180d2313 0217f8ec
ffff88b97e752f00 1551060593 S Bi:4:003:1 -115 4096 <
ffff88b97e7520c0 1551062314 C Bi:4:003:1 0 478 = 5b5d0e01 d6010001 9d171000 0701cb0d 00006b6b fd01fd04 fc06f703 fd0304ff
ffff88b97e7520c0 1551062332 S Bi:4:003:1 -115 4096 <
ffff88b97e752840 1551064313 C Bi:4:003:1 0 486 = 5b5d0f01 d6010001 ab061100 0701cb0d 00006e80 01571cf7 02ffe40e 1308f90f
ffff88b97e752840 1551064325 S Bi:4:003:1 -115 4096 <
ffff88b97e752a80 1551066063 C Bi:4:003:1 0 479 = 5b5d1001 d7010001 abde0000 0c01cc0d 00006262 fffd04fe 02fe02ff fd010103
ffff88b97e752a80 1551066074 S Bi:4:003:1 -115 4096 <
ffff88b97e752f00 1551068188 C Bi:4:003:1 0 485 = 5b5d1101 d7010001 b9b10100 0c01cc0d 00005e80 00c21810 1a0d2b0a 0713faef
ffff88b97e752f00 1551068199 S Bi:4:003:1 -115 4096 <
ffff88b97e7520c0 1551069938 C Bi:4:003:1 0 478 = 5b5d1201 d6010001 baa61000 0701cb0d 00006e67 04fdfe00 ff0af701 0200fdff
ffff88b97e7520c0 1551069950 S Bi:4:003:1 -115 4096 <
ffff88b97e752840 1551071941 C Bi:4:003:1 0 486 = 5b5d1301 d6010001 c89e1100 0701cb0d 00006b80 01531ef8 04fbe610 1204fc09
ffff88b97e752840 1551071953 S Bi:4:003:1 -115 4096 <
ffff88b97e752a80 1551073688 C Bi:4:003:1 0 479 = 5b5d1401 d7010001 c9770000 0c01cc0d 0000615d ff020201 00fd01ff ffff0301
ffff88b97e752a80 1551073699 S Bi:4:003:1 -115 4096 <
ffff88b97e752f00 1551075814 C Bi:4:003:1 0 483 = 5b5d1501 d7010001 d74f0100 0c01cc0d 00005f80 00c3180f 190e2b0d 0415faeb
ffff88b97e752f00 1551075825 S Bi:4:003:1 -115 4096 <
ffff88b97e7520c0 1551077453 C Bi:4:003:1 0 478 = 5b5d1601 d6010001 d8441000 0701cb0d 00006e6b fefe0405 fc03f900 fb07fe04
ffff88b97e7520c0 1551077465 S Bi:4:003:1 -115 4096 <
ffff88b97e752840 1551079431 C Bi:4:003:1 0 486 = 5b5d1701 d6010001 e6331100 0701cb0d 00006e80 01561ffa 04f8ea0d 0c08fb0b
ffff88b97e752840 1551079443 S Bi:4:003:1 -115 4096 <
ffff88b97e752a80 1551081316 C Bi:4:003:1 0 479 = 5b5d1801 d7010001 e70c0000 0c01cc0d 0000635f ff000004 03fa02ff fa010500
ffff88b97e752a80 1551081327 S Bi:4:003:1 -115 4096 <
ffff88b97e752f00 1551083314 C Bi:4:003:1 0 483 = 5b5d1901 d7010001 f4de0100 0c01cc0d 00005c80 00c01812 1b102213 0214fce9
ffff88b97e752f00 1551083324 S Bi:4:003:1 -115 4096 <
ffff88b97e7520c0 1551085063 C Bi:4:003:1 0 478 = 5b5d1a01 d6010001 f5d31000 0701cb0d 00006964 03fcfd08 fb06fd00 00fdfe00
ffff88b97e7520c0 1551085076 S Bi:4:003:1 -115 4096 <
ffff88b97e752840 1551087064 C Bi:4:003:1 0 486 = 5b5d1b01 d6010001 03ca1100 0701cb0d 00007080 01551ffa 07fde00e 0f040007
ffff88b97e752840 1551087076 S Bi:4:003:1 -115 4096 <
ffff88b97e752a80 1551088814 C Bi:4:003:1 0 479 = 5b5d1c01 d7010001 04a20000 0c01cc0d 0000625f fefc0502 03fa07fa 00ff0203
ffff88b97e752a80 1551088825 S Bi:4:003:1 -115 4096 <
ffff88b97e752f00 1551090939 C Bi:4:003:1 0 485 = 5b5d1d01 d7010001 127b0100 0c01cc0d 00006080 00c41c09 1e102211 0512fbed
ffff88b97e752f00 1551090950 S Bi:4:003:1 -115 4096 <
ffff88b97e7520c0 1551092569 C Bi:4:003:1 0 478 = 5b5d1e01 d6010001 13701000 0701cb0d 00006e6b 00000200 fb05f802 02000202
ffff88b97e7520c0 1551092581 S Bi:4:003:1 -115 4096 <
ffff88b97e752840 1551094688 C Bi:4:003:1 0 488 = 5b5d1f01 d6010001 21661100 0701cb0d 00006c80 01531dfd 0100e50a 1105fa08
ffff88b97e752840 1551094701 S Bi:4:003:1 -115 4096 <
ffff88b97e752a80 1551096438 C Bi:4:003:1 0 479 = 5b5d2001 d7010001 223f0000 0c01cc0d 00005e5c 00fd05ff 02fe04fd fefc0302
ffff88b97e752a80 1551096449 S Bi:4:003:1 -115 4096 <
ffff88b97e752f00 1551098432 C Bi:4:003:1 0 483 = 5b5d2101 d7010001 30130100 0c01cc0d 00006080 00c51613 1a0c2413 060bfdef
ffff88b97e752f00 1551098443 S Bi:4:003:1 -115 4096 <
ffff88b97e7520c0 1551100191 C Bi:4:003:1 0 478 = 5b5d2201 d6010001 31071000 0701cb0d 0000716f 000000fc ff07f408 01ff0200
ffff88b97e7520c0 1551100211 S Bi:4:003:1 -115 4096 <
ffff88b97e752840 1551102204 C Bi:4:003:1 0 488 = 5b5d2301 d6010001 3efd1100 0701cb0d 00006c80 014f20fa 04fce60f 1306fd0c
ffff88b97e752840 1551102216 S Bi:4:003:1 -115 4096 <
ffff88b97e752a80 1551103958 C Bi:4:003:1 0 479 = 5b5d2401 d7010001 3fd50000 0c01cc0d 0000605f fdff01ff 030001ff fc010300
ffff88b97e752a80 1551103969 S Bi:4:003:1 -115 4096 <
ffff88b97e752f00 1551106059 C Bi:4:003:1 0 483 = 5b5d2501 d7010001 4db10100 0c01cc0d 00005e80 00c11515 1e082b0b 0712fbee
ffff88b97e752f00 1551106070 S Bi:4:003:1 -115 4096 <
ffff88b97e7520c0 1551107813 C Bi:4:003:1 0 478 = 5b5d2601 d6010001 4ea51000 0701cb0d 00006b69 fefc0401 fc0af8fe 02fffe04
ffff88b97e7520c0 1551107826 S Bi:4:003:1 -115 4096 <
ffff88b97e752840 1551109812 C Bi:4:003:1 0 486 = 5b5d2701 d6010001 5c9b1100 0701cb0d 00006d80 01551df9 05fee609 1408fa07
ffff88b97e752840 1551109824 S Bi:4:003:1 -115 4096 <
ffff88b97e752a80 1551111564 C Bi:4:003:1 0 479 = 5b5d2801 d7010001 5d740000 0c01cc0d 00005e5c fb0304ff 01ff01fd 01fd0303
ffff88b97e752a80 1551111575 S Bi:4:003:1 -115 4096 <
ffff88b97e752f00 1551113688 C Bi:4:003:1 0 485 = 5b5d2901 d7010001 6b460100 0c01cc0d 00005e80 00c01a12 190d2712 0511f9ee
ffff88b97e752f00 1551113699 S Bi:4:003:1 -115 4096 <
ffff88b97e7520c0 1551115313 C Bi:4:003:1 0 478 = 5b5d2a01 d6010001 6c3b1000 0701cb0d 00007372 fefe03fe fb07f507 01ffff00
ffff88b97e7520c0 1551115325 S Bi:4:003:1 -115 4096 <
ffff88b97e752840 1551117330 C Bi:4:003:1 0 488 = 5b5d2b01 d6010001 7a311100 0701cb0d 00006f80 015618fe 07fae612 0b06fa08
ffff88b97e752840 1551117342 S Bi:4:003:1 -115 4096 <
ffff88b97e752a80 1551119188 C Bi:4:003:1 0 479 = 5b5d2c01 d7010001 7b0a0000 0c01cc0d 00006261 fffc05fe 04f905ff 00fd0203
ffff88b97e752a80 1551119199 S Bi:4:003:1 -115 4096 <
ffff88b97e752f00 1551121209 C Bi:4:003:1 0 483 = 5b5d2d01 d7010001 88e60100 0c01cc0d 00005d80 00c31414 1b102112 0411fceb
ffff88b97e752f00 1551121220 S Bi:4:003:1 -115 4096 <
ffff88b97e7520c0 1551122938 C Bi:4:003:1 0 478 = 5b5d2e01 d6010001 89da1000 0701cb0d 00006b64 08fa03fd fd05fb04 02fe01fc
ffff88b97e7520c0 1551122957 S Bi:4:003:1 -115 4096 <
ffff88b97e752840 1551124945 C Bi:4:003:1 0 486 = 5b5d2f01 d6010001 97d01100 0701cb0d 00006d80 01551cf7 07fdea0c 0d08fd05
ffff88b97e752840 1551124958 S Bi:4:003:1 -115 4096 <
ffff88b97e752a80 1551126812 C Bi:4:003:1 0 479 = 5b5d3001 d7010001 98a80000 0c01cc0d 0000605b 02fe0004 02fd0000 fcfd0401
ffff88b97e752a80 1551126823 S Bi:4:003:1 -115 4096 <
ffff88b97e752f00 1551128812 C Bi:4:003:1 0 483 = 5b5d3101 d7010001 a67b0100 0c01cc0d 00006180 00c31814 1a0f2111 0711faeb
ffff88b97e752f00 1551128823 S Bi:4:003:1 -115 4096 <
ffff88b97e7520c0 1551130562 C Bi:4:003:1 0 478 = 5b5d3201 d6010001 a76f1000 0701cb0d 0000706d 02fb08fa fe08f7fe 05000200
ffff88b97e7520c0 1551130581 S Bi:4:003:1 -115 4096 <
ffff88b97e752840 1551132565 C Bi:4:003:1 0 488 = 5b5d3301 d6010001 b5651100 0701cb0d 00006f80 01561bf9 06fbe90d 0f05fe09
ffff88b97e752840 1551132578 S Bi:4:003:1 -115 4096 <
ffff88b97e752a80 1551134321 C Bi:4:003:1 0 479 = 5b5d3401 d7010001 b63e0000 0c01cc0d 0000605c 02fb06fe 03fc02ff 01fe0005
ffff88b97e752a80 1551134332 S Bi:4:003:1 -115 4096 <
ffff88b97e752f00 1551136327 C Bi:4:003:1 0 483 = 5b5d3501 d7010001 c4190100 0c01cc0d 00005e80 00c31a12 140e2910 0612fbec
ffff88b97e752f00 1551136338 S Bi:4:003:1 -115 4096 <
ffff88b97e7520c0 1551138063 C Bi:4:003:1 0 478 = 5b5d3601 d6010001 c50e1000 0701cb0d 00006a69 00fc0001 f70cfd01 03fdfd01
ffff88b97e7520c0 1551138081 S Bi:4:003:1 -115 4096 <
ffff88b97e752840 1551140072 C Bi:4:003:1 0 488 = 5b5d3701 d6010001 d3031100 0701cb0d 00006b80 014f20fc 03fce70e 0d05fd09
ffff88b97e752840 1551140084 S Bi:4:003:1 -115 4096 <
ffff88b97e752a80 1551141939 C Bi:4:003:1 0 479 = 5b5d3801 d7010001 d3dc0000 0c01cc0d 00006060 fefd0300 02fe0000 fefa0701
ffff88b97e752a80 1551141950 S Bi:4:003:1 -115 4096 <
ffff88b97e752f00 1551143952 C Bi:4:003:1 0 483 = 5b5d3901 d7010001 e1af0100 0c01cc0d 00005b80 00c11714 15132410 0410fceb
ffff88b97e752f00 1551143963 S Bi:4:003:1 -115 4096 <
ffff88b97e7520c0 1551145690 C Bi:4:003:1 0 478 = 5b5d3a01 d6010001 e2a41000 0701cb0d 00006c6d fefd0301 fb05fc01 feff0103
ffff88b97e7520c0 1551145702 S Bi:4:003:1 -115 4096 <
ffff88b97e752840 1551147716 C Bi:4:003:1 0 486 = 5b5d3b01 d6010001 f0991100 0701cb0d 00006a80 01501dfc 00fde417 0d030002
ffff88b97e752840 1551147733 S Bi:4:003:1 -115 4096 <
ffff88b97e752a80 1551149437 C Bi:4:003:1 0 479 = 5b5d3c01 d7010001 f1720000 0c01cc0d 0000615a 030003fd 04fe01fb 02fffe08
ffff88b97e752a80 1551149449 S Bi:4:003:1 -115 4096 <
ffff88b97e752f00 1551151564 C Bi:4:003:1 0 485 = 5b5d3d01 d7010001 ff4b0100 0c01cc0d 00005f80 00c11715 1a082b0f 050ffdea
ffff88b97e752f00 1551151576 S Bi:4:003:1 -115 4096 <
ffff88b97e7520c0 1551153315 C Bi:4:003:1 0 478 = 5b5d3e01 d6010001 003f1000 0701cb0d 00006a69 fff90300 0205fc01 fefb0201
ffff88b97e7520c0 1551153327 S Bi:4:003:1 -115 4096 <
ffff88b97e752840 1551155316 C Bi:4:003:1 0 486 = 5b5d3f01 d6010001 0e361100 0701cb0d 00006c80 015418fc 08f9e413 0d0afd09
ffff88b97e752840 1551155329 S Bi:4:003:1 -115 4096 <
ffff88b97e752a80 1551157064 C Bi:4:003:1 0 479 = 5b5d4001 d7010001 0f0e0000 0c01cc0d 0000605d fffc07fe 04fc0200 00f90803
ffff88b97e752a80 1551157076 S Bi:4:003:1 -115 4096 <
ffff88b97e752f00 1551159071 C Bi:4:003:1 0 485 = 5b5d4101 d7010001 1ce10100 0c01cc0d 00005e80 00c5150d 1d0d290f 0216faf0
ffff88b97e752f00 1551159082 S Bi:4:003:1 -115 4096 <
ffff88b97e7520c0 1551160815 C Bi:4:003:1 0 478 = 5b5d4201 d6010001 1dd61000 0701cb0d 00006c66 06f905ff fd04fc02 03fb0000
ffff88b97e7520c0 1551160827 S Bi:4:003:1 -115 4096 <
ffff88b97e752840 1551162817 C Bi:4:003:1 0 486 = 5b5d4301 d6010001 2bcc1100 0701cb0d 00006880 015317fb 06faea11 0c06fc0a
ffff88b97e752840 1551162829 S Bi:4:003:1 -115 4096 <
ffff88b97e752a80 1551164689 C Bi:4:003:1 0 479 = 5b5d4401 d7010001 2ca50000 0c01cc0d 0000625d 02ff0100 01fe03fd ffff0401
ffff88b97e752a80 1551164700 S Bi:4:003:1 -115 4096 <
ffff88b97e752f00 1551166694 C Bi:4:003:1 0 485 = 5b5d4501 d7010001 3a7e0100 0c01cc0d 00005e80 00c11712 1c0d280d 0910faef
ffff88b97e752f00 1551166705 S Bi:4:003:1 -115 4096 <
ffff88b97e7520c0 1551169314 C Bi:4:003:1 0 2471 = 5b5d4609 9f020201 015c083d 00001012 02061013 02011011 03061014 43011015
ffff88b97e7520c0 1551169324 S Bi:4:003:1 -115 4096 <
ffff88b97e752840 1551170815 C Bi:4:003:1 0 478 = 5b5d4701 d6010001 3b721000 0701cb8d 0000706a 0202fd00 ff04f609 fffe0100
ffff88b97e752840 1551170833 S Bi:4:003:1 -115 4096 <
ffff88b97e752a80 1551173814 C Bi:4:003:1 0 486 = 5b5d4801 d6010001 568d1100 0701cb8d 00007080 01501ef6 0ff5e90d 0e0afa09
ffff88b97e752a80 1551173827 S Bi:4:003:1 -115 4096 <
ffff88b97e752f00 1551176084 C Bi:4:003:1 0 479 = 5b5d4901 d7010001 57650000 0c01cc8d 00006260 fa0104ff 05f905fe fc000303
ffff88b97e752f00 1551176095 S Bi:4:003:1 -115 4096 <
ffff88b97e7520c0 1551179698 C Bi:4:003:1 0 485 = 5b5d4a01 d7010001 67360100 0c01cc8d 00005e80 00c41909 210b2911 0115f8ef
ffff88b97e7520c0 1551179709 S Bi:4:003:1 -115 4096 <
ffff88b97e752840 1551897949 C Bi:4:003:1 0 478 = 5b5d4b01 d6010001 5a571000 0701cb0d 00006a69 fcfe0002 ff05f804 fefb09ff
ffff88b97e752840 1551897969 S Bi:4:003:1 -115 4096 <
ffff88b97e752a80 1551899940 C Bi:4:003:1 0 486 = 5b5d4c01 d6010001 6a471100 0701cb0d 00006e80 01561cfd 05f8e611 0a06010b
ffff88b97e752a80 1551899953 S Bi:4:003:1 -115 4096 <
ffff88b97e752f00 1551901819 C Bi:4:003:1 0 479 = 5b5d4d01 d7010001 6b200000 0c01cc0d 00006160 fdff0301 02fdff00 00ff0102
ffff88b97e752f00 1551901830 S Bi:4:003:1 -115 4096 <
ffff88b97e7520c0 1551903820 C Bi:4:003:1 0 483 = 5b5d4e01 d7010001 78f20100 0c01cc0d 00005d80 00abf5e1 edea0aff fdf60cff
ffff88b97e7520c0 1551903831 S Bi:4:003:1 -115 4096 <
ffff88b97e752840 1551905573 C Bi:4:003:1 0 478 = 5b5d4f01 d6010001 79e71000 0701cb0d 0000716e fdfc06fe fb05fa03 fd05fe04
ffff88b97e752840 1551905586 S Bi:4:003:1 -115 4096 <
ffff88b97e752a80 1551907570 C Bi:4:003:1 0 486 = 5b5d5001 d6010001 87de1100 0701cb0d 00006f80 01551cfd 03fbe80d 0e0afa0c
ffff88b97e752a80 1551907582 S Bi:4:003:1 -115 4096 <
ffff88b97e752f00 1551909321 C Bi:4:003:1 0 479 = 5b5d5101 d7010001 88b70000 0c01cc0d 00005e5d 00fb05ff 05fb0102 fb000402
ffff88b97e752f00 1551909332 S Bi:4:003:1 -115 4096 <
ffff88b97e7520c0 1551911334 C Bi:4:003:1 0 485 = 5b5d5201 d7010001 968f0100 0c01cc0d 00005d80 009eeae6 f6f00efd 00f40c00
ffff88b97e7520c0 1551911346 S Bi:4:003:1 -115 4096 <
ffff88b97e752840 1551913071 C Bi:4:003:1 0 478 = 5b5d5301 d6010001 97841000 0701cb0d 00006c69 02fc0000 f70cfa02 fd03fe02
ffff88b97e752840 1551913083 S Bi:4:003:1 -115 4096 <
ffff88b97e752a80 1551915070 C Bi:4:003:1 0 486 = 5b5d5401 d6010001 a57a1100 0701cb0d 00006c80 015719fb 07f7e910 090df80b
ffff88b97e752a80 1551915082 S Bi:4:003:1 -115 4096 <
ffff88b97e752f00 1551916945 C Bi:4:003:1 0 479 = 5b5d5501 d7010001 a6530000 0c01cc0d 00006160 fdfe04fe 06fc01fe 00fd0202
ffff88b97e752f00 1551916956 S Bi:4:003:1 -115 4096 <
ffff88b97e7520c0 1551918949 C Bi:4:003:1 0 483 = 5b5d5601 d7010001 b4260100 0c01cc0d 00005d80 0090e9e8 fbf90cfe 02f60901
ffff88b97e7520c0 1551918960 S Bi:4:003:1 -115 4096 <
ffff88b97e752840 1551920696 C Bi:4:003:1 0 478 = 5b5d5701 d6010001 b51a1000 0701cb0d 00006c65 01fd0303 f809fd02 fffd02fc
ffff88b97e752840 1551920714 S Bi:4:003:1 -115 4096 <
ffff88b97e752a80 1551922696 C Bi:4:003:1 0 486 = 5b5d5801 d6010001 c3111100 0701cb0d 00006e80 01541ffa 07f9e312 0d06fe0c
ffff88b97e752a80 1551922708 S Bi:4:003:1 -115 4096 <
ffff88b97e752f00 1551924438 C Bi:4:003:1 0 479 = 5b5d5901 d7010001 c3ea0000 0c01cc0d 0000615d 04fc03ff 02fe03fa 03fe0300
ffff88b97e752f00 1551924449 S Bi:4:003:1 -115 4096 <
ffff88b97e7520c0 1551926570 C Bi:4:003:1 0 483 = 5b5d5a01 d7010001 d1c30100 0c01cc0d 00005d80 0087ebf2 faf90bfd 05f20804
ffff88b97e7520c0 1551926581 S Bi:4:003:1 -115 4096 <
ffff88b97e752840 1551928323 C Bi:4:003:1 0 478 = 5b5d5b01 d6010001 d2b71000 0701cb0d 00006e62 05fe0301 f909f908 fbffff02
ffff88b97e752840 1551928343 S Bi:4:003:1 -115 4096 <
ffff88b97e752a80 1551930323 C Bi:4:003:1 0 486 = 5b5d5c01 d6010001 e0ac1100 0701cb0d 00007180 015919fd 07fbe611 0808fa0b
ffff88b97e752a80 1551930335 S Bi:4:003:1 -115 4096 <
ffff88b97e752f00 1551932070 C Bi:4:003:1 0 479 = 5b5d5d01 d7010001 e1850000 0c01cc0d 0000615f feff0202 02fa05fc 000003ff
ffff88b97e752f00 1551932081 S Bi:4:003:1 -115 4096 <
ffff88b97e7520c0 1551934076 C Bi:4:003:1 0 485 = 5b5d5e01 d7010001 ef570100 0c01cc0d 00005c80 0082eff0 fef50efb 04f60703
ffff88b97e7520c0 1551934088 S Bi:4:003:1 -115 4096 <
ffff88b97e752840 1551935821 C Bi:4:003:1 0 478 = 5b5d5f01 d6010001 f04c1000 0701cb0d 00006b67 00fd04fe fc0bf702 fe02fd02
ffff88b97e752840 1551935834 S Bi:4:003:1 -115 4096 <
ffff88b97e752a80 1551937819 C Bi:4:003:1 0 486 = 5b5d6001 d6010001 fe431100 0701cb0d 00007080 015a1ff5 06fde50e 0a09fd0a
ffff88b97e752a80 1551937831 S Bi:4:003:1 -115 4096 <
ffff88b97e752f00 1551939697 C Bi:4:003:1 0 479 = 5b5d6101 d7010001 ff1b0000 0c01cc0d 0000605b 04fc0202 03fb02ff 00fc0500
ffff88b97e752f00 1551939708 S Bi:4:003:1 -115 4096 <
ffff88b97e7520c0 1551941697 C Bi:4:003:1 0 485 = 5b5d6201 d7010001 0cf60100 0c01cc0d 00005c80 0081edf2 fef610ff fef40c00
ffff88b97e7520c0 1551941708 S Bi:4:003:1 -115 4096 <
ffff88b97e752840 1551943448 C Bi:4:003:1 0 478 = 5b5d6301 d6010001 0dea1000 0701cb0d 00006b68 fdfa09fd ff06fb02 fdfffc03
ffff88b97e752840 1551943460 S Bi:4:003:1 -115 4096 <
ffff88b97e752a80 1551945446 C Bi:4:003:1 0 486 = 5b5d6401 d6010001 1be11100 0701cb0d 00006f80 01571cfb 05fbe413 0a060009
ffff88b97e752a80 1551945459 S Bi:4:003:1 -115 4096 <
ffff88b97e752f00 1551947188 C Bi:4:003:1 0 479 = 5b5d6501 d7010001 1cba0000 0c01cc0d 00006260 ffff0101 02fc00fd 03fe02ff
ffff88b97e752f00 1551947199 S Bi:4:003:1 -115 4096 <
ffff88b97e7520c0 1551949322 C Bi:4:003:1 0 483 = 5b5d6601 d7010001 2a8c0100 0c01cc0d 00005c80 0086eaf4 faf80a02 fcf60e00
ffff88b97e7520c0 1551949333 S Bi:4:003:1 -115 4096 <
ffff88b97e752840 1551950949 C Bi:4:003:1 0 478 = 5b5d6701 d6010001 2b811000 0701cb0d 00006c6b fefc0301 fa09f702 f80affff
ffff88b97e752840 1551950968 S Bi:4:003:1 -115 4096 <
ffff88b97e752a80 1551952965 C Bi:4:003:1 0 486 = 5b5d6801 d6010001 39761100 0701cb0d 00007180 015521f4 10f2e90c 0c0cfc06
ffff88b97e752a80 1551952978 S Bi:4:003:1 -115 4096 <
ffff88b97e752f00 1551954822 C Bi:4:003:1 0 479 = 5b5d6901 d7010001 3a4f0000 0c01cc0d 0000605f feff02ff 05fa02fe ff0004ff
ffff88b97e752f00 1551954833 S Bi:4:003:1 -115 4096 <
ffff88b97e7520c0 1551956822 C Bi:4:003:1 0 483 = 5b5d6a01 d7010001 48290100 0c01cc0d 00006080 0088e9f4 fbf50ffd 01f20b04
ffff88b97e7520c0 1551956833 S Bi:4:003:1 -115 4096 <
ffff88b97e752840 1551958584 C Bi:4:003:1 0 478 = 5b5d6b01 d6010001 491e1000 0701cb0d 00006c64 09f70104 f60ef902 00ff00fe
ffff88b97e752840 1551958603 S Bi:4:003:1 -115 4096 <
ffff88b97e752a80 1551960585 C Bi:4:003:1 0 486 = 5b5d6c01 d6010001 57131100 0701cb0d 00006e80 015915fd 06fae615 0908fc09
ffff88b97e752a80 1551960597 S Bi:4:003:1 -115 4096 <
ffff88b97e752f00 1551962341 C Bi:4:003:1 0 479 = 5b5d6d01 d7010001 57ec0000 0c01cc0d 00006261 00fc03ff 04fffe00 fdff06ff
ffff88b97e752f00 1551962352 S Bi:4:003:1 -115 4096 <
ffff88b97e7520c0 1551964446 C Bi:4:003:1 0 483 = 5b5d6e01 d7010001 65be0100 0c01cc0d 00006080 0088eef0 fdf10eff 00f60d02
ffff88b97e7520c0 1551964457 S Bi:4:003:1 -115 4096 <
ffff88b97e752840 1551966196 C Bi:4:003:1 0 478 = 5b5d6f01 d6010001 66b31000 0701cb0d 00006f68 05f709ff f70af702 00010201
ffff88b97e752840 1551966215 S Bi:4:003:1 -115 4096 <
ffff88b97e752a80 1551968195 C Bi:4:003:1 0 486 = 5b5d7001 d6010001 74a81100 0701cb0d 00006e80 015420fa 02fee80b 0e08fd07
ffff88b97e752a80 1551968208 S Bi:4:003:1 -115 4096 <
ffff88b97e752f00 1551969946 C Bi:4:003:1 0 479 = 5b5d7101 d7010001 75810000 0c01cc0d 00006061 fefe0101 04f805ff fefe05fb
ffff88b97e752f00 1551969957 S Bi:4:003:1 -115 4096 <
ffff88b97e7520c0 1551972072 C Bi:4:003:1 0 483 = 5b5d7201 d7010001 835b0100 0c01cc0d 00005f80 008fe3f1 01f012fd 00f40bff
ffff88b97e7520c0 1551972083 S Bi:4:003:1 -115 4096 <
ffff88b97e752840 1551973821 C Bi:4:003:1 0 478 = 5b5d7301 d6010001 84501000 0701cb0d 00006c68 fd000301 fb06f902 fe02ff04
ffff88b97e752840 1551973833 S Bi:4:003:1 -115 4096 <
ffff88b97e752a80 1551975820 C Bi:4:003:1 0 486 = 5b5d7401 d6010001 92451100 0701cb0d 00006f80 015818fe 03feea0b 0e02f90f
ffff88b97e752a80 1551975833 S Bi:4:003:1 -115 4096 <
ffff88b97e752f00 1551977571 C Bi:4:003:1 0 479 = 5b5d7501 d7010001 931e0000 0c01cc0d 00006263 fffb0201 02fc06fe fffc0003
ffff88b97e752f00 1551977582 S Bi:4:003:1 -115 4096 <
ffff88b97e7520c0 1551979569 C Bi:4:003:1 0 483 = 5b5d7601 d7010001 a0f00100 0c01cc0d 00006180 009ae3eb faf213fe 00f20c01
ffff88b97e7520c0 1551979581 S Bi:4:003:1 -115 4096 <
ffff88b97e752840 1551981322 C Bi:4:003:1 0 478 = 5b5d7701 d6010001 a1e41000 0701cb0d 00006f6a 03fd01fe fd05f805 02ff04fc
ffff88b97e752840 1551981341 S Bi:4:003:1 -115 4096 <
ffff88b97e752a80 1551983322 C Bi:4:003:1 0 486 = 5b5d7801 d6010001 afda1100 0701cb0d 00006f80 015421f8 04fae610 1007fa0b
ffff88b97e752a80 1551983333 S Bi:4:003:1 -115 4096 <
ffff88b97e752f00 1551985065 C Bi:4:003:1 0 479 = 5b5d7901 d7010001 b0b30000 0c01cc0d 00006261 fffe01fd 05fe02ff 00fa0701
ffff88b97e752f00 1551985076 S Bi:4:003:1 -115 4096 <
ffff88b97e7520c0 1551987195 C Bi:4:003:1 0 483 = 5b5d7a01 d7010001 be8b0100 0c01cc0d 00005f80 0097e4ed fdef11fd fff30e00
ffff88b97e7520c0 1551987206 S Bi:4:003:1 -115 4096 <
ffff88b97e752840 1551988946 C Bi:4:003:1 0 478 = 5b5d7b01 d6010001 bf801000 0701cb0d 00006f6a 01fefd03 fb0af803 fd0301fc
ffff88b97e752840 1551988958 S Bi:4:003:1 -115 4096 <
ffff88b97e752a80 1551990947 C Bi:4:003:1 0 486 = 5b5d7c01 d6010001 cd771100 0701cb0d 00006a80 015519f8 06fde910 0b050107
ffff88b97e752a80 1551990959 S Bi:4:003:1 -115 4096 <
ffff88b97e752f00 1551992699 C Bi:4:003:1 0 479 = 5b5d7d01 d7010001 ce500000 0c01cc0d 00006161 fdfc0303 03f807fd fc010401
ffff88b97e752f00 1551992710 S Bi:4:003:1 -115 4096 <
ffff88b97e7520c0 1551994821 C Bi:4:003:1 0 483 = 5b5d7e01 d7010001 dc220100 0c01cc0d 00005d80 009ce8e6 f7f30e00 fff40b01
ffff88b97e7520c0 1551994832 S Bi:4:003:1 -115 4096 <
ffff88b97e752840 1551996445 C Bi:4:003:1 0 478 = 5b5d7f01 d6010001 dd161000 0701cb0d 00006d68 01f80501 fa09fd00 fd02fc03
ffff88b97e752840 1551996458 S Bi:4:003:1 -115 4096 <
ffff88b97e752a80 1551998443 C Bi:4:003:1 0 486 = 5b5d8001 d6010001 eb061100 0701cb0d 00006e80 01561afd 04fbe612 0d04fc0b
ffff88b97e752a80 1551998456 S Bi:4:003:1 -115 4096 <
ffff88b97e752f00 1552000321 C Bi:4:003:1 0 479 = 5b5d8101 d7010001 ebde0000 0c01cc0d 0000615f 02f70600 02fe0101 fc010201
ffff88b97e752f00 1552000332 S Bi:4:003:1 -115 4096 <
ffff88b97e7520c0 1552002321 C Bi:4:003:1 0 483 = 5b5d8201 d7010001 f9b70100 0c01cc0d 00005d80 00a3eadf f5f30ffe fff20e00
ffff88b97e7520c0 1552002331 S Bi:4:003:1 -115 4096 <
ffff88b97e752840 1552004069 C Bi:4:003:1 0 478 = 5b5d8301 d6010001 faab1000 0701cb0d 00006d6a fc000203 fa09fa03 f8030000
ffff88b97e752840 1552004090 S Bi:4:003:1 -115 4096 <
ffff88b97e752a80 1552006068 C Bi:4:003:1 0 486 = 5b5d8401 d6010001 08a31100 0701cb0d 00006a80 01531cf7 07fee50e 0f09fb08
ffff88b97e752a80 1552006080 S Bi:4:003:1 -115 4096 <
ffff88b97e752f00 1552007820 C Bi:4:003:1 0 479 = 5b5d8501 d7010001 097b0000 0c01cc0d 0000605e 00fc0401 02fc0100 00fb0501
ffff88b97e752f00 1552007831 S Bi:4:003:1 -115 4096 <
ffff88b97e7520c0 1552009947 C Bi:4:003:1 0 483 = 5b5d8601 d7010001 17540100 0c01cc0d 00006280 00afefd9 f2f10c00 fff30d00
ffff88b97e7520c0 1552009960 S Bi:4:003:1 -115 4096 <
ffff88b97e752840 1552011570 C Bi:4:003:1 0 478 = 5b5d8701 d6010001 18481000 0701cb0d 00006e6b 01fc00fe fd07f901 00040200
ffff88b97e752840 1552011589 S Bi:4:003:1 -115 4096 <
ffff88b97e752a80 1552013697 C Bi:4:003:1 0 486 = 5b5d8801 d6010001 26381100 0701cb0d 00006c80 01531ff6 06fbe810 090bfd0a
ffff88b97e752a80 1552013709 S Bi:4:003:1 -115 4096 <
ffff88b97e752f00 1552015447 C Bi:4:003:1 0 479 = 5b5d8901 d7010001 27100000 0c01cc0d 00005f5d 03fc0104 fefd01ff 02fb06fc
ffff88b97e752f00 1552015458 S Bi:4:003:1 -115 4096 <
ffff88b97e7520c0 1552017440 C Bi:4:003:1 0 485 = 5b5d8a01 d7010001 34e90100 0c01cc0d 00005e80 00b2f7da e9eb0bff 00f40cff
ffff88b97e7520c0 1552017451 S Bi:4:003:1 -115 4096 <
ffff88b97e752840 1552019197 C Bi:4:003:1 0 478 = 5b5d8b01 d6010001 35de1000 0701cb0d 00006f6a 04fb0200 fb08f704 fc030200
ffff88b97e752840 1552019216 S Bi:4:003:1 -115 4096 <
ffff88b97e752a80 1552021188 C Bi:4:003:1 0 486 = 5b5d8c01 d6010001 43d61100 0701cb0d 00006e80 01541900 04fceb0d 0a05f80a
ffff88b97e752a80 1552021200 S Bi:4:003:1 -115 4096 <
ffff88b97e752f00 1552022959 C Bi:4:003:1 0 479 = 5b5d8d01 d7010001 44ae0000 0c01cc0d 0000615e 00fe0005 01fa05fd fe010301
ffff88b97e752f00 1552022970 S Bi:4:003:1 -115 4096 <
ffff88b97e7520c0 1552025071 C Bi:4:003:1 0 483 = 5b5d8e01 d7010001 52870100 0c01cc0d 00005d80 00b503e3 dce609f9 03f20bff
ffff88b97e7520c0 1552025082 S Bi:4:003:1 -115 4096 <
ffff88b97e752840 1552026821 C Bi:4:003:1 0 478 = 5b5d8f01 d6010001 537c1000 0701cb0d 00006d6b fefffd01 fc09fd00 fd04fc01
ffff88b97e752840 1552026834 S Bi:4:003:1 -115 4096 <
ffff88b97e752a80 1552028821 C Bi:4:003:1 0 486 = 5b5d9001 d6010001 616b1100 0701cb0d 00006d80 01541ef9 07f7ef0a 0f06f806
ffff88b97e752a80 1552028833 S Bi:4:003:1 -115 4096 <
ffff88b97e752f00 1552030572 C Bi:4:003:1 0 479 = 5b5d9101 d7010001 62430000 0c01cc0d 00006360 fc0302ff 03fb04ff fffc0403
ffff88b97e752f00 1552030583 S Bi:4:003:1 -115 4096 <
ffff88b97e7520c0 1552032695 C Bi:4:003:1 0 483 = 5b5d9201 d7010001 701c0100 0c01cc0d 00005d80 00b50ded d7de02fd fef10c02
ffff88b97e7520c0 1552032706 S Bi:4:003:1 -115 4096 <
ffff88b97e752840 1552034322 C Bi:4:003:1 0 478 = 5b5d9301 d6010001 71111000 0701cb0d 00006d61 0800fd02 f809fe01 fc06ffff
ffff88b97e752840 1552034341 S Bi:4:003:1 -115 4096 <
ffff88b97e752a80 1552036336 C Bi:4:003:1 0 486 = 5b5d9401 d6010001 7f061100 0701cb0d 00006a80 015418fc 09f6e90e 0f09f80c
ffff88b97e752a80 1552036348 S Bi:4:003:1 -115 4096 <
ffff88b97e752f00 1552038197 C Bi:4:003:1 0 479 = 5b5d9501 d7010001 7fde0000 0c01cc0d 0000605e 01fb0401 fdfe05fa 0200ff04
ffff88b97e752f00 1552038208 S Bi:4:003:1 -115 4096 <
ffff88b97e7520c0 1552040218 C Bi:4:003:1 0 483 = 5b5d9601 d7010001 8db90100 0c01cc0d 00005e80 00be0a04 dfccf6f9 fdf50701
ffff88b97e7520c0 1552040229 S Bi:4:003:1 -115 4096 <
ffff88b97e752840 1552041946 C Bi:4:003:1 0 478 = 5b5d9701 d6010001 8ead1000 0701cb0d 00006b6b faf90afd ff09faff fd010001
ffff88b97e752840 1552041958 S Bi:4:003:1 -115 4096 <
ffff88b97e752a80 1552043960 C Bi:4:003:1 0 486 = 5b5d9801 d6010001 9c9c1100 0701cb0d 00006d80 01541bfa 09fbe70a 1107fe0c
ffff88b97e752a80 1552043973 S Bi:4:003:1 -115 4096 <
ffff88b97e752f00 1552045822 C Bi:4:003:1 0 479 = 5b5d9901 d7010001 9d750000 0c01cc0d 00006060 ffff03fe 01fd04ff fefd0502
ffff88b97e752f00 1552045833 S Bi:4:003:1 -115 4096 <
ffff88b97e7520c0 1552047822 C Bi:4:003:1 0 483 = 5b5d9a01 d7010001 ab4e0100 0c01cc0d 00005e80 00bd0e0a ffc5f7f1 01f707fb
ffff88b97e7520c0 1552047833 S Bi:4:003:1 -115 4096 <
ffff88b97e752840 1552049572 C Bi:4:003:1 0 478 = 5b5d9b01 d6010001 ac431000 0701cb0d 00006f6e fcfd03ff fe07f903 fbfd0500
ffff88b97e752840 1552049591 S Bi:4:003:1 -115 4096 <
ffff88b97e752a80 1552051572 C Bi:4:003:1 0 486 = 5b5d9c01 d6010001 ba381100 0701cb0d 00006d80 01561dfa 08f9e70e 0c030208
ffff88b97e752a80 1552051584 S Bi:4:003:1 -115 4096 <
ffff88b97e752f00 1552053324 C Bi:4:003:1 0 479 = 5b5d9d01 d7010001 bb100000 0c01cc0d 00005f5e fffb05fe 02fe03fb 05fb0401
ffff88b97e752f00 1552053335 S Bi:4:003:1 -115 4096 <
ffff88b97e7520c0 1552055334 C Bi:4:003:1 0 483 = 5b5d9e01 d7010001 c8eb0100 0c01cc0d 00005c80 00c1110a 0be70b00 0402fdf3
ffff88b97e7520c0 1552055345 S Bi:4:003:1 -115 4096 <
ffff88b97e752840 1552057074 C Bi:4:003:1 0 478 = 5b5d9f01 d6010001 c9df1000 0701cb0d 00006f6b 01ff02fd fb0bf601 02fd0501
ffff88b97e752840 1552057094 S Bi:4:003:1 -115 4096 <
ffff88b97e752a80 1552059077 C Bi:4:003:1 0 486 = 5b5da001 d6010001 d7cf1100 0701cb0d 00006d80 015222f8 04fce511 0c07fb0b
ffff88b97e752a80 1552059090 S Bi:4:003:1 -115 4096 <
ffff88b97e752f00 1552060947 C Bi:4:003:1 0 479 = 5b5da101 d7010001 d8a70000 0c01cc0d 0000615d ff04fe03 01fd01fd 01010101
ffff88b97e752f00 1552060958 S Bi:4:003:1 -115 4096 <
ffff88b97e7520c0 1552062949 C Bi:4:003:1 0 483 = 5b5da201 d7010001 e6800100 0c01cc0d 00006080 00c71311 1a031c0a 040ef5f3
ffff88b97e7520c0 1552062960 S Bi:4:003:1 -115 4096 <
ffff88b97e752840 1552064700 C Bi:4:003:1 0 478 = 5b5da301 d6010001 e7741000 0701cb0d 00006f66 07fc02ff fe0af704 fdff02fe
ffff88b97e752840 1552064720 S Bi:4:003:1 -115 4096 <
ffff88b97e752a80 1552066697 C Bi:4:003:1 0 486 = 5b5da401 d6010001 f56a1100 0701cb0d 00006a80 015419fc 0101e611 0e01fe0b
ffff88b97e752a80 1552066709 S Bi:4:003:1 -115 4096 <
ffff88b97e752f00 1552068447 C Bi:4:003:1 0 479 = 5b5da501 d7010001 f6430000 0c01cc0d 0000605e 00fd0302 01fe03fb 00ff03ff
ffff88b97e752f00 1552068458 S Bi:4:003:1 -115 4096 <
ffff88b97e7520c0 1552070570 C Bi:4:003:1 0 483 = 5b5da601 d7010001 041d0100 0c01cc0d 00006180 00c71714 150f260e 0612f7ef
ffff88b97e7520c0 1552070582 S Bi:4:003:1 -115 4096 <
ffff88b97e752840 1552072198 C Bi:4:003:1 0 478 = 5b5da701 d6010001 05111000 0701cb0d 00006d6e fbff0400 fb07fb00 fc020301
ffff88b97e752840 1552072211 S Bi:4:003:1 -115 4096 <
ffff88b97e752a80 1552074325 C Bi:4:003:1 0 486 = 5b5da801 d6010001 13011100 0701cb0d 00006e80 015819f9 06fae514 0d08fe08
ffff88b97e752a80 1552074337 S Bi:4:003:1 -115 4096 <
ffff88b97e752f00 1552076074 C Bi:4:003:1 0 479 = 5b5da901 d7010001 13d90000 0c01cc0d 0000625e 0002fe01 01ff00ff 01fd0301
ffff88b97e752f00 1552076085 S Bi:4:003:1 -115 4096 <
ffff88b97e7520c0 1552078073 C Bi:4:003:1 0 485 = 5b5daa01 d7010001 21b20100 0c01cc0d 00005e80 00c01b0f 1d092910 0512f7f0
ffff88b97e7520c0 1552078084 S Bi:4:003:1 -115 4096 <
ffff88b97e752840 1552079822 C Bi:4:003:1 0 478 = 5b5dab01 d6010001 22a61000 0701cb0d 00006d6c fffe03ff ff05f700 ff020104
ffff88b97e752840 1552079834 S Bi:4:003:1 -115 4096 <
ffff88b97e752a80 1552081824 C Bi:4:003:1 0 486 = 5b5dac01 d6010001 309d1100 0701cb0d 00006e80 01581afb 04fdeb0d 0a03fd0b
ffff88b97e752a80 1552081837 S Bi:4:003:1 -115 4096 <
ffff88b97e752f00 1552083700 C Bi:4:003:1 0 479 = 5b5dad01 d7010001 31760000 0c01cc0d 0000605d 04fa0301 fe010002 fefd05fd
ffff88b97e752f00 1552083711 S Bi:4:003:1 -115 4096 <
ffff88b97e7520c0 1552085699 C Bi:4:003:1 0 483 = 5b5dae01 d7010001 3f4e0100 0c01cc0d 00005d80 00c31412 1e0b270d 0a0efaed
ffff88b97e7520c0 1552085710 S Bi:4:003:1 -115 4096 <
ffff88b97e752840 1552087446 C Bi:4:003:1 0 478 = 5b5daf01 d6010001 40431000 0701cb0d 00006c69 05f706fc 0004fa02 0300fb07
ffff88b97e752840 1552087465 S Bi:4:003:1 -115 4096 <
ffff88b97e752a80 1552089447 C Bi:4:003:1 0 486 = 5b5db001 d6010001 4e321100 0701cb0d 00006e80 01561ff6 08fbe510 1104fe04
ffff88b97e752a80 1552089460 S Bi:4:003:1 -115 4096 <
ffff88b97e752f00 1552091219 C Bi:4:003:1 0 479 = 5b5db101 d7010001 4f0b0000 0c01cc0d 00005e5c 02f907ff 03f90401 fc0002fe
ffff88b97e752f00 1552091230 S Bi:4:003:1 -115 4096 <
ffff88b97e7520c0 1552093321 C Bi:4:003:1 0 483 = 5b5db201 d7010001 5ce30100 0c01cc0d 00005d80 00c21318 170d2810 080dfaef
ffff88b97e7520c0 1552093332 S Bi:4:003:1 -115 4096 <
ffff88b97e752840 1552094954 C Bi:4:003:1 0 478 = 5b5db301 d6010001 5dd81000 0701cb0d 00006b6a f8030203 fa0ff500 fefdfe04
ffff88b97e752840 1552094974 S Bi:4:003:1 -115 4096 <
ffff88b97e752a80 1552097073 C Bi:4:003:1 0 486 = 5b5db401 d6010001 6bcd1100 0701cb0d 00006980 015619fa 01f9ef0a 1008fb06
ffff88b97e752a80 1552097085 S Bi:4:003:1 -115 4096 <
ffff88b97e752f00 1552098822 C Bi:4:003:1 0 479 = 5b5db501 d7010001 6ca60000 0c01cc0d 0000605e 01fe0202 ff00fefd 02fd0005
ffff88b97e752f00 1552098833 S Bi:4:003:1 -115 4096 <
ffff88b97e7520c0 1552100821 C Bi:4:003:1 0 483 = 5b5db601 d7010001 7a7e0100 0c01cc0d 00005d80 00c11813 170c2a0a 0910fced
ffff88b97e7520c0 1552100832 S Bi:4:003:1 -115 4096 <
ffff88b97e752840 1552102572 C Bi:4:003:1 0 478 = 5b5db701 d6010001 7b731000 0701cb0d 00006b69 fdff01fe 0208f900 ffff01fd
ffff88b97e752840 1552102592 S Bi:4:003:1 -115 4096 <
ffff88b97e752a80 1552104564 C Bi:4:003:1 0 488 = 5b5db801 d6010001 89641100 0701cb0d 00006d80 015818fb 07f8ea14 0906fd07
ffff88b97e752a80 1552104577 S Bi:4:003:1 -115 4096 <
ffff88b97e752f00 1552106334 C Bi:4:003:1 0 479 = 5b5db901 d7010001 8a3c0000 0c01cc0d 0000615e fefd07ff 00feff01 ff0102ff
ffff88b97e752f00 1552106344 S Bi:4:003:1 -115 4096 <
ffff88b97e7520c0 1552108446 C Bi:4:003:1 0 485 = 5b5dba01 d7010001 98160100 0c01cc0d 00005e80 00c31910 1c0c280a 0a10faee
ffff88b97e7520c0 1552108457 S Bi:4:003:1 -115 4096 <
ffff88b97e752840 1552110197 C Bi:4:003:1 0 478 = 5b5dbb01 d6010001 990b1000 0701cb0d 00006a6a fdf90402 0104f706 fbfc04fc
ffff88b97e752840 1552110209 S Bi:4:003:1 -115 4096 <
ffff88b97e752a80 1552112199 C Bi:4:003:1 0 488 = 5b5dbc01 d6010001 a7021100 0701cb0d 00006880 01511500 07fae710 0e05f90b
ffff88b97e752a80 1552112211 S Bi:4:003:1 -115 4096 <
ffff88b97e752f00 1552113965 C Bi:4:003:1 0 479 = 5b5dbd01 d7010001 a7da0000 0c01cc0d 0000605e 02fb0500 02fb04fd fc000404
ffff88b97e752f00 1552113976 S Bi:4:003:1 -115 4096 <
ffff88b97e7520c0 1552116072 C Bi:4:003:1 0 483 = 5b5dbe01 d7010001 b5b40100 0c01cc0d 00005f80 00c01d0d 1a0e270f 0710f7f2
ffff88b97e7520c0 1552116083 S Bi:4:003:1 -115 4096 <
ffff88b97e752840 1552117824 C Bi:4:003:1 0 478 = 5b5dbf01 d6010001 b6a91000 0701cb0d 00006b6c fafb0501 fe0cf401 04fdfb05
ffff88b97e752840 1552117843 S Bi:4:003:1 -115 4096 <
ffff88b97e752a80 1552119820 C Bi:4:003:1 0 488 = 5b5dc001 d6010001 c49a1100 0701cb0d 00006c80 01541ff9 05fde70f 0e02fc09
ffff88b97e752a80 1552119831 S Bi:4:003:1 -115 4096 <
ffff88b97e752f00 1552121575 C Bi:4:003:1 0 479 = 5b5dc101 d7010001 c5720000 0c01cc0d 00005f5e fefe0501 00fe0001 fd000204
ffff88b97e752f00 1552121586 S Bi:4:003:1 -115 4096 <
ffff88b97e7520c0 1552123593 C Bi:4:003:1 0 483 = 5b5dc201 d7010001 d3460100 0c01cc0d 00005d80 00bf1a0b 1f0f290e 0510f8ef
ffff88b97e7520c0 1552123604 S Bi:4:003:1 -115 4096 <
ffff88b97e752840 1552125323 C Bi:4:003:1 0 478 = 5b5dc301 d6010001 d43a1000 0701cb0d 00006e6b ff01fc06 fc07f706 fdfe00ff
ffff88b97e752840 1552125335 S Bi:4:003:1 -115 4096 <
ffff88b97e752a80 1552127327 C Bi:4:003:1 0 486 = 5b5dc401 d6010001 e2301100 0701cb0d 00006b80 01561bf8 08fae80c 0f04fe09
ffff88b97e752a80 1552127339 S Bi:4:003:1 -115 4096 <
ffff88b97e752f00 1552129075 C Bi:4:003:1 0 479 = 5b5dc501 d7010001 e3080000 0c01cc0d 0000615f ffff0002 04fb04fd fb000402
ffff88b97e752f00 1552129086 S Bi:4:003:1 -115 4096 <
ffff88b97e7520c0 1552131220 C Bi:4:003:1 0 483 = 5b5dc601 d7010001 f0e10100 0c01cc0d 00005d80 00c31515 170f2212 0810f7f3
ffff88b97e7520c0 1552131231 S Bi:4:003:1 -115 4096 <
ffff88b97e752840 1552132948 C Bi:4:003:1 0 478 = 5b5dc701 d6010001 f1d51000 0701cb0d 0000706c 00fe0204 f809f703 f9050102
ffff88b97e752840 1552132960 S Bi:4:003:1 -115 4096 <
ffff88b97e752a80 1552134946 C Bi:4:003:1 0 486 = 5b5dc801 d6010001 ffcb1100 0701cb0d 00006e80 01581ef6 06fce80b 1303fe0c
ffff88b97e752a80 1552134959 S Bi:4:003:1 -115 4096 <
ffff88b97e752f00 1552136694 C Bi:4:003:1 0 479 = 5b5dc901 d7010001 00a30000 0c01cc0d 0000635f ffff04ff 000001fd fe0006ff
ffff88b97e752f00 1552136705 S Bi:4:003:1 -115 4096 <
ffff88b97e7520c0 1552138818 C Bi:4:003:1 0 483 = 5b5dca01 d7010001 0e760100 0c01cc0d 00005d80 00c31712 1a111f12 0514f8eb
ffff88b97e7520c0 1552138829 S Bi:4:003:1 -115 4096 <
ffff88b97e752840 1552140440 C Bi:4:003:1 0 478 = 5b5dcb01 d6010001 0f6a1000 0701cb0d 0000716c 01fd0002 fb07f603 03000301
ffff88b97e752840 1552140460 S Bi:4:003:1 -115 4096 <
ffff88b97e752a80 1552142445 C Bi:4:003:1 0 486 = 5b5dcc01 d6010001 1d601100 0701cb0d 00006e80 01581ef7 06f9e811 0f05f909
ffff88b97e752a80 1552142457 S Bi:4:003:1 -115 4096 <
ffff88b97e752f00 1552144325 C Bi:4:003:1 0 479 = 5b5dcd01 d7010001 1e380000 0c01cc0d 0000615e fd0104fa 06fd05fb ff0001fe
ffff88b97e752f00 1552144336 S Bi:4:003:1 -115 4096 <
ffff88b97e7520c0 1552146326 C Bi:4:003:1 0 483 = 5b5dce01 d7010001 2c110100 0c01cc0d 00005c80 00c01610 1b122211 0812f4f5
ffff88b97e7520c0 1552146336 S Bi:4:003:1 -115 4096 <
ffff88b97e752840 1552148948 C Bi:4:003:1 0 2471 = 5b5dcf09 9f020201 015c083d 00001012 02061013 02011011 03061014 43011015
ffff88b97e752840 1552148959 S Bi:4:003:1 -115 4096 <
ffff88b97e752a80 1552150448 C Bi:4:003:1 0 478 = 5b5dd001 d6010001 2d051000 0701cb8d 00006b6d f8010200 fc0bf500 04f90500
ffff88b97e752a80 1552150461 S Bi:4:003:1 -115 4096 <
ffff88b97e752f00 1552153454 C Bi:4:003:1 0 488 = 5b5dd101 d6010001 48341100 0701cb8d 00006a80 01531bf7 06fde60e 0f08fc0a
ffff88b97e752f00 1552153466 S Bi:4:003:1 -115 4096 <
ffff88b97e7520c0 1552155823 C Bi:4:003:1 0 479 = 5b5dd201 d7010001 490d0000 0c01cc8d 0000625f ff00ff02 04fa0300 fb010601
ffff88b97e7520c0 1552155834 S Bi:4:003:1 -115 4096 <
ffff88b97e752840 1552159314 C Bi:4:003:1 0 483 = 5b5dd301 d7010001 58de0100 0c01cc8d 00005f80 00c61412 17112411 090dfced
ffff88b97e752840 1552159325 S Bi:4:003:1 -115 4096 <
ffff88b97e752a80 1553150591 C Bi:4:003:1 0 2471 = 5b5dd409 9f020201 015c083d 00001012 02061013 02011011 03061014 43011015
ffff88b97e752a80 1553150619 S Bi:4:003:1 -115 4096 <
ffff88b97e752f00 1553152081 C Bi:4:003:1 0 478 = 5b5dd501 d6010001 70d71000 0701cb8d 00006f6e fc000303 fb05f9ff fa060001
ffff88b97e752f00 1553152100 S Bi:4:003:1 -115 4096 <
ffff88b97e7520c0 1553155084 C Bi:4:003:1 0 486 = 5b5dd601 d6010001 8f991100 0701cb8d 00006e80 01541ef6 07fae510 090ffc09
ffff88b97e7520c0 1553155097 S Bi:4:003:1 -115 4096 <
ffff88b97e752840 1553157338 C Bi:4:003:1 0 479 = 5b5dd701 d7010001 90720000 0c01cc8d 00005e5e fefc0303 00feff03 fefd0400
ffff88b97e752840 1553157348 S Bi:4:003:1 -115 4096 <
ffff88b97e752a80 1553160958 C Bi:4:003:1 0 483 = 5b5dd801 d7010001 a03c0100 0c01cc8d 00005f80 00c51314 1d0b2511 0810f6ee
ffff88b97e752a80 1553160969 S Bi:4:003:1 -115 4096 <
ffff88b97e752f00 1553731339 C Bi:4:003:1 0 478 = 5b5dd901 d6010001 50b31000 0701cb0d 00006c6a 03f806ff fe03f9fe 0bfa0201
ffff88b97e752f00 1553731351 S Bi:4:003:1 -115 4096 <
ffff88b97e7520c0 1553733339 C Bi:4:003:1 0 488 = 5b5dda01 d6010001 61c81100 0701cb0d 00006c80 01531af8 05fee317 0c050204
ffff88b97e7520c0 1553733351 S Bi:4:003:1 -115 4096 <
ffff88b97e752840 1553735099 C Bi:4:003:1 0 479 = 5b5ddb01 d7010001 62a10000 0c01cc0d 00006160 fefd0401 01fb0201 fd010301
ffff88b97e752840 1553735110 S Bi:4:003:1 -115 4096 <
ffff88b97e752a80 1553737210 C Bi:4:003:1 0 487 = 5b5ddc01 d7010001 707a0100 0c01cc0d 00005d80 00c11712 1d0c290b 0413fdec
ffff88b97e752a80 1553737221 S Bi:4:003:1 -115 4096 <
ffff88b97e752f00 1553738836 C Bi:4:003:1 0 478 = 5b5ddd01 d6010001 716f1000 0701cb0d 00006d6d fefc0005 fd04fb02 fd010101
ffff88b97e752f00 1553738849 S Bi:4:003:1 -115 4096 <
ffff88b97e7520c0 1553740962 C Bi:4:003:1 0 488 = 5b5dde01 d6010001 7f671100 0701cb0d 00007180 01561ef8 07fee411 0d05fc06
ffff88b97e7520c0 1553740974 S Bi:4:003:1 -115 4096 <
ffff88b97e752840 1553742713 C Bi:4:003:1 0 479 = 5b5ddf01 d7010001 803f0000 0c01cc0d 0000605d 01ff0201 02fb0100 00ff03fe
ffff88b97e752840 1553742724 S Bi:4:003:1 -115 4096 <
ffff88b97e752a80 1553744836 C Bi:4:003:1 0 485 = 5b5de001 d7010001 8e130100 0c01cc0d 00005f80 00be1711 220a280e 0414fcea
ffff88b97e752a80 1553744846 S Bi:4:003:1 -115 4096 <
ffff88b97e752f00 1553746460 C Bi:4:003:1 0 478 = 5b5de101 d6010001 8f071000 0701cb0d 00006f6d fefe0002 fd06fa02 fe03fe02
ffff88b97e752f00 1553746480 S Bi:4:003:1 -115 4096 <
ffff88b97e7520c0 1553748476 C Bi:4:003:1 0 488 = 5b5de201 d6010001 9cfe1100 0701cb0d 00006e80 01561bfc 03f8e713 0f01fd0b
ffff88b97e7520c0 1553748488 S Bi:4:003:1 -115 4096 <
ffff88b97e752840 1553750222 C Bi:4:003:1 0 479 = 5b5de301 d7010001 9dd70000 0c01cc0d 0000605e 00fc0201 01fffb07 fcff04ff
ffff88b97e752840 1553750234 S Bi:4:003:1 -115 4096 <
ffff88b97e752a80 1553752336 C Bi:4:003:1 0 485 = 5b5de401 d7010001 abb00100 0c01cc0d 00005c80 00be1911 1a0e2311 0c0ff9ee
ffff88b97e752a80 1553752347 S Bi:4:003:1 -115 4096 <
ffff88b97e752f00 1553754085 C Bi:4:003:1 0 478 = 5b5de501 d6010001 aca51000 0701cb0d 00006a69 00fcfffe 0308f606 fffefdff
ffff88b97e752f00 1553754098 S Bi:4:003:1 -115 4096 <
ffff88b97e7520c0 1553756086 C Bi:4:003:1 0 488 = 5b5de601 d6010001 ba9b1100 0701cb0d 00006d80 01531afd 01fee812 0e05fe09
ffff88b97e7520c0 1553756099 S Bi:4:003:1 -115 4096 <
ffff88b97e752840 1553757837 C Bi:4:003:1 0 479 = 5b5de701 d7010001 bb740000 0c01cc0d 00006161 fff80701 03f90400 01fb0500
ffff88b97e752840 1553757848 S Bi:4:003:1 -115 4096 <
ffff88b97e752a80 1553759961 C Bi:4:003:1 0 487 = 5b5de801 d7010001 c9490100 0c01cc0d 00005d80 00c1160f 1f0b280f 0711f8ee
ffff88b97e752a80 1553759972 S Bi:4:003:1 -115 4096 <
ffff88b97e752f00 1553761587 C Bi:4:003:1 0 478 = 5b5de901 d6010001 ca3e1000 0701cb0d 00006c68 02fefd04 ff04fb05 fdfb03fd
ffff88b97e752f00 1553761605 S Bi:4:003:1 -115 4096 <
ffff88b97e7520c0 1553763602 C Bi:4:003:1 0 488 = 5b5dea01 d6010001 d8361100 0701cb0d 00006e80 01561df7 0301e50c 1600fd08
ffff88b97e7520c0 1553763615 S Bi:4:003:1 -115 4096 <
ffff88b97e752840 1553765461 C Bi:4:003:1 0 479 = 5b5deb01 d7010001 d90e0000 0c01cc0d 0000605d 02f90303 fffe01ff 03fd0002
ffff88b97e752840 1553765471 S Bi:4:003:1 -115 4096 <
ffff88b97e752a80 1553767454 C Bi:4:003:1 0 485 = 5b5dec01 d7010001 e6e80100 0c01cc0d 00005f80 00c21a10 18131e15 050c02ed
ffff88b97e752a80 1553767465 S Bi:4:003:1 -115 4096 <
ffff88b97e752f00 1553769212 C Bi:4:003:1 0 478 = 5b5ded01 d6010001 e7dd1000 0701cb0d 00006e6a 01f90301 fd0cf8fe ff02fc06
ffff88b97e752f00 1553769232 S Bi:4:003:1 -115 4096 <
ffff88b97e7520c0 1553771226 C Bi:4:003:1 0 488 = 5b5dee01 d6010001 f5d31100 0701cb0d 00006e80 015321f5 05fde80a 14020009
ffff88b97e7520c0 1553771239 S Bi:4:003:1 -115 4096 <
ffff88b97e752840 1553772968 C Bi:4:003:1 0 479 = 5b5def01 d7010001 f6ac0000 0c01cc0d 00005f5d 01fe02ff 02fd0200 fdfb0802
ffff88b97e752840 1553772979 S Bi:4:003:1 -115 4096 <
ffff88b97e752a80 1553775086 C Bi:4:003:1 0 485 = 5b5df001 d7010001 04810100 0c01cc0d 00005f80 00c40f17 1a0d280e 0511fcec
ffff88b97e752a80 1553775097 S Bi:4:003:1 -115 4096 <
ffff88b97e752f00 1553776836 C Bi:4:003:1 0 478 = 5b5df101 d6010001 05761000 0701cb0d 00006d6f fafe0403 ff03f702 fa08ff02
ffff88b97e752f00 1553776849 S Bi:4:003:1 -115 4096 <
ffff88b97e7520c0 1553778837 C Bi:4:003:1 0 488 = 5b5df201 d6010001 136c1100 0701cb0d 00006b80 015220f6 03fbe416 090bfd07
ffff88b97e7520c0 1553778850 S Bi:4:003:1 -115 4096 <
ffff88b97e752840 1553780586 C Bi:4:003:1 0 479 = 5b5df301 d7010001 14450000 0c01cc0d 00005e5c 01000101 02fc0200 fdfd0401
ffff88b97e752840 1553780597 S Bi:4:003:1 -115 4096 <
ffff88b97e752a80 1553782706 C Bi:4:003:1 0 483 = 5b5df401 d7010001 221f0100 0c01cc0d 00005d80 00c11713 160e2a0d 0a0ff9f0
ffff88b97e752a80 1553782718 S Bi:4:003:1 -115 4096 <
ffff88b97e752f00 1553784330 C Bi:4:003:1 0 478 = 5b5df501 d6010001 23141000 0701cb0d 00006d68 02feff01 fe08fa03 00fffeff
ffff88b97e752f00 1553784342 S Bi:4:003:1 -115 4096 <
ffff88b97e7520c0 1553786351 C Bi:4:003:1 0 486 = 5b5df601 d6010001 31091100 0701cb0d 00006e80 015321f8 04fae816 0706fc07
ffff88b97e7520c0 1553786363 S Bi:4:003:1 -115 4096 <
ffff88b97e752840 1553788210 C Bi:4:003:1 0 479 = 5b5df701 d7010001 31e10000 0c01cc0d 0000605d 03fb0003 04fefffc 00ff0600
ffff88b97e752840 1553788222 S Bi:4:003:1 -115 4096 <
ffff88b97e752a80 1553790225 C Bi:4:003:1 0 483 = 5b5df801 d7010001 3fb40100 0c01cc0d 00005d80 00bd1b10 1f072a0f 0512f9ef
ffff88b97e752a80 1553790236 S Bi:4:003:1 -115 4096 <
ffff88b97e752f00 1553791962 C Bi:4:003:1 0 478 = 5b5df901 d6010001 40a81000 0701cb0d 00006f6d 04fbfe02 fb07fa04 fe0002fb
ffff88b97e752f00 1553791981 S Bi:4:003:1 -115 4096 <
ffff88b97e7520c0 1553793964 C Bi:4:003:1 0 486 = 5b5dfa01 d6010001 4e9e1100 0701cb0d 00006b80 015122f7 04ffe50b 0b0afb0b
ffff88b97e7520c0 1553793977 S Bi:4:003:1 -115 4096 <
ffff88b97e752840 1553795838 C Bi:4:003:1 0 479 = 5b5dfb01 d7010001 4f760000 0c01cc0d 0000605b 03fc04ff 02fd01ff 00fe0403
ffff88b97e752840 1553795850 S Bi:4:003:1 -115 4096 <
ffff88b97e752a80 1553797837 C Bi:4:003:1 0 485 = 5b5dfc01 d7010001 5d4f0100 0c01cc0d 00005d80 00be1a10 1a0f270f 0511fcee
ffff88b97e752a80 1553797848 S Bi:4:003:1 -115 4096 <
ffff88b97e752f00 1553799585 C Bi:4:003:1 0 478 = 5b5dfd01 d6010001 5e431000 0701cb0d 00006c68 05f706fd fb0cf902 01fe00ff
ffff88b97e752f00 1553799604 S Bi:4:003:1 -115 4096 <
ffff88b97e7520c0 1553801590 C Bi:4:003:1 0 488 = 5b5dfe01 d6010001 6c3a1100 0701cb0d 00006d80 015519fa 07fce117 0d05fd08
ffff88b97e7520c0 1553801602 S Bi:4:003:1 -115 4096 <
ffff88b97e752840 1553803336 C Bi:4:003:1 0 479 = 5b5dff01 d7010001 6d130000 0c01cc0d 0000615d 0000fd05 00ff0101 fefd0103
ffff88b97e752840 1553803347 S Bi:4:003:1 -115 4096 <
ffff88b97e752a80 1553805340 C Bi:4:003:1 0 483 = 5b5d0001 d7010001 7ae60100 0c01cc0d 00005d80 00be1910 1b0f2810 0510fbec
ffff88b97e752a80 1553805351 S Bi:4:003:1 -115 4096 <
ffff88b97e752f00 1553807103 C Bi:4:003:1 0 478 = 5b5d0101 d6010001 7bdb1000 0701cb0d 00006e6d 00fe02fb 0105f606 01ffff01
ffff88b97e752f00 1553807122 S Bi:4:003:1 -115 4096 <
ffff88b97e7520c0 1553809086 C Bi:4:003:1 0 488 = 5b5d0201 d6010001 89cc1100 0701cb0d 00006d80 01531ef9 0003e60d 1204fb0a
ffff88b97e7520c0 1553809098 S Bi:4:003:1 -115 4096 <
ffff88b97e752840 1553810960 C Bi:4:003:1 0 479 = 5b5d0301 d7010001 8aa40000 0c01cc0d 00005f5c 00ff0102 02fc0000 00fc0701
ffff88b97e752840 1553810971 S Bi:4:003:1 -115 4096 <
ffff88b97e752a80 1553812962 C Bi:4:003:1 0 483 = 5b5d0401 d7010001 987e0100 0c01cc0d 00005c80 00c21714 14102a0d 0414f8f1
ffff88b97e752a80 1553812973 S Bi:4:003:1 -115 4096 <
ffff88b97e752f00 1553814710 C Bi:4:003:1 0 478 = 5b5d0501 d6010001 99731000 0701cb0d 00006f69 02fd02ff 0005f704 ff0300fe
ffff88b97e752f00 1553814722 S Bi:4:003:1 -115 4096 <
ffff88b97e7520c0 1553816711 C Bi:4:003:1 0 486 = 5b5d0601 d6010001 a7681100 0701cb0d 00006b80 015220f4 08fde711 0a05fd05
ffff88b97e7520c0 1553816723 S Bi:4:003:1 -115 4096 <
ffff88b97e752840 1553818483 C Bi:4:003:1 0 479 = 5b5d0701 d7010001 a8410000 0c01cc0d 0000605d 03fc05fd ff0101fd 01fd0501
ffff88b97e752840 1553818494 S Bi:4:003:1 -115 4096 <
ffff88b97e752a80 1553820586 C Bi:4:003:1 0 483 = 5b5d0801 d7010001 b6190100 0c01cc0d 00005f80 00c51811 1b0b2512 0214fbee
ffff88b97e752a80 1553820597 S Bi:4:003:1 -115 4096 <
ffff88b97e752f00 1553822222 C Bi:4:003:1 0 478 = 5b5d0901 d6010001 b70e1000 0701cb0d 00006a64 03fe04ff fc08fcff 05fafd01
ffff88b97e752f00 1553822242 S Bi:4:003:1 -115 4096 <
ffff88b97e7520c0 1553824337 C Bi:4:003:1 0 488 = 5b5d0a01 d6010001 c4ff1100 0701cb0d 00006a80 01531bf7 08fbe712 0d04fd08
ffff88b97e7520c0 1553824349 S Bi:4:003:1 -115 4096 <
ffff88b97e752840 1553826086 C Bi:4:003:1 0 479 = 5b5d0b01 d7010001 c5d80000 0c01cc0d 00005f5f fffe0003 02fb02fe 00fd07fd
ffff88b97e752840 1553826097 S Bi:4:003:1 -115 4096 <
ffff88b97e752a80 1553828085 C Bi:4:003:1 0 485 = 5b5d0c01 d7010001 d3b10100 0c01cc0d 00006080 00c6180e 19132311 0213fbee
ffff88b97e752a80 1553828096 S Bi:4:003:1 -115 4096 <
ffff88b97e752f00 1553829837 C Bi:4:003:1 0 478 = 5b5d0d01 d6010001 d4a61000 0701cb0d 00006967 fcfd0005 fd06fffd 0001fefb
ffff88b97e752f00 1553829857 S Bi:4:003:1 -115 4096 <
ffff88b97e7520c0 1553831836 C Bi:4:003:1 0 486 = 5b5d0e01 d6010001 e29d1100 0701cb0d 00006d80 01561af4 0bfde20f 1403fd0e
ffff88b97e7520c0 1553831849 S Bi:4:003:1 -115 4096 <
ffff88b97e752840 1553833606 C Bi:4:003:1 0 479 = 5b5d0f01 d7010001 e3750000 0c01cc0d 0000625d 00ff06fc 03fe0000 fe0102ff
ffff88b97e752840 1553833617 S Bi:4:003:1 -115 4096 <
ffff88b97e752a80 1553835715 C Bi:4:003:1 0 485 = 5b5d1001 d7010001 f14e0100 0c01cc0d 00005f80 00c21b11 180e250f 0513fdec
ffff88b97e752a80 1553835726 S Bi:4:003:1 -115 4096 <
ffff88b97e752f00 1553837462 C Bi:4:003:1 0 478 = 5b5d1101 d6010001 f2421000 0701cb0d 00006d68 05fa03fe fd08f905 03fdfe00
ffff88b97e752f00 1553837481 S Bi:4:003:1 -115 4096 <
ffff88b97e7520c0 1553839462 C Bi:4:003:1 0 486 = 5b5d1201 d6010001 00351100 0701cb0d 00007180 01541ff9 05fee611 09030107
ffff88b97e7520c0 1553839475 S Bi:4:003:1 -115 4096 <
ffff88b97e752840 1553841216 C Bi:4:003:1 0 479 = 5b5d1301 d7010001 010d0000 0c01cc0d 00005f5e fc010001 02ff03fd feff0501
ffff88b97e752840 1553841227 S Bi:4:003:1 -115 4096 <
ffff88b97e752a80 1553843337 C Bi:4:003:1 0 483 = 5b5d1401 d7010001 0ee60100 0c01cc0d 00005d80 00bc1c13 1511270b 0913f8ec
ffff88b97e752a80 1553843348 S Bi:4:003:1 -115 4096 <
ffff88b97e752f00 1553844962 C Bi:4:003:1 0 478 = 5b5d1501 d6010001 0fda1000 0701cb0d 00006b6a fbfc06ff ff06fb00 00fd0003
ffff88b97e752f00 1553844981 S Bi:4:003:1 -115 4096 <
ffff88b97e7520c0 1553846979 C Bi:4:003:1 0 486 = 5b5d1601 d6010001 1dd01100 0701cb0d 00006980 01521bfa 04fde70f 1001ff08
ffff88b97e7520c0 1553846992 S Bi:4:003:1 -115 4096 <
ffff88b97e752840 1553848837 C Bi:4:003:1 0 479 = 5b5d1701 d7010001 1ea90000 0c01cc0d 0000615e ff010000 02fc0100 01fc0300
ffff88b97e752840 1553848848 S Bi:4:003:1 -115 4096 <
ffff88b97e752a80 1553850837 C Bi:4:003:1 0 485 = 5b5d1801 d7010001 2c810100 0c01cc0d 00005f80 00c51611 1b0a2910 0612f7f1
ffff88b97e752a80 1553850848 S Bi:4:003:1 -115 4096 <
ffff88b97e752f00 1553852590 C Bi:4:003:1 0 478 = 5b5d1901 d6010001 2d761000 0701cb0d 0000706c 00fe0500 fd03f800 08fa0104
ffff88b97e752f00 1553852609 S Bi:4:003:1 -115 4096 <
ffff88b97e7520c0 1553854606 C Bi:4:003:1 0 486 = 5b5d1a01 d6010001 3b661100 0701cb0d 00006c80 015120f6 0af8e80e 090dfd09
ffff88b97e7520c0 1553854619 S Bi:4:003:1 -115 4096 <
ffff88b97e752840 1553856337 C Bi:4:003:1 0 479 = 5b5d1b01 d7010001 3c3f0000 0c01cc0d 0000605f fdfe0402 01fc05fc fffc0303
ffff88b97e752840 1553856348 S Bi:4:003:1 -115 4096 <
ffff88b97e752a80 1553858432 C Bi:4:003:1 0 483 = 5b5d1c01 d7010001 4a190100 0c01cc0d 00005c80 00c4180c 1912250f 060efdee
ffff88b97e752a80 1553858453 S Bi:4:003:1 -115 4096 <
ffff88b97e752f00 1553860215 C Bi:4:003:1 0 478 = 5b5d1d01 d6010001 4b0e1000 0701cb0d 00006c64 05fc01ff 0206f805 00fa02fe
ffff88b97e752f00 1553860220 S Bi:4:003:1 -115 4096 <
ffff88b97e7520c0 1553862212 C Bi:4:003:1 0 488 = 5b5d1e01 d6010001 59031100 0701cb0d 00006b80 01551cf8 03fde80b 1205fd07
ffff88b97e7520c0 1553862218 S Bi:4:003:1 -115 4096 <
ffff88b97e752840 1553863969 C Bi:4:003:1 0 479 = 5b5d1f01 d7010001 59dc0000 0c01cc0d 0000605d 01fc0400 02fe02fc 01fe06fe
ffff88b97e752840 1553863973 S Bi:4:003:1 -115 4096 <
ffff88b97e752a80 1553866064 C Bi:4:003:1 0 485 = 5b5d2001 d7010001 67b60100 0c01cc0d 00005e80 00c31812 1511270d 0511fced
ffff88b97e752a80 1553866068 S Bi:4:003:1 -115 4096 <
ffff88b97e752f00 1553867837 C Bi:4:003:1 0 478 = 5b5d2101 d6010001 68ab1000 0701cb0d 00006b67 03fb07fd fa08f706 fc04fe02
ffff88b97e752f00 1553867843 S Bi:4:003:1 -115 4096 <
ffff88b97e7520c0 1553869837 C Bi:4:003:1 0 486 = 5b5d2201 d6010001 769b1100 0701cb0d 00006c80 01531ff7 01ffe70d 1301010d
ffff88b97e7520c0 1553869843 S Bi:4:003:1 -115 4096 <
ffff88b97e752840 1553871587 C Bi:4:003:1 0 479 = 5b5d2301 d7010001 77740000 0c01cc0d 0000615d 02ff0002 00fd0400 fefe04fd
ffff88b97e752840 1553871591 S Bi:4:003:1 -115 4096 <
ffff88b97e752a80 1553873598 C Bi:4:003:1 0 483 = 5b5d2401 d7010001 854e0100 0c01cc0d 00005d80 00c01812 1e0a2312 0610fbef
ffff88b97e752a80 1553873602 S Bi:4:003:1 -115 4096 <
ffff88b97e752f00 1553875340 C Bi:4:003:1 0 478 = 5b5d2501 d6010001 86431000 0701cb0d 00006d69 fffd0004 0104f507 fe01fefc
ffff88b97e752f00 1553875345 S Bi:4:003:1 -115 4096 <
ffff88b97e7520c0 1553877343 C Bi:4:003:1 0 488 = 5b5d2601 d6010001 94381100 0701cb0d 00006b80 01531bf9 08fae610 0f08fb04
ffff88b97e7520c0 1553877348 S Bi:4:003:1 -115 4096 <
ffff88b97e752840 1553879081 C Bi:4:003:1 0 479 = 5b5d2701 d7010001 95110000 0c01cc0d 00005e5c 04fb0300 01fe0003 fff90402
ffff88b97e752840 1553879086 S Bi:4:003:1 -115 4096 <
ffff88b97e752a80 1553881213 C Bi:4:003:1 0 485 = 5b5d2801 d7010001 a2ea0100 0c01cc0d 00005f80 00c11811 190f2b0b 0511fced
ffff88b97e752a80 1553881217 S Bi:4:003:1 -115 4096 <
ffff88b97e752f00 1553882962 C Bi:4:003:1 0 478 = 5b5d2901 d6010001 a3df1000 0701cb0d 00006b65 06f9fe05 f70efa01 02fffcfd
ffff88b97e752f00 1553882974 S Bi:4:003:1 -115 4096 <
ffff88b97e7520c0 1553884964 C Bi:4:003:1 0 486 = 5b5d2a01 d6010001 b1cf1100 0701cb0d 00006a80 015617f7 06fbec0f 0b0bf80b
ffff88b97e7520c0 1553884969 S Bi:4:003:1 -115 4096 <
ffff88b97e752840 1553886713 C Bi:4:003:1 0 479 = 5b5d2b01 d7010001 b2a80000 0c01cc0d 00005f5b 02ff01fe 03fd02ff 02fc0400
ffff88b97e752840 1553886717 S Bi:4:003:1 -115 4096 <
ffff88b97e752a80 1553888837 C Bi:4:003:1 0 485 = 5b5d2c01 d7010001 c0820100 0c01cc0d 00005f80 00c11613 190d2813 0311faf1
ffff88b97e752a80 1553888841 S Bi:4:003:1 -115 4096 <
ffff88b97e752f00 1553890462 C Bi:4:003:1 0 478 = 5b5d2d01 d6010001 c1771000 0701cb0d 00006a68 fcfe0400 fd09f901 02fefa05
ffff88b97e752f00 1553890474 S Bi:4:003:1 -115 4096 <
ffff88b97e7520c0 1553892459 C Bi:4:003:1 0 486 = 5b5d2e01 d6010001 cf6d1100 0701cb0d 00006b80 01511ef7 09f9e90c 0712fc04
ffff88b97e7520c0 1553892464 S Bi:4:003:1 -115 4096 <
ffff88b97e752840 1553894338 C Bi:4:003:1 0 479 = 5b5d2f01 d7010001 d0460000 0c01cc0d 00005f5c 02fc0301 04fa0100 01ffff02
ffff88b97e752840 1553894342 S Bi:4:003:1 -115 4096 <
ffff88b97e752a80 1553896340 C Bi:4:003:1 0 483 = 5b5d3001 d7010001 de1e0100 0c01cc0d 00005f80 00bf1d10 170d2910 0610fcea
ffff88b97e752a80 1553896345 S Bi:4:003:1 -115 4096 <
ffff88b97e752f00 1553898090 C Bi:4:003:1 0 478 = 5b5d3101 d6010001 df131000 0701cb0d 00006d6a 00fd01fd 0505f50d fdf8fe03
ffff88b97e752f00 1553898102 S Bi:4:003:1 -115 4096 <
ffff88b97e7520c0 1553900086 C Bi:4:003:1 0 488 = 5b5d3201 d6010001 ed021100 0701cb0d 00006e80 015618fc 04fbec0d 0d04ff04
ffff88b97e7520c0 1553900092 S Bi:4:003:1 -115 4096 <
ffff88b97e752840 1553901837 C Bi:4:003:1 0 479 = 5b5d3301 d7010001 eddb0000 0c01cc0d 0000605c 02fe01fe 06ffff01 fefd0300
ffff88b97e752840 1553901841 S Bi:4:003:1 -115 4096 <
ffff88b97e752a80 1553903964 C Bi:4:003:1 0 485 = 5b5d3401 d7010001 fbb50100 0c01cc0d 00005b80 00c01b0e 180e2c0b 0713f7ef
ffff88b97e752a80 1553903968 S Bi:4:003:1 -115 4096 <
ffff88b97e752f00 1553905712 C Bi:4:003:1 0 478 = 5b5d3501 d6010001 fca91000 0701cb0d 00006e6a 04f90303 f80bf805 fe00fd02
ffff88b97e752f00 1553905723 S Bi:4:003:1 -115 4096 <
ffff88b97e7520c0 1553907712 C Bi:4:003:1 0 486 = 5b5d3601 d6010001 0aa21100 0701cb0d 00006a80 01521bf7 09f7ee0c 1106fc03
ffff88b97e7520c0 1553907718 S Bi:4:003:1 -115 4096 <
ffff88b97e752840 1553909463 C Bi:4:003:1 0 479 = 5b5d3701 d7010001 0b7a0000 0c01cc0d 00005d59 01010100 01fc03fe 01ff02fe
ffff88b97e752840 1553909467 S Bi:4:003:1 -115 4096 <
ffff88b97e752a80 1553911468 C Bi:4:003:1 0 485 = 5b5d3801 d7010001 19530100 0c01cc0d 00005c80 00bf1311 1f0f250f 0511fcef
ffff88b97e752a80 1553911472 S Bi:4:003:1 -115 4096 <
ffff88b97e752f00 1553913225 C Bi:4:003:1 0 478 = 5b5d3901 d6010001 1a471000 0701cb0d 00006b68 02fc01ff fa0afc01 02fffd02
ffff88b97e752f00 1553913238 S Bi:4:003:1 -115 4096 <
ffff88b97e7520c0 1553915204 C Bi:4:003:1 0 486 = 5b5d3a01 d6010001 28381100 0701cb0d 00006b80 01531ff8 04fbe90d 1106fb0a
ffff88b97e7520c0 1553915210 S Bi:4:003:1 -115 4096 <
ffff88b97e752840 1553916977 C Bi:4:003:1 0 479 = 5b5d3b01 d7010001 29110000 0c01cc0d 0000605f fb040000 05f9ff04 fffd0200
ffff88b97e752840 1553916981 S Bi:4:003:1 -115 4096 <
ffff88b97e752a80 1553919091 C Bi:4:003:1 0 485 = 5b5d3c01 d7010001 36e90100 0c01cc0d 00005f80 00c21514 15102a11 0510fbec
ffff88b97e752a80 1553919096 S Bi:4:003:1 -115 4096 <
ffff88b97e752f00 1553920838 C Bi:4:003:1 0 478 = 5b5d3d01 d6010001 37de1000 0701cb0d 00006e6a ffff0201 ff04f800 03ffff01
ffff88b97e752f00 1553920844 S Bi:4:003:1 -115 4096 <
ffff88b97e7520c0 1553922837 C Bi:4:003:1 0 486 = 5b5d3e01 d6010001 45d61100 0701cb0d 00006b80 015715fa 09fae514 0c09f70a
ffff88b97e7520c0 1553922842 S Bi:4:003:1 -115 4096 <
ffff88b97e752840 1553924604 C Bi:4:003:1 0 479 = 5b5d3f01 d7010001 46af0000 0c01cc0d 0000605e fffd0500 00fe0100 00fe0003
ffff88b97e752840 1553924609 S Bi:4:003:1 -115 4096 <
ffff88b97e752a80 1553926712 C Bi:4:003:1 0 485 = 5b5d4001 d7010001 54870100 0c01cc0d 00005c80 00bf1516 190d2611 080cfaef
ffff88b97e752a80 1553926716 S Bi:4:003:1 -115 4096 <
ffff88b97e752f00 1553928337 C Bi:4:003:1 0 478 = 5b5d4101 d6010001 557c1000 0701cb0d 0000696c fdff0001 fa08f600 ff03fd04
ffff88b97e752f00 1553928343 S Bi:4:003:1 -115 4096 <
ffff88b97e7520c0 1553930464 C Bi:4:003:1 0 486 = 5b5d4201 d6010001 636c1100 0701cb0d 00006c80 01541cf9 06fde60e 0d07fb0b
ffff88b97e7520c0 1553930470 S Bi:4:003:1 -115 4096 <
ffff88b97e752840 1553932213 C Bi:4:003:1 0 479 = 5b5d4301 d7010001 64450000 0c01cc0d 0000605f ffff0202 fdff04fb 02fc06fe
ffff88b97e752840 1553932217 S Bi:4:003:1 -115 4096 <
ffff88b97e752a80 1553934207 C Bi:4:003:1 0 483 = 5b5d4401 d7010001 72170100 0c01cc0d 00006280 00c91413 1a0a2a0d 0412fbee
ffff88b97e752a80 1553934211 S Bi:4:003:1 -115 4096 <
ffff88b97e752f00 1553935962 C Bi:4:003:1 0 478 = 5b5d4501 d6010001 730c1000 0701cb0d 00006c63 07fc00fe ff0bf901 03f90102
ffff88b97e752f00 1553935974 S Bi:4:003:1 -115 4096 <
ffff88b97e7520c0 1553937975 C Bi:4:003:1 0 486 = 5b5d4601 d6010001 81031100 0701cb0d 00006c80 01541df2 07fde616 0909ff06
ffff88b97e7520c0 1553937981 S Bi:4:003:1 -115 4096 <
ffff88b97e752840 1553939840 C Bi:4:003:1 0 479 = 5b5d4701 d7010001 81dc0000 0c01cc0d 0000605d 02fc0200 04fdffff fe000304
ffff88b97e752840 1553939844 S Bi:4:003:1 -115 4096 <
ffff88b97e752a80 1553941837 C Bi:4:003:1 0 483 = 5b5d4801 d7010001 8fb40100 0c01cc0d 00005e80 00be1f0d 1e082b0e 0514f4f1
ffff88b97e752a80 1553941841 S Bi:4:003:1 -115 4096 <
ffff88b97e752f00 1553943588 C Bi:4:003:1 0 478 = 5b5d4901 d6010001 90a91000 0701cb0d 00006f6b 02ffffff ff05f805 fd030101
ffff88b97e752f00 1553943600 S Bi:4:003:1 -115 4096 <
ffff88b97e7520c0 1553945591 C Bi:4:003:1 0 488 = 5b5d4a01 d6010001 9e9e1100 0701cb0d 00006a80 015519f5 08f8eb13 0c09fa06
ffff88b97e7520c0 1553945596 S Bi:4:003:1 -115 4096 <
ffff88b97e752840 1553947343 C Bi:4:003:1 0 479 = 5b5d4b01 d7010001 9f770000 0c01cc0d 00006160 fffe0200 01fd0203 fb010100
ffff88b97e752840 1553947347 S Bi:4:003:1 -115 4096 <
ffff88b97e752a80 1553949486 C Bi:4:003:1 0 483 = 5b5d4c01 d7010001 ad4a0100 0c01cc0d 00005f80 00c41511 1e0a2610 0615f6ef
ffff88b97e752a80 1553949491 S Bi:4:003:1 -115 4096 <
ffff88b97e752f00 1553951080 C Bi:4:003:1 0 478 = 5b5d4d01 d6010001 ae3f1000 0701cb0d 00006c68 fffa0603 000af4ff feffff02
ffff88b97e752f00 1553951091 S Bi:4:003:1 -115 4096 <
ffff88b97e7520c0 1553953094 C Bi:4:003:1 0 486 = 5b5d4e01 d6010001 bc341100 0701cb0d 00006d80 015121f7 07fbe90a 0c0cfa0a
ffff88b97e7520c0 1553953100 S Bi:4:003:1 -115 4096 <
ffff88b97e752840 1553954962 C Bi:4:003:1 0 479 = 5b5d4f01 d7010001 bd0d0000 0c01cc0d 00005f5d 00fc05ff 03fc03ff ffff0200
ffff88b97e752840 1553954966 S Bi:4:003:1 -115 4096 <
ffff88b97e752a80 1553956974 C Bi:4:003:1 0 485 = 5b5d5001 d7010001 cae70100 0c01cc0d 00005e80 00c31514 190b2910 0414f9ed
ffff88b97e752a80 1553956978 S Bi:4:003:1 -115 4096 <
ffff88b97e752f00 1553958712 C Bi:4:003:1 0 478 = 5b5d5101 d6010001 cbdc1000 0701cb0d 00006c6c fb020100 fd08f306 fe020100
ffff88b97e752f00 1553958718 S Bi:4:003:1 -115 4096 <
ffff88b97e7520c0 1553960717 C Bi:4:003:1 0 486 = 5b5d5201 d6010001 d9d21100 0701cb0d 00006d80 01571df2 09fae70b 1505fc09
ffff88b97e7520c0 1553960723 S Bi:4:003:1 -115 4096 <
ffff88b97e752840 1553962463 C Bi:4:003:1 0 479 = 5b5d5301 d7010001 daab0000 0c01cc0d 00005e5c 00fc07fb 06fa0201 fdff0303
ffff88b97e752840 1553962467 S Bi:4:003:1 -115 4096 <
ffff88b97e752a80 1553964587 C Bi:4:003:1 0 483 = 5b5d5401 d7010001 e87d0100 0c01cc0d 00005c80 00c31414 1b0c2610 080efbee
ffff88b97e752a80 1553964592 S Bi:4:003:1 -115 4096 <
ffff88b97e752f00 1553966339 C Bi:4:003:1 0 478 = 5b5d5501 d6010001 e9721000 0701cb0d 00006e6a 06fbfeff 0104f50b fefc0301
ffff88b97e752f00 1553966350 S Bi:4:003:1 -115 4096 <
ffff88b97e7520c0 1553968339 C Bi:4:003:1 0 486 = 5b5d5601 d6010001 f7671100 0701cb0d 00006f80 014f24f7 08f8e80f 0d08fb0a
ffff88b97e7520c0 1553968345 S Bi:4:003:1 -115 4096 <
ffff88b97e752840 1553970087 C Bi:4:003:1 0 479 = 5b5d5701 d7010001 f8400000 0c01cc0d 00006362 fefe0104 01fb04fd fc010400
ffff88b97e752840 1553970091 S Bi:4:003:1 -115 4096 <
ffff88b97e752a80 1553972100 C Bi:4:003:1 0 483 = 5b5d5801 d7010001 061b0100 0c01cc0d 00005e80 00c11c0f 170f2710 0414f6f0
ffff88b97e752a80 1553972104 S Bi:4:003:1 -115 4096 <
ffff88b97e752f00 1553973838 C Bi:4:003:1 0 478 = 5b5d5901 d6010001 070f1000 0701cb0d 00006d6d fdfd06fe fc06f804 0001fc04
ffff88b97e752f00 1553973844 S Bi:4:003:1 -115 4096 <
ffff88b97e7520c0 1553975838 C Bi:4:003:1 0 486 = 5b5d5a01 d6010001 15041100 0701cb0d 00006d80 015521f3 0af8e512 0a0bfb09
ffff88b97e7520c0 1553975844 S Bi:4:003:1 -115 4096 <
ffff88b97e752840 1553977712 C Bi:4:003:1 0 479 = 5b5d5b01 d7010001 15dd0000 0c01cc0d 00005e5c 02fb05fd 03fb04ff 01fc0301
ffff88b97e752840 1553977716 S Bi:4:003:1 -115 4096 <
ffff88b97e752a80 1553979716 C Bi:4:003:1 0 483 = 5b5d5c01 d7010001 23b00100 0c01cc0d 00005e80 00c01716 1512260d 0810fbed
ffff88b97e752a80 1553979720 S Bi:4:003:1 -115 4096 <
ffff88b97e752f00 1553981463 C Bi:4:003:1 0 478 = 5b5d5d01 d6010001 24a41000 0701cb0d 00006c68 00ff0201 f907fd01 02fe01ff
ffff88b97e752f00 1553981475 S Bi:4:003:1 -115 4096 <
ffff88b97e7520c0 1553983463 C Bi:4:003:1 0 488 = 5b5d5e01 d6010001 32991100 0701cb0d 00007080 015420f5 0cf5e911 08030409
ffff88b97e7520c0 1553983469 S Bi:4:003:1 -115 4096 <
ffff88b97e752840 1553985206 C Bi:4:003:1 0 479 = 5b5d5f01 d7010001 33720000 0c01cc0d 00005e59 05fcff02 05fa0200 ff0003ff
ffff88b97e752840 1553985211 S Bi:4:003:1 -115 4096 <
ffff88b97e752a80 1553987339 C Bi:4:003:1 0 483 = 5b5d6001 d7010001 414d0100 0c01cc0d 00005f80 00c4150e 1d0f250f 0812f9ee
ffff88b97e752a80 1553987357 S Bi:4:003:1 -115 4096 <
ffff88b97e752f00 1553988979 C Bi:4:003:1 0 478 = 5b5d6101 d6010001 42421000 0701cb0d 00006f67 06fb02fd 000af604 00fefe03
ffff88b97e752f00 1553988991 S Bi:4:003:1 -115 4096 <
ffff88b97e7520c0 1553991090 C Bi:4:003:1 0 486 = 5b5d6201 d6010001 50371100 0701cb0d 00006c80 01551cf6 05fbe713 0b060405
ffff88b97e7520c0 1553991096 S Bi:4:003:1 -115 4096 <
ffff88b97e752840 1553992839 C Bi:4:003:1 0 479 = 5b5d6301 d7010001 51100000 0c01cc0d 0000625f 02fb0301 03fcff01 01fd0200
ffff88b97e752840 1553992843 S Bi:4:003:1 -115 4096 <
ffff88b97e752a80 1553994840 C Bi:4:003:1 0 483 = 5b5d6401 d7010001 5ee20100 0c01cc0d 00005f80 00c31511 1811270e 0811f9f0
ffff88b97e752a80 1553994844 S Bi:4:003:1 -115 4096 <
ffff88b97e752f00 1553996592 C Bi:4:003:1 0 478 = 5b5d6501 d6010001 5fd71000 0701cb0d 00006d68 04fffe00 fd07f505 06fa05fc
ffff88b97e752f00 1553996603 S Bi:4:003:1 -115 4096 <
ffff88b97e7520c0 1553998610 C Bi:4:003:1 0 486 = 5b5d6601 d6010001 6dcc1100 0701cb0d 00007180 015520f7 08fbe60f 0e02000b
ffff88b97e7520c0 1553998616 S Bi:4:003:1 -115 4096 <
ffff88b97e752840 1554000464 C Bi:4:003:1 0 479 = 5b5d6701 d7010001 6ea50000 0c01cc0d 00006261 fc010101 ffff02fc 04fd04fe
ffff88b97e752840 1554000469 S Bi:4:003:1 -115 4096 <
ffff88b97e752a80 1554002464 C Bi:4:003:1 0 483 = 5b5d6801 d7010001 7c7e0100 0c01cc0d 00005e80 00c61410 1a0d2614 0112fbf0
ffff88b97e752a80 1554002468 S Bi:4:003:1 -115 4096 <
ffff88b97e752f00 1554004213 C Bi:4:003:1 0 478 = 5b5d6901 d6010001 7d721000 0701cb0d 00006b69 fc0103ff ff07f703 fff50901
ffff88b97e752f00 1554004225 S Bi:4:003:1 -115 4096 <
ffff88b97e7520c0 1554006217 C Bi:4:003:1 0 486 = 5b5d6a01 d6010001 8b691100 0701cb0d 00006d80 01551bfe 0003e00b 1005fa0c
ffff88b97e7520c0 1554006222 S Bi:4:003:1 -115 4096 <
ffff88b97e752840 1554007981 C Bi:4:003:1 0 479 = 5b5d6b01 d7010001 8c420000 0c01cc0d 0000605d 02fd0101 02ff02fd 00fd0104
ffff88b97e752840 1554007986 S Bi:4:003:1 -115 4096 <
ffff88b97e752a80 1554010091 C Bi:4:003:1 0 483 = 5b5d6c01 d7010001 9a140100 0c01cc0d 00005e80 00c31614 170c2910 0612f8f2
ffff88b97e752a80 1554010096 S Bi:4:003:1 -115 4096 <
ffff88b97e752f00 1554011838 C Bi:4:003:1 0 478 = 5b5d6d01 d6010001 9b091000 0701cb0d 00006a67 fb01ff07 ff04fa01 fe0000fd
ffff88b97e752f00 1554011850 S Bi:4:003:1 -115 4096 <
ffff88b97e7520c0 1554013838 C Bi:4:003:1 0 488 = 5b5d6e01 d6010001 a8fe1100 0701cb0d 00006a80 01511af7 08fce910 0d06fe06
ffff88b97e7520c0 1554013843 S Bi:4:003:1 -115 4096 <
ffff88b97e752840 1554015587 C Bi:4:003:1 0 479 = 5b5d6f01 d7010001 a9d70000 0c01cc0d 00006160 00fe02fd 07fc01fd fffd0501
ffff88b97e752840 1554015592 S Bi:4:003:1 -115 4096 <
ffff88b97e752a80 1554017581 C Bi:4:003:1 0 483 = 5b5d7001 d7010001 b7b10100 0c01cc0d 00006080 00c61217 180e260f 0512f9ef
ffff88b97e752a80 1554017585 S Bi:4:003:1 -115 4096 <
ffff88b97e752f00 1554019339 C Bi:4:003:1 0 478 = 5b5d7101 d6010001 b8a51000 0701cb0d 00006d6a fffe00fc 0506f908 fefcfc01
ffff88b97e752f00 1554019351 S Bi:4:003:1 -115 4096 <
ffff88b97e7520c0 1554021351 C Bi:4:003:1 0 486 = 5b5d7201 d6010001 c69d1100 0701cb0d 00006b80 015617f9 07f8e913 0d06ff03
ffff88b97e7520c0 1554021357 S Bi:4:003:1 -115 4096 <
ffff88b97e752840 1554023091 C Bi:4:003:1 0 479 = 5b5d7301 d7010001 c7750000 0c01cc0d 00005f5d 00fc0102 03fd04fe 00fc02ff
ffff88b97e752840 1554023095 S Bi:4:003:1 -115 4096 <
ffff88b97e752a80 1554025213 C Bi:4:003:1 0 485 = 5b5d7401 d7010001 d5480100 0c01cc0d 00005d80 00c11612 1e0b270d 0613f8f0
ffff88b97e752a80 1554025217 S Bi:4:003:1 -115 4096 <
ffff88b97e752f00 1554026965 C Bi:4:003:1 0 478 = 5b5d7501 d6010001 d63c1000 0701cb0d 00006d6a 02fd02ff f70bfc01 06fefc01
ffff88b97e752f00 1554026977 S Bi:4:003:1 -115 4096 <
ffff88b97e7520c0 1554028962 C Bi:4:003:1 0 488 = 5b5d7601 d6010001 e4331100 0701cb0d 00006b80 01521ef4 0bf9e811 0c06fc0b
ffff88b97e7520c0 1554028968 S Bi:4:003:1 -115 4096 <
ffff88b97e752840 1554030715 C Bi:4:003:1 0 479 = 5b5d7701 d7010001 e50c0000 0c01cc0d 00005e58 04fe01fd 07fc0200 fffd0300
ffff88b97e752840 1554030719 S Bi:4:003:1 -115 4096 <
ffff88b97e752a80 1554032837 C Bi:4:003:1 0 483 = 5b5d7801 d7010001 f2e50100 0c01cc0d 00005e80 00c01713 1e082c09 0a0ff9ed
ffff88b97e752a80 1554032842 S Bi:4:003:1 -115 4096 <
ffff88b97e752f00 1554034471 C Bi:4:003:1 0 478 = 5b5d7901 d6010001 f3da1000 0701cb0d 00006f68 ff05fe02 fa05fa05 05fa0000
ffff88b97e752f00 1554034477 S Bi:4:003:1 -115 4096 <
ffff88b97e7520c0 1554036477 C Bi:4:003:1 0 486 = 5b5d7a01 d6010001 01d11100 0701cb0d 00006f80 01531ffa 03fce809 1307fd08
ffff88b97e7520c0 1554036483 S Bi:4:003:1 -115 4096 <
ffff88b97e752840 1554038337 C Bi:4:003:1 0 479 = 5b5d7b01 d7010001 02aa0000 0c01cc0d 0000615e ff000303 fffffeff 00fd06fe
ffff88b97e752840 1554038342 S Bi:4:003:1 -115 4096 <
ffff88b97e752a80 1554040360 C Bi:4:003:1 0 485 = 5b5d7c01 d7010001 107c0100 0c01cc0d 00005c80 00c41310 1c0e270b 0b12f9ee
ffff88b97e752a80 1554040365 S Bi:4:003:1 -115 4096 <
ffff88b97e752f00 1554042089 C Bi:4:003:1 0 478 = 5b5d7d01 d6010001 11771000 0701cb0d 00006e6c fffc0202 f909fa01 04fefb06
ffff88b97e752f00 1554042100 S Bi:4:003:1 -115 4096 <
ffff88b97e7520c0 1554044093 C Bi:4:003:1 0 486 = 5b5d7e01 d6010001 1f671100 0701cb0d 00006c80 01541df6 06fde015 0f07fc09
ffff88b97e7520c0 1554044098 S Bi:4:003:1 -115 4096 <
ffff88b97e752840 1554045838 C Bi:4:003:1 0 479 = 5b5d7f01 d7010001 20400000 0c01cc0d 00005f5f fefe0100 04fb05fa 05fd05fa
ffff88b97e752840 1554045842 S Bi:4:003:1 -115 4096 <
ffff88b97e752a80 1554047963 C Bi:4:003:1 0 483 = 5b5d8001 d7010001 2e190100 0c01cc0d 00006080 00c31711 1c10240e 0414f9f1
ffff88b97e752a80 1554047967 S Bi:4:003:1 -115 4096 <
ffff88b97e752f00 1554049713 C Bi:4:003:1 0 478 = 5b5d8101 d6010001 2f0d1000 0701cb0d 00006f6c fffc0501 fa07f606 fe01ff00
ffff88b97e752f00 1554049724 S Bi:4:003:1 -115 4096 <
ffff88b97e7520c0 1554051715 C Bi:4:003:1 0 488 = 5b5d8201 d6010001 3d021100 0701cb0d 00006c80 01531ef8 07f9e50f 090cff0a
ffff88b97e7520c0 1554051720 S Bi:4:003:1 -115 4096 <
ffff88b97e752840 1554053465 C Bi:4:003:1 0 479 = 5b5d8301 d7010001 3ddb0000 0c01cc0d 00005f5e 00fc05ff 02fd02ff fdff05fd
ffff88b97e752840 1554053469 S Bi:4:003:1 -115 4096 <
ffff88b97e752a80 1554055471 C Bi:4:003:1 0 485 = 5b5d8401 d7010001 4bb00100 0c01cc0d 00005c80 00bf1712 1813230f 0910f9ec
ffff88b97e752a80 1554055475 S Bi:4:003:1 -115 4096 <
ffff88b97e752f00 1554057227 C Bi:4:003:1 0 478 = 5b5d8501 d6010001 4ca51000 0701cb0d 00006a69 fbfe0203 fe07f800 01fe03ff
ffff88b97e752f00 1554057239 S Bi:4:003:1 -115 4096 <
ffff88b97e7520c0 1554059207 C Bi:4:003:1 0 486 = 5b5d8601 d6010001 5a951100 0701cb0d 00006e80 015818f9 06fbe411 0f050008
ffff88b97e7520c0 1554059213 S Bi:4:003:1 -115 4096 <
ffff88b97e752840 1554060979 C Bi:4:003:1 0 479 = 5b5d8701 d7010001 5b6e0000 0c01cc0d 0000605f fcff0301 00fe05fb 01fd07fd
ffff88b97e752840 1554060984 S Bi:4:003:1 -115 4096 <
ffff88b97e752a80 1554063091 C Bi:4:003:1 0 483 = 5b5d8801 d7010001 69460100 0c01cc0d 00006080 00c51910 1a0e2412 0413f7ef
ffff88b97e752a80 1554063095 S Bi:4:003:1 -115 4096 <
ffff88b97e752f00 1554064841 C Bi:4:003:1 0 478 = 5b5d8901 d6010001 6a3b1000 0701cb0d 00006e6b feff0301 ff05f209 fcf90802
ffff88b97e752f00 1554064853 S Bi:4:003:1 -115 4096 <
ffff88b97e7520c0 1554066839 C Bi:4:003:1 0 488 = 5b5d8a01 d6010001 78301100 0701cb0d 00006c80 01521df6 07fee414 0c07f60f
ffff88b97e7520c0 1554066845 S Bi:4:003:1 -115 4096 <
ffff88b97e752840 1554068589 C Bi:4:003:1 0 479 = 5b5d8b01 d7010001 79090000 0c01cc0d 0000615e 02fc0105 03fb0200 fdfd06ff
ffff88b97e752840 1554068593 S Bi:4:003:1 -115 4096 <
ffff88b97e752a80 1554070713 C Bi:4:003:1 0 485 = 5b5d8c01 d7010001 86e40100 0c01cc0d 00005c80 00bd1c0d 1c072b11 0414f7f1
ffff88b97e752a80 1554070717 S Bi:4:003:1 -115 4096 <
ffff88b97e752f00 1554072338 C Bi:4:003:1 0 478 = 5b5d8d01 d6010001 87d91000 0701cb0d 00006b68 feff0205 f905feff fe0202fd
ffff88b97e752f00 1554072344 S Bi:4:003:1 -115 4096 <
ffff88b97e7520c0 1554074353 C Bi:4:003:1 0 486 = 5b5d8e01 d6010001 95c91100 0701cb0d 00006c80 015913fb 06fee50f 1104fc08
ffff88b97e7520c0 1554074359 S Bi:4:003:1 -115 4096 <
ffff88b97e752840 1554076213 C Bi:4:003:1 0 479 = 5b5d8f01 d7010001 96a20000 0c01cc0d 00005e5e fc030101 01fb04fe fd0005fe
ffff88b97e752840 1554076217 S Bi:4:003:1 -115 4096 <
ffff88b97e752a80 1554078218 C Bi:4:003:1 0 483 = 5b5d9001 d7010001 a47a0100 0c01cc0d 00005e80 00c21610 1b0d2713 0312faef
ffff88b97e752a80 1554078223 S Bi:4:003:1 -115 4096 <
ffff88b97e752f00 1554079965 C Bi:4:003:1 0 478 = 5b5d9101 d6010001 a56f1000 0701cb0d 0000716f 02f706fd fc08fb06 fdff00fd
ffff88b97e752f00 1554079976 S Bi:4:003:1 -115 4096 <
ffff88b97e7520c0 1554081964 C Bi:4:003:1 0 488 = 5b5d9201 d6010001 b3641100 0701cb0d 00006d80 01551ff6 04fee70c 1004fd09
ffff88b97e7520c0 1554081970 S Bi:4:003:1 -115 4096 <
ffff88b97e752840 1554083840 C Bi:4:003:1 0 479 = 5b5d9301 d7010001 b43d0000 0c01cc0d 00005e5d 02fb0100 03ff01ff fffd04fe
ffff88b97e752840 1554083844 S Bi:4:003:1 -115 4096 <
ffff88b97e752a80 1554085839 C Bi:4:003:1 0 485 = 5b5d9401 d7010001 c2190100 0c01cc0d 00005c80 00ba1a11 1b0e260f 0414feed
ffff88b97e752a80 1554085844 S Bi:4:003:1 -115 4096 <
ffff88b97e752f00 1554087464 C Bi:4:003:1 0 478 = 5b5d9501 d6010001 c30d1000 0701cb0d 00006c6d fdfcfe03 fc0bf704 00fffd01
ffff88b97e752f00 1554087469 S Bi:4:003:1 -115 4096 <
ffff88b97e7520c0 1554089588 C Bi:4:003:1 0 486 = 5b5d9601 d6010001 d0fe1100 0701cb0d 00006e80 01551ef4 0af9eb0f 0d05fb05
ffff88b97e7520c0 1554089594 S Bi:4:003:1 -115 4096 <
ffff88b97e752840 1554091341 C Bi:4:003:1 0 479 = 5b5d9701 d7010001 d1d60000 0c01cc0d 0000635f 03fc06ff fffd03fe 00fdfe06
ffff88b97e752840 1554091346 S Bi:4:003:1 -115 4096 <
ffff88b97e752a80 1554093331 C Bi:4:003:1 0 483 = 5b5d9801 d7010001 dfaf0100 0c01cc0d 00006080 00c21813 17112410 0512f7ee
ffff88b97e752a80 1554093335 S Bi:4:003:1 -115 4096 <
ffff88b97e752f00 1554095090 C Bi:4:003:1 0 478 = 5b5d9901 d6010001 e0a31000 0701cb0d 0000716e 00fe01fd fa0cfa05 ffffffff
ffff88b97e752f00 1554095096 S Bi:4:003:1 -115 4096 <
ffff88b97e7520c0 1554097102 C Bi:4:003:1 0 486 = 5b5d9a01 d6010001 ee991100 0701cb0d 00006c80 015419fc 02fce512 0e060206
ffff88b97e7520c0 1554097108 S Bi:4:003:1 -115 4096 <
ffff88b97e752840 1554098838 C Bi:4:003:1 0 479 = 5b5d9b01 d7010001 ef720000 0c01cc0d 0000605a 02000203 00fd01fe fe020101
ffff88b97e752840 1554098843 S Bi:4:003:1 -115 4096 <
ffff88b97e752a80 1554100965 C Bi:4:003:1 0 483 = 5b5d9c01 d7010001 fd4a0100 0c01cc0d 00006080 00c81111 1a11240f 080cfeec
ffff88b97e752a80 1554100969 S Bi:4:003:1 -115 4096 <
ffff88b97e752f00 1554102715 C Bi:4:003:1 0 478 = 5b5d9d01 d6010001 fe3f1000 0701cb0d 00006f6c 02fa03ff 0005f20b fd0203fb
ffff88b97e752f00 1554102727 S Bi:4:003:1 -115 4096 <
ffff88b97e7520c0 1554104713 C Bi:4:003:1 0 486 = 5b5d9e01 d6010001 0c301100 0701cb0d 00006880 01501cfa 02fbee0d 0c07fe06
ffff88b97e7520c0 1554104719 S Bi:4:003:1 -115 4096 <
ffff88b97e752840 1554106464 C Bi:4:003:1 0 479 = 5b5d9f01 d7010001 0d080000 0c01cc0d 00006160 00fc03fe 05f90200 00fd0205
ffff88b97e752840 1554106469 S Bi:4:003:1 -115 4096 <
ffff88b97e752a80 1554108478 C Bi:4:003:1 0 483 = 5b5da001 d7010001 1ae10100 0c01cc0d 00005e80 00bf1c0f 1c10260d 0510fdec
ffff88b97e752a80 1554108483 S Bi:4:003:1 -115 4096 <
ffff88b97e752f00 1554110214 C Bi:4:003:1 0 478 = 5b5da101 d6010001 1bd51000 0701cb0d 00006f6d fdfd0206 f807f805 fb05fd01
ffff88b97e752f00 1554110226 S Bi:4:003:1 -115 4096 <
ffff88b97e7520c0 1554112220 C Bi:4:003:1 0 486 = 5b5da201 d6010001 29cb1100 0701cb0d 00006c80 01541cf7 06fce913 0906fc07
ffff88b97e7520c0 1554112226 S Bi:4:003:1 -115 4096 <
ffff88b97e752840 1554114089 C Bi:4:003:1 0 479 = 5b5da301 d7010001 2aa40000 0c01cc0d 0000625f 02fcfd05 04fd00fe fffe03ff
ffff88b97e752840 1554114093 S Bi:4:003:1 -115 4096 <
ffff88b97e752a80 1554116089 C Bi:4:003:1 0 483 = 5b5da401 d7010001 387c0100 0c01cc0d 00005d80 00be1a12 1911250c 0a11faec
ffff88b97e752a80 1554116093 S Bi:4:003:1 -115 4096 <
ffff88b97e752f00 1554118841 C Bi:4:003:1 0 2471 = 5b5da509 9f020201 015c083d 00001012 02061013 02011011 03061014 43011015
ffff88b97e752f00 1554118845 S Bi:4:003:1 -115 4096 <
ffff88b97e7520c0 1554120236 C Bi:4:003:1 0 478 = 5b5da601 d6010001 39711000 0701cb8d 00006d6d f9ff0401 0104f901 fc010002
ffff88b97e7520c0 1554120242 S Bi:4:003:1 -115 4096 <
ffff88b97e752840 1554123222 C Bi:4:003:1 0 488 = 5b5da701 d6010001 54ab1100 0701cb8d 00006b80 014f1dfb 05f7e70e 1109fb0a
ffff88b97e752840 1554123228 S Bi:4:003:1 -115 4096 <
ffff88b97e752a80 1554125589 C Bi:4:003:1 0 479 = 5b5da801 d7010001 55830000 0c01cc8d 0000605c 01fd03fe 06fb01fe 05fb0100
ffff88b97e752a80 1554125594 S Bi:4:003:1 -115 4096 <
ffff88b97e752f00 1554129214 C Bi:4:003:1 0 485 = 5b5da901 d7010001 65550100 0c01cc8d 00005e80 00c01c11 1a092b0c 0713f8ef
ffff88b97e752f00 1554129218 S Bi:4:003:1 -115 4096 <
ffff88b97e7520c0 1555122472 C Bi:4:003:1 0 2471 = 5b5daa09 9f020201 015c083d 00001012 02061013 02011011 03061014 43011015
ffff88b97e7520c0 1555122476 S Bi:4:003:1 -115 4096 <
ffff88b97e752840 1555123970 C Bi:4:003:1 0 478 = 5b5dab01 d6010001 7d541000 0701cb8d 00006d69 fe000002 fd09f9fc 0201fcff
ffff88b97e752840 1555123982 S Bi:4:003:1 -115 4096 <
ffff88b97e752a80 1555126977 C Bi:4:003:1 0 486 = 5b5dac01 d6010001 9c1c1100 0701cb8d 00006e80 01511df4 0bfae90e 1106f50d
ffff88b97e752a80 1555126982 S Bi:4:003:1 -115 4096 <
ffff88b97e752f00 1555129214 C Bi:4:003:1 0 479 = 5b5dad01 d7010001 9cf50000 0c01cc8d 0000615f fff80701 020003fa 01fc0502
ffff88b97e752f00 1555129219 S Bi:4:003:1 -115 4096 <
ffff88b97e7520c0 1555132839 C Bi:4:003:1 0 483 = 5b5dae01 d7010001 acc50100 0c01cc8d 00005f80 00c41117 190e270e 0515f8ee
ffff88b97e7520c0 1555132843 S Bi:4:003:1 -115 4096 <
